03/09/2024 12:09:32 PM --- Done page: 1/1
03/09/2024 12:09:32 PM --- Number of posts for page 1: 12
03/09/2024 12:09:32 PM --- Number of posts added on 2024-09-03: 0
03/09/2024 04:29:36 PM --- Done page: 1/1
03/09/2024 04:29:36 PM --- Number of posts for page 1: 12
03/09/2024 04:29:36 PM --- Number of posts added on 2024-09-03: 0
04/09/2024 04:28:02 PM --- Done page: 1/1
04/09/2024 04:28:02 PM --- Number of posts for page 1: 12
04/09/2024 04:28:02 PM --- Number of posts added on 2024-09-04: 0
05/09/2024 04:28:39 PM --- Done page: 1/1
05/09/2024 04:28:39 PM --- Number of posts for page 1: 12
05/09/2024 04:28:39 PM --- Number of posts added on 2024-09-05: 0
07/09/2024 04:26:54 PM --- Done page: 1/1
07/09/2024 04:26:54 PM --- Number of posts for page 1: 12
07/09/2024 04:26:54 PM --- Number of posts added on 2024-09-07: 0
08/09/2024 04:27:21 PM --- Done page: 1/1
08/09/2024 04:27:21 PM --- Number of posts for page 1: 12
08/09/2024 04:27:21 PM --- Number of posts added on 2024-09-08: 0
09/09/2024 04:28:27 PM --- Done page: 1/1
09/09/2024 04:28:27 PM --- Number of posts for page 1: 12
09/09/2024 04:28:27 PM --- Number of posts added on 2024-09-09: 0
10/09/2024 04:28:16 PM --- Done page: 1/1
10/09/2024 04:28:16 PM --- Number of posts for page 1: 12
10/09/2024 04:28:16 PM --- Number of posts added on 2024-09-10: 0
11/09/2024 04:28:35 PM --- Done page: 1/1
11/09/2024 04:28:35 PM --- Number of posts for page 1: 12
11/09/2024 04:28:35 PM --- Number of posts added on 2024-09-11: 0
12/09/2024 04:29:24 PM --- Done page: 1/1
12/09/2024 04:29:24 PM --- Number of posts for page 1: 12
12/09/2024 04:29:24 PM --- Number of posts added on 2024-09-12: 0
13/09/2024 04:27:34 PM --- Done page: 1/1
13/09/2024 04:27:34 PM --- Number of posts for page 1: 12
13/09/2024 04:27:34 PM --- Number of posts added on 2024-09-13: 0
14/09/2024 04:26:45 PM --- Done page: 1/1
14/09/2024 04:26:45 PM --- Number of posts for page 1: 12
14/09/2024 04:26:45 PM --- Number of posts added on 2024-09-14: 0
15/09/2024 04:27:46 PM --- Done page: 1/1
15/09/2024 04:27:46 PM --- Number of posts for page 1: 12
15/09/2024 04:27:46 PM --- Number of posts added on 2024-09-15: 0
16/09/2024 04:29:36 PM --- Done: Ghost job - Nghịch lý đăng tuyển dụng nhưng không tuyển người
16/09/2024 04:29:49 PM --- Done page: 1/1
16/09/2024 04:29:49 PM --- Number of posts for page 1: 12
16/09/2024 04:29:49 PM --- Number of posts added on 2024-09-16: 1
17/09/2024 04:29:16 PM --- Done page: 1/1
17/09/2024 04:29:16 PM --- Number of posts for page 1: 12
17/09/2024 04:29:16 PM --- Number of posts added on 2024-09-17: 0
18/09/2024 04:29:09 PM --- Done page: 1/1
18/09/2024 04:29:09 PM --- Number of posts for page 1: 12
18/09/2024 04:29:09 PM --- Number of posts added on 2024-09-18: 0
19/09/2024 04:29:03 PM --- Done page: 1/1
19/09/2024 04:29:03 PM --- Number of posts for page 1: 12
19/09/2024 04:29:03 PM --- Number of posts added on 2024-09-19: 0
20/09/2024 04:29:12 PM --- Done page: 1/1
20/09/2024 04:29:12 PM --- Number of posts for page 1: 12
20/09/2024 04:29:12 PM --- Number of posts added on 2024-09-20: 0
21/09/2024 04:28:37 PM --- Done page: 1/1
21/09/2024 04:28:37 PM --- Number of posts for page 1: 12
21/09/2024 04:28:37 PM --- Number of posts added on 2024-09-21: 0
22/09/2024 04:26:45 PM --- Done page: 1/1
22/09/2024 04:26:45 PM --- Number of posts for page 1: 12
22/09/2024 04:26:45 PM --- Number of posts added on 2024-09-22: 0
23/09/2024 04:28:54 PM --- Done page: 1/1
23/09/2024 04:28:54 PM --- Number of posts for page 1: 12
23/09/2024 04:28:54 PM --- Number of posts added on 2024-09-23: 0
24/09/2024 04:30:17 PM --- Done page: 1/1
24/09/2024 04:30:17 PM --- Number of posts for page 1: 12
24/09/2024 04:30:17 PM --- Number of posts added on 2024-09-24: 0
25/09/2024 04:32:37 PM --- Done page: 1/1
25/09/2024 04:32:37 PM --- Number of posts for page 1: 12
25/09/2024 04:32:37 PM --- Number of posts added on 2024-09-25: 0
26/09/2024 04:29:57 PM --- Done page: 1/1
26/09/2024 04:29:57 PM --- Number of posts for page 1: 12
26/09/2024 04:29:57 PM --- Number of posts added on 2024-09-26: 0
27/09/2024 04:29:21 PM --- Done page: 1/1
27/09/2024 04:29:21 PM --- Number of posts for page 1: 12
27/09/2024 04:29:21 PM --- Number of posts added on 2024-09-27: 0
28/09/2024 04:27:41 PM --- Done page: 1/1
28/09/2024 04:27:41 PM --- Number of posts for page 1: 12
28/09/2024 04:27:41 PM --- Number of posts added on 2024-09-28: 0
29/09/2024 04:28:13 PM --- Done page: 1/1
29/09/2024 04:28:13 PM --- Number of posts for page 1: 12
29/09/2024 04:28:13 PM --- Number of posts added on 2024-09-29: 0
30/09/2024 04:30:19 PM --- Done page: 1/1
30/09/2024 04:30:19 PM --- Number of posts for page 1: 12
30/09/2024 04:30:19 PM --- Number of posts added on 2024-09-30: 0
01/10/2024 04:31:14 PM --- Done page: 1/1
01/10/2024 04:31:14 PM --- Number of posts for page 1: 12
01/10/2024 04:31:14 PM --- Number of posts added on 2024-10-01: 0
02/10/2024 04:30:10 PM --- Done: Digital footprint - Khi dấu chân quá khứ làm hư hỏng tương lai
02/10/2024 04:30:11 PM --- Done: Milkshake Duck là gì mà có khắp mạng xã hội?
02/10/2024 04:30:20 PM --- Done page: 1/1
02/10/2024 04:30:20 PM --- Number of posts for page 1: 12
02/10/2024 04:30:20 PM --- Number of posts added on 2024-10-02: 2
03/10/2024 04:30:14 PM --- Done page: 1/1
03/10/2024 04:30:14 PM --- Number of posts for page 1: 12
03/10/2024 04:30:14 PM --- Number of posts added on 2024-10-03: 0
04/10/2024 04:30:15 PM --- Done page: 1/1
04/10/2024 04:30:15 PM --- Number of posts for page 1: 12
04/10/2024 04:30:15 PM --- Number of posts added on 2024-10-04: 0
05/10/2024 04:27:47 PM --- Done page: 1/1
05/10/2024 04:27:47 PM --- Number of posts for page 1: 12
05/10/2024 04:27:47 PM --- Number of posts added on 2024-10-05: 0
06/10/2024 04:27:00 PM --- Done page: 1/1
06/10/2024 04:27:00 PM --- Number of posts for page 1: 12
06/10/2024 04:27:00 PM --- Number of posts added on 2024-10-06: 0
07/10/2024 04:29:51 PM --- Done page: 1/1
07/10/2024 04:29:51 PM --- Number of posts for page 1: 12
07/10/2024 04:29:51 PM --- Number of posts added on 2024-10-07: 0
08/10/2024 04:30:53 PM --- Done page: 1/1
08/10/2024 04:30:53 PM --- Number of posts for page 1: 12
08/10/2024 04:30:53 PM --- Number of posts added on 2024-10-08: 0
09/10/2024 04:28:57 PM --- Done page: 1/1
09/10/2024 04:28:57 PM --- Number of posts for page 1: 12
09/10/2024 04:28:57 PM --- Number of posts added on 2024-10-09: 0
10/10/2024 04:29:26 PM --- Done page: 1/1
10/10/2024 04:29:26 PM --- Number of posts for page 1: 12
10/10/2024 04:29:26 PM --- Number of posts added on 2024-10-10: 0
11/10/2024 04:29:11 PM --- Done page: 1/1
11/10/2024 04:29:11 PM --- Number of posts for page 1: 12
11/10/2024 04:29:11 PM --- Number of posts added on 2024-10-11: 0
12/10/2024 04:28:18 PM --- Done page: 1/1
12/10/2024 04:28:18 PM --- Number of posts for page 1: 12
12/10/2024 04:28:18 PM --- Number of posts added on 2024-10-12: 0
13/10/2024 04:27:30 PM --- Done page: 1/1
13/10/2024 04:27:30 PM --- Number of posts for page 1: 12
13/10/2024 04:27:30 PM --- Number of posts added on 2024-10-13: 0
14/10/2024 04:28:53 PM --- Done page: 1/1
14/10/2024 04:28:53 PM --- Number of posts for page 1: 12
14/10/2024 04:28:53 PM --- Number of posts added on 2024-10-14: 0
15/10/2024 04:30:05 PM --- Done page: 1/1
15/10/2024 04:30:05 PM --- Number of posts for page 1: 12
15/10/2024 04:30:05 PM --- Number of posts added on 2024-10-15: 0
16/10/2024 04:30:03 PM --- Done: Silver economy - Khi người cao tuổi “áp đảo” thị trường
16/10/2024 04:30:13 PM --- Done page: 1/1
16/10/2024 04:30:13 PM --- Number of posts for page 1: 12
16/10/2024 04:30:13 PM --- Number of posts added on 2024-10-16: 1
17/10/2024 04:31:08 PM --- Done page: 1/1
17/10/2024 04:31:08 PM --- Number of posts for page 1: 12
17/10/2024 04:31:08 PM --- Number of posts added on 2024-10-17: 0
18/10/2024 04:29:32 PM --- Done page: 1/1
18/10/2024 04:29:32 PM --- Number of posts for page 1: 12
18/10/2024 04:29:32 PM --- Number of posts added on 2024-10-18: 0
19/10/2024 04:28:17 PM --- Done page: 1/1
19/10/2024 04:28:17 PM --- Number of posts for page 1: 12
19/10/2024 04:28:17 PM --- Number of posts added on 2024-10-19: 0
20/10/2024 04:27:35 PM --- Done: Sunday scaries - Thứ hai chưa qua, Chủ nhật đã muốn “vã”
20/10/2024 04:27:48 PM --- Done page: 1/1
20/10/2024 04:27:48 PM --- Number of posts for page 1: 12
20/10/2024 04:27:48 PM --- Number of posts added on 2024-10-20: 1
21/10/2024 04:29:23 PM --- Done page: 1/1
21/10/2024 04:29:23 PM --- Number of posts for page 1: 12
21/10/2024 04:29:23 PM --- Number of posts added on 2024-10-21: 0
22/10/2024 04:30:16 PM --- Done page: 1/1
22/10/2024 04:30:16 PM --- Number of posts for page 1: 12
22/10/2024 04:30:16 PM --- Number of posts added on 2024-10-22: 0
23/10/2024 04:29:54 PM --- Done page: 1/1
23/10/2024 04:29:54 PM --- Number of posts for page 1: 12
23/10/2024 04:29:54 PM --- Number of posts added on 2024-10-23: 0
24/10/2024 04:29:16 PM --- Done page: 1/1
24/10/2024 04:29:16 PM --- Number of posts for page 1: 12
24/10/2024 04:29:16 PM --- Number of posts added on 2024-10-24: 0
25/10/2024 04:29:43 PM --- Done page: 1/1
25/10/2024 04:29:43 PM --- Number of posts for page 1: 12
25/10/2024 04:29:43 PM --- Number of posts added on 2024-10-25: 0
26/10/2024 04:27:17 PM --- Done page: 1/1
26/10/2024 04:27:17 PM --- Number of posts for page 1: 12
26/10/2024 04:27:17 PM --- Number of posts added on 2024-10-26: 0
27/10/2024 04:28:55 PM --- Done page: 1/1
27/10/2024 04:28:55 PM --- Number of posts for page 1: 12
27/10/2024 04:28:55 PM --- Number of posts added on 2024-10-27: 0
28/10/2024 04:30:40 PM --- Done page: 1/1
28/10/2024 04:30:40 PM --- Number of posts for page 1: 12
28/10/2024 04:30:40 PM --- Number of posts added on 2024-10-28: 0
29/10/2024 04:30:51 PM --- Done page: 1/1
29/10/2024 04:30:51 PM --- Number of posts for page 1: 12
29/10/2024 04:30:51 PM --- Number of posts added on 2024-10-29: 0
30/10/2024 04:30:31 PM --- Done page: 1/1
30/10/2024 04:30:31 PM --- Number of posts for page 1: 12
30/10/2024 04:30:31 PM --- Number of posts added on 2024-10-30: 0
31/10/2024 04:30:13 PM --- Done page: 1/1
31/10/2024 04:30:13 PM --- Number of posts for page 1: 12
31/10/2024 04:30:13 PM --- Number of posts added on 2024-10-31: 0
01/11/2024 04:28:43 PM --- Done page: 1/1
01/11/2024 04:28:43 PM --- Number of posts for page 1: 12
01/11/2024 04:28:43 PM --- Number of posts added on 2024-11-01: 0
02/11/2024 04:28:23 PM --- Done page: 1/1
02/11/2024 04:28:23 PM --- Number of posts for page 1: 12
02/11/2024 04:28:23 PM --- Number of posts added on 2024-11-02: 0
03/11/2024 04:27:22 PM --- Done page: 1/1
03/11/2024 04:27:22 PM --- Number of posts for page 1: 12
03/11/2024 04:27:22 PM --- Number of posts added on 2024-11-03: 0
04/11/2024 04:29:03 PM --- Done page: 1/1
04/11/2024 04:29:03 PM --- Number of posts for page 1: 12
04/11/2024 04:29:03 PM --- Number of posts added on 2024-11-04: 0
05/11/2024 04:30:23 PM --- Done page: 1/1
05/11/2024 04:30:23 PM --- Number of posts for page 1: 12
05/11/2024 04:30:23 PM --- Number of posts added on 2024-11-05: 0
06/11/2024 04:29:17 PM --- Done page: 1/1
06/11/2024 04:29:17 PM --- Number of posts for page 1: 12
06/11/2024 04:29:17 PM --- Number of posts added on 2024-11-06: 0
07/11/2024 04:29:14 PM --- Done page: 1/1
07/11/2024 04:29:14 PM --- Number of posts for page 1: 12
07/11/2024 04:29:14 PM --- Number of posts added on 2024-11-07: 0
08/11/2024 04:31:49 PM --- Done page: 1/1
08/11/2024 04:31:49 PM --- Number of posts for page 1: 12
08/11/2024 04:31:49 PM --- Number of posts added on 2024-11-08: 0
09/11/2024 04:26:28 PM --- Done page: 1/1
09/11/2024 04:26:28 PM --- Number of posts for page 1: 12
09/11/2024 04:26:28 PM --- Number of posts added on 2024-11-09: 0
10/11/2024 04:26:19 PM --- Done page: 1/1
10/11/2024 04:26:19 PM --- Number of posts for page 1: 12
10/11/2024 04:26:19 PM --- Number of posts added on 2024-11-10: 0
11/11/2024 04:29:49 PM --- Done page: 1/1
11/11/2024 04:29:49 PM --- Number of posts for page 1: 12
11/11/2024 04:29:49 PM --- Number of posts added on 2024-11-11: 0
12/11/2024 04:30:26 PM --- Done page: 1/1
12/11/2024 04:30:26 PM --- Number of posts for page 1: 12
12/11/2024 04:30:26 PM --- Number of posts added on 2024-11-12: 0
13/11/2024 04:28:40 PM --- Done page: 1/1
13/11/2024 04:28:40 PM --- Number of posts for page 1: 12
13/11/2024 04:28:40 PM --- Number of posts added on 2024-11-13: 0
14/11/2024 04:30:52 PM --- Done page: 1/1
14/11/2024 04:30:52 PM --- Number of posts for page 1: 12
14/11/2024 04:30:52 PM --- Number of posts added on 2024-11-14: 0
15/11/2024 04:30:53 PM --- Done: Brat - Từ “trẻ hư” đến từ khoá hot nhất năm 2024
15/11/2024 04:31:04 PM --- Done page: 1/1
15/11/2024 04:31:04 PM --- Number of posts for page 1: 12
15/11/2024 04:31:04 PM --- Number of posts added on 2024-11-15: 1
16/11/2024 04:29:49 PM --- Done page: 1/1
16/11/2024 04:29:49 PM --- Number of posts for page 1: 12
16/11/2024 04:29:49 PM --- Number of posts added on 2024-11-16: 0
17/11/2024 04:27:13 PM --- Done page: 1/1
17/11/2024 04:27:13 PM --- Number of posts for page 1: 12
17/11/2024 04:27:13 PM --- Number of posts added on 2024-11-17: 0
18/11/2024 04:31:50 PM --- Done page: 1/1
18/11/2024 04:31:50 PM --- Number of posts for page 1: 12
18/11/2024 04:31:50 PM --- Number of posts added on 2024-11-18: 0
19/11/2024 04:30:32 PM --- Done page: 1/1
19/11/2024 04:30:32 PM --- Number of posts for page 1: 12
19/11/2024 04:30:32 PM --- Number of posts added on 2024-11-19: 0
20/11/2024 04:31:37 PM --- Done page: 1/1
20/11/2024 04:31:37 PM --- Number of posts for page 1: 12
20/11/2024 04:31:37 PM --- Number of posts added on 2024-11-20: 0
21/11/2024 04:31:37 PM --- Done page: 1/1
21/11/2024 04:31:37 PM --- Number of posts for page 1: 12
21/11/2024 04:31:37 PM --- Number of posts added on 2024-11-21: 0
22/11/2024 04:31:16 PM --- Done page: 1/1
22/11/2024 04:31:16 PM --- Number of posts for page 1: 12
22/11/2024 04:31:16 PM --- Number of posts added on 2024-11-22: 0
23/11/2024 04:28:10 PM --- Done page: 1/1
23/11/2024 04:28:10 PM --- Number of posts for page 1: 12
23/11/2024 04:28:10 PM --- Number of posts added on 2024-11-23: 0
24/11/2024 04:27:43 PM --- Done: Yapping - Khi “lải nhải” cũng là một kỹ năng
24/11/2024 04:27:55 PM --- Done page: 1/1
24/11/2024 04:27:55 PM --- Number of posts for page 1: 12
24/11/2024 04:27:55 PM --- Number of posts added on 2024-11-24: 1
25/11/2024 04:31:36 PM --- Done page: 1/1
25/11/2024 04:31:36 PM --- Number of posts for page 1: 12
25/11/2024 04:31:36 PM --- Number of posts added on 2024-11-25: 0
26/11/2024 04:32:30 PM --- Done: Rage baiting - Khi cơn giận của bạn trở thành “cần câu cơm” của người khác
26/11/2024 04:32:42 PM --- Done page: 1/1
26/11/2024 04:32:42 PM --- Number of posts for page 1: 12
26/11/2024 04:32:42 PM --- Number of posts added on 2024-11-26: 1
27/11/2024 04:32:26 PM --- Done page: 1/1
27/11/2024 04:32:26 PM --- Number of posts for page 1: 12
27/11/2024 04:32:26 PM --- Number of posts added on 2024-11-27: 0
28/11/2024 04:31:05 PM --- Done page: 1/1
28/11/2024 04:31:05 PM --- Number of posts for page 1: 12
28/11/2024 04:31:05 PM --- Number of posts added on 2024-11-28: 0
29/11/2024 04:31:15 PM --- Done page: 1/1
29/11/2024 04:31:15 PM --- Number of posts for page 1: 12
29/11/2024 04:31:15 PM --- Number of posts added on 2024-11-29: 0
30/11/2024 04:28:37 PM --- Done page: 1/1
30/11/2024 04:28:37 PM --- Number of posts for page 1: 12
30/11/2024 04:28:37 PM --- Number of posts added on 2024-11-30: 0
01/12/2024 04:29:03 PM --- Done page: 1/1
01/12/2024 04:29:03 PM --- Number of posts for page 1: 12
01/12/2024 04:29:03 PM --- Number of posts added on 2024-12-01: 0
02/12/2024 04:32:38 PM --- Done page: 1/1
02/12/2024 04:32:38 PM --- Number of posts for page 1: 12
02/12/2024 04:32:38 PM --- Number of posts added on 2024-12-02: 0
03/12/2024 04:32:47 PM --- Done page: 1/1
03/12/2024 04:32:47 PM --- Number of posts for page 1: 12
03/12/2024 04:32:47 PM --- Number of posts added on 2024-12-03: 0
04/12/2024 04:33:31 PM --- Done page: 1/1
04/12/2024 04:33:31 PM --- Number of posts for page 1: 12
04/12/2024 04:33:31 PM --- Number of posts added on 2024-12-04: 0
05/12/2024 04:33:14 PM --- Done page: 1/1
05/12/2024 04:33:14 PM --- Number of posts for page 1: 12
05/12/2024 04:33:14 PM --- Number of posts added on 2024-12-05: 0
06/12/2024 04:29:46 PM --- Done page: 1/1
06/12/2024 04:29:46 PM --- Number of posts for page 1: 12
06/12/2024 04:29:46 PM --- Number of posts added on 2024-12-06: 0
07/12/2024 04:29:15 PM --- Done page: 1/1
07/12/2024 04:29:15 PM --- Number of posts for page 1: 12
07/12/2024 04:29:15 PM --- Number of posts added on 2024-12-07: 0
08/12/2024 04:28:39 PM --- Done page: 1/1
08/12/2024 04:28:39 PM --- Number of posts for page 1: 12
08/12/2024 04:28:39 PM --- Number of posts added on 2024-12-08: 0
09/12/2024 04:33:11 PM --- Done page: 1/1
09/12/2024 04:33:11 PM --- Number of posts for page 1: 12
09/12/2024 04:33:11 PM --- Number of posts added on 2024-12-09: 0
10/12/2024 04:33:19 PM --- Done page: 1/1
10/12/2024 04:33:19 PM --- Number of posts for page 1: 12
10/12/2024 04:33:19 PM --- Number of posts added on 2024-12-10: 0
11/12/2024 04:33:08 PM --- Done page: 1/1
11/12/2024 04:33:08 PM --- Number of posts for page 1: 12
11/12/2024 04:33:08 PM --- Number of posts added on 2024-12-11: 0
12/12/2024 04:32:34 PM --- Done page: 1/1
12/12/2024 04:32:34 PM --- Number of posts for page 1: 12
12/12/2024 04:32:34 PM --- Number of posts added on 2024-12-12: 0
13/12/2024 04:31:50 PM --- Done page: 1/1
13/12/2024 04:31:50 PM --- Number of posts for page 1: 12
13/12/2024 04:31:50 PM --- Number of posts added on 2024-12-13: 0
14/12/2024 04:28:54 PM --- Done page: 1/1
14/12/2024 04:28:54 PM --- Number of posts for page 1: 12
14/12/2024 04:28:54 PM --- Number of posts added on 2024-12-14: 0
15/12/2024 04:28:54 PM --- Done page: 1/1
15/12/2024 04:28:54 PM --- Number of posts for page 1: 12
15/12/2024 04:28:54 PM --- Number of posts added on 2024-12-15: 0
16/12/2024 04:33:00 PM --- Done page: 1/1
16/12/2024 04:33:00 PM --- Number of posts for page 1: 12
16/12/2024 04:33:00 PM --- Number of posts added on 2024-12-16: 0
17/12/2024 04:32:58 PM --- Done: Sledging: Trì hoãn nói chia tay vì không muốn lẻ bóng mùa lễ hội
17/12/2024 04:33:08 PM --- Done page: 1/1
17/12/2024 04:33:08 PM --- Number of posts for page 1: 12
17/12/2024 04:33:08 PM --- Number of posts added on 2024-12-17: 1
18/12/2024 04:31:34 PM --- Done page: 1/1
18/12/2024 04:31:34 PM --- Number of posts for page 1: 12
18/12/2024 04:31:34 PM --- Number of posts added on 2024-12-18: 0
19/12/2024 04:28:34 PM --- Done page: 1/1
19/12/2024 04:28:34 PM --- Number of posts for page 1: 12
19/12/2024 04:28:34 PM --- Number of posts added on 2024-12-19: 0
20/12/2024 04:28:47 PM --- Done page: 1/1
20/12/2024 04:28:47 PM --- Number of posts for page 1: 12
20/12/2024 04:28:47 PM --- Number of posts added on 2024-12-20: 0
21/12/2024 04:26:40 PM --- Done page: 1/1
21/12/2024 04:26:40 PM --- Number of posts for page 1: 12
21/12/2024 04:26:40 PM --- Number of posts added on 2024-12-21: 0
22/12/2024 04:26:04 PM --- Done page: 1/1
22/12/2024 04:26:04 PM --- Number of posts for page 1: 12
22/12/2024 04:26:04 PM --- Number of posts added on 2024-12-22: 0
23/12/2024 04:28:43 PM --- Done page: 1/1
23/12/2024 04:28:43 PM --- Number of posts for page 1: 12
23/12/2024 04:28:43 PM --- Number of posts added on 2024-12-23: 0
24/12/2024 04:28:08 PM --- Done page: 1/1
24/12/2024 04:28:08 PM --- Number of posts for page 1: 12
24/12/2024 04:28:08 PM --- Number of posts added on 2024-12-24: 0
25/12/2024 04:28:08 PM --- Done page: 1/1
25/12/2024 04:28:08 PM --- Number of posts for page 1: 12
25/12/2024 04:28:08 PM --- Number of posts added on 2024-12-25: 0
26/12/2024 04:28:25 PM --- Done page: 1/1
26/12/2024 04:28:25 PM --- Number of posts for page 1: 12
26/12/2024 04:28:25 PM --- Number of posts added on 2024-12-26: 0
27/12/2024 04:27:54 PM --- Done page: 1/1
27/12/2024 04:27:54 PM --- Number of posts for page 1: 12
27/12/2024 04:27:54 PM --- Number of posts added on 2024-12-27: 0
28/12/2024 04:26:50 PM --- Done page: 1/1
28/12/2024 04:26:50 PM --- Number of posts for page 1: 12
28/12/2024 04:26:50 PM --- Number of posts added on 2024-12-28: 0
29/12/2024 04:26:19 PM --- Done page: 1/1
29/12/2024 04:26:19 PM --- Number of posts for page 1: 12
29/12/2024 04:26:19 PM --- Number of posts added on 2024-12-29: 0
30/12/2024 04:28:55 PM --- Done page: 1/1
30/12/2024 04:28:55 PM --- Number of posts for page 1: 12
30/12/2024 04:28:55 PM --- Number of posts added on 2024-12-30: 0
31/12/2024 04:28:02 PM --- Done page: 1/1
31/12/2024 04:28:02 PM --- Number of posts for page 1: 12
31/12/2024 04:28:02 PM --- Number of posts added on 2024-12-31: 0
01/01/2025 04:28:10 PM --- Done page: 1/1
01/01/2025 04:28:10 PM --- Number of posts for page 1: 12
01/01/2025 04:28:10 PM --- Number of posts added on 2025-01-01: 0
02/01/2025 04:29:15 PM --- Done page: 1/1
02/01/2025 04:29:15 PM --- Number of posts for page 1: 12
02/01/2025 04:29:15 PM --- Number of posts added on 2025-01-02: 0
03/01/2025 04:28:54 PM --- Done page: 1/1
03/01/2025 04:28:54 PM --- Number of posts for page 1: 12
03/01/2025 04:28:54 PM --- Number of posts added on 2025-01-03: 0
04/01/2025 04:26:49 PM --- Done page: 1/1
04/01/2025 04:26:49 PM --- Number of posts for page 1: 12
04/01/2025 04:26:49 PM --- Number of posts added on 2025-01-04: 0
05/01/2025 04:26:25 PM --- Done page: 1/1
05/01/2025 04:26:25 PM --- Number of posts for page 1: 12
05/01/2025 04:26:25 PM --- Number of posts added on 2025-01-05: 0
06/01/2025 04:29:59 PM --- Done page: 1/1
06/01/2025 04:29:59 PM --- Number of posts for page 1: 12
06/01/2025 04:29:59 PM --- Number of posts added on 2025-01-06: 0
07/01/2025 04:39:44 PM --- Done page: 1/1
07/01/2025 04:39:44 PM --- Number of posts for page 1: 12
07/01/2025 04:39:44 PM --- Number of posts added on 2025-01-07: 0
08/01/2025 04:29:50 PM --- Done page: 1/1
08/01/2025 04:29:50 PM --- Number of posts for page 1: 12
08/01/2025 04:29:50 PM --- Number of posts added on 2025-01-08: 0
09/01/2025 04:30:09 PM --- Done page: 1/1
09/01/2025 04:30:09 PM --- Number of posts for page 1: 12
09/01/2025 04:30:09 PM --- Number of posts added on 2025-01-09: 0
10/01/2025 04:30:08 PM --- Done page: 1/1
10/01/2025 04:30:08 PM --- Number of posts for page 1: 12
10/01/2025 04:30:08 PM --- Number of posts added on 2025-01-10: 0
11/01/2025 04:27:04 PM --- Done page: 1/1
11/01/2025 04:27:04 PM --- Number of posts for page 1: 12
11/01/2025 04:27:04 PM --- Number of posts added on 2025-01-11: 0
12/01/2025 04:26:31 PM --- Done page: 1/1
12/01/2025 04:26:31 PM --- Number of posts for page 1: 12
12/01/2025 04:26:31 PM --- Number of posts added on 2025-01-12: 0
13/01/2025 04:31:31 PM --- Done page: 1/1
13/01/2025 04:31:31 PM --- Number of posts for page 1: 12
13/01/2025 04:31:31 PM --- Number of posts added on 2025-01-13: 0
14/01/2025 04:29:01 PM --- Done page: 1/1
14/01/2025 04:29:01 PM --- Number of posts for page 1: 12
14/01/2025 04:29:01 PM --- Number of posts added on 2025-01-14: 0
15/01/2025 04:27:40 PM --- Done page: 1/1
15/01/2025 04:27:40 PM --- Number of posts for page 1: 12
15/01/2025 04:27:40 PM --- Number of posts added on 2025-01-15: 0
16/01/2025 04:28:22 PM --- Done page: 1/1
16/01/2025 04:28:22 PM --- Number of posts for page 1: 12
16/01/2025 04:28:22 PM --- Number of posts added on 2025-01-16: 0
17/01/2025 04:27:54 PM --- Done page: 1/1
17/01/2025 04:27:54 PM --- Number of posts for page 1: 12
17/01/2025 04:27:54 PM --- Number of posts added on 2025-01-17: 0
18/01/2025 04:25:33 PM --- Done page: 1/1
18/01/2025 04:25:33 PM --- Number of posts for page 1: 12
18/01/2025 04:25:33 PM --- Number of posts added on 2025-01-18: 0
19/01/2025 04:25:19 PM --- Done page: 1/1
19/01/2025 04:25:19 PM --- Number of posts for page 1: 12
19/01/2025 04:25:19 PM --- Number of posts added on 2025-01-19: 0
20/01/2025 04:28:35 PM --- Done page: 1/1
20/01/2025 04:28:35 PM --- Number of posts for page 1: 12
20/01/2025 04:28:35 PM --- Number of posts added on 2025-01-20: 0
21/01/2025 04:30:01 PM --- Done page: 1/1
21/01/2025 04:30:01 PM --- Number of posts for page 1: 12
21/01/2025 04:30:01 PM --- Number of posts added on 2025-01-21: 0
22/01/2025 04:29:09 PM --- Done page: 1/1
22/01/2025 04:29:09 PM --- Number of posts for page 1: 12
22/01/2025 04:29:09 PM --- Number of posts added on 2025-01-22: 0
23/01/2025 04:29:30 PM --- Done page: 1/1
23/01/2025 04:29:30 PM --- Number of posts for page 1: 12
23/01/2025 04:29:30 PM --- Number of posts added on 2025-01-23: 0
24/01/2025 04:28:31 PM --- Done page: 1/1
24/01/2025 04:28:31 PM --- Number of posts for page 1: 12
24/01/2025 04:28:31 PM --- Number of posts added on 2025-01-24: 0
25/01/2025 04:27:15 PM --- Done page: 1/1
25/01/2025 04:27:15 PM --- Number of posts for page 1: 12
25/01/2025 04:27:15 PM --- Number of posts added on 2025-01-25: 0
26/01/2025 04:25:32 PM --- Done page: 1/1
26/01/2025 04:25:32 PM --- Number of posts for page 1: 12
26/01/2025 04:25:32 PM --- Number of posts added on 2025-01-26: 0
27/01/2025 04:28:09 PM --- Done page: 1/1
27/01/2025 04:28:09 PM --- Number of posts for page 1: 12
27/01/2025 04:28:09 PM --- Number of posts added on 2025-01-27: 0
28/01/2025 04:28:49 PM --- Done page: 1/1
28/01/2025 04:28:49 PM --- Number of posts for page 1: 12
28/01/2025 04:28:49 PM --- Number of posts added on 2025-01-28: 0
29/01/2025 04:29:27 PM --- Done page: 1/1
29/01/2025 04:29:27 PM --- Number of posts for page 1: 12
29/01/2025 04:29:27 PM --- Number of posts added on 2025-01-29: 0
30/01/2025 04:29:30 PM --- Done page: 1/1
30/01/2025 04:29:30 PM --- Number of posts for page 1: 12
30/01/2025 04:29:30 PM --- Number of posts added on 2025-01-30: 0
31/01/2025 04:28:05 PM --- Done page: 1/1
31/01/2025 04:28:05 PM --- Number of posts for page 1: 12
31/01/2025 04:28:05 PM --- Number of posts added on 2025-01-31: 0
01/02/2025 04:25:33 PM --- Done page: 1/1
01/02/2025 04:25:33 PM --- Number of posts for page 1: 12
01/02/2025 04:25:33 PM --- Number of posts added on 2025-02-01: 0
02/02/2025 04:27:05 PM --- Done page: 1/1
02/02/2025 04:27:05 PM --- Number of posts for page 1: 12
02/02/2025 04:27:05 PM --- Number of posts added on 2025-02-02: 0
03/02/2025 04:28:51 PM --- Done page: 1/1
03/02/2025 04:28:51 PM --- Number of posts for page 1: 12
03/02/2025 04:28:51 PM --- Number of posts added on 2025-02-03: 0
04/02/2025 04:29:59 PM --- Done page: 1/1
04/02/2025 04:29:59 PM --- Number of posts for page 1: 12
04/02/2025 04:29:59 PM --- Number of posts added on 2025-02-04: 0
05/02/2025 04:29:21 PM --- Done page: 1/1
05/02/2025 04:29:21 PM --- Number of posts for page 1: 12
05/02/2025 04:29:21 PM --- Number of posts added on 2025-02-05: 0
06/02/2025 04:28:07 PM --- Done page: 1/1
06/02/2025 04:28:07 PM --- Number of posts for page 1: 12
06/02/2025 04:28:07 PM --- Number of posts added on 2025-02-06: 0
07/02/2025 04:29:13 PM --- Done page: 1/1
07/02/2025 04:29:13 PM --- Number of posts for page 1: 12
07/02/2025 04:29:13 PM --- Number of posts added on 2025-02-07: 0
08/02/2025 04:25:49 PM --- Done page: 1/1
08/02/2025 04:25:49 PM --- Number of posts for page 1: 12
08/02/2025 04:25:49 PM --- Number of posts added on 2025-02-08: 0
09/02/2025 04:25:41 PM --- Done page: 1/1
09/02/2025 04:25:41 PM --- Number of posts for page 1: 12
09/02/2025 04:25:41 PM --- Number of posts added on 2025-02-09: 0
10/02/2025 04:29:51 PM --- Done page: 1/1
10/02/2025 04:29:51 PM --- Number of posts for page 1: 12
10/02/2025 04:29:51 PM --- Number of posts added on 2025-02-10: 0
11/02/2025 04:31:22 PM --- Done page: 1/1
11/02/2025 04:31:22 PM --- Number of posts for page 1: 12
11/02/2025 04:31:22 PM --- Number of posts added on 2025-02-11: 0
12/02/2025 04:30:44 PM --- Done page: 1/1
12/02/2025 04:30:44 PM --- Number of posts for page 1: 12
12/02/2025 04:30:44 PM --- Number of posts added on 2025-02-12: 0
13/02/2025 04:30:27 PM --- Done page: 1/1
13/02/2025 04:30:27 PM --- Number of posts for page 1: 12
13/02/2025 04:30:27 PM --- Number of posts added on 2025-02-13: 0
14/02/2025 04:27:57 PM --- Done page: 1/1
14/02/2025 04:27:57 PM --- Number of posts for page 1: 12
14/02/2025 04:27:57 PM --- Number of posts added on 2025-02-14: 0
15/02/2025 04:26:29 PM --- Done page: 1/1
15/02/2025 04:26:29 PM --- Number of posts for page 1: 12
15/02/2025 04:26:29 PM --- Number of posts added on 2025-02-15: 0
16/02/2025 04:26:09 PM --- Done page: 1/1
16/02/2025 04:26:09 PM --- Number of posts for page 1: 12
16/02/2025 04:26:09 PM --- Number of posts added on 2025-02-16: 0
17/02/2025 04:29:27 PM --- Done page: 1/1
17/02/2025 04:29:27 PM --- Number of posts for page 1: 12
17/02/2025 04:29:27 PM --- Number of posts added on 2025-02-17: 0
18/02/2025 04:31:04 PM --- Done page: 1/1
18/02/2025 04:31:04 PM --- Number of posts for page 1: 12
18/02/2025 04:31:04 PM --- Number of posts added on 2025-02-18: 0
19/02/2025 04:29:12 PM --- Done page: 1/1
19/02/2025 04:29:12 PM --- Number of posts for page 1: 12
19/02/2025 04:29:12 PM --- Number of posts added on 2025-02-19: 0
20/02/2025 04:31:37 PM --- Done page: 1/1
20/02/2025 04:31:37 PM --- Number of posts for page 1: 12
20/02/2025 04:31:37 PM --- Number of posts added on 2025-02-20: 0
21/02/2025 04:29:36 PM --- Done page: 1/1
21/02/2025 04:29:36 PM --- Number of posts for page 1: 12
21/02/2025 04:29:36 PM --- Number of posts added on 2025-02-21: 0
22/02/2025 04:26:26 PM --- Done page: 1/1
22/02/2025 04:26:26 PM --- Number of posts for page 1: 12
22/02/2025 04:26:26 PM --- Number of posts added on 2025-02-22: 0
23/02/2025 04:26:26 PM --- Done page: 1/1
23/02/2025 04:26:26 PM --- Number of posts for page 1: 12
23/02/2025 04:26:26 PM --- Number of posts added on 2025-02-23: 0
24/02/2025 04:32:11 PM --- Done page: 1/1
24/02/2025 04:32:11 PM --- Number of posts for page 1: 12
24/02/2025 04:32:11 PM --- Number of posts added on 2025-02-24: 0
25/02/2025 04:31:21 PM --- Done page: 1/1
25/02/2025 04:31:21 PM --- Number of posts for page 1: 12
25/02/2025 04:31:21 PM --- Number of posts added on 2025-02-25: 0
26/02/2025 04:31:16 PM --- Done page: 1/1
26/02/2025 04:31:16 PM --- Number of posts for page 1: 12
26/02/2025 04:31:16 PM --- Number of posts added on 2025-02-26: 0
27/02/2025 04:31:59 PM --- Done page: 1/1
27/02/2025 04:31:59 PM --- Number of posts for page 1: 12
27/02/2025 04:31:59 PM --- Number of posts added on 2025-02-27: 0
28/02/2025 04:30:50 PM --- Done page: 1/1
28/02/2025 04:30:50 PM --- Number of posts for page 1: 12
28/02/2025 04:30:50 PM --- Number of posts added on 2025-02-28: 0
01/03/2025 04:27:03 PM --- Done page: 1/1
01/03/2025 04:27:03 PM --- Number of posts for page 1: 12
01/03/2025 04:27:03 PM --- Number of posts added on 2025-03-01: 0
02/03/2025 04:28:00 PM --- Done page: 1/1
02/03/2025 04:28:00 PM --- Number of posts for page 1: 12
02/03/2025 04:28:00 PM --- Number of posts added on 2025-03-02: 0
03/03/2025 04:30:07 PM --- Done page: 1/1
03/03/2025 04:30:07 PM --- Number of posts for page 1: 12
03/03/2025 04:30:07 PM --- Number of posts added on 2025-03-03: 0
04/03/2025 04:31:52 PM --- Done page: 1/1
04/03/2025 04:31:52 PM --- Number of posts for page 1: 12
04/03/2025 04:31:52 PM --- Number of posts added on 2025-03-04: 0
05/03/2025 04:37:15 PM --- Done page: 1/1
05/03/2025 04:37:15 PM --- Number of posts for page 1: 12
05/03/2025 04:37:15 PM --- Number of posts added on 2025-03-05: 0
06/03/2025 04:30:58 PM --- Done page: 1/1
06/03/2025 04:30:58 PM --- Number of posts for page 1: 12
06/03/2025 04:30:58 PM --- Number of posts added on 2025-03-06: 0
07/03/2025 04:30:21 PM --- Done page: 1/1
07/03/2025 04:30:21 PM --- Number of posts for page 1: 12
07/03/2025 04:30:21 PM --- Number of posts added on 2025-03-07: 0
08/03/2025 04:23:05 PM --- Done page: 1/1
08/03/2025 04:23:05 PM --- Number of posts for page 1: 12
08/03/2025 04:23:05 PM --- Number of posts added on 2025-03-08: 0
09/03/2025 04:23:42 PM --- Done page: 1/1
09/03/2025 04:23:42 PM --- Number of posts for page 1: 12
09/03/2025 04:23:42 PM --- Number of posts added on 2025-03-09: 0
10/03/2025 04:29:04 PM --- Done page: 1/1
10/03/2025 04:29:04 PM --- Number of posts for page 1: 12
10/03/2025 04:29:04 PM --- Number of posts added on 2025-03-10: 0
11/03/2025 04:32:54 PM --- Done page: 1/1
11/03/2025 04:32:54 PM --- Number of posts for page 1: 12
11/03/2025 04:32:54 PM --- Number of posts added on 2025-03-11: 0
12/03/2025 04:32:22 PM --- Done page: 1/1
12/03/2025 04:32:22 PM --- Number of posts for page 1: 12
12/03/2025 04:32:22 PM --- Number of posts added on 2025-03-12: 0
13/03/2025 04:32:51 PM --- Done page: 1/1
13/03/2025 04:32:51 PM --- Number of posts for page 1: 12
13/03/2025 04:32:51 PM --- Number of posts added on 2025-03-13: 0
14/03/2025 04:30:07 PM --- Done page: 1/1
14/03/2025 04:30:07 PM --- Number of posts for page 1: 12
14/03/2025 04:30:07 PM --- Number of posts added on 2025-03-14: 0
15/03/2025 04:27:36 PM --- Done page: 1/1
15/03/2025 04:27:36 PM --- Number of posts for page 1: 12
15/03/2025 04:27:36 PM --- Number of posts added on 2025-03-15: 0
16/03/2025 04:28:11 PM --- Done page: 1/1
16/03/2025 04:28:11 PM --- Number of posts for page 1: 12
16/03/2025 04:28:11 PM --- Number of posts added on 2025-03-16: 0
17/03/2025 04:32:26 PM --- Done page: 1/1
17/03/2025 04:32:26 PM --- Number of posts for page 1: 12
17/03/2025 04:32:26 PM --- Number of posts added on 2025-03-17: 0
18/03/2025 04:32:38 PM --- Done page: 1/1
18/03/2025 04:32:38 PM --- Number of posts for page 1: 12
18/03/2025 04:32:38 PM --- Number of posts added on 2025-03-18: 0
19/03/2025 04:32:03 PM --- Done page: 1/1
19/03/2025 04:32:03 PM --- Number of posts for page 1: 12
19/03/2025 04:32:03 PM --- Number of posts added on 2025-03-19: 0
20/03/2025 04:32:20 PM --- Done page: 1/1
20/03/2025 04:32:20 PM --- Number of posts for page 1: 12
20/03/2025 04:32:20 PM --- Number of posts added on 2025-03-20: 0
21/03/2025 04:31:36 PM --- Done page: 1/1
21/03/2025 04:31:36 PM --- Number of posts for page 1: 12
21/03/2025 04:31:36 PM --- Number of posts added on 2025-03-21: 0
22/03/2025 04:28:04 PM --- Done page: 1/1
22/03/2025 04:28:04 PM --- Number of posts for page 1: 12
22/03/2025 04:28:04 PM --- Number of posts added on 2025-03-22: 0
23/03/2025 04:28:12 PM --- Done page: 1/1
23/03/2025 04:28:12 PM --- Number of posts for page 1: 12
23/03/2025 04:28:12 PM --- Number of posts added on 2025-03-23: 0
25/03/2025 02:45:52 PM --- Done page: 1/1
25/03/2025 02:45:52 PM --- Number of posts for page 1: 12
25/03/2025 02:45:52 PM --- Number of posts added on 2025-03-25: 0
25/03/2025 04:30:12 PM --- Done page: 1/1
25/03/2025 04:30:12 PM --- Number of posts for page 1: 12
25/03/2025 04:30:12 PM --- Number of posts added on 2025-03-25: 0
26/03/2025 04:33:03 PM --- Done page: 1/1
26/03/2025 04:33:03 PM --- Number of posts for page 1: 12
26/03/2025 04:33:03 PM --- Number of posts added on 2025-03-26: 0
27/03/2025 04:32:37 PM --- Done page: 1/1
27/03/2025 04:32:37 PM --- Number of posts for page 1: 12
27/03/2025 04:32:37 PM --- Number of posts added on 2025-03-27: 0
28/03/2025 04:31:21 PM --- Done page: 1/1
28/03/2025 04:31:21 PM --- Number of posts for page 1: 12
28/03/2025 04:31:21 PM --- Number of posts added on 2025-03-28: 0
29/03/2025 04:29:56 PM --- Done page: 1/1
29/03/2025 04:29:56 PM --- Number of posts for page 1: 12
29/03/2025 04:29:56 PM --- Number of posts added on 2025-03-29: 0
30/03/2025 04:29:00 PM --- Done page: 1/1
30/03/2025 04:29:00 PM --- Number of posts for page 1: 12
30/03/2025 04:29:00 PM --- Number of posts added on 2025-03-30: 0
31/03/2025 04:32:31 PM --- Done page: 1/1
31/03/2025 04:32:31 PM --- Number of posts for page 1: 12
31/03/2025 04:32:31 PM --- Number of posts added on 2025-03-31: 0
01/04/2025 04:31:14 PM --- Done page: 1/1
01/04/2025 04:31:14 PM --- Number of posts for page 1: 12
01/04/2025 04:31:14 PM --- Number of posts added on 2025-04-01: 0
02/04/2025 04:33:21 PM --- Done page: 1/1
02/04/2025 04:33:21 PM --- Number of posts for page 1: 12
02/04/2025 04:33:21 PM --- Number of posts added on 2025-04-02: 0
03/04/2025 04:31:37 PM --- Done page: 1/1
03/04/2025 04:31:37 PM --- Number of posts for page 1: 12
03/04/2025 04:31:37 PM --- Number of posts added on 2025-04-03: 0
04/04/2025 04:30:59 PM --- Done page: 1/1
04/04/2025 04:30:59 PM --- Number of posts for page 1: 12
04/04/2025 04:30:59 PM --- Number of posts added on 2025-04-04: 0
05/04/2025 04:29:00 PM --- Done page: 1/1
05/04/2025 04:29:00 PM --- Number of posts for page 1: 12
05/04/2025 04:29:00 PM --- Number of posts added on 2025-04-05: 0
06/04/2025 04:28:33 PM --- Done page: 1/1
06/04/2025 04:28:33 PM --- Number of posts for page 1: 12
06/04/2025 04:28:33 PM --- Number of posts added on 2025-04-06: 0
07/04/2025 04:31:00 PM --- Done page: 1/1
07/04/2025 04:31:00 PM --- Number of posts for page 1: 12
07/04/2025 04:31:00 PM --- Number of posts added on 2025-04-07: 0
08/04/2025 04:32:52 PM --- Done page: 1/1
08/04/2025 04:32:52 PM --- Number of posts for page 1: 12
08/04/2025 04:32:52 PM --- Number of posts added on 2025-04-08: 0
09/04/2025 04:32:59 PM --- Done page: 1/1
09/04/2025 04:32:59 PM --- Number of posts for page 1: 12
09/04/2025 04:32:59 PM --- Number of posts added on 2025-04-09: 0
10/04/2025 04:32:50 PM --- Done page: 1/1
10/04/2025 04:32:50 PM --- Number of posts for page 1: 12
10/04/2025 04:32:50 PM --- Number of posts added on 2025-04-10: 0
11/04/2025 04:32:25 PM --- Done page: 1/1
11/04/2025 04:32:25 PM --- Number of posts for page 1: 12
11/04/2025 04:32:25 PM --- Number of posts added on 2025-04-11: 0
12/04/2025 04:28:52 PM --- Done page: 1/1
12/04/2025 04:28:52 PM --- Number of posts for page 1: 12
12/04/2025 04:28:52 PM --- Number of posts added on 2025-04-12: 0
13/04/2025 04:30:29 PM --- Done page: 1/1
13/04/2025 04:30:29 PM --- Number of posts for page 1: 12
13/04/2025 04:30:29 PM --- Number of posts added on 2025-04-13: 0
14/04/2025 04:32:32 PM --- Done page: 1/1
14/04/2025 04:32:32 PM --- Number of posts for page 1: 12
14/04/2025 04:32:32 PM --- Number of posts added on 2025-04-14: 0
15/04/2025 04:31:13 PM --- Done page: 1/1
15/04/2025 04:31:13 PM --- Number of posts for page 1: 12
15/04/2025 04:31:13 PM --- Number of posts added on 2025-04-15: 0
16/04/2025 04:33:01 PM --- Done page: 1/1
16/04/2025 04:33:01 PM --- Number of posts for page 1: 12
16/04/2025 04:33:01 PM --- Number of posts added on 2025-04-16: 0
17/04/2025 04:32:00 PM --- Done page: 1/1
17/04/2025 04:32:00 PM --- Number of posts for page 1: 12
17/04/2025 04:32:00 PM --- Number of posts added on 2025-04-17: 0
18/04/2025 04:31:03 PM --- Done page: 1/1
18/04/2025 04:31:03 PM --- Number of posts for page 1: 12
18/04/2025 04:31:03 PM --- Number of posts added on 2025-04-18: 0
19/04/2025 04:30:18 PM --- Done page: 1/1
19/04/2025 04:30:18 PM --- Number of posts for page 1: 12
19/04/2025 04:30:18 PM --- Number of posts added on 2025-04-19: 0
20/04/2025 04:28:28 PM --- Done page: 1/1
20/04/2025 04:28:28 PM --- Number of posts for page 1: 12
20/04/2025 04:28:28 PM --- Number of posts added on 2025-04-20: 0
21/04/2025 04:33:16 PM --- Done page: 1/1
21/04/2025 04:33:16 PM --- Number of posts for page 1: 12
21/04/2025 04:33:16 PM --- Number of posts added on 2025-04-21: 0
22/04/2025 04:32:19 PM --- Done page: 1/1
22/04/2025 04:32:19 PM --- Number of posts for page 1: 12
22/04/2025 04:32:19 PM --- Number of posts added on 2025-04-22: 0
23/04/2025 04:33:31 PM --- Done page: 1/1
23/04/2025 04:33:31 PM --- Number of posts for page 1: 12
23/04/2025 04:33:31 PM --- Number of posts added on 2025-04-23: 0
24/04/2025 04:33:04 PM --- Done page: 1/1
24/04/2025 04:33:04 PM --- Number of posts for page 1: 12
24/04/2025 04:33:04 PM --- Number of posts added on 2025-04-24: 0
25/04/2025 04:31:52 PM --- Done page: 1/1
25/04/2025 04:31:52 PM --- Number of posts for page 1: 12
25/04/2025 04:31:52 PM --- Number of posts added on 2025-04-25: 0
26/04/2025 04:29:24 PM --- Done page: 1/1
26/04/2025 04:29:24 PM --- Number of posts for page 1: 12
26/04/2025 04:29:24 PM --- Number of posts added on 2025-04-26: 0
27/04/2025 04:29:23 PM --- Done page: 1/1
27/04/2025 04:29:23 PM --- Number of posts for page 1: 12
27/04/2025 04:29:23 PM --- Number of posts added on 2025-04-27: 0
28/04/2025 04:31:56 PM --- Done page: 1/1
28/04/2025 04:31:56 PM --- Number of posts for page 1: 12
28/04/2025 04:31:56 PM --- Number of posts added on 2025-04-28: 0
29/04/2025 04:32:55 PM --- Done page: 1/1
29/04/2025 04:32:55 PM --- Number of posts for page 1: 12
29/04/2025 04:32:55 PM --- Number of posts added on 2025-04-29: 0
30/04/2025 04:32:54 PM --- Done page: 1/1
30/04/2025 04:32:54 PM --- Number of posts for page 1: 12
30/04/2025 04:32:54 PM --- Number of posts added on 2025-04-30: 0
01/05/2025 04:32:41 PM --- Done page: 1/1
01/05/2025 04:32:41 PM --- Number of posts for page 1: 12
01/05/2025 04:32:41 PM --- Number of posts added on 2025-05-01: 0
02/05/2025 04:32:59 PM --- Done page: 1/1
02/05/2025 04:32:59 PM --- Number of posts for page 1: 12
02/05/2025 04:32:59 PM --- Number of posts added on 2025-05-02: 0
03/05/2025 04:30:09 PM --- Done page: 1/1
03/05/2025 04:30:09 PM --- Number of posts for page 1: 12
03/05/2025 04:30:09 PM --- Number of posts added on 2025-05-03: 0
04/05/2025 04:30:20 PM --- Done page: 1/1
04/05/2025 04:30:20 PM --- Number of posts for page 1: 12
04/05/2025 04:30:20 PM --- Number of posts added on 2025-05-04: 0
05/05/2025 04:33:51 PM --- Done page: 1/1
05/05/2025 04:33:51 PM --- Number of posts for page 1: 12
05/05/2025 04:33:51 PM --- Number of posts added on 2025-05-05: 0
06/05/2025 04:32:12 PM --- Done page: 1/1
06/05/2025 04:32:12 PM --- Number of posts for page 1: 12
06/05/2025 04:32:12 PM --- Number of posts added on 2025-05-06: 0
07/05/2025 04:34:28 PM --- Done page: 1/1
07/05/2025 04:34:28 PM --- Number of posts for page 1: 12
07/05/2025 04:34:28 PM --- Number of posts added on 2025-05-07: 0
08/05/2025 04:34:18 PM --- Done page: 1/1
08/05/2025 04:34:18 PM --- Number of posts for page 1: 12
08/05/2025 04:34:18 PM --- Number of posts added on 2025-05-08: 0
09/05/2025 04:32:07 PM --- Done page: 1/1
09/05/2025 04:32:07 PM --- Number of posts for page 1: 12
09/05/2025 04:32:07 PM --- Number of posts added on 2025-05-09: 0
10/05/2025 04:31:28 PM --- Done page: 1/1
10/05/2025 04:31:28 PM --- Number of posts for page 1: 12
10/05/2025 04:31:28 PM --- Number of posts added on 2025-05-10: 0
11/05/2025 04:30:14 PM --- Done page: 1/1
11/05/2025 04:30:14 PM --- Number of posts for page 1: 12
11/05/2025 04:30:14 PM --- Number of posts added on 2025-05-11: 0
12/05/2025 04:34:23 PM --- Done page: 1/1
12/05/2025 04:34:23 PM --- Number of posts for page 1: 12
12/05/2025 04:34:23 PM --- Number of posts added on 2025-05-12: 0
13/05/2025 04:34:19 PM --- Done page: 1/1
13/05/2025 04:34:19 PM --- Number of posts for page 1: 12
13/05/2025 04:34:19 PM --- Number of posts added on 2025-05-13: 0
14/05/2025 04:33:32 PM --- Done page: 1/1
14/05/2025 04:33:32 PM --- Number of posts for page 1: 12
14/05/2025 04:33:32 PM --- Number of posts added on 2025-05-14: 0
15/05/2025 04:34:22 PM --- Done page: 1/1
15/05/2025 04:34:22 PM --- Number of posts for page 1: 12
15/05/2025 04:34:22 PM --- Number of posts added on 2025-05-15: 0
16/05/2025 04:33:00 PM --- Done page: 1/1
16/05/2025 04:33:00 PM --- Number of posts for page 1: 12
16/05/2025 04:33:00 PM --- Number of posts added on 2025-05-16: 0
17/05/2025 04:30:35 PM --- Done page: 1/1
17/05/2025 04:30:35 PM --- Number of posts for page 1: 12
17/05/2025 04:30:35 PM --- Number of posts added on 2025-05-17: 0
18/05/2025 04:29:53 PM --- Done page: 1/1
18/05/2025 04:29:53 PM --- Number of posts for page 1: 12
18/05/2025 04:29:53 PM --- Number of posts added on 2025-05-18: 0
19/05/2025 04:33:46 PM --- Done page: 1/1
19/05/2025 04:33:46 PM --- Number of posts for page 1: 12
19/05/2025 04:33:46 PM --- Number of posts added on 2025-05-19: 0
20/05/2025 04:34:02 PM --- Done page: 1/1
20/05/2025 04:34:02 PM --- Number of posts for page 1: 12
20/05/2025 04:34:02 PM --- Number of posts added on 2025-05-20: 0
21/05/2025 04:34:15 PM --- Done page: 1/1
21/05/2025 04:34:15 PM --- Number of posts for page 1: 12
21/05/2025 04:34:15 PM --- Number of posts added on 2025-05-21: 0
22/05/2025 04:33:51 PM --- Done page: 1/1
22/05/2025 04:33:51 PM --- Number of posts for page 1: 12
22/05/2025 04:33:51 PM --- Number of posts added on 2025-05-22: 0
23/05/2025 04:32:40 PM --- Done page: 1/1
23/05/2025 04:32:40 PM --- Number of posts for page 1: 12
23/05/2025 04:32:40 PM --- Number of posts added on 2025-05-23: 0
24/05/2025 04:30:18 PM --- Done page: 1/1
24/05/2025 04:30:18 PM --- Number of posts for page 1: 12
24/05/2025 04:30:18 PM --- Number of posts added on 2025-05-24: 0
25/05/2025 04:31:18 PM --- Done page: 1/1
25/05/2025 04:31:18 PM --- Number of posts for page 1: 12
25/05/2025 04:31:18 PM --- Number of posts added on 2025-05-25: 0
26/05/2025 04:32:25 PM --- Done page: 1/1
26/05/2025 04:32:25 PM --- Number of posts for page 1: 12
26/05/2025 04:32:25 PM --- Number of posts added on 2025-05-26: 0
27/05/2025 04:34:15 PM --- Done page: 1/1
27/05/2025 04:34:15 PM --- Number of posts for page 1: 12
27/05/2025 04:34:15 PM --- Number of posts added on 2025-05-27: 0
28/05/2025 04:33:17 PM --- Done page: 1/1
28/05/2025 04:33:17 PM --- Number of posts for page 1: 12
28/05/2025 04:33:17 PM --- Number of posts added on 2025-05-28: 0
29/05/2025 04:33:31 PM --- Done page: 1/1
29/05/2025 04:33:31 PM --- Number of posts for page 1: 12
29/05/2025 04:33:31 PM --- Number of posts added on 2025-05-29: 0
31/05/2025 03:14:00 AM --- Done page: 1/1
31/05/2025 03:14:00 AM --- Number of posts for page 1: 12
31/05/2025 03:14:00 AM --- Number of posts added on 2025-05-31: 0
31/05/2025 04:30:37 PM --- Done page: 1/1
31/05/2025 04:30:37 PM --- Number of posts for page 1: 12
31/05/2025 04:30:37 PM --- Number of posts added on 2025-05-31: 0
01/06/2025 04:31:20 PM --- Done page: 1/1
01/06/2025 04:31:20 PM --- Number of posts for page 1: 12
01/06/2025 04:31:20 PM --- Number of posts added on 2025-06-01: 0
02/06/2025 04:35:26 PM --- Done page: 1/1
02/06/2025 04:35:26 PM --- Number of posts for page 1: 12
02/06/2025 04:35:26 PM --- Number of posts added on 2025-06-02: 0
03/06/2025 04:35:56 PM --- Done page: 1/1
03/06/2025 04:35:56 PM --- Number of posts for page 1: 12
03/06/2025 04:35:56 PM --- Number of posts added on 2025-06-03: 0
04/06/2025 04:29:59 PM --- Done page: 1/1
04/06/2025 04:29:59 PM --- Number of posts for page 1: 12
04/06/2025 04:29:59 PM --- Number of posts added on 2025-06-04: 0
05/06/2025 04:34:15 PM --- Done page: 1/1
05/06/2025 04:34:15 PM --- Number of posts for page 1: 12
05/06/2025 04:34:15 PM --- Number of posts added on 2025-06-05: 0
06/06/2025 04:34:23 PM --- Done page: 1/1
06/06/2025 04:34:23 PM --- Number of posts for page 1: 12
06/06/2025 04:34:23 PM --- Number of posts added on 2025-06-06: 0
07/06/2025 04:31:27 PM --- Done page: 1/1
07/06/2025 04:31:27 PM --- Number of posts for page 1: 12
07/06/2025 04:31:27 PM --- Number of posts added on 2025-06-07: 0
08/06/2025 04:30:29 PM --- Done page: 1/1
08/06/2025 04:30:29 PM --- Number of posts for page 1: 12
08/06/2025 04:30:29 PM --- Number of posts added on 2025-06-08: 0
09/06/2025 04:35:14 PM --- Done page: 1/1
09/06/2025 04:35:14 PM --- Number of posts for page 1: 12
09/06/2025 04:35:14 PM --- Number of posts added on 2025-06-09: 0
10/06/2025 04:35:10 PM --- Done page: 1/1
10/06/2025 04:35:10 PM --- Number of posts for page 1: 12
10/06/2025 04:35:10 PM --- Number of posts added on 2025-06-10: 0
11/06/2025 04:35:01 PM --- Done page: 1/1
11/06/2025 04:35:01 PM --- Number of posts for page 1: 12
11/06/2025 04:35:01 PM --- Number of posts added on 2025-06-11: 0
12/06/2025 04:34:40 PM --- Done page: 1/1
12/06/2025 04:34:40 PM --- Number of posts for page 1: 12
12/06/2025 04:34:40 PM --- Number of posts added on 2025-06-12: 0
13/06/2025 04:34:17 PM --- Done page: 1/1
13/06/2025 04:34:17 PM --- Number of posts for page 1: 12
13/06/2025 04:34:17 PM --- Number of posts added on 2025-06-13: 0
14/06/2025 04:31:11 PM --- Done page: 1/1
14/06/2025 04:31:11 PM --- Number of posts for page 1: 12
14/06/2025 04:31:11 PM --- Number of posts added on 2025-06-14: 0
15/06/2025 04:31:03 PM --- Done page: 1/1
15/06/2025 04:31:03 PM --- Number of posts for page 1: 12
15/06/2025 04:31:03 PM --- Number of posts added on 2025-06-15: 0
16/06/2025 04:34:59 PM --- Done page: 1/1
16/06/2025 04:34:59 PM --- Number of posts for page 1: 12
16/06/2025 04:34:59 PM --- Number of posts added on 2025-06-16: 0
17/06/2025 04:35:29 PM --- Done page: 1/1
17/06/2025 04:35:29 PM --- Number of posts for page 1: 12
17/06/2025 04:35:29 PM --- Number of posts added on 2025-06-17: 0
18/06/2025 04:35:11 PM --- Done page: 1/1
18/06/2025 04:35:11 PM --- Number of posts for page 1: 12
18/06/2025 04:35:11 PM --- Number of posts added on 2025-06-18: 0
19/06/2025 04:33:57 PM --- Done page: 1/1
19/06/2025 04:33:57 PM --- Number of posts for page 1: 12
19/06/2025 04:33:57 PM --- Number of posts added on 2025-06-19: 0
20/06/2025 04:33:26 PM --- Done page: 1/1
20/06/2025 04:33:26 PM --- Number of posts for page 1: 12
20/06/2025 04:33:26 PM --- Number of posts added on 2025-06-20: 0
21/06/2025 04:31:46 PM --- Done page: 1/1
21/06/2025 04:31:46 PM --- Number of posts for page 1: 12
21/06/2025 04:31:46 PM --- Number of posts added on 2025-06-21: 0
22/06/2025 04:31:22 PM --- Done page: 1/1
22/06/2025 04:31:22 PM --- Number of posts for page 1: 12
22/06/2025 04:31:22 PM --- Number of posts added on 2025-06-22: 0
23/06/2025 04:35:32 PM --- Done page: 1/1
23/06/2025 04:35:32 PM --- Number of posts for page 1: 12
23/06/2025 04:35:32 PM --- Number of posts added on 2025-06-23: 0
24/06/2025 04:35:25 PM --- Done page: 1/1
24/06/2025 04:35:25 PM --- Number of posts for page 1: 12
24/06/2025 04:35:25 PM --- Number of posts added on 2025-06-24: 0
25/06/2025 04:36:04 PM --- Done page: 1/1
25/06/2025 04:36:04 PM --- Number of posts for page 1: 12
25/06/2025 04:36:04 PM --- Number of posts added on 2025-06-25: 0
26/06/2025 04:34:31 PM --- Done page: 1/1
26/06/2025 04:34:31 PM --- Number of posts for page 1: 12
26/06/2025 04:34:31 PM --- Number of posts added on 2025-06-26: 0
27/06/2025 04:33:30 PM --- Done page: 1/1
27/06/2025 04:33:30 PM --- Number of posts for page 1: 12
27/06/2025 04:33:30 PM --- Number of posts added on 2025-06-27: 0
28/06/2025 04:31:51 PM --- Done page: 1/1
28/06/2025 04:31:51 PM --- Number of posts for page 1: 12
28/06/2025 04:31:51 PM --- Number of posts added on 2025-06-28: 0
29/06/2025 04:31:46 PM --- Done page: 1/1
29/06/2025 04:31:46 PM --- Number of posts for page 1: 12
29/06/2025 04:31:46 PM --- Number of posts added on 2025-06-29: 0
30/06/2025 04:35:23 PM --- Done page: 1/1
30/06/2025 04:35:23 PM --- Number of posts for page 1: 12
30/06/2025 04:35:23 PM --- Number of posts added on 2025-06-30: 0
01/07/2025 04:35:17 PM --- Done page: 1/1
01/07/2025 04:35:17 PM --- Number of posts for page 1: 12
01/07/2025 04:35:17 PM --- Number of posts added on 2025-07-01: 0
02/07/2025 04:34:49 PM --- Done page: 1/1
02/07/2025 04:34:49 PM --- Number of posts for page 1: 12
02/07/2025 04:34:49 PM --- Number of posts added on 2025-07-02: 0
03/07/2025 04:34:11 PM --- Done page: 1/1
03/07/2025 04:34:11 PM --- Number of posts for page 1: 12
03/07/2025 04:34:11 PM --- Number of posts added on 2025-07-03: 0
04/07/2025 04:33:24 PM --- Done page: 1/1
04/07/2025 04:33:24 PM --- Number of posts for page 1: 12
04/07/2025 04:33:24 PM --- Number of posts added on 2025-07-04: 0
05/07/2025 04:31:34 PM --- Done page: 1/1
05/07/2025 04:31:34 PM --- Number of posts for page 1: 12
05/07/2025 04:31:34 PM --- Number of posts added on 2025-07-05: 0
06/07/2025 04:32:05 PM --- Done page: 1/1
06/07/2025 04:32:05 PM --- Number of posts for page 1: 12
06/07/2025 04:32:05 PM --- Number of posts added on 2025-07-06: 0
07/07/2025 04:35:31 PM --- Done page: 1/1
07/07/2025 04:35:31 PM --- Number of posts for page 1: 12
07/07/2025 04:35:31 PM --- Number of posts added on 2025-07-07: 0
08/07/2025 04:35:48 PM --- Done page: 1/1
08/07/2025 04:35:48 PM --- Number of posts for page 1: 12
08/07/2025 04:35:48 PM --- Number of posts added on 2025-07-08: 0
09/07/2025 04:35:18 PM --- Done page: 1/1
09/07/2025 04:35:18 PM --- Number of posts for page 1: 12
09/07/2025 04:35:18 PM --- Number of posts added on 2025-07-09: 0
10/07/2025 04:36:01 PM --- Done page: 1/1
10/07/2025 04:36:01 PM --- Number of posts for page 1: 12
10/07/2025 04:36:01 PM --- Number of posts added on 2025-07-10: 0
11/07/2025 04:35:04 PM --- Done page: 1/1
11/07/2025 04:35:04 PM --- Number of posts for page 1: 12
11/07/2025 04:35:04 PM --- Number of posts added on 2025-07-11: 0
12/07/2025 04:32:46 PM --- Done page: 1/1
12/07/2025 04:32:46 PM --- Number of posts for page 1: 12
12/07/2025 04:32:46 PM --- Number of posts added on 2025-07-12: 0
13/07/2025 04:32:37 PM --- Done page: 1/1
13/07/2025 04:32:37 PM --- Number of posts for page 1: 12
13/07/2025 04:32:37 PM --- Number of posts added on 2025-07-13: 0
14/07/2025 04:36:28 PM --- Done page: 1/1
14/07/2025 04:36:28 PM --- Number of posts for page 1: 12
14/07/2025 04:36:28 PM --- Number of posts added on 2025-07-14: 0
15/07/2025 04:36:42 PM --- Done page: 1/1
15/07/2025 04:36:42 PM --- Number of posts for page 1: 12
15/07/2025 04:36:42 PM --- Number of posts added on 2025-07-15: 0
16/07/2025 04:37:01 PM --- Done page: 1/1
16/07/2025 04:37:01 PM --- Number of posts for page 1: 12
16/07/2025 04:37:01 PM --- Number of posts added on 2025-07-16: 0
17/07/2025 04:36:41 PM --- Done page: 1/1
17/07/2025 04:36:41 PM --- Number of posts for page 1: 12
17/07/2025 04:36:41 PM --- Number of posts added on 2025-07-17: 0
18/07/2025 04:36:59 PM --- Done page: 1/1
18/07/2025 04:36:59 PM --- Number of posts for page 1: 12
18/07/2025 04:36:59 PM --- Number of posts added on 2025-07-18: 0
19/07/2025 04:33:30 PM --- Done page: 1/1
19/07/2025 04:33:30 PM --- Number of posts for page 1: 12
19/07/2025 04:33:30 PM --- Number of posts added on 2025-07-19: 0
20/07/2025 04:33:18 PM --- Done page: 1/1
20/07/2025 04:33:18 PM --- Number of posts for page 1: 12
20/07/2025 04:33:18 PM --- Number of posts added on 2025-07-20: 0
21/07/2025 04:36:48 PM --- Done page: 1/1
21/07/2025 04:36:48 PM --- Number of posts for page 1: 12
21/07/2025 04:36:48 PM --- Number of posts added on 2025-07-21: 0
22/07/2025 04:37:46 PM --- Done page: 1/1
22/07/2025 04:37:46 PM --- Number of posts for page 1: 12
22/07/2025 04:37:46 PM --- Number of posts added on 2025-07-22: 0
23/07/2025 04:37:44 PM --- Done page: 1/1
23/07/2025 04:37:44 PM --- Number of posts for page 1: 12
23/07/2025 04:37:44 PM --- Number of posts added on 2025-07-23: 0
24/07/2025 04:35:02 PM --- Done page: 1/1
24/07/2025 04:35:02 PM --- Number of posts for page 1: 12
24/07/2025 04:35:02 PM --- Number of posts added on 2025-07-24: 0
25/07/2025 04:36:13 PM --- Done page: 1/1
25/07/2025 04:36:13 PM --- Number of posts for page 1: 12
25/07/2025 04:36:13 PM --- Number of posts added on 2025-07-25: 0
26/07/2025 04:33:50 PM --- Done page: 1/1
26/07/2025 04:33:50 PM --- Number of posts for page 1: 12
26/07/2025 04:33:50 PM --- Number of posts added on 2025-07-26: 0
27/07/2025 04:33:54 PM --- Done page: 1/1
27/07/2025 04:33:54 PM --- Number of posts for page 1: 12
27/07/2025 04:33:54 PM --- Number of posts added on 2025-07-27: 0
28/07/2025 04:38:07 PM --- Done page: 1/1
28/07/2025 04:38:07 PM --- Number of posts for page 1: 12
28/07/2025 04:38:07 PM --- Number of posts added on 2025-07-28: 0
29/07/2025 04:36:52 PM --- Done page: 1/1
29/07/2025 04:36:52 PM --- Number of posts for page 1: 12
29/07/2025 04:36:52 PM --- Number of posts added on 2025-07-29: 0
30/07/2025 04:36:26 PM --- Done page: 1/1
30/07/2025 04:36:26 PM --- Number of posts for page 1: 12
30/07/2025 04:36:26 PM --- Number of posts added on 2025-07-30: 0
31/07/2025 04:37:39 PM --- Done page: 1/1
31/07/2025 04:37:39 PM --- Number of posts for page 1: 12
31/07/2025 04:37:39 PM --- Number of posts added on 2025-07-31: 0
01/08/2025 04:37:55 PM --- Done page: 1/1
01/08/2025 04:37:55 PM --- Number of posts for page 1: 12
01/08/2025 04:37:55 PM --- Number of posts added on 2025-08-01: 0
02/08/2025 04:34:04 PM --- Done page: 1/1
02/08/2025 04:34:04 PM --- Number of posts for page 1: 12
02/08/2025 04:34:04 PM --- Number of posts added on 2025-08-02: 0
03/08/2025 04:34:39 PM --- Done page: 1/1
03/08/2025 04:34:39 PM --- Number of posts for page 1: 12
03/08/2025 04:34:39 PM --- Number of posts added on 2025-08-03: 0
04/08/2025 04:39:48 PM --- Done page: 1/1
04/08/2025 04:39:48 PM --- Number of posts for page 1: 12
04/08/2025 04:39:48 PM --- Number of posts added on 2025-08-04: 0
05/08/2025 04:31:57 PM --- Done page: 1/1
05/08/2025 04:31:57 PM --- Number of posts for page 1: 12
05/08/2025 04:31:57 PM --- Number of posts added on 2025-08-05: 0
06/08/2025 04:38:11 PM --- Done page: 1/1
06/08/2025 04:38:11 PM --- Number of posts for page 1: 12
06/08/2025 04:38:11 PM --- Number of posts added on 2025-08-06: 0
07/08/2025 04:38:35 PM --- Done page: 1/1
07/08/2025 04:38:35 PM --- Number of posts for page 1: 12
07/08/2025 04:38:35 PM --- Number of posts added on 2025-08-07: 0
08/08/2025 04:34:32 PM --- Done page: 1/1
08/08/2025 04:34:32 PM --- Number of posts for page 1: 12
08/08/2025 04:34:32 PM --- Number of posts added on 2025-08-08: 0
09/08/2025 04:33:17 PM --- Done page: 1/1
09/08/2025 04:33:17 PM --- Number of posts for page 1: 12
09/08/2025 04:33:17 PM --- Number of posts added on 2025-08-09: 0
10/08/2025 04:33:22 PM --- Done page: 1/1
10/08/2025 04:33:22 PM --- Number of posts for page 1: 12
10/08/2025 04:33:22 PM --- Number of posts added on 2025-08-10: 0
11/08/2025 04:37:11 PM --- Done page: 1/1
11/08/2025 04:37:11 PM --- Number of posts for page 1: 12
11/08/2025 04:37:11 PM --- Number of posts added on 2025-08-11: 0
12/08/2025 04:36:13 PM --- Done page: 1/1
12/08/2025 04:36:13 PM --- Number of posts for page 1: 12
12/08/2025 04:36:13 PM --- Number of posts added on 2025-08-12: 0
13/08/2025 04:30:48 PM --- Done page: 1/1
13/08/2025 04:30:48 PM --- Number of posts for page 1: 12
13/08/2025 04:30:48 PM --- Number of posts added on 2025-08-13: 0
14/08/2025 04:36:07 PM --- Done page: 1/1
14/08/2025 04:36:07 PM --- Number of posts for page 1: 12
14/08/2025 04:36:07 PM --- Number of posts added on 2025-08-14: 0
15/08/2025 04:34:13 PM --- Done page: 1/1
15/08/2025 04:34:13 PM --- Number of posts for page 1: 12
15/08/2025 04:34:13 PM --- Number of posts added on 2025-08-15: 0
16/08/2025 04:31:22 PM --- Done page: 1/1
16/08/2025 04:31:22 PM --- Number of posts for page 1: 12
16/08/2025 04:31:22 PM --- Number of posts added on 2025-08-16: 0
17/08/2025 04:32:25 PM --- Done page: 1/1
17/08/2025 04:32:25 PM --- Number of posts for page 1: 12
17/08/2025 04:32:25 PM --- Number of posts added on 2025-08-17: 0
18/08/2025 04:36:05 PM --- Done page: 1/1
18/08/2025 04:36:05 PM --- Number of posts for page 1: 12
18/08/2025 04:36:05 PM --- Number of posts added on 2025-08-18: 0
19/08/2025 04:33:44 PM --- Done page: 1/1
19/08/2025 04:33:44 PM --- Number of posts for page 1: 12
19/08/2025 04:33:44 PM --- Number of posts added on 2025-08-19: 0
20/08/2025 04:32:19 PM --- Done page: 1/1
20/08/2025 04:32:19 PM --- Number of posts for page 1: 12
20/08/2025 04:32:19 PM --- Number of posts added on 2025-08-20: 0
21/08/2025 04:42:55 PM --- Done page: 1/1
21/08/2025 04:42:55 PM --- Number of posts for page 1: 12
21/08/2025 04:42:55 PM --- Number of posts added on 2025-08-21: 0
22/08/2025 04:32:30 PM --- Done page: 1/1
22/08/2025 04:32:30 PM --- Number of posts for page 1: 12
22/08/2025 04:32:30 PM --- Number of posts added on 2025-08-22: 0
23/08/2025 04:29:15 PM --- Done page: 1/1
23/08/2025 04:29:15 PM --- Number of posts for page 1: 12
23/08/2025 04:29:15 PM --- Number of posts added on 2025-08-23: 0
24/08/2025 12:15:32 AM --- Done page: 1/1
24/08/2025 12:15:32 AM --- Number of posts for page 1: 12
24/08/2025 12:15:32 AM --- Number of posts added on 2025-08-24: 0
24/08/2025 12:16:40 AM --- Done page: 1/1
24/08/2025 12:16:40 AM --- Number of posts for page 1: 12
24/08/2025 12:16:40 AM --- Number of posts added on 2025-08-24: 0
24/08/2025 12:17:33 AM --- Done page: 1/1
24/08/2025 12:17:33 AM --- Number of posts for page 1: 12
24/08/2025 12:17:33 AM --- Number of posts added on 2025-08-24: 0
24/08/2025 12:24:08 AM --- Done page: 1/1
24/08/2025 12:24:08 AM --- Number of posts for page 1: 12
24/08/2025 12:24:08 AM --- Number of posts added on 2025-08-24: 0
24/08/2025 12:24:31 AM --- Done: Metadata: Bằng chứng không chỉ cho các ồn ào showbiz
24/08/2025 12:24:31 AM --- Done: Kiss Cam - Từ trò vui giữa giờ đến câu chuyện bóc phốt công khai
24/08/2025 12:24:32 AM --- Done: Mama boy - Con dù lớn mãi là con trai cưng của mẹ
24/08/2025 12:24:32 AM --- Done: Hồng tỷ - Chỉ là một meme hài hước? 
24/08/2025 12:24:34 AM --- Done page: 1/1
24/08/2025 12:24:34 AM --- Number of posts for page 1: 12
24/08/2025 12:24:34 AM --- Number of posts added on 2025-08-24: 4
24/08/2025 04:30:28 PM --- Done page: 1/1
24/08/2025 04:30:28 PM --- Number of posts for page 1: 12
24/08/2025 04:30:28 PM --- Number of posts added on 2025-08-24: 0
25/08/2025 04:33:57 PM --- Done page: 1/1
25/08/2025 04:33:57 PM --- Number of posts for page 1: 12
25/08/2025 04:33:57 PM --- Number of posts added on 2025-08-25: 0
26/08/2025 04:32:40 PM --- Done page: 1/1
26/08/2025 04:32:40 PM --- Number of posts for page 1: 12
26/08/2025 04:32:40 PM --- Number of posts added on 2025-08-26: 0
27/08/2025 04:33:06 PM --- Done page: 1/1
27/08/2025 04:33:06 PM --- Number of posts for page 1: 12
27/08/2025 04:33:06 PM --- Number of posts added on 2025-08-27: 0
28/08/2025 04:32:49 PM --- Done page: 1/1
28/08/2025 04:32:49 PM --- Number of posts for page 1: 12
28/08/2025 04:32:49 PM --- Number of posts added on 2025-08-28: 0
29/08/2025 04:31:52 PM --- Done page: 1/1
29/08/2025 04:31:52 PM --- Number of posts for page 1: 12
29/08/2025 04:31:52 PM --- Number of posts added on 2025-08-29: 0
30/08/2025 04:29:09 PM --- Done page: 1/1
30/08/2025 04:29:09 PM --- Number of posts for page 1: 12
30/08/2025 04:29:09 PM --- Number of posts added on 2025-08-30: 0
31/08/2025 04:29:33 PM --- Done page: 1/1
31/08/2025 04:29:33 PM --- Number of posts for page 1: 12
31/08/2025 04:29:33 PM --- Number of posts added on 2025-08-31: 0
01/09/2025 04:31:04 PM --- Done page: 1/1
01/09/2025 04:31:04 PM --- Number of posts for page 1: 12
01/09/2025 04:31:04 PM --- Number of posts added on 2025-09-01: 0
02/09/2025 04:33:04 PM --- Done page: 1/1
02/09/2025 04:33:04 PM --- Number of posts for page 1: 12
02/09/2025 04:33:04 PM --- Number of posts added on 2025-09-02: 0
03/09/2025 04:31:57 PM --- Done page: 1/1
03/09/2025 04:31:57 PM --- Number of posts for page 1: 12
03/09/2025 04:31:57 PM --- Number of posts added on 2025-09-03: 0
04/09/2025 04:32:06 PM --- Done page: 1/1
04/09/2025 04:32:06 PM --- Number of posts for page 1: 12
04/09/2025 04:32:06 PM --- Number of posts added on 2025-09-04: 0
05/09/2025 04:29:35 PM --- Done page: 1/1
05/09/2025 04:29:35 PM --- Number of posts for page 1: 12
05/09/2025 04:29:35 PM --- Number of posts added on 2025-09-05: 0
06/09/2025 04:27:46 PM --- Done page: 1/1
06/09/2025 04:27:46 PM --- Number of posts for page 1: 12
06/09/2025 04:27:46 PM --- Number of posts added on 2025-09-06: 0
07/09/2025 04:27:47 PM --- Done page: 1/1
07/09/2025 04:27:47 PM --- Number of posts for page 1: 12
07/09/2025 04:27:47 PM --- Number of posts added on 2025-09-07: 0
08/09/2025 04:31:59 PM --- Done page: 1/1
08/09/2025 04:31:59 PM --- Number of posts for page 1: 12
08/09/2025 04:31:59 PM --- Number of posts added on 2025-09-08: 0
09/09/2025 04:32:29 PM --- Done page: 1/1
09/09/2025 04:32:29 PM --- Number of posts for page 1: 12
09/09/2025 04:32:29 PM --- Number of posts added on 2025-09-09: 0
10/09/2025 04:32:19 PM --- Done page: 1/1
10/09/2025 04:32:19 PM --- Number of posts for page 1: 12
10/09/2025 04:32:19 PM --- Number of posts added on 2025-09-10: 0
11/09/2025 04:31:18 PM --- Done page: 1/1
11/09/2025 04:31:18 PM --- Number of posts for page 1: 12
11/09/2025 04:31:18 PM --- Number of posts added on 2025-09-11: 0
12/09/2025 04:27:32 PM --- Done page: 1/1
12/09/2025 04:27:32 PM --- Number of posts for page 1: 12
12/09/2025 04:27:32 PM --- Number of posts added on 2025-09-12: 0
13/09/2025 04:26:36 PM --- Done page: 1/1
13/09/2025 04:26:36 PM --- Number of posts for page 1: 12
13/09/2025 04:26:36 PM --- Number of posts added on 2025-09-13: 0
14/09/2025 04:26:27 PM --- Done page: 1/1
14/09/2025 04:26:27 PM --- Number of posts for page 1: 12
14/09/2025 04:26:27 PM --- Number of posts added on 2025-09-14: 0
15/09/2025 04:32:42 PM --- Done page: 1/1
15/09/2025 04:32:42 PM --- Number of posts for page 1: 12
15/09/2025 04:32:42 PM --- Number of posts added on 2025-09-15: 0
16/09/2025 04:32:13 PM --- Done page: 1/1
16/09/2025 04:32:13 PM --- Number of posts for page 1: 12
16/09/2025 04:32:13 PM --- Number of posts added on 2025-09-16: 0
17/09/2025 04:32:15 PM --- Done page: 1/1
17/09/2025 04:32:15 PM --- Number of posts for page 1: 12
17/09/2025 04:32:15 PM --- Number of posts added on 2025-09-17: 0
18/09/2025 04:31:26 PM --- Done page: 1/1
18/09/2025 04:31:26 PM --- Number of posts for page 1: 12
18/09/2025 04:31:26 PM --- Number of posts added on 2025-09-18: 0
19/09/2025 04:30:54 PM --- Done page: 1/1
19/09/2025 04:30:54 PM --- Number of posts for page 1: 12
19/09/2025 04:30:54 PM --- Number of posts added on 2025-09-19: 0
20/09/2025 04:27:55 PM --- Done page: 1/1
20/09/2025 04:27:55 PM --- Number of posts for page 1: 12
20/09/2025 04:27:55 PM --- Number of posts added on 2025-09-20: 0
21/09/2025 04:28:48 PM --- Done page: 1/1
21/09/2025 04:28:48 PM --- Number of posts for page 1: 12
21/09/2025 04:28:48 PM --- Number of posts added on 2025-09-21: 0
22/09/2025 04:33:04 PM --- Done page: 1/1
22/09/2025 04:33:04 PM --- Number of posts for page 1: 12
22/09/2025 04:33:04 PM --- Number of posts added on 2025-09-22: 0
23/09/2025 04:32:54 PM --- Done page: 1/1
23/09/2025 04:32:54 PM --- Number of posts for page 1: 12
23/09/2025 04:32:54 PM --- Number of posts added on 2025-09-23: 0
24/09/2025 04:33:26 PM --- Done page: 1/1
24/09/2025 04:33:26 PM --- Number of posts for page 1: 12
24/09/2025 04:33:26 PM --- Number of posts added on 2025-09-24: 0
25/09/2025 04:32:27 PM --- Done page: 1/1
25/09/2025 04:32:27 PM --- Number of posts for page 1: 12
25/09/2025 04:32:27 PM --- Number of posts added on 2025-09-25: 0
26/09/2025 04:32:28 PM --- Done page: 1/1
26/09/2025 04:32:28 PM --- Number of posts for page 1: 12
26/09/2025 04:32:28 PM --- Number of posts added on 2025-09-26: 0
27/09/2025 04:28:13 PM --- Done page: 1/1
27/09/2025 04:28:13 PM --- Number of posts for page 1: 12
27/09/2025 04:28:13 PM --- Number of posts added on 2025-09-27: 0
28/09/2025 04:27:14 PM --- Done page: 1/1
28/09/2025 04:27:14 PM --- Number of posts for page 1: 12
28/09/2025 04:27:14 PM --- Number of posts added on 2025-09-28: 0
29/09/2025 04:26:42 PM --- Done page: 1/1
29/09/2025 04:26:42 PM --- Number of posts for page 1: 12
29/09/2025 04:26:42 PM --- Number of posts added on 2025-09-29: 0
30/09/2025 04:32:42 PM --- Done page: 1/1
30/09/2025 04:32:42 PM --- Number of posts for page 1: 12
30/09/2025 04:32:42 PM --- Number of posts added on 2025-09-30: 0
01/10/2025 04:32:38 PM --- Done page: 1/1
01/10/2025 04:32:38 PM --- Number of posts for page 1: 12
01/10/2025 04:32:38 PM --- Number of posts added on 2025-10-01: 0
02/10/2025 04:31:25 PM --- Done page: 1/1
02/10/2025 04:31:25 PM --- Number of posts for page 1: 12
02/10/2025 04:31:25 PM --- Number of posts added on 2025-10-02: 0
03/10/2025 04:30:46 PM --- Done page: 1/1
03/10/2025 04:30:46 PM --- Number of posts for page 1: 12
03/10/2025 04:30:46 PM --- Number of posts added on 2025-10-03: 0
04/10/2025 04:28:27 PM --- Done page: 1/1
04/10/2025 04:28:27 PM --- Number of posts for page 1: 12
04/10/2025 04:28:27 PM --- Number of posts added on 2025-10-04: 0
05/10/2025 04:28:13 PM --- Done page: 1/1
05/10/2025 04:28:13 PM --- Number of posts for page 1: 12
05/10/2025 04:28:13 PM --- Number of posts added on 2025-10-05: 0
06/10/2025 04:31:56 PM --- Done page: 1/1
06/10/2025 04:31:56 PM --- Number of posts for page 1: 12
06/10/2025 04:31:56 PM --- Number of posts added on 2025-10-06: 0
07/10/2025 04:32:21 PM --- Done page: 1/1
07/10/2025 04:32:21 PM --- Number of posts for page 1: 12
07/10/2025 04:32:21 PM --- Number of posts added on 2025-10-07: 0
08/10/2025 04:32:25 PM --- Done page: 1/1
08/10/2025 04:32:25 PM --- Number of posts for page 1: 12
08/10/2025 04:32:25 PM --- Number of posts added on 2025-10-08: 0
09/10/2025 04:34:49 PM --- Done page: 1/1
09/10/2025 04:34:49 PM --- Number of posts for page 1: 12
09/10/2025 04:34:49 PM --- Number of posts added on 2025-10-09: 0
10/10/2025 04:31:54 PM --- Done page: 1/1
10/10/2025 04:31:54 PM --- Number of posts for page 1: 12
10/10/2025 04:31:54 PM --- Number of posts added on 2025-10-10: 0
11/10/2025 04:27:38 PM --- Done page: 1/1
11/10/2025 04:27:38 PM --- Number of posts for page 1: 12
11/10/2025 04:27:38 PM --- Number of posts added on 2025-10-11: 0
12/10/2025 04:28:37 PM --- Done page: 1/1
12/10/2025 04:28:37 PM --- Number of posts for page 1: 12
12/10/2025 04:28:37 PM --- Number of posts added on 2025-10-12: 0
13/10/2025 04:32:57 PM --- Done page: 1/1
13/10/2025 04:32:57 PM --- Number of posts for page 1: 12
13/10/2025 04:32:57 PM --- Number of posts added on 2025-10-13: 0
14/10/2025 04:33:15 PM --- Done page: 1/1
14/10/2025 04:33:15 PM --- Number of posts for page 1: 12
14/10/2025 04:33:15 PM --- Number of posts added on 2025-10-14: 0
15/10/2025 04:30:02 PM --- Done page: 1/1
15/10/2025 04:30:02 PM --- Number of posts for page 1: 12
15/10/2025 04:30:02 PM --- Number of posts added on 2025-10-15: 0
16/10/2025 04:33:46 PM --- Done page: 1/1
16/10/2025 04:33:46 PM --- Number of posts for page 1: 12
16/10/2025 04:33:46 PM --- Number of posts added on 2025-10-16: 0
17/10/2025 04:32:20 PM --- Done page: 1/1
17/10/2025 04:32:20 PM --- Number of posts for page 1: 12
17/10/2025 04:32:20 PM --- Number of posts added on 2025-10-17: 0
18/10/2025 04:28:54 PM --- Done: Glass Ceiling – Rào cản vô hình trên hành trình trở thành lãnh đạo của phụ nữ
18/10/2025 04:29:08 PM --- Done page: 1/1
18/10/2025 04:29:08 PM --- Number of posts for page 1: 12
18/10/2025 04:29:08 PM --- Number of posts added on 2025-10-18: 1
19/10/2025 04:29:33 PM --- Done page: 1/1
19/10/2025 04:29:33 PM --- Number of posts for page 1: 12
19/10/2025 04:29:33 PM --- Number of posts added on 2025-10-19: 0
20/10/2025 04:33:20 PM --- Done page: 1/1
20/10/2025 04:33:20 PM --- Number of posts for page 1: 12
20/10/2025 04:33:20 PM --- Number of posts added on 2025-10-20: 0
21/10/2025 04:33:34 PM --- Done page: 1/1
21/10/2025 04:33:34 PM --- Number of posts for page 1: 12
21/10/2025 04:33:34 PM --- Number of posts added on 2025-10-21: 0
22/10/2025 04:35:27 PM --- Done page: 1/1
22/10/2025 04:35:27 PM --- Number of posts for page 1: 12
22/10/2025 04:35:27 PM --- Number of posts added on 2025-10-22: 0
23/10/2025 04:33:37 PM --- Done page: 1/1
23/10/2025 04:33:37 PM --- Number of posts for page 1: 12
23/10/2025 04:33:37 PM --- Number of posts added on 2025-10-23: 0
24/10/2025 04:33:26 PM --- Done page: 1/1
24/10/2025 04:33:26 PM --- Number of posts for page 1: 12
24/10/2025 04:33:26 PM --- Number of posts added on 2025-10-24: 0
25/10/2025 04:30:23 PM --- Done page: 1/1
25/10/2025 04:30:23 PM --- Number of posts for page 1: 12
25/10/2025 04:30:23 PM --- Number of posts added on 2025-10-25: 0
26/10/2025 04:30:25 PM --- Done: Bloomscrolling - Nội dung tích cực giúp tâm trí “nở hoa”
26/10/2025 04:30:35 PM --- Done page: 1/1
26/10/2025 04:30:35 PM --- Number of posts for page 1: 12
26/10/2025 04:30:35 PM --- Number of posts added on 2025-10-26: 1
27/10/2025 04:35:16 PM --- Done page: 1/1
27/10/2025 04:35:16 PM --- Number of posts for page 1: 12
27/10/2025 04:35:16 PM --- Number of posts added on 2025-10-27: 0
28/10/2025 04:36:31 PM --- Done page: 1/1
28/10/2025 04:36:31 PM --- Number of posts for page 1: 12
28/10/2025 04:36:31 PM --- Number of posts added on 2025-10-28: 0
29/10/2025 04:36:50 PM --- Done page: 1/1
29/10/2025 04:36:50 PM --- Number of posts for page 1: 12
29/10/2025 04:36:50 PM --- Number of posts added on 2025-10-29: 0
30/10/2025 04:35:02 PM --- Done page: 1/1
30/10/2025 04:35:02 PM --- Number of posts for page 1: 12
30/10/2025 04:35:02 PM --- Number of posts added on 2025-10-30: 0
31/10/2025 04:33:58 PM --- Done page: 1/1
31/10/2025 04:33:58 PM --- Number of posts for page 1: 12
31/10/2025 04:33:58 PM --- Number of posts added on 2025-10-31: 0
01/11/2025 04:28:42 PM --- Done: No Nut November là gì? Bạn có muốn thử thách sự kiên nhẫn của mình?
01/11/2025 04:28:55 PM --- Done page: 1/1
01/11/2025 04:28:55 PM --- Number of posts for page 1: 12
01/11/2025 04:28:55 PM --- Number of posts added on 2025-11-01: 1
02/11/2025 04:29:45 PM --- Done page: 1/1
02/11/2025 04:29:45 PM --- Number of posts for page 1: 12
02/11/2025 04:29:45 PM --- Number of posts added on 2025-11-02: 0
