03/09/2024 04:41:13 PM --- Done: Trải nghiệm “như phim” là xu hướng du lịch lên ngôi ở Gen Z
03/09/2024 04:41:14 PM --- Done: Xu hướng trữ đông trứng: “Bảo hiểm” có con trong tương lai?
03/09/2024 04:41:14 PM --- Done: Vì sao CEO của Telegram bị bắt? “Vấn đề kiểm duyệt”
03/09/2024 04:41:15 PM --- Done: Vụ ngược đãi chó ở Đà Lạt nói gì về mô hình kinh doanh bằng thú cưng?
03/09/2024 04:41:16 PM --- Done: “Hình phạt” cho người độc thân: Thực hư ra sao, hiệu quả liệu đến mức nào?
03/09/2024 04:41:16 PM --- Done: Du lịch Việt Nam chuẩn bị đón 4500 khách từ Ấn Độ
03/09/2024 04:41:17 PM --- Done: Ai là người được follow nhiều nhất Việt Nam?
03/09/2024 04:41:17 PM --- Done: Việt Nam giành 3 huy chương vàng từ Olympic, nhưng không phải Paris
03/09/2024 04:41:18 PM --- Done: Mua hàng miễn thuế sân bay Thái sắp trở thành quá khứ?
03/09/2024 04:41:18 PM --- Done: Biểu tình, chất thải sinh học và giường chống QHTD: Vì sao Olympic Paris “bất ổn” đến thế?
03/09/2024 04:41:19 PM --- Done: Giải mã sức hút đằng sau Possessed Love - Chương trình hẹn hò tâm linh 
03/09/2024 04:41:19 PM --- Done: Châu Bùi bị quay lén: Camera giấu kín giá rẻ nhưng nạn nhân phải trả giá đắt
03/09/2024 04:41:19 PM --- Done page: 1/100
03/09/2024 04:41:19 PM --- Number of posts for page 1: 12
03/09/2024 04:41:19 PM --- Number of posts added on 2024-09-03: 12
03/09/2024 04:41:20 PM --- Done: Indonesia thí điểm tuần làm việc 4 ngày, Việt Nam thì sao?
03/09/2024 04:41:20 PM --- Done: Ngoài lịch thi đấu, đây là những điều bạn cần biết về Euro 2024
03/09/2024 04:41:21 PM --- Done: Apple ra mắt A.I, cam kết sẽ không giống ai
03/09/2024 04:41:21 PM --- Done: Có gì mới lạ trong app hẹn hò của chính phủ Nhật Bản?
03/09/2024 04:41:22 PM --- Done: Chính phủ tăng cường rà soát các phiên livestream doanh thu trăm tỷ
03/09/2024 04:41:30 PM --- Done: Trải nghiệm “như phim” là xu hướng du lịch lên ngôi ở Gen Z
03/09/2024 04:41:31 PM --- Done: Xu hướng trữ đông trứng: “Bảo hiểm” có con trong tương lai?
03/09/2024 04:41:31 PM --- Done: Vì sao CEO của Telegram bị bắt? “Vấn đề kiểm duyệt”
03/09/2024 04:41:32 PM --- Done: Vụ ngược đãi chó ở Đà Lạt nói gì về mô hình kinh doanh bằng thú cưng?
03/09/2024 04:41:33 PM --- Done: “Hình phạt” cho người độc thân: Thực hư ra sao, hiệu quả liệu đến mức nào?
03/09/2024 04:41:33 PM --- Done: Du lịch Việt Nam chuẩn bị đón 4500 khách từ Ấn Độ
03/09/2024 04:41:34 PM --- Done: Ai là người được follow nhiều nhất Việt Nam?
03/09/2024 04:41:34 PM --- Done: Việt Nam giành 3 huy chương vàng từ Olympic, nhưng không phải Paris
03/09/2024 04:41:35 PM --- Done: Mua hàng miễn thuế sân bay Thái sắp trở thành quá khứ?
03/09/2024 04:41:35 PM --- Done: Biểu tình, chất thải sinh học và giường chống QHTD: Vì sao Olympic Paris “bất ổn” đến thế?
03/09/2024 04:41:36 PM --- Done: Giải mã sức hút đằng sau Possessed Love - Chương trình hẹn hò tâm linh 
03/09/2024 04:41:37 PM --- Done: Châu Bùi bị quay lén: Camera giấu kín giá rẻ nhưng nạn nhân phải trả giá đắt
03/09/2024 04:41:37 PM --- Done page: 1/100
03/09/2024 04:41:37 PM --- Number of posts for page 1: 12
03/09/2024 04:41:37 PM --- Number of posts added on 2024-09-03: 12
03/09/2024 04:41:38 PM --- Done: Indonesia thí điểm tuần làm việc 4 ngày, Việt Nam thì sao?
03/09/2024 04:41:38 PM --- Done: Ngoài lịch thi đấu, đây là những điều bạn cần biết về Euro 2024
03/09/2024 04:41:39 PM --- Done: Apple ra mắt A.I, cam kết sẽ không giống ai
03/09/2024 04:41:40 PM --- Done: Có gì mới lạ trong app hẹn hò của chính phủ Nhật Bản?
03/09/2024 04:41:40 PM --- Done: Chính phủ tăng cường rà soát các phiên livestream doanh thu trăm tỷ
03/09/2024 04:41:41 PM --- Done: Người nổi tiếng có sai khi yêu cầu sự riêng tư tại nơi công cộng?
03/09/2024 04:41:41 PM --- Done: Gần 40% các trang web “bay màu” sau một thập kỷ, vì sao lại thế?
03/09/2024 04:41:42 PM --- Done: Thực hư tranh cãi xung quanh phát ngôn "mã gen normal" của Ninh Anh Bùi
03/09/2024 04:41:42 PM --- Done: Vụ việc Mina Dating Cafe: Khi phụ nữ là món hàng và nam giới là khách hàng
03/09/2024 04:41:43 PM --- Done: Vì sao máy bay ngày càng dễ gặp “ổ gà” trên không?
03/09/2024 04:41:43 PM --- Done: Ngành livestream hot thế nào mà đến “nữ hoàng kem trộn Rihanna” cũng tham gia?
03/09/2024 04:41:44 PM --- Done: ChatGPT nói giọng Black Widow, tưởng “hay như phim” nhưng không hay chút nào
03/09/2024 04:41:44 PM --- Done page: 2/100
03/09/2024 04:41:44 PM --- Number of posts for page 2: 12
03/09/2024 04:41:44 PM --- Number of posts added on 2024-09-03: 24
03/09/2024 04:41:45 PM --- Done: Toàn cảnh vụ bê bối Burning Sun qua phim tài liệu của BBC
03/09/2024 04:41:45 PM --- Done: Việt Nam và Đông Nam Á đã trở thành bãi rác của thế giới như thế nào?
03/09/2024 04:41:46 PM --- Done: Vì sao ngày càng nhiều công ty yêu cầu nhân viên chạy bộ?
03/09/2024 04:41:46 PM --- Done: Đã tổ chức thi IELTS từ lâu, tại sao tới nay IDP mới sai quy định?
03/09/2024 04:41:47 PM --- Done: Sách nhạy cảm trong trường quốc tế: Tranh luận "dâm hay không dâm" là chưa đủ
03/09/2024 04:41:47 PM --- Done: Toàn cảnh “đại chiến gia tộc” HYBE - ADOR: New Jeans sẽ ra sao?
03/09/2024 04:41:48 PM --- Done: Dự án giao thông mới của Campuchia sẽ ảnh hưởng thế nào tới Việt Nam?
03/09/2024 04:41:48 PM --- Done: Quentin Tarantino “bỏ ngang” phim cuối cùng, người hâm mộ buồn vui lẫn lộn
03/09/2024 04:41:49 PM --- Done: Kéo dài nghỉ lễ 30/4: Nghỉ thêm một ngày, niềm vui nhân đôi
03/09/2024 04:41:49 PM --- Done: CEO Apple đến Việt Nam: Thị trường tiềm năng mới cho gã khổng lồ công nghệ Mỹ? 
03/09/2024 04:41:50 PM --- Done: Vé máy bay trong nước đắt: Một vạn câu hỏi vì sao?
03/09/2024 04:41:51 PM --- Done: Hạ viện Thái Lan đồng tình với hôn nhân đồng tính
03/09/2024 04:41:51 PM --- Done page: 3/100
03/09/2024 04:41:51 PM --- Number of posts for page 3: 12
03/09/2024 04:41:51 PM --- Number of posts added on 2024-09-03: 36
03/09/2024 04:41:51 PM --- Done: Bất chấp Netflix “làm căng”, 10% người dùng vẫn “xem chùa”
03/09/2024 04:41:52 PM --- Done: Mỹ cấm TikTok vì bản thân TikTok hay vì lý do khác?
03/09/2024 04:41:52 PM --- Done: Tiêu cực trong Liên Minh Huyền Thoại Việt Nam: Còn gì cho eSports Việt?
03/09/2024 04:41:53 PM --- Done: Chán LinkedIn, mọi người chuyển sang tìm việc làm trên Threads
03/09/2024 04:41:53 PM --- Done: Năm trước Cá Hồi Hoang tan rã, năm nay Ngọt chia tay chúng ta
03/09/2024 04:41:54 PM --- Done: Phim tiểu sử về Michael Jackson bị tố “tẩy trắng” sự thật đen tối
03/09/2024 04:41:55 PM --- Done: Tổng Cục Thuế livestream hướng dẫn làm thuế: Bạn kê khai thu nhập chưa?
03/09/2024 04:41:56 PM --- Done: Khi cuộc sống quá khó khăn, hãy để Spotify chọn giúp bạn một tụ 
03/09/2024 04:41:57 PM --- Done: Tưởng như Trái Đất ngừng quay khi Facebook và nhiều ứng dụng "mất điện"
03/09/2024 04:41:57 PM --- Done: The Eras Tour Singapore: Khi mà chính phủ cũng "mê" Taylor Swift
03/09/2024 04:41:58 PM --- Done: “Cúng Locket” - Hệ tư tưởng dùng mạng xã hội để sống thật, có gì mà hot?
03/09/2024 04:41:58 PM --- Done: Màn vạch trần chồng cũ viral TikTok cả thế giới - Nhờ đâu “Who TF Did I Marry?” thành công?
03/09/2024 04:41:58 PM --- Done page: 4/100
03/09/2024 04:41:58 PM --- Number of posts for page 4: 12
03/09/2024 04:41:58 PM --- Number of posts added on 2024-09-03: 48
03/09/2024 04:41:59 PM --- Done: "Vũ trụ điện ảnh" The Beatles sẽ ra rạp năm 2027
03/09/2024 04:42:00 PM --- Done: Đào, Phở, và Piano - Trường hợp cá biệt của điện ảnh Việt Nam
03/09/2024 04:42:00 PM --- Done: Rabbit R1 có thay thế được chiếc điện thoại trong túi bạn?
03/09/2024 04:42:01 PM --- Done: Người bán hàng bị trừ cả tỷ đồng sau đợt “check var” của Shopee 
03/09/2024 04:42:01 PM --- Done: Disney hết hạn bản quyền với chuột Mickey, giờ chúng ta có thể làm gì?
03/09/2024 04:42:02 PM --- Done: Thị thực Hallyu là gì, và bạn có hiểu nhầm về nó không?
03/09/2024 04:42:02 PM --- Done: Những ai phải chịu trách nhiệm cho cái chết của Lee Sun Kyun?
03/09/2024 04:42:03 PM --- Done: Zara bị tẩy chay sau chiến dịch quảng cáo gợi nhắc thương đau ở dải Gaza
03/09/2024 04:42:03 PM --- Done: Học sinh hành hung cô giáo ở Tuyên Quang: Để yên cho nhà giáo hiền 
03/09/2024 04:42:04 PM --- Done: Đại học Harvard có “cửa sau” cho con nhà siêu giàu?
03/09/2024 04:42:04 PM --- Done: Được giới trẻ yêu mến, tại sao Baemin phải rút khỏi Việt Nam?
03/09/2024 04:42:05 PM --- Done: CZ và Binance nhận tội: Sóng gió có cuốn trôi gã khổng lồ tiền số cuối cùng?
03/09/2024 04:42:05 PM --- Done page: 5/100
03/09/2024 04:42:05 PM --- Number of posts for page 5: 12
03/09/2024 04:42:05 PM --- Number of posts added on 2024-09-03: 60
03/09/2024 04:42:06 PM --- Done: Tháp nước Hàng Đậu - nơi ai cũng thắc mắc có gì ở trong - mở cửa đón khách
03/09/2024 04:42:06 PM --- Done: Vì sao chính phủ kêu gọi người trẻ "chạy KPI" lập gia đình?
03/09/2024 04:42:07 PM --- Done: Cuộc chia tay trắc trở và gian truân giữa Sam Altman và OpenAI
03/09/2024 04:42:07 PM --- Done: Now and Then - Khúc ca cuối có đặt dấu chấm hết cho The Beatles?
03/09/2024 04:42:08 PM --- Done: Messi lập kỷ lục Quả Bóng Vàng: Không anh thì ai?
03/09/2024 04:42:08 PM --- Done: Mùa nóng đã qua nhưng Hà Nội vẫn "hạn hán" nước sạch
03/09/2024 04:42:09 PM --- Done: Ồn ào rồi cũng qua đi - Doanh thu trăm tỷ mới là thành công?
03/09/2024 04:42:09 PM --- Done: Quá khứ đau thương đang lặp lại tại Israel-Palestine
03/09/2024 04:42:10 PM --- Done: Nobel Văn chương 2023 gọi tên Jon Fosse
03/09/2024 04:42:11 PM --- Done: "Công thức viral" nào đằng sau trắc nghiệm tính cách Taiwan Design Expo? 
03/09/2024 04:42:11 PM --- Done: Giáo viên kéo lê học trò: Nhiều hơn chuyện cô, trò, và cái bánh
03/09/2024 04:42:12 PM --- Done: ‘Người Sắt’ Mark Zuckerberg đang tạo ra đế chế Ultron?
03/09/2024 04:42:12 PM --- Done page: 6/100
03/09/2024 04:42:12 PM --- Number of posts for page 6: 12
03/09/2024 04:42:12 PM --- Number of posts added on 2024-09-03: 72
03/09/2024 04:42:12 PM --- Done: Chơi điện tử, tranh huy chương ASIAD
03/09/2024 04:42:13 PM --- Done: "Check Var" Chủ tịch Liên đoàn Bóng đá Tây Ban Nha, penalty sút bay ghế
03/09/2024 04:42:14 PM --- Done: ‘Bigcityboi’ Binz hát nhạc phim hành động Hollywood
03/09/2024 04:42:14 PM --- Done: Nhạc của AI tranh cử Grammy có khiến ngành âm nhạc lo lắng?
03/09/2024 04:42:15 PM --- Done: Vài giây gặp Messi và ngày trở lại showbiz đầy sóng gió của Jack
03/09/2024 04:42:15 PM --- Done: Anime bởi AI thì mộng mơ đấy nhưng…
03/09/2024 04:42:16 PM --- Done: Ấn Độ trở thành nước đầu tiên hạ cánh tại vùng tối của mặt trăng
03/09/2024 04:42:16 PM --- Done: Ở Hà Nội mà sợ xe bus đông, tại sao không thử xe đạp công cộng?
03/09/2024 04:42:17 PM --- Done: Ấn Độ cấm xuất khẩu gạo và khủng hoảng lương thực có ảnh hưởng đến Việt Nam?
03/09/2024 04:42:17 PM --- Done: Twitter đổi tên thành X và tham vọng làm ra WeChat kiểu Mỹ của Elon Musk
03/09/2024 04:42:18 PM --- Done: Hơn 1000 diễn viên gửi thư "sẵn sàng đình công," Hollywood gặp nguy
03/09/2024 04:42:19 PM --- Done: Ai đã định giá cho đồng Pi 7 tỷ?
03/09/2024 04:42:19 PM --- Done page: 7/100
03/09/2024 04:42:19 PM --- Number of posts for page 7: 12
03/09/2024 04:42:19 PM --- Number of posts added on 2024-09-03: 84
03/09/2024 04:42:19 PM --- Done: Khi Secret Invasion sử dụng AI cho intro, người làm sáng tạo nên lo sợ
03/09/2024 04:42:20 PM --- Done: Tàu lặn thám hiểm xác tàu Titanic mất tích ở đáy biển Đại Tây Dương
03/09/2024 04:42:20 PM --- Done: Tập đoàn báo chí lớn nhất Mỹ kiện Google vì độc quyền quảng cáo
03/09/2024 04:42:21 PM --- Done: Bê bối thu gom đồ cũ để tái chế của H&M nói gì về thời trang bền vững?
03/09/2024 04:42:21 PM --- Done: Liên Minh Huyền Thoại Việt Nam lại lỡ cơ hội thi đấu vì vấn đề visa
03/09/2024 04:42:22 PM --- Done: Grab lên kế hoạch cắt giảm hơn 1000 người, giá cổ phiếu lao dốc
03/09/2024 04:42:23 PM --- Done: Tại sao sách giáo khoa phổ thông chương trình mới đắt thế?
03/09/2024 04:42:23 PM --- Done: 103 trường xét tuyển đại học bằng IELTS: Tuyển sinh có đang thiếu công bằng?
03/09/2024 04:42:24 PM --- Done: "Một màu đen đen" bao phủ Reddit
03/09/2024 04:42:24 PM --- Done: Jennie, thần tượng Kpop nhập vai nữ siêu hùng Marvel?
03/09/2024 04:42:25 PM --- Done: Tranh cãi về trường chuyên và những suy nghĩ về việc dạy con
03/09/2024 04:42:25 PM --- Done: Vì sao miền Bắc thường xuyên mất điện?
03/09/2024 04:42:25 PM --- Done page: 8/100
03/09/2024 04:42:25 PM --- Number of posts for page 8: 12
03/09/2024 04:42:25 PM --- Number of posts added on 2024-09-03: 96
03/09/2024 04:42:26 PM --- Done: Hayao Miyazaki, từ vết thương ấu thơ đến thơ ấu của triệu người
03/09/2024 04:42:27 PM --- Done: Giảm năng suất lao động: Không thể đổ lỗi cho làm việc từ xa!
03/09/2024 04:42:27 PM --- Done: Tuyển thủ đình công, Riot Games "đe dọa" hủy bỏ giải đấu LCS
03/09/2024 04:42:28 PM --- Done: Vẹt cũng biết "video call" để bớt cô đơn
03/09/2024 04:42:28 PM --- Done: ‘The Idol’ tại Cannes: Ơn giời, phim gây sốc đây rồi
03/09/2024 04:42:29 PM --- Done:  Johnny Depp rơi nước mắt ở Cannes
03/09/2024 04:42:30 PM --- Done: VICE Media LLC phá sản: "Than ôi! Thời oanh liệt nay còn đâu!"
03/09/2024 04:42:30 PM --- Done: JVevermind làm trưởng FC Trấn Thành và sự trưởng thành của một người nổi tiếng
03/09/2024 04:42:31 PM --- Done: Biểu tình ở lễ đăng quang: Thách thức đón chờ tân vương Charles III
03/09/2024 04:42:31 PM --- Done: Tài khoản mạng xã hội “chính chủ”: Chúng ta cần biết gì?
03/09/2024 04:42:32 PM --- Done: Những thành tựu mới nhất của kính James Webb định hình lại hiểu biết về vũ trụ
03/09/2024 04:42:32 PM --- Done: Hơn 11000 biên kịch tại Mỹ đình công, bạn cần biết gì?
03/09/2024 04:42:32 PM --- Done page: 9/100
03/09/2024 04:42:32 PM --- Number of posts for page 9: 12
03/09/2024 04:42:32 PM --- Number of posts added on 2024-09-03: 108
03/09/2024 04:42:33 PM --- Done: AI đọc suy nghĩ con người: Khi bộ não không còn riêng tư
03/09/2024 04:42:33 PM --- Done: "Bố già AI" rời khỏi Google, cảnh báo về một thế giới không có sự thật
03/09/2024 04:42:34 PM --- Done: AI hát ai nghe?
03/09/2024 04:42:35 PM --- Done: Tại sao ngày càng nhiều phụ nữ lựa chọn đông lạnh trứng?
03/09/2024 04:42:35 PM --- Done: Tái hiện Cleopatra da màu và da trắng: Bản "gốc" nào mới chính xác?
03/09/2024 04:42:36 PM --- Done: Tin mừng: Từ nay pháp luật sẽ bảo vệ thông tin của chúng ta?
03/09/2024 04:42:36 PM --- Done: Synthwave Boy: Người bạn mới của Lofi Girl
03/09/2024 04:42:37 PM --- Done: Những gì bạn cần biết về đề nghị xây dựng Luật Bản dạng giới tại Quốc hội
03/09/2024 04:42:37 PM --- Done: Phố cổ Hội An bắt buộc du khách mua vé tham quan: Liệu có khả thi?
03/09/2024 04:42:38 PM --- Done: TikTok bị kiểm tra hoạt động tại Việt Nam: Kết quả là gì?
03/09/2024 04:42:39 PM --- Done: Sau phiên bản AI, Harry Potter có series truyền hình? 
03/09/2024 04:42:39 PM --- Done: Donald Trump trở thành vị cựu Tổng thống Mỹ đầu tiên bị truy tố
03/09/2024 04:42:39 PM --- Done page: 10/100
03/09/2024 04:42:39 PM --- Number of posts for page 10: 12
03/09/2024 04:42:39 PM --- Number of posts added on 2024-09-03: 120
03/09/2024 04:42:40 PM --- Done: Bình cũ, rượu mới: JVevermind tái xuất trên YouTube!
03/09/2024 04:42:41 PM --- Done: Oscar nên trao giải cao nhất cho một bộ phim Mỹ? 
03/09/2024 04:42:41 PM --- Done: Cô gái kiếm tiền qua Tinder: Tranh luận văn minh thay vì mạt sát và bắt nạt
03/09/2024 04:42:42 PM --- Done: Rap Việt là không mày - tao
03/09/2024 04:42:42 PM --- Done: Vụ thực tập sinh Việt bỏ con tại Nhật: Tòa án Tối cao tuyên vô tội!
03/09/2024 04:42:43 PM --- Done: Cuộc hợp nhất của hai ngân hàng lớn nhất Thụy Sĩ
03/09/2024 04:42:43 PM --- Done: Cuộc phản đối chính sách tăng tuổi nghỉ hưu có phải câu chuyện của riêng nước Pháp?
03/09/2024 04:42:44 PM --- Done: Cái chết của Silicon Valley Bank có phải khởi đầu của khủng hoảng mới?
03/09/2024 04:42:44 PM --- Done: Trông đợi điều gì ở GPT-4 - bản nâng cấp của ChatGPT?
03/09/2024 04:42:45 PM --- Done: Ai sẽ đứng về phía những ngành nghề được coi là "vô dụng"?
03/09/2024 04:42:46 PM --- Done: Phim hoạt hình không phải là điện ảnh, và chỉ dành cho trẻ con?
03/09/2024 04:42:46 PM --- Done: Vì sao chúng ta cứ mãi dẹp vỉa hè năm này qua năm khác?
03/09/2024 04:42:46 PM --- Done page: 11/100
03/09/2024 04:42:46 PM --- Number of posts for page 11: 12
03/09/2024 04:42:46 PM --- Number of posts added on 2024-09-03: 132
03/09/2024 04:42:47 PM --- Done: Y tá Úc bị cấm làm OnlyFans và tranh luận về nội dung 18+ có trả phí
03/09/2024 04:42:47 PM --- Done: Nghiên cứu cho thấy độ dài trung bình của dương vật tăng
03/09/2024 04:42:48 PM --- Done: Phương pháp cai nghiện TikTok tới từ chính TikTok
03/09/2024 04:42:48 PM --- Done: Dịch vụ tích xanh thu phí mới của Meta nói gì về danh tính trên mạng?
03/09/2024 04:42:49 PM --- Done: Những sợi cáp quang mỏng manh "gánh" nền kinh tế internet Việt Nam
03/09/2024 04:42:49 PM --- Done: Hàn Quốc có kế hoạch remake biểu tượng văn hóa đại chúng Breaking Bad
03/09/2024 04:42:50 PM --- Done: Nhật Bản đề xuất tăng tuổi đồng thuận tình dục từ 13 lên 16
03/09/2024 04:42:50 PM --- Done: “Tôi thích phá vỡ quy tắc” - Liệu A.I. đã có cảm xúc như người?
03/09/2024 04:42:51 PM --- Done: Phim Winnie the Pooh do người đóng, nhưng nó lạ lắm...
03/09/2024 04:42:52 PM --- Done: Di cư vì biến đổi khí hậu toàn cầu: Đâu là tương lai của chúng ta?
03/09/2024 04:42:52 PM --- Done: Hogwarts Legacy: Chơi game có biến bạn thành người kì thị chuyển giới?
03/09/2024 04:42:53 PM --- Done: Chiếc ấn vàng của vua Minh Mạng hồi hương sau 70 năm ở Pháp
03/09/2024 04:42:53 PM --- Done page: 12/100
03/09/2024 04:42:53 PM --- Number of posts for page 12: 12
03/09/2024 04:42:53 PM --- Number of posts added on 2024-09-03: 144
03/09/2024 04:42:53 PM --- Done: Người Việt với giải Nobel Văn chương và câu chuyện "gốc Việt"
03/09/2024 04:42:54 PM --- Done: Cô đồng xem bói có gì hay mà ai cũng "đúng nhận sai cãi"?
03/09/2024 04:42:54 PM --- Done: Công dân Việt thắng kiện tại Hàn Quốc về thảm sát trong chiến tranh
03/09/2024 04:42:55 PM --- Done: Google, Baidu và Microsoft cùng nhảy vào cuộc đua A.I.
03/09/2024 04:42:56 PM --- Done: Động đất ở Thổ Nhĩ Kỳ và Syria: Thương vong có thể lên đến 20.000 người
03/09/2024 04:42:56 PM --- Done: Học sinh cấp 3 trả lời câu hỏi kinh điển của nhân loại như thế nào?
03/09/2024 04:42:57 PM --- Done: Phụ huynh bỏ việc để "học thi" cùng con nói lên điều gì về giáo dục Hàn Quốc?
03/09/2024 04:42:57 PM --- Done: 5 Cảnh sát Mỹ đánh người đến thiệt mạng: Nên cảnh báo về độ bạo lực khi đưa tin
03/09/2024 04:42:58 PM --- Done: Trung Quốc mở cửa biên giới sau 1016 ngày bế quan tỏa cảng vì "zero Covid"
03/09/2024 04:42:58 PM --- Done: Cần quan tâm gì ở chuyện giám đốc đăng kiểm không biết chữ?
03/09/2024 04:42:59 PM --- Done: Magnus Carlsen vẫn vô địch giải cờ quốc tế sau những kiện tụng và tranh cãi
03/09/2024 04:42:59 PM --- Done: Bé trai lọt trụ bê tông 35m: Chạy đua với thời gian để tạo ra phép màu
03/09/2024 04:42:59 PM --- Done page: 13/100
03/09/2024 04:42:59 PM --- Number of posts for page 13: 12
03/09/2024 04:42:59 PM --- Number of posts added on 2024-09-03: 156
03/09/2024 04:43:00 PM --- Done: Sau "tiên tri vũ trụ," giờ chúng ta có "nhà thơ thế giới"
03/09/2024 04:43:01 PM --- Done: Netflix có thể thắng người dùng trong cuộc chiến chống chia sẻ tài khoản?
03/09/2024 04:43:02 PM --- Done: Việt Nam hụt mất mục tiêu đón 5 triệu lượt khách quốc tế năm 2022
03/09/2024 04:43:02 PM --- Done: Hỏng hơn 300 phim, điều gì khiến Hãng phim truyện Việt Nam sống mòn?
03/09/2024 04:43:03 PM --- Done: 25 Cuốn sách Hán Nôm quý, sao có thể thất lạc?
03/09/2024 04:43:03 PM --- Done: Binance "lên thớt" với Bộ Tư pháp Hoa Kỳ
03/09/2024 04:43:04 PM --- Done: Wonder Woman 3 bị hủy - Khi điện ảnh chỉ là công cụ kiếm tiền
03/09/2024 04:43:05 PM --- Done: Volodymyr Zelensky: Danh hài, Tổng thống, Nhân vật của năm 2022
03/09/2024 04:43:05 PM --- Done: Bức ảnh thay đổi cách loài người nhìn nhận Trái đất nay đã tròn 50 tuổi
03/09/2024 04:43:06 PM --- Done: 1,5 Triệu USD bồi thường cáo buộc sai về gian lận thi cử
03/09/2024 04:43:07 PM --- Done: "Khủng hoảng kết hôn": Không chỉ là câu chuyện của riêng Trung Quốc 
03/09/2024 04:43:07 PM --- Done: FBI lo ngại TikTok đe doạ an ninh quốc gia Mỹ
03/09/2024 04:43:07 PM --- Done page: 14/100
03/09/2024 04:43:07 PM --- Number of posts for page 14: 12
03/09/2024 04:43:07 PM --- Number of posts added on 2024-09-03: 168
03/09/2024 04:43:08 PM --- Done: Công nghệ khiến bóng đá công bằng hơn hay thiếu hấp dẫn hơn?
03/09/2024 04:43:09 PM --- Done: Elon Musk và hành trình biến Twitter thành của riêng mình
03/09/2024 04:43:09 PM --- Done: Hơn 6500 công nhân thiệt mạng để phục vụ cho World Cup Qatar 2022
03/09/2024 04:43:10 PM --- Done: Nờ Ô Nô: Của cho không bằng cách cho
03/09/2024 04:43:10 PM --- Done: Quảng cáo tình dục hóa trẻ em, nước 'đi vào lòng đất' của Balenciaga 
03/09/2024 04:43:11 PM --- Done: Messi - Ronaldo đối đầu: Quảng cáo "chiếu tướng" đại chúng 
03/09/2024 04:43:11 PM --- Done: 8 Tỷ phi hành đoàn trên con tàu vũ trụ trái đất: Cần lưu ý những gì?
03/09/2024 04:43:12 PM --- Done: Cờ LGBTIQ+ xuất hiện tại World Cup 2022, nhưng nó lạ lắm...
03/09/2024 04:43:12 PM --- Done: Khi IELTS không còn là "vua của mọi chứng chỉ"
03/09/2024 04:43:13 PM --- Done: Chúng ta đang "làm ngơ" với thảm họa đã tới? 
03/09/2024 04:43:13 PM --- Done: Thảm kịch tại Itaewon: Làm gì để sống sót trong dòng người?
03/09/2024 04:43:14 PM --- Done: Kanye West mất danh hiệu tỉ phú sau khi bị các nhãn hàng tẩy chay
03/09/2024 04:43:14 PM --- Done page: 15/100
03/09/2024 04:43:14 PM --- Number of posts for page 15: 12
03/09/2024 04:43:14 PM --- Number of posts added on 2024-09-03: 180
03/09/2024 04:43:15 PM --- Done: Emoji mặt hề mà sao không hài? 
03/09/2024 04:43:16 PM --- Done: Anna Bắc Giang nói gì về "cờ đỏ" của siêu lừa đảo?
03/09/2024 04:43:16 PM --- Done: Just Stop Oil: Phá hoại của công không nâng cao nhận thức về môi trường
03/09/2024 04:43:17 PM --- Done: Facebook xin lỗi vì lỗi "bay màu" người theo dõi
03/09/2024 04:43:17 PM --- Done: Việt Nam trúng cử thành viên Hội đồng Nhân quyền Liên Hợp Quốc
03/09/2024 04:43:18 PM --- Done: Thêm một nhà văn nữ thắng giải Nobel Văn chương 
03/09/2024 04:43:18 PM --- Done: Luận án tiến sĩ về áo ngực: Khoa học và thiết thực nhưng vẫn bị chê?
03/09/2024 04:43:19 PM --- Done: Đi làm phải vui hay phải biết chấp nhận?
03/09/2024 04:43:19 PM --- Done: Từ Hoa hậu Hòa bình Việt Nam, nghĩ về "văn hóa dân tộc"
03/09/2024 04:43:20 PM --- Done: Thung lũng Silicon có đang “chết” như giới chuyên gia nhận định?
03/09/2024 04:43:20 PM --- Done: Semantic Error nói gì và không nói gì về LGBTQ?
03/09/2024 04:43:21 PM --- Done: Thần Trùng - Game kinh dị thuần Việt tạo điểm nhấn ngay khi ra mắt
03/09/2024 04:43:21 PM --- Done page: 16/100
03/09/2024 04:43:21 PM --- Number of posts for page 16: 12
03/09/2024 04:43:21 PM --- Number of posts added on 2024-09-03: 192
03/09/2024 04:44:08 PM --- Done: Trải nghiệm “như phim” là xu hướng du lịch lên ngôi ở Gen Z
03/09/2024 04:44:08 PM --- Done: Xu hướng trữ đông trứng: “Bảo hiểm” có con trong tương lai?
03/09/2024 04:44:09 PM --- Done: Vì sao CEO của Telegram bị bắt? “Vấn đề kiểm duyệt”
03/09/2024 04:44:09 PM --- Done: Vụ ngược đãi chó ở Đà Lạt nói gì về mô hình kinh doanh bằng thú cưng?
03/09/2024 04:44:10 PM --- Done: “Hình phạt” cho người độc thân: Thực hư ra sao, hiệu quả liệu đến mức nào?
03/09/2024 04:44:10 PM --- Done: Du lịch Việt Nam chuẩn bị đón 4500 khách từ Ấn Độ
03/09/2024 04:44:11 PM --- Done: Ai là người được follow nhiều nhất Việt Nam?
03/09/2024 04:44:11 PM --- Done: Việt Nam giành 3 huy chương vàng từ Olympic, nhưng không phải Paris
03/09/2024 04:44:12 PM --- Done: Mua hàng miễn thuế sân bay Thái sắp trở thành quá khứ?
03/09/2024 04:44:12 PM --- Done: Biểu tình, chất thải sinh học và giường chống QHTD: Vì sao Olympic Paris “bất ổn” đến thế?
03/09/2024 04:44:13 PM --- Done: Giải mã sức hút đằng sau Possessed Love - Chương trình hẹn hò tâm linh 
03/09/2024 04:44:14 PM --- Done: Châu Bùi bị quay lén: Camera giấu kín giá rẻ nhưng nạn nhân phải trả giá đắt
03/09/2024 04:44:14 PM --- Done page: 1/10000
03/09/2024 04:44:14 PM --- Number of posts for page 1: 12
03/09/2024 04:44:14 PM --- Number of posts added on 2024-09-03: 12
03/09/2024 04:44:14 PM --- Done: Indonesia thí điểm tuần làm việc 4 ngày, Việt Nam thì sao?
03/09/2024 04:44:15 PM --- Done: Ngoài lịch thi đấu, đây là những điều bạn cần biết về Euro 2024
03/09/2024 04:44:15 PM --- Done: Apple ra mắt A.I, cam kết sẽ không giống ai
03/09/2024 04:44:16 PM --- Done: Có gì mới lạ trong app hẹn hò của chính phủ Nhật Bản?
03/09/2024 04:44:16 PM --- Done: Chính phủ tăng cường rà soát các phiên livestream doanh thu trăm tỷ
03/09/2024 04:44:17 PM --- Done: Người nổi tiếng có sai khi yêu cầu sự riêng tư tại nơi công cộng?
03/09/2024 04:44:17 PM --- Done: Gần 40% các trang web “bay màu” sau một thập kỷ, vì sao lại thế?
03/09/2024 04:44:18 PM --- Done: Thực hư tranh cãi xung quanh phát ngôn "mã gen normal" của Ninh Anh Bùi
03/09/2024 04:44:18 PM --- Done: Vụ việc Mina Dating Cafe: Khi phụ nữ là món hàng và nam giới là khách hàng
03/09/2024 04:44:19 PM --- Done: Vì sao máy bay ngày càng dễ gặp “ổ gà” trên không?
03/09/2024 04:44:19 PM --- Done: Ngành livestream hot thế nào mà đến “nữ hoàng kem trộn Rihanna” cũng tham gia?
03/09/2024 04:44:20 PM --- Done: ChatGPT nói giọng Black Widow, tưởng “hay như phim” nhưng không hay chút nào
03/09/2024 04:44:20 PM --- Done page: 2/10000
03/09/2024 04:44:20 PM --- Number of posts for page 2: 12
03/09/2024 04:44:20 PM --- Number of posts added on 2024-09-03: 24
03/09/2024 04:44:21 PM --- Done: Toàn cảnh vụ bê bối Burning Sun qua phim tài liệu của BBC
03/09/2024 04:44:21 PM --- Done: Việt Nam và Đông Nam Á đã trở thành bãi rác của thế giới như thế nào?
03/09/2024 04:44:22 PM --- Done: Vì sao ngày càng nhiều công ty yêu cầu nhân viên chạy bộ?
03/09/2024 04:44:22 PM --- Done: Đã tổ chức thi IELTS từ lâu, tại sao tới nay IDP mới sai quy định?
03/09/2024 04:44:23 PM --- Done: Sách nhạy cảm trong trường quốc tế: Tranh luận "dâm hay không dâm" là chưa đủ
03/09/2024 04:44:23 PM --- Done: Toàn cảnh “đại chiến gia tộc” HYBE - ADOR: New Jeans sẽ ra sao?
03/09/2024 04:44:24 PM --- Done: Dự án giao thông mới của Campuchia sẽ ảnh hưởng thế nào tới Việt Nam?
03/09/2024 04:44:24 PM --- Done: Quentin Tarantino “bỏ ngang” phim cuối cùng, người hâm mộ buồn vui lẫn lộn
03/09/2024 04:44:25 PM --- Done: Kéo dài nghỉ lễ 30/4: Nghỉ thêm một ngày, niềm vui nhân đôi
03/09/2024 04:44:25 PM --- Done: CEO Apple đến Việt Nam: Thị trường tiềm năng mới cho gã khổng lồ công nghệ Mỹ? 
03/09/2024 04:44:26 PM --- Done: Vé máy bay trong nước đắt: Một vạn câu hỏi vì sao?
03/09/2024 04:44:26 PM --- Done: Hạ viện Thái Lan đồng tình với hôn nhân đồng tính
03/09/2024 04:44:26 PM --- Done page: 3/10000
03/09/2024 04:44:26 PM --- Number of posts for page 3: 12
03/09/2024 04:44:26 PM --- Number of posts added on 2024-09-03: 36
03/09/2024 04:44:27 PM --- Done: Bất chấp Netflix “làm căng”, 10% người dùng vẫn “xem chùa”
03/09/2024 04:44:27 PM --- Done: Mỹ cấm TikTok vì bản thân TikTok hay vì lý do khác?
03/09/2024 04:44:28 PM --- Done: Tiêu cực trong Liên Minh Huyền Thoại Việt Nam: Còn gì cho eSports Việt?
03/09/2024 04:44:28 PM --- Done: Chán LinkedIn, mọi người chuyển sang tìm việc làm trên Threads
03/09/2024 04:44:29 PM --- Done: Năm trước Cá Hồi Hoang tan rã, năm nay Ngọt chia tay chúng ta
03/09/2024 04:44:29 PM --- Done: Phim tiểu sử về Michael Jackson bị tố “tẩy trắng” sự thật đen tối
03/09/2024 04:44:30 PM --- Done: Tổng Cục Thuế livestream hướng dẫn làm thuế: Bạn kê khai thu nhập chưa?
03/09/2024 04:44:30 PM --- Done: Khi cuộc sống quá khó khăn, hãy để Spotify chọn giúp bạn một tụ 
03/09/2024 04:44:31 PM --- Done: Tưởng như Trái Đất ngừng quay khi Facebook và nhiều ứng dụng "mất điện"
03/09/2024 04:44:31 PM --- Done: The Eras Tour Singapore: Khi mà chính phủ cũng "mê" Taylor Swift
03/09/2024 04:44:32 PM --- Done: “Cúng Locket” - Hệ tư tưởng dùng mạng xã hội để sống thật, có gì mà hot?
03/09/2024 04:44:32 PM --- Done: Màn vạch trần chồng cũ viral TikTok cả thế giới - Nhờ đâu “Who TF Did I Marry?” thành công?
03/09/2024 04:44:32 PM --- Done page: 4/10000
03/09/2024 04:44:32 PM --- Number of posts for page 4: 12
03/09/2024 04:44:32 PM --- Number of posts added on 2024-09-03: 48
03/09/2024 04:44:33 PM --- Done: "Vũ trụ điện ảnh" The Beatles sẽ ra rạp năm 2027
03/09/2024 04:44:34 PM --- Done: Đào, Phở, và Piano - Trường hợp cá biệt của điện ảnh Việt Nam
03/09/2024 04:44:34 PM --- Done: Rabbit R1 có thay thế được chiếc điện thoại trong túi bạn?
03/09/2024 04:44:34 PM --- Done: Người bán hàng bị trừ cả tỷ đồng sau đợt “check var” của Shopee 
03/09/2024 04:44:35 PM --- Done: Disney hết hạn bản quyền với chuột Mickey, giờ chúng ta có thể làm gì?
03/09/2024 04:44:35 PM --- Done: Thị thực Hallyu là gì, và bạn có hiểu nhầm về nó không?
03/09/2024 04:44:36 PM --- Done: Những ai phải chịu trách nhiệm cho cái chết của Lee Sun Kyun?
03/09/2024 04:44:36 PM --- Done: Zara bị tẩy chay sau chiến dịch quảng cáo gợi nhắc thương đau ở dải Gaza
03/09/2024 04:44:37 PM --- Done: Học sinh hành hung cô giáo ở Tuyên Quang: Để yên cho nhà giáo hiền 
03/09/2024 04:44:37 PM --- Done: Đại học Harvard có “cửa sau” cho con nhà siêu giàu?
03/09/2024 04:44:38 PM --- Done: Được giới trẻ yêu mến, tại sao Baemin phải rút khỏi Việt Nam?
03/09/2024 04:44:39 PM --- Done: CZ và Binance nhận tội: Sóng gió có cuốn trôi gã khổng lồ tiền số cuối cùng?
03/09/2024 04:44:39 PM --- Done page: 5/10000
03/09/2024 04:44:39 PM --- Number of posts for page 5: 12
03/09/2024 04:44:39 PM --- Number of posts added on 2024-09-03: 60
03/09/2024 04:44:39 PM --- Done: Tháp nước Hàng Đậu - nơi ai cũng thắc mắc có gì ở trong - mở cửa đón khách
03/09/2024 04:44:40 PM --- Done: Vì sao chính phủ kêu gọi người trẻ "chạy KPI" lập gia đình?
03/09/2024 04:44:40 PM --- Done: Cuộc chia tay trắc trở và gian truân giữa Sam Altman và OpenAI
03/09/2024 04:44:41 PM --- Done: Now and Then - Khúc ca cuối có đặt dấu chấm hết cho The Beatles?
03/09/2024 04:44:41 PM --- Done: Messi lập kỷ lục Quả Bóng Vàng: Không anh thì ai?
03/09/2024 04:44:42 PM --- Done: Mùa nóng đã qua nhưng Hà Nội vẫn "hạn hán" nước sạch
03/09/2024 04:44:43 PM --- Done: Ồn ào rồi cũng qua đi - Doanh thu trăm tỷ mới là thành công?
03/09/2024 04:44:43 PM --- Done: Quá khứ đau thương đang lặp lại tại Israel-Palestine
03/09/2024 04:44:44 PM --- Done: Nobel Văn chương 2023 gọi tên Jon Fosse
03/09/2024 04:44:44 PM --- Done: "Công thức viral" nào đằng sau trắc nghiệm tính cách Taiwan Design Expo? 
03/09/2024 04:44:45 PM --- Done: Giáo viên kéo lê học trò: Nhiều hơn chuyện cô, trò, và cái bánh
03/09/2024 04:44:45 PM --- Done: ‘Người Sắt’ Mark Zuckerberg đang tạo ra đế chế Ultron?
03/09/2024 04:44:45 PM --- Done page: 6/10000
03/09/2024 04:44:45 PM --- Number of posts for page 6: 12
03/09/2024 04:44:45 PM --- Number of posts added on 2024-09-03: 72
03/09/2024 04:44:46 PM --- Done: Chơi điện tử, tranh huy chương ASIAD
03/09/2024 04:44:47 PM --- Done: "Check Var" Chủ tịch Liên đoàn Bóng đá Tây Ban Nha, penalty sút bay ghế
03/09/2024 04:44:47 PM --- Done: ‘Bigcityboi’ Binz hát nhạc phim hành động Hollywood
03/09/2024 04:44:48 PM --- Done: Nhạc của AI tranh cử Grammy có khiến ngành âm nhạc lo lắng?
03/09/2024 04:44:48 PM --- Done: Vài giây gặp Messi và ngày trở lại showbiz đầy sóng gió của Jack
03/09/2024 04:44:49 PM --- Done: Anime bởi AI thì mộng mơ đấy nhưng…
03/09/2024 04:44:49 PM --- Done: Ấn Độ trở thành nước đầu tiên hạ cánh tại vùng tối của mặt trăng
03/09/2024 04:44:50 PM --- Done: Ở Hà Nội mà sợ xe bus đông, tại sao không thử xe đạp công cộng?
03/09/2024 04:44:50 PM --- Done: Ấn Độ cấm xuất khẩu gạo và khủng hoảng lương thực có ảnh hưởng đến Việt Nam?
03/09/2024 04:44:51 PM --- Done: Twitter đổi tên thành X và tham vọng làm ra WeChat kiểu Mỹ của Elon Musk
03/09/2024 04:44:51 PM --- Done: Hơn 1000 diễn viên gửi thư "sẵn sàng đình công," Hollywood gặp nguy
03/09/2024 04:44:52 PM --- Done: Ai đã định giá cho đồng Pi 7 tỷ?
03/09/2024 04:44:52 PM --- Done page: 7/10000
03/09/2024 04:44:52 PM --- Number of posts for page 7: 12
03/09/2024 04:44:52 PM --- Number of posts added on 2024-09-03: 84
03/09/2024 04:44:53 PM --- Done: Khi Secret Invasion sử dụng AI cho intro, người làm sáng tạo nên lo sợ
03/09/2024 04:44:53 PM --- Done: Tàu lặn thám hiểm xác tàu Titanic mất tích ở đáy biển Đại Tây Dương
03/09/2024 04:44:54 PM --- Done: Tập đoàn báo chí lớn nhất Mỹ kiện Google vì độc quyền quảng cáo
03/09/2024 04:44:54 PM --- Done: Bê bối thu gom đồ cũ để tái chế của H&M nói gì về thời trang bền vững?
03/09/2024 04:44:55 PM --- Done: Liên Minh Huyền Thoại Việt Nam lại lỡ cơ hội thi đấu vì vấn đề visa
03/09/2024 04:44:55 PM --- Done: Grab lên kế hoạch cắt giảm hơn 1000 người, giá cổ phiếu lao dốc
03/09/2024 04:44:55 PM --- Done: Tại sao sách giáo khoa phổ thông chương trình mới đắt thế?
03/09/2024 04:44:56 PM --- Done: 103 trường xét tuyển đại học bằng IELTS: Tuyển sinh có đang thiếu công bằng?
03/09/2024 04:44:56 PM --- Done: "Một màu đen đen" bao phủ Reddit
03/09/2024 04:44:57 PM --- Done: Jennie, thần tượng Kpop nhập vai nữ siêu hùng Marvel?
03/09/2024 04:44:58 PM --- Done: Tranh cãi về trường chuyên và những suy nghĩ về việc dạy con
03/09/2024 04:44:58 PM --- Done: Vì sao miền Bắc thường xuyên mất điện?
03/09/2024 04:44:58 PM --- Done page: 8/10000
03/09/2024 04:44:58 PM --- Number of posts for page 8: 12
03/09/2024 04:44:58 PM --- Number of posts added on 2024-09-03: 96
03/09/2024 04:44:59 PM --- Done: Hayao Miyazaki, từ vết thương ấu thơ đến thơ ấu của triệu người
03/09/2024 04:44:59 PM --- Done: Giảm năng suất lao động: Không thể đổ lỗi cho làm việc từ xa!
03/09/2024 04:45:00 PM --- Done: Tuyển thủ đình công, Riot Games "đe dọa" hủy bỏ giải đấu LCS
03/09/2024 04:45:00 PM --- Done: Vẹt cũng biết "video call" để bớt cô đơn
03/09/2024 04:45:01 PM --- Done: ‘The Idol’ tại Cannes: Ơn giời, phim gây sốc đây rồi
03/09/2024 04:45:02 PM --- Done:  Johnny Depp rơi nước mắt ở Cannes
03/09/2024 04:45:02 PM --- Done: VICE Media LLC phá sản: "Than ôi! Thời oanh liệt nay còn đâu!"
03/09/2024 04:45:03 PM --- Done: JVevermind làm trưởng FC Trấn Thành và sự trưởng thành của một người nổi tiếng
03/09/2024 04:45:03 PM --- Done: Biểu tình ở lễ đăng quang: Thách thức đón chờ tân vương Charles III
03/09/2024 04:45:04 PM --- Done: Tài khoản mạng xã hội “chính chủ”: Chúng ta cần biết gì?
03/09/2024 04:45:04 PM --- Done: Những thành tựu mới nhất của kính James Webb định hình lại hiểu biết về vũ trụ
03/09/2024 04:45:05 PM --- Done: Hơn 11000 biên kịch tại Mỹ đình công, bạn cần biết gì?
03/09/2024 04:45:05 PM --- Done page: 9/10000
03/09/2024 04:45:05 PM --- Number of posts for page 9: 12
03/09/2024 04:45:05 PM --- Number of posts added on 2024-09-03: 108
03/09/2024 04:45:06 PM --- Done: AI đọc suy nghĩ con người: Khi bộ não không còn riêng tư
03/09/2024 04:45:06 PM --- Done: "Bố già AI" rời khỏi Google, cảnh báo về một thế giới không có sự thật
03/09/2024 04:45:07 PM --- Done: AI hát ai nghe?
03/09/2024 04:45:07 PM --- Done: Tại sao ngày càng nhiều phụ nữ lựa chọn đông lạnh trứng?
03/09/2024 04:45:08 PM --- Done: Tái hiện Cleopatra da màu và da trắng: Bản "gốc" nào mới chính xác?
03/09/2024 04:45:08 PM --- Done: Tin mừng: Từ nay pháp luật sẽ bảo vệ thông tin của chúng ta?
03/09/2024 04:45:09 PM --- Done: Synthwave Boy: Người bạn mới của Lofi Girl
03/09/2024 04:45:09 PM --- Done: Những gì bạn cần biết về đề nghị xây dựng Luật Bản dạng giới tại Quốc hội
03/09/2024 04:45:10 PM --- Done: Phố cổ Hội An bắt buộc du khách mua vé tham quan: Liệu có khả thi?
03/09/2024 04:45:10 PM --- Done: TikTok bị kiểm tra hoạt động tại Việt Nam: Kết quả là gì?
03/09/2024 04:45:11 PM --- Done: Sau phiên bản AI, Harry Potter có series truyền hình? 
03/09/2024 04:45:11 PM --- Done: Donald Trump trở thành vị cựu Tổng thống Mỹ đầu tiên bị truy tố
03/09/2024 04:45:11 PM --- Done page: 10/10000
03/09/2024 04:45:11 PM --- Number of posts for page 10: 12
03/09/2024 04:45:11 PM --- Number of posts added on 2024-09-03: 120
03/09/2024 04:45:12 PM --- Done: Bình cũ, rượu mới: JVevermind tái xuất trên YouTube!
03/09/2024 04:45:13 PM --- Done: Oscar nên trao giải cao nhất cho một bộ phim Mỹ? 
03/09/2024 04:45:13 PM --- Done: Cô gái kiếm tiền qua Tinder: Tranh luận văn minh thay vì mạt sát và bắt nạt
03/09/2024 04:45:14 PM --- Done: Rap Việt là không mày - tao
03/09/2024 04:45:14 PM --- Done: Vụ thực tập sinh Việt bỏ con tại Nhật: Tòa án Tối cao tuyên vô tội!
03/09/2024 04:45:15 PM --- Done: Cuộc hợp nhất của hai ngân hàng lớn nhất Thụy Sĩ
03/09/2024 04:45:15 PM --- Done: Cuộc phản đối chính sách tăng tuổi nghỉ hưu có phải câu chuyện của riêng nước Pháp?
03/09/2024 04:45:16 PM --- Done: Cái chết của Silicon Valley Bank có phải khởi đầu của khủng hoảng mới?
03/09/2024 04:45:16 PM --- Done: Trông đợi điều gì ở GPT-4 - bản nâng cấp của ChatGPT?
03/09/2024 04:45:17 PM --- Done: Ai sẽ đứng về phía những ngành nghề được coi là "vô dụng"?
03/09/2024 04:45:17 PM --- Done: Phim hoạt hình không phải là điện ảnh, và chỉ dành cho trẻ con?
03/09/2024 04:45:18 PM --- Done: Vì sao chúng ta cứ mãi dẹp vỉa hè năm này qua năm khác?
03/09/2024 04:45:18 PM --- Done page: 11/10000
03/09/2024 04:45:18 PM --- Number of posts for page 11: 12
03/09/2024 04:45:18 PM --- Number of posts added on 2024-09-03: 132
03/09/2024 04:45:19 PM --- Done: Y tá Úc bị cấm làm OnlyFans và tranh luận về nội dung 18+ có trả phí
03/09/2024 04:45:19 PM --- Done: Nghiên cứu cho thấy độ dài trung bình của dương vật tăng
03/09/2024 04:45:20 PM --- Done: Phương pháp cai nghiện TikTok tới từ chính TikTok
03/09/2024 04:45:20 PM --- Done: Dịch vụ tích xanh thu phí mới của Meta nói gì về danh tính trên mạng?
03/09/2024 04:45:21 PM --- Done: Những sợi cáp quang mỏng manh "gánh" nền kinh tế internet Việt Nam
03/09/2024 04:45:21 PM --- Done: Hàn Quốc có kế hoạch remake biểu tượng văn hóa đại chúng Breaking Bad
03/09/2024 04:45:22 PM --- Done: Nhật Bản đề xuất tăng tuổi đồng thuận tình dục từ 13 lên 16
03/09/2024 04:45:22 PM --- Done: “Tôi thích phá vỡ quy tắc” - Liệu A.I. đã có cảm xúc như người?
03/09/2024 04:45:23 PM --- Done: Phim Winnie the Pooh do người đóng, nhưng nó lạ lắm...
03/09/2024 04:45:23 PM --- Done: Di cư vì biến đổi khí hậu toàn cầu: Đâu là tương lai của chúng ta?
03/09/2024 04:45:24 PM --- Done: Hogwarts Legacy: Chơi game có biến bạn thành người kì thị chuyển giới?
03/09/2024 04:45:24 PM --- Done: Chiếc ấn vàng của vua Minh Mạng hồi hương sau 70 năm ở Pháp
03/09/2024 04:45:24 PM --- Done page: 12/10000
03/09/2024 04:45:24 PM --- Number of posts for page 12: 12
03/09/2024 04:45:24 PM --- Number of posts added on 2024-09-03: 144
03/09/2024 04:45:25 PM --- Done: Người Việt với giải Nobel Văn chương và câu chuyện "gốc Việt"
03/09/2024 04:45:26 PM --- Done: Cô đồng xem bói có gì hay mà ai cũng "đúng nhận sai cãi"?
03/09/2024 04:45:26 PM --- Done: Công dân Việt thắng kiện tại Hàn Quốc về thảm sát trong chiến tranh
03/09/2024 04:45:27 PM --- Done: Google, Baidu và Microsoft cùng nhảy vào cuộc đua A.I.
03/09/2024 04:45:27 PM --- Done: Động đất ở Thổ Nhĩ Kỳ và Syria: Thương vong có thể lên đến 20.000 người
03/09/2024 04:45:28 PM --- Done: Học sinh cấp 3 trả lời câu hỏi kinh điển của nhân loại như thế nào?
03/09/2024 04:45:28 PM --- Done: Phụ huynh bỏ việc để "học thi" cùng con nói lên điều gì về giáo dục Hàn Quốc?
03/09/2024 04:45:29 PM --- Done: 5 Cảnh sát Mỹ đánh người đến thiệt mạng: Nên cảnh báo về độ bạo lực khi đưa tin
03/09/2024 04:45:29 PM --- Done: Trung Quốc mở cửa biên giới sau 1016 ngày bế quan tỏa cảng vì "zero Covid"
03/09/2024 04:45:30 PM --- Done: Cần quan tâm gì ở chuyện giám đốc đăng kiểm không biết chữ?
03/09/2024 04:45:31 PM --- Done: Magnus Carlsen vẫn vô địch giải cờ quốc tế sau những kiện tụng và tranh cãi
03/09/2024 04:45:31 PM --- Done: Bé trai lọt trụ bê tông 35m: Chạy đua với thời gian để tạo ra phép màu
03/09/2024 04:45:31 PM --- Done page: 13/10000
03/09/2024 04:45:31 PM --- Number of posts for page 13: 12
03/09/2024 04:45:31 PM --- Number of posts added on 2024-09-03: 156
03/09/2024 04:45:32 PM --- Done: Sau "tiên tri vũ trụ," giờ chúng ta có "nhà thơ thế giới"
03/09/2024 04:45:33 PM --- Done: Netflix có thể thắng người dùng trong cuộc chiến chống chia sẻ tài khoản?
03/09/2024 04:45:33 PM --- Done: Việt Nam hụt mất mục tiêu đón 5 triệu lượt khách quốc tế năm 2022
03/09/2024 04:45:34 PM --- Done: Hỏng hơn 300 phim, điều gì khiến Hãng phim truyện Việt Nam sống mòn?
03/09/2024 04:45:35 PM --- Done: 25 Cuốn sách Hán Nôm quý, sao có thể thất lạc?
03/09/2024 04:45:35 PM --- Done: Binance "lên thớt" với Bộ Tư pháp Hoa Kỳ
03/09/2024 04:45:36 PM --- Done: Wonder Woman 3 bị hủy - Khi điện ảnh chỉ là công cụ kiếm tiền
03/09/2024 04:45:36 PM --- Done: Volodymyr Zelensky: Danh hài, Tổng thống, Nhân vật của năm 2022
03/09/2024 04:45:37 PM --- Done: Bức ảnh thay đổi cách loài người nhìn nhận Trái đất nay đã tròn 50 tuổi
03/09/2024 04:45:37 PM --- Done: 1,5 Triệu USD bồi thường cáo buộc sai về gian lận thi cử
03/09/2024 04:45:38 PM --- Done: "Khủng hoảng kết hôn": Không chỉ là câu chuyện của riêng Trung Quốc 
03/09/2024 04:45:38 PM --- Done: FBI lo ngại TikTok đe doạ an ninh quốc gia Mỹ
03/09/2024 04:45:38 PM --- Done page: 14/10000
03/09/2024 04:45:38 PM --- Number of posts for page 14: 12
03/09/2024 04:45:38 PM --- Number of posts added on 2024-09-03: 168
03/09/2024 04:45:39 PM --- Done: Công nghệ khiến bóng đá công bằng hơn hay thiếu hấp dẫn hơn?
03/09/2024 04:45:40 PM --- Done: Elon Musk và hành trình biến Twitter thành của riêng mình
03/09/2024 04:45:40 PM --- Done: Hơn 6500 công nhân thiệt mạng để phục vụ cho World Cup Qatar 2022
03/09/2024 04:45:41 PM --- Done: Nờ Ô Nô: Của cho không bằng cách cho
03/09/2024 04:45:41 PM --- Done: Quảng cáo tình dục hóa trẻ em, nước 'đi vào lòng đất' của Balenciaga 
03/09/2024 04:45:42 PM --- Done: Messi - Ronaldo đối đầu: Quảng cáo "chiếu tướng" đại chúng 
03/09/2024 04:45:42 PM --- Done: 8 Tỷ phi hành đoàn trên con tàu vũ trụ trái đất: Cần lưu ý những gì?
03/09/2024 04:45:43 PM --- Done: Cờ LGBTIQ+ xuất hiện tại World Cup 2022, nhưng nó lạ lắm...
03/09/2024 04:45:43 PM --- Done: Khi IELTS không còn là "vua của mọi chứng chỉ"
03/09/2024 04:45:44 PM --- Done: Chúng ta đang "làm ngơ" với thảm họa đã tới? 
03/09/2024 04:45:44 PM --- Done: Thảm kịch tại Itaewon: Làm gì để sống sót trong dòng người?
03/09/2024 04:45:45 PM --- Done: Kanye West mất danh hiệu tỉ phú sau khi bị các nhãn hàng tẩy chay
03/09/2024 04:45:45 PM --- Done page: 15/10000
03/09/2024 04:45:45 PM --- Number of posts for page 15: 12
03/09/2024 04:45:45 PM --- Number of posts added on 2024-09-03: 180
03/09/2024 04:45:45 PM --- Done: Emoji mặt hề mà sao không hài? 
03/09/2024 04:45:46 PM --- Done: Anna Bắc Giang nói gì về "cờ đỏ" của siêu lừa đảo?
03/09/2024 04:45:47 PM --- Done: Just Stop Oil: Phá hoại của công không nâng cao nhận thức về môi trường
03/09/2024 04:45:47 PM --- Done: Facebook xin lỗi vì lỗi "bay màu" người theo dõi
03/09/2024 04:45:47 PM --- Done: Việt Nam trúng cử thành viên Hội đồng Nhân quyền Liên Hợp Quốc
03/09/2024 04:45:48 PM --- Done: Thêm một nhà văn nữ thắng giải Nobel Văn chương 
03/09/2024 04:45:48 PM --- Done: Luận án tiến sĩ về áo ngực: Khoa học và thiết thực nhưng vẫn bị chê?
03/09/2024 04:45:49 PM --- Done: Đi làm phải vui hay phải biết chấp nhận?
03/09/2024 04:45:49 PM --- Done: Từ Hoa hậu Hòa bình Việt Nam, nghĩ về "văn hóa dân tộc"
03/09/2024 04:45:50 PM --- Done: Thung lũng Silicon có đang “chết” như giới chuyên gia nhận định?
03/09/2024 04:45:50 PM --- Done: Semantic Error nói gì và không nói gì về LGBTQ?
03/09/2024 04:45:51 PM --- Done: Thần Trùng - Game kinh dị thuần Việt tạo điểm nhấn ngay khi ra mắt
03/09/2024 04:45:51 PM --- Done page: 16/10000
03/09/2024 04:45:51 PM --- Number of posts for page 16: 12
03/09/2024 04:45:51 PM --- Number of posts added on 2024-09-03: 192
03/09/2024 04:45:52 PM --- Done: Hàn Quốc muốn bắt Do Kwon - cha đẻ đồng LUNA
03/09/2024 04:45:53 PM --- Done: Tóm Lại Là: Cởi mở hay "cởi dở” trong âm nhạc? 
03/09/2024 04:45:53 PM --- Done: Nữ hoàng Anh Elizabeth II qua đời: Thế giới phản ứng ra sao?
03/09/2024 04:45:54 PM --- Done: iPhone 14 series ra mắt: Màn hình “viên thuốc” mới khẳng định độ dày của ví bạn
03/09/2024 04:45:54 PM --- Done: Xin 'in tư' sao cứ phải 'kính thưa hội đồng xét xử?' 
03/09/2024 04:45:55 PM --- Done: AI thắng con người còn nghệ thuật đã chết? 
03/09/2024 04:45:55 PM --- Done: Miễn nghĩa vụ quân sự cho sao Hàn: Đi hay không đi nói một lời!
03/09/2024 04:45:56 PM --- Done: Hơn 40 người Việt trốn khỏi casino tại Campuchia 
03/09/2024 04:45:57 PM --- Done: Singapore bỏ luật cấm nam giới quan hệ đồng tính
03/09/2024 04:45:57 PM --- Done: Đừng đợi bị phạt tiền triệu mới ‘soi’ túi rác và tập phân loại rác thải 
03/09/2024 04:45:57 PM --- Done: Nhân chứng người Việt kiện chính phủ Hàn Quốc vì tội ác chiến tranh
03/09/2024 04:45:58 PM --- Done: Dọa ma trẻ em: Trào lưu vô hại hay hại vô kể? 
03/09/2024 04:45:58 PM --- Done page: 17/10000
03/09/2024 04:45:58 PM --- Number of posts for page 17: 12
03/09/2024 04:45:58 PM --- Number of posts added on 2024-09-03: 204
03/09/2024 04:45:59 PM --- Done: Apple gợi ý thu phí người dùng, Facebook "chê"
03/09/2024 04:45:59 PM --- Done: Cái chết của em bé 12 tuổi và câu hỏi lớn về quyền định đoạt sự sống
03/09/2024 04:46:00 PM --- Done: Hồi sinh nội tạng lợn: Các nhà khoa học đang định nghĩa lại cái chết?
03/09/2024 04:46:00 PM --- Done: Ba nước châu Âu từ chối hộ chiếu mới của Việt Nam
03/09/2024 04:46:01 PM --- Done: Pi Network: Khi nào đồng Pi có giá nghìn đô?
03/09/2024 04:46:01 PM --- Done: Không riêng gì Tổng thống Mỹ, ai cũng có thể tái nhiễm Covid-19
03/09/2024 04:46:02 PM --- Done: Cầm quyền trượng sao cho không "sượng"?
03/09/2024 04:46:03 PM --- Done: Tăng 2 bậc hạnh phúc, Việt Nam vẫn "lọt top" 3 buồn bã nhất Đông Nam Á
03/09/2024 04:46:03 PM --- Done: Loa phường: Công cụ đưa tin hay ô nhiễm tiếng ồn?
03/09/2024 04:46:04 PM --- Done: Black Panther: Wakanda Forever - Di sản sau khi Chadwick Boseman ra đi
03/09/2024 04:46:04 PM --- Done: Bùng phát bệnh đậu mùa khỉ: Vì sao số liệu chỉ rơi vào người đồng tính nam?
03/09/2024 04:46:05 PM --- Done: Vụ bạo hành bé Vân An: Hoãn xét xử để xem xét tội danh của người cha
03/09/2024 04:46:05 PM --- Done page: 18/10000
03/09/2024 04:46:05 PM --- Number of posts for page 18: 12
03/09/2024 04:46:05 PM --- Number of posts added on 2024-09-03: 216
03/09/2024 04:46:06 PM --- Done: Loạn thi Hoa hậu - Câu hỏi không phải là "sao nhiều thế?"  
03/09/2024 04:46:06 PM --- Done: Hacker bán 30 Triệu hồ sơ người Việt đổi lấy 80 triệu đồng
03/09/2024 04:46:07 PM --- Done: 4.7 Tỷ năm của vũ trụ qua kính thiên văn James Webb
03/09/2024 04:46:07 PM --- Done: Lofi Girl miệt mài học bài 2 năm nay "nghỉ xả hơi" 48 tiếng
03/09/2024 04:46:08 PM --- Done: Hồ sơ Uber: Có gì trong 124.000 tài liệu vừa được tiết lộ? 
03/09/2024 04:46:08 PM --- Done: Cựu Thủ tướng Nhật Bản Abe Shinzo qua đời sau khi bị bắn
03/09/2024 04:46:09 PM --- Done: Tóm Lại Là: Nghệ sĩ Việt bị cáo buộc hiếp dâm ở Tây Ban Nha
03/09/2024 04:46:09 PM --- Done: AI vẽ tranh Midjourney: Liệu AI có thể thay thế nghệ sĩ?
03/09/2024 04:46:10 PM --- Done: 46 thi thể trong xe container tại Texas: Cái giá quá đắt cho ước mơ đổi đời
03/09/2024 04:46:10 PM --- Done: Pha quay xe thế kỷ thuộc về Mỹ khi bãi bỏ quyền phá thai
03/09/2024 04:46:11 PM --- Done: Netflix hết “chill”, hàng loạt công ty cắt giảm nhân sự
03/09/2024 04:46:11 PM --- Done: Tarot with YouTube: Dành cho Gen Z chơi hệ tâm linh
03/09/2024 04:46:11 PM --- Done page: 19/10000
03/09/2024 04:46:11 PM --- Number of posts for page 19: 12
03/09/2024 04:46:11 PM --- Number of posts added on 2024-09-03: 228
03/09/2024 04:46:13 PM --- Done: Metaverse đang tạo điều kiện cho quấy rối tình dục?
03/09/2024 04:46:13 PM --- Done: Giảm điểm ưu tiên khi vào Đại học liệu có tìm được người tài?
03/09/2024 04:46:14 PM --- Done: Ai vào vai búp bê Barbie (và rồi sao nữa?)
03/09/2024 04:46:14 PM --- Done: Nháy mắt là quấy rối tình dục?
03/09/2024 04:46:15 PM --- Done: Johnny Depp thắng Amber Heard nói gì về bạo lực gia đình?
03/09/2024 04:46:15 PM --- Done: 20 Chú mèo bị "đánh bả": Giết chóc chưa bao giờ nên là giải pháp
03/09/2024 04:46:16 PM --- Done: Livestream có ngăn chặn được bạo lực học đường? 
03/09/2024 04:46:16 PM --- Done: Xả súng tại Mỹ: tiếp tục chia buồn tới bao giờ?
03/09/2024 04:46:17 PM --- Done: Đề văn lớp 8 về xâm hại tình dục trẻ em: Hay nhưng đã đủ để học sinh “cởi mở”?
03/09/2024 04:46:17 PM --- Done: Phòng chat thứ N - Ai cũng có thể là thủ phạm bóc lột tình dục?
03/09/2024 04:46:18 PM --- Done: "Phao cứu người, không lấy."
03/09/2024 04:46:19 PM --- Done: My Liberation Notes - Xã hội có đang thiên vị người hướng ngoại?
03/09/2024 04:46:19 PM --- Done page: 20/10000
03/09/2024 04:46:19 PM --- Number of posts for page 20: 12
03/09/2024 04:46:19 PM --- Number of posts added on 2024-09-03: 240
03/09/2024 04:46:19 PM --- Done: Vì sao các đại gia hàng hiệu lần lượt mở đường cho crypto?
03/09/2024 04:46:20 PM --- Done: Apple, Google và Microsoft “bắt tay" vì một tương lai đăng nhập không mật khẩu
03/09/2024 04:46:21 PM --- Done: Con người có cần chịu trách nhiệm trước hiện tượng loạn nhiệt gần đây?
03/09/2024 04:46:21 PM --- Done: Quyền phá thai có thể bị huỷ bỏ tại Mỹ, đâu là những điều cần quan tâm?
03/09/2024 04:46:22 PM --- Done: Hàn Quốc không còn bắt buộc đeo khẩu trang ngoài trời!
03/09/2024 04:46:22 PM --- Done: Cú nhảy xuống của Sơn Tùng-MTP
03/09/2024 04:46:23 PM --- Done: Heartstopper - Chuyện tình gà bông nói gì về văn hóa boy's love?
03/09/2024 04:46:23 PM --- Done: Khi giấc ngủ trở thành sản phẩm đắt đỏ
03/09/2024 04:46:24 PM --- Done: Khi toà án Tối cao Hàn Quốc lên tiếng bảo vệ quyền lợi binh sĩ đồng tính
03/09/2024 04:46:25 PM --- Done: Xu hướng "e-sport hóa" thể thao: Cờ vua trên máy tính
03/09/2024 04:46:25 PM --- Done: Netflix: Đang "chill" thì có quảng cáo
03/09/2024 04:46:25 PM --- Done: Trước sự phổ biến của TikTok, Instagram Reels “tung ra" chiến thuật mới
03/09/2024 04:46:25 PM --- Done page: 21/10000
03/09/2024 04:46:25 PM --- Number of posts for page 21: 12
03/09/2024 04:46:25 PM --- Number of posts added on 2024-09-03: 252
03/09/2024 04:46:26 PM --- Done: Umbrella Academy thay đổi giới tính nhân vật theo diễn viên chuyển giới
03/09/2024 04:46:27 PM --- Done: Thống kê về dịch bệnh: Những bức tranh mâu thuẫn
03/09/2024 04:46:27 PM --- Done: Con người có đang đóng vai Chúa trời khi lựa chọn giới tính thai nhi?
03/09/2024 04:46:28 PM --- Done: Ép con học quá nhiều, phụ huynh đang gây bạo lực gia đình?
03/09/2024 04:46:28 PM --- Done:  Làm tại văn phòng, chỉ một-hai ngày là đủ!
03/09/2024 04:46:29 PM --- Done: Ngồi ở cấp 3 mà vẫn tích lũy trước học phần Đại học
03/09/2024 04:46:29 PM --- Done: Covid thắng chúng ta nhưng thua giới siêu giàu
03/09/2024 04:46:30 PM --- Done: Tìm thấy vi nhựa trong phổi người: Có quá muộn để quan tâm tới môi trường? 
03/09/2024 04:46:30 PM --- Done: Thuê nhạc, thuê phim đã là chuyện cũ - Apple sẽ cho thuê điện thoại?
03/09/2024 04:46:31 PM --- Done: Chúng ta có thể mong đợi gì khi tỷ phú nắm giữ truyền thông?
03/09/2024 04:46:31 PM --- Done: Morbius: Một bộ phim bị ma cà rồng hút hết sự thú vị
03/09/2024 04:46:32 PM --- Done: Grammy đã bớt... trắng? Nhưng chúng ta kỳ vọng thêm điều gì?
03/09/2024 04:46:32 PM --- Done page: 22/10000
03/09/2024 04:46:32 PM --- Number of posts for page 22: 12
03/09/2024 04:46:32 PM --- Number of posts added on 2024-09-03: 264
03/09/2024 04:46:33 PM --- Done: Louis C.K. nhận Grammy: Chúng ta có nên bỏ qua cho kẻ quấy rối tình dục?
03/09/2024 04:46:33 PM --- Done: "Cú tát quý ông" của Will Smith trên sóng Oscar
03/09/2024 04:46:34 PM --- Done: Pachinko: Nhập cư và nỗi đau của người châu Á
03/09/2024 04:46:35 PM --- Done: Con người sắp trở lại Mặt Trăng?
03/09/2024 04:46:35 PM --- Done: Kotaro Lives Alone: “Cháu không biết việc mình được sinh ra là một điều tốt”
03/09/2024 04:46:36 PM --- Done: Netflix tính phụ phí, tài khoản "ký sinh trùng" lao đao 
03/09/2024 04:46:36 PM --- Done: "Don't Say Gay": Disney im lặng trước dự luật đe dọa cộng đồng LGBTQIA+
03/09/2024 04:46:37 PM --- Done: Ms. Marvel - Chúng ta cần thêm nhiều phim nữ siêu hùng?
03/09/2024 04:46:38 PM --- Done: Better Call Saul: Hồi kết của tên luật sư trong Breaking Bad
03/09/2024 04:46:38 PM --- Done: Twenty Five, Twenty One: Xem phim thanh xuân, nghĩ về văn hóa
03/09/2024 04:46:39 PM --- Done: Nữ sinh tố bị quấy rối ở xe buýt, xã hội cần đáp lời thế nào?
03/09/2024 04:46:39 PM --- Done: Muôn vàn lo lắng vì xăng tăng giá
03/09/2024 04:46:39 PM --- Done page: 23/10000
03/09/2024 04:46:39 PM --- Number of posts for page 23: 12
03/09/2024 04:46:39 PM --- Number of posts added on 2024-09-03: 276
03/09/2024 04:46:40 PM --- Done: Làm gì khi Việt Nam sắp "dư thừa" 1,5 triệu nam giới?
03/09/2024 04:46:40 PM --- Done: Sao Nhập Ngũ: Không drama nhưng “mãi mận” 
03/09/2024 04:46:41 PM --- Done: TikTok bị điều tra, người dùng có hả dạ? 
03/09/2024 04:46:41 PM --- Done: Dự luật tiền mã hóa của châu Âu không còn làm khó Bitcoin
03/09/2024 04:46:42 PM --- Done: Hàn Quốc chi 187 triệu USD xây dựng hệ sinh thái metaverse quốc gia
03/09/2024 04:46:42 PM --- Done: The Batman 2022 - Người Dơi chơi trò giải đố 
03/09/2024 04:46:43 PM --- Done: Juvenile Justice: Cái nhìn cương quyết về tội phạm vị thành niên 
03/09/2024 04:46:43 PM --- Done: Oscar bỗng dưng chiều lòng khán giả đại chúng
03/09/2024 04:46:44 PM --- Done:   Các bác sĩ giả như Nguyễn Quốc Khiêm làm gì để qua mắt mọi người?
03/09/2024 04:46:44 PM --- Done: Mạng xã hội mới của Trump liệu có làm nên chuyện?
03/09/2024 04:46:45 PM --- Done: Giảm thiểu nỗi lo thuốc giả với thuốc trị COVID của Việt Nam 
03/09/2024 04:46:46 PM --- Done: Bạo lực và bóc lột - Mặt trái của những thực tập sinh Việt tại Nhật
03/09/2024 04:46:46 PM --- Done page: 24/10000
03/09/2024 04:46:46 PM --- Number of posts for page 24: 12
03/09/2024 04:46:46 PM --- Number of posts added on 2024-09-03: 288
03/09/2024 04:46:47 PM --- Done: Stranger Things 4: Lạ mấy cũng sắp hạ màn
03/09/2024 04:46:47 PM --- Done: Đã có người phụ nữ đầu tiên trên thế giới được chữa khỏi HIV 
03/09/2024 04:46:48 PM --- Done: Chính phủ Anh tiên phong cấm vá màng trinh
03/09/2024 04:46:48 PM --- Done: Trailer mới của Doctor Strange 2: Hỗn loạn như chính tên phim
03/09/2024 04:46:49 PM --- Done: The Tinder Swindler - "Soái ca lừa đảo" trên Tinder dạy ta điều gì về lòng tin?
03/09/2024 04:46:49 PM --- Done: Vẽ mắt lên vô diện, tranh triệu đô bị phá hoại 
03/09/2024 04:46:50 PM --- Done: Tấm vé World Cup của tuyển nữ Việt Nam nói gì về định kiến giới?
03/09/2024 04:46:51 PM --- Done: Vụ cô gái Việt vứt xác con tại Nhật nói gì về quyền phá thai?
03/09/2024 04:46:51 PM --- Done: VinFuture: Ai sẽ là người chiến thắng?
03/09/2024 04:46:52 PM --- Done: Bé gái 3 tuổi bị găm đinh vào đầu: Khi bạo lực là bất lực
03/09/2024 04:46:52 PM --- Done: Marvel ra mắt trailer Moon Knight vào ngày trăng rằm
03/09/2024 04:46:53 PM --- Done: Sau núi lửa phun là sóng thần, còn lại gì cho Tonga?
03/09/2024 04:46:53 PM --- Done page: 25/10000
03/09/2024 04:46:53 PM --- Number of posts for page 25: 12
03/09/2024 04:46:53 PM --- Number of posts added on 2024-09-03: 300
03/09/2024 04:46:54 PM --- Done: Đàn hổ hờn dỗi: Đến "cha đẻ" linh vật cũng bất ngờ
03/09/2024 04:46:54 PM --- Done: Lo mất Tết khi lương chưa có, thưởng thì không thấy đâu
03/09/2024 04:46:55 PM --- Done: Deltacron: Chủng lai giữa Delta và Omicron có đáng lo ngại?
03/09/2024 04:46:56 PM --- Done: Single’s Inferno - Địa ngục độc thân hay một tiếng nói mới về tính nữ?
03/09/2024 04:46:56 PM --- Done: Tịnh thất Bồng Lai: Mặt trái của kinh tế tâm linh
03/09/2024 04:46:57 PM --- Done: Làm sao để trở thành một thực tập sinh Kpop?
03/09/2024 04:46:57 PM --- Done: Giữa biển phim, vì sao The Silent Sea hot?
03/09/2024 04:46:58 PM --- Done: Ngoài kia vẫn còn rất nhiều em như Vân An
03/09/2024 04:46:58 PM --- Done: Chưa thể chắc chắn về sai phạm của các nghệ sĩ trong hoạt động từ thiện
03/09/2024 04:46:59 PM --- Done: Đừng Nhìn Lên mà hãy nhìn lại sự thờ ơ của thế giới
03/09/2024 04:46:59 PM --- Done: Anh em Quốc Cơ và Quốc Nghiệp xác lập kỷ lục Guinness mới 
03/09/2024 04:47:00 PM --- Done: Không phải thi SAT/ACT vẫn có thể vào được Harvard
03/09/2024 04:47:00 PM --- Done page: 26/10000
03/09/2024 04:47:00 PM --- Number of posts for page 26: 12
03/09/2024 04:47:00 PM --- Number of posts added on 2024-09-03: 312
03/09/2024 04:47:01 PM --- Done: Livestream bán đồ vẫn phải đóng thuế đủ
03/09/2024 04:47:02 PM --- Done: Mùa hè năm ấy có lẽ không phải lần cuối bên nhau
03/09/2024 04:47:02 PM --- Done: Bỉ mở phiên toà xét xử vụ 39 người Việt chết trong xe tải tại Anh
03/09/2024 04:47:03 PM --- Done: 500 Nữ vận động viên bị quấy rối tình dục được bồi thường 380 triệu USD
03/09/2024 04:47:03 PM --- Done: ‘Maika’ dự Sundance - Điện ảnh Việt có thêm “ngôi sao hy vọng”?
03/09/2024 04:47:04 PM --- Done: Hậu đại dịch, khoe nghỉ việc trở thành xu hướng
03/09/2024 04:47:04 PM --- Done: Quốc ca bị tắt tiếng trên YouTube, chuyện không chỉ ở bản ghi
03/09/2024 04:47:05 PM --- Done: Nữ sinh ở Thanh Hóa sai nhưng không đáng bị nhục mạ công khai
03/09/2024 04:47:06 PM --- Done: Hàng loạt thủy điện xả lũ, người dân chạy xuyên đêm
03/09/2024 04:47:07 PM --- Done: Hàn Quốc muốn cấm thịt chó, Việt Nam thì sao?
03/09/2024 04:47:07 PM --- Done: Có gì ở “vòng đối đầu” vụ Rap Việt vi phạm bản quyền?
03/09/2024 04:47:08 PM --- Done: Trung Quốc cấm người nổi tiếng khoe giàu sang
03/09/2024 04:47:08 PM --- Done page: 27/10000
03/09/2024 04:47:08 PM --- Number of posts for page 27: 12
03/09/2024 04:47:08 PM --- Number of posts added on 2024-09-03: 324
03/09/2024 04:47:09 PM --- Done: Tiền trong tài khoản tự nhiên bốc hơi, bạn nên làm gì?
03/09/2024 04:47:09 PM --- Done: Chính phủ Anh chốt hạ: Bạch tuộc cũng có tri giác và cần được bảo vệ 
03/09/2024 04:47:10 PM --- Done: Câu hỏi 64 tỷ USD: Ai là cha đẻ Bitcoin?
03/09/2024 04:47:10 PM --- Done: Bác sĩ sao phải đi bán rau trong khi máy móc tiền tỷ xếp xó?
03/09/2024 04:47:11 PM --- Done: ByteDance bỏ chế độ 996: Tôn thờ công việc đến đâu là đủ?
03/09/2024 04:47:11 PM --- Done: Bi kịch tại buổi hòa nhạc của Travis Scott: Lỗi tại ai?
03/09/2024 04:47:12 PM --- Done: Giải mã tam giác CEO Vietjet, Linacre College và COP 26
03/09/2024 04:47:12 PM --- Done: Đám cưới của công chúa Nhật Bản nói gì về áp lực của phụ nữ hoàng gia?
03/09/2024 04:47:13 PM --- Done: Facebook đổi tên, liệu có đổi vận?
03/09/2024 04:47:13 PM --- Done: Những lí do vì sao bạn nên xem Maid ngay khi có thể
03/09/2024 04:47:14 PM --- Done: Có nhất thiết phải tiêu hủy đàn chó mèo không?
03/09/2024 04:47:15 PM --- Done: Phim Trung Quốc lại xuyên tạc lịch sử
03/09/2024 04:47:15 PM --- Done page: 28/10000
03/09/2024 04:47:15 PM --- Number of posts for page 28: 12
03/09/2024 04:47:15 PM --- Number of posts added on 2024-09-03: 336
03/09/2024 04:47:16 PM --- Done: Facebook gặp biến to trước khi "sập nguồn" tối 04/10
03/09/2024 04:47:16 PM --- Done: Hồ sơ Pandora hé lộ bí mật gì về giới tinh hoa?
03/09/2024 04:47:17 PM --- Done: Gia đình bé Nhật Linh nói gì về 14 tỉ tiền bồi thường?
03/09/2024 04:47:18 PM --- Done: Tại sao tập đoàn bất động sản Evergrande ôm nợ?
03/09/2024 04:47:18 PM --- Done: Khải Hoàn Môn bị bọc kín - Một tác phẩm "đẹp đẽ và vô dụng"?
03/09/2024 04:47:19 PM --- Done: Thẻ xanh - Tấm vé để sống chung với đại dịch?
03/09/2024 04:47:19 PM --- Done: Hometown Cha-Cha-Cha - Bỏ phố về quê có đơn giản?
03/09/2024 04:47:20 PM --- Done: Sự việc Huỳnh Lập - Hồng Tú nói gì về văn hóa chụp màn hình?
03/09/2024 04:47:20 PM --- Done: Triệu Vy ngã ngựa vì một nền "thịnh vượng chung"?
03/09/2024 04:47:21 PM --- Done: Phim D.P - Chuyện quân đội Hàn có gì hấp dẫn khán giả Việt?
03/09/2024 04:47:21 PM --- Done: Vì sao OnlyFans cấm 18+ nhưng rồi lại không cấm?
03/09/2024 04:47:22 PM --- Done: Bao giờ đạt được miễn dịch cộng đồng?
03/09/2024 04:47:22 PM --- Done page: 29/10000
03/09/2024 04:47:22 PM --- Number of posts for page 29: 12
03/09/2024 04:47:22 PM --- Number of posts added on 2024-09-03: 348
03/09/2024 04:47:23 PM --- Done: Tương lai nào cho Afghanistan khi Taliban tiếp quản?
03/09/2024 04:47:23 PM --- Done: Họa sĩ Việt bán tranh NFT được nửa tỷ đồng!
03/09/2024 04:47:24 PM --- Done: Messi rời Barcelona - Đầu tiên là tiền đâu?
03/09/2024 04:47:24 PM --- Done: Án mạng nam sinh Việt tại Osaka - Từ góc nhìn tâm lý và xã hội
03/09/2024 04:47:25 PM --- Done: Ngô Diệc Phàm và quyền lực thần tượng độc hại 
03/09/2024 04:47:26 PM --- Done: Hậu đại dịch, các công ty công nghệ có còn thắng đậm?
03/09/2024 04:47:26 PM --- Done: Phim Kingdom: Ashin of the North - Hay nhưng chưa đủ?
03/09/2024 04:47:27 PM --- Done: Lũ lụt châu Âu nói gì về biến đổi khí hậu?
03/09/2024 04:47:27 PM --- Done: Branson bay vào vũ trụ - Viễn cảnh nào cho du lịch không gian?
03/09/2024 04:47:28 PM --- Done: Quyên góp tiếng ho, đẩy lùi COVID
03/09/2024 04:47:28 PM --- Done: Tóm Lại Là: Ngày mai không "đóng cửa toàn thành phố"!
03/09/2024 04:47:29 PM --- Done: Sex/Life có gì mà top 1 Netflix?
03/09/2024 04:47:29 PM --- Done page: 30/10000
03/09/2024 04:47:29 PM --- Number of posts for page 30: 12
03/09/2024 04:47:29 PM --- Number of posts added on 2024-09-03: 360
03/09/2024 04:47:30 PM --- Done: Vì sao "Uber Trung Quốc" - Didi bay màu?
03/09/2024 04:47:30 PM --- Done: Facebook kiện 4 người Việt - Chuyện gì vừa xảy ra?
03/09/2024 04:47:31 PM --- Done: Johnson & Johnson bồi thường 230 triệu đô và cuộc khủng hoảng opioid ở Mỹ
03/09/2024 04:47:31 PM --- Done: Tóm Lại Là: Hy vọng nào cho Britney?
03/09/2024 04:47:32 PM --- Done: Tóm Lại Là: Ronaldo thích uống nước lọc hơn!
03/09/2024 04:47:32 PM --- Done: Tóm Lại Là: Liệu Olympics có lại bị hoãn?
03/09/2024 04:47:33 PM --- Done: Tóm Lại Là: Bao giờ cả thế giới được tiêm vaccine?
03/09/2024 04:47:34 PM --- Done: Avatar hoạt hình nói gì về tính cách bạn?
03/09/2024 04:47:34 PM --- Done: Hospital Playlist tối nay có phần 2!
03/09/2024 04:47:35 PM --- Done: Loki đang “tấu hài” gì trên Disney+? 
03/09/2024 04:47:35 PM --- Done: Sweet Tooth — Viên kẹo ngọt thời COVID
03/09/2024 04:47:36 PM --- Done: Bitcoin có thể trở thành đơn vị tiền tệ hợp pháp?
03/09/2024 04:47:36 PM --- Done page: 31/10000
03/09/2024 04:47:36 PM --- Number of posts for page 31: 12
03/09/2024 04:47:36 PM --- Number of posts added on 2024-09-03: 372
03/09/2024 04:47:37 PM --- Done: Tóm Lại Là: Tại sao Naomi Osaka bỏ giải?
03/09/2024 04:47:37 PM --- Done: Tóm Lại Là: Rạp phim Việt kêu cứu
03/09/2024 04:47:38 PM --- Done: Phim Mine có gì mà đứng top 1 Netflix Việt Nam?
03/09/2024 04:47:38 PM --- Done: Báo chí điện tử thay đổi như thế nào sau nghị định mới?
03/09/2024 04:47:39 PM --- Done: Xung đột Israel - Palestine xoay quanh những gì?
03/09/2024 04:47:40 PM --- Done: Tóm Lại Là: Ai “sập bẫy" tiền ảo đa cấp?
03/09/2024 04:47:40 PM --- Done: Tóm Lại Là: Tom Cruise trả lại 3 Quả cầu vàng
03/09/2024 04:47:41 PM --- Done: Vingroup dừng sản xuất điện thoại Vsmart!
03/09/2024 04:47:41 PM --- Done: Bill và Melinda Gates — Vậy là lần cuối đi bên nhau?
03/09/2024 04:47:42 PM --- Done: Từ câu chuyện của Quỳnh Trần JP — Ai được ăn chân gấu? 
03/09/2024 04:47:42 PM --- Done: Covid-19 và có hay không khởi đầu mới?
03/09/2024 04:47:43 PM --- Done: Tóm Lại Là: Sau "bão" chấm Now 1 sao là gì?
03/09/2024 04:47:43 PM --- Done page: 32/10000
03/09/2024 04:47:43 PM --- Number of posts for page 32: 12
03/09/2024 04:47:43 PM --- Number of posts added on 2024-09-03: 384
03/09/2024 04:47:44 PM --- Done: Nói ngọng thì không thể làm giáo viên?
03/09/2024 04:47:44 PM --- Done: Tại sao Nhật Bản muốn xả nước thải từ Fukushima vào đại dương?
03/09/2024 04:47:45 PM --- Done: Tóm Lại Là: Xe đạp công cộng - nên hay không?
03/09/2024 04:47:45 PM --- Done: Tưởng chai Innisfree giấy, ai ngờ nhựa!
03/09/2024 04:47:46 PM --- Done: Lối đi nào cho tương lai phủ sóng Internet vệ tinh tại Việt Nam?
03/09/2024 04:47:46 PM --- Done: Tóm Lại Là: "Trải nghiệm bị xâm hại tình dục tập thể"
03/09/2024 04:47:47 PM --- Done: Báo trả phí vì sao lại khó thành hiện thực?
03/09/2024 04:47:47 PM --- Done: Tại sao giày Satan có máu người của Lil Nas bị kiện?
03/09/2024 04:47:48 PM --- Done: Tại sao vụ kẹt tàu Ever Given lại ảnh hưởng đến thế giới?
03/09/2024 04:47:49 PM --- Done: Tóm Lại Là: Tại sao Forbes bảo ta bỏ Google? 
03/09/2024 04:47:49 PM --- Done: Hộ chiếu vaccine COVID-19 bắt đầu thời kỳ bình thường mới?
03/09/2024 04:47:50 PM --- Done: Người đồng tính thì không được "ban phước"?
03/09/2024 04:47:50 PM --- Done page: 33/10000
03/09/2024 04:47:50 PM --- Number of posts for page 33: 12
03/09/2024 04:47:50 PM --- Number of posts added on 2024-09-03: 396
03/09/2024 04:47:51 PM --- Done: Tóm Lại Là: "Hú vía" trẻ không dùng điện thoại một mình
03/09/2024 04:47:51 PM --- Done: Chuyện cổ tích từ đầu đã không tồn tại ở hoàng gia Anh
03/09/2024 04:47:52 PM --- Done: Tóm Lại Là: 8/3 nói chuyện vai trò đàn bà và đàn ông
03/09/2024 04:47:52 PM --- Done: Tóm Lại Là: Rich kid có phải thế hệ phô trương?
03/09/2024 04:47:53 PM --- Done: Tại sao chiến dịch Free Britney trở lại?
03/09/2024 04:47:53 PM --- Done: Coca Cola và câu chuyện về “da trắng thượng đẳng”
03/09/2024 04:47:54 PM --- Done: Tóm Lại Là: Người châu Á bị thù ghét vì COVID-19?
03/09/2024 04:47:54 PM --- Done: Tại sao Elon Musk mua Bitcoin cũng thành hiện tượng?
03/09/2024 04:47:55 PM --- Done: Tóm Lại Là: Cốc cốc Bar Stories ơi!
03/09/2024 04:47:55 PM --- Done: Tóm Lại Là: Vai trò truyền thông trong trận đấu Bình Gold và ViruSs
03/09/2024 04:47:56 PM --- Done: Tỷ phú không thiếu, kỳ lân công nghệ mới chỉ hai?
03/09/2024 04:47:56 PM --- Done: The Winx Saga - Chuyển thể có cần tươi sáng như bản gốc?
03/09/2024 04:47:56 PM --- Done page: 34/10000
03/09/2024 04:47:56 PM --- Number of posts for page 34: 12
03/09/2024 04:47:56 PM --- Number of posts added on 2024-09-03: 408
03/09/2024 04:47:57 PM --- Done: Tóm Lại Là: Quan toà phù thuỷ trên mạng xã hội
03/09/2024 04:47:58 PM --- Done: Tại sao không cho rapper quảng cáo?
03/09/2024 04:47:58 PM --- Done: Elisa Lam và tương lai của phim tài liệu Netflix
03/09/2024 04:47:59 PM --- Done: Deepfake Blackpink, tưởng thật nhưng giả!
03/09/2024 04:47:59 PM --- Done: Khi sự riêng tư là một món hàng
03/09/2024 04:48:00 PM --- Done: Lupin có gì mà vào top 10 Netflix Việt Nam nhanh thế?
03/09/2024 04:48:00 PM --- Done: Tóm Lại Là: Khi động vật làm diễn viên
03/09/2024 04:48:01 PM --- Done: Tóm Lại Là: Đừng xin link hình chụp lén nữa!
03/09/2024 04:48:01 PM --- Done: Tóm Lại Là: Đạo hay không đạo?
03/09/2024 04:48:02 PM --- Done: Tóm Lại Là: "Thần tượng" hay là "ca sĩ"?
03/09/2024 04:48:02 PM --- Done: Tóm Lại Là: Có hay không ngày sinh may mắn và đen đủi nhất?
03/09/2024 04:48:03 PM --- Done: Tóm Lại Là: "Sự thật nó vậy rồi đành chấp nhận thôi chứ biết sao giờ!"
03/09/2024 04:48:03 PM --- Done page: 35/10000
03/09/2024 04:48:03 PM --- Number of posts for page 35: 12
03/09/2024 04:48:03 PM --- Number of posts added on 2024-09-03: 420
03/09/2024 04:48:04 PM --- Done: Tóm Lại Là: Đứa con tinh thần cũng cần được khai sinh
03/09/2024 04:48:04 PM --- Done: Concert ảo sẽ “thế chỗ” trải nghiệm thật?
03/09/2024 04:48:05 PM --- Done: Tóm Lại Là: An Nguy có bầu, cơ hội nào cho những gia đình hai mẹ ở Việt Nam?
03/09/2024 04:48:05 PM --- Done: Tóm Lại Là: Kiki là trợ lý giọng nói đầu tiên của người Việt!
03/09/2024 04:48:06 PM --- Done: Tóm Lại Là: Phẫu thuật “vùng kín” hay “sự tự tin”? 
03/09/2024 04:48:06 PM --- Done: Phim Sweet Home - Ai mới thực sự là quái vật?
03/09/2024 04:48:07 PM --- Done: Tóm Lại Là: Phim lậu đội lốt “review phim”
03/09/2024 04:48:07 PM --- Done: Sơn Tùng M-TP và những "đỉnh núi"
03/09/2024 04:48:08 PM --- Done: Kết thúc năm COVID thứ nhất, thể loại phim sinh tồn lên ngôi
03/09/2024 04:48:08 PM --- Done: Tóm Lại Là: Sập nguồn, đừng sập giờ thiêng
03/09/2024 04:48:09 PM --- Done: Hiệu ứng tâm lý nào ẩn sau Spotify Wrapped?
03/09/2024 04:48:09 PM --- Done: The Call không chỉ là một phim hot trên Netflix!
03/09/2024 04:48:09 PM --- Done page: 36/10000
03/09/2024 04:48:09 PM --- Number of posts for page 36: 12
03/09/2024 04:48:09 PM --- Number of posts added on 2024-09-03: 432
03/09/2024 04:48:11 PM --- Done: Tóm Lại Là: Grammy ồn ào, vì sao thế?
03/09/2024 04:48:11 PM --- Done: Tóm Lại Là: Việt Nam sắp phải nhập khẩu cô dâu?
03/09/2024 04:48:12 PM --- Done: Tóm Lại Là: Tại sao chúng ta vẫn cần thêm hoa hậu?
03/09/2024 04:48:12 PM --- Done: Đám cưới các sao, sao ta quan tâm đến thế?
03/09/2024 04:48:13 PM --- Done: Tóm Lại Là: Quyền nữ, sao cứ phải "đòi"?
03/09/2024 04:48:13 PM --- Done: Tóm Lại Là: Vắc xin COVID-19 đã có, nhưng hãy khoan vui!
03/09/2024 04:48:14 PM --- Done: Tóm Lại Là: Áo dài cho nam, không chỉ là chuyện áo dài!
03/09/2024 04:48:14 PM --- Done: Vì sao chúng ta mê mẩn The Queen's Gambit?
03/09/2024 04:48:15 PM --- Done: Hương Giang và Nữ hoàng đạo lý, ai thắng ai thua?
03/09/2024 04:48:16 PM --- Done: Đỗ Nhật Nam đã lớn, nhưng chúng ta vẫn không lớn?
03/09/2024 04:48:16 PM --- Done: Tóm Lại Là: Thủy Tiên và từ-thiện-đúng-luật
03/09/2024 04:48:17 PM --- Done: Tóm Lại Là: Ai xứng đáng được đặc cách vào Đại học?
03/09/2024 04:48:17 PM --- Done page: 37/10000
03/09/2024 04:48:17 PM --- Number of posts for page 37: 12
03/09/2024 04:48:17 PM --- Number of posts added on 2024-09-03: 444
03/09/2024 04:48:18 PM --- Done: Tóm Lại Là: Facebook có thật sự chỉ muốn challenge bạn không?
03/09/2024 04:48:18 PM --- Done: Tóm Lại Là: Vì sao bạn nên xem Enola Holmes?
03/09/2024 04:48:19 PM --- Done: Among Us có gì mà ai cũng chơi thế?
03/09/2024 04:48:19 PM --- Done: Tóm Lại Là: Vì sao gà nguyên lông không nên nấu cháo?
03/09/2024 04:48:20 PM --- Done: Điều gì thực sự tạo nên điểm 10 môn Ngữ Văn?
03/09/2024 04:48:20 PM --- Done: Học được gì từ chuyện bị bắt nạt của Giang Ơi?
03/09/2024 04:48:21 PM --- Done: Kiên bỏ SoundCloud, chúng ta có đang dễ tính với nhạc lậu?
03/09/2024 04:48:22 PM --- Done: Giữa đại dịch, hơn 1 triệu du học sinh Mỹ đối mặt với nguy cơ bị trục xuất
03/09/2024 04:48:22 PM --- Done: Tóm Lại Là: Hàng trăm chú voi đột tử — Đòn giáng xuống nỗ lực bảo tồn voi tại châu Phi
03/09/2024 04:48:23 PM --- Done: Tóm Lại Là: Hate speech là gì mà khiến 56 tỷ đô "bốc hơi" trong một nốt nhạc?
03/09/2024 04:48:23 PM --- Done: Trào lưu FaceApp quay trở lại, liệu còn nguy hiểm?
03/09/2024 04:48:24 PM --- Done: Tóm Lại Là: Người Việt ở nước ngoài có cần đổi tên Tây?
03/09/2024 04:48:24 PM --- Done page: 38/10000
03/09/2024 04:48:24 PM --- Number of posts for page 38: 12
03/09/2024 04:48:24 PM --- Number of posts added on 2024-09-03: 456
03/09/2024 04:48:25 PM --- Done: Tóm Lại Là: Làm sao để nói về người chuyển giới một cách tôn trọng?
03/09/2024 04:48:25 PM --- Done: Thu phí rác theo cân — Nhật, Hàn đã làm, sắp đến Việt Nam?
03/09/2024 04:48:26 PM --- Done: Tóm Lại Là: Chuyến bay quốc tế mở lại? Có nên đi?
03/09/2024 04:48:26 PM --- Done: Tóm Lại Là: Tragedy of the commons là gì? Vì sao không nên ăn cá vẹt?
03/09/2024 04:48:27 PM --- Done: Tóm Lại Là: Voi chết vì ăn pháo nổ - Tàn ác hay tai nạn?
03/09/2024 04:48:27 PM --- Done: Vì sao fan Kpop kéo nhau đánh sập hashtag #WhiteLivesMatter?
03/09/2024 04:48:28 PM --- Done: George Floyd - Giọt nước mắt tràn ly của người Mỹ da đen
03/09/2024 04:48:28 PM --- Done: Du lịch vũ trụ sắp trở thành hiện thực?
03/09/2024 04:48:29 PM --- Done: Tóm Lại Là: Máy bay có còn là phương tiện an toàn nhất?
03/09/2024 04:48:29 PM --- Done: Tóm Lại Là: Những điều ta không biết về 100.000 ca tử vong ở Mỹ
03/09/2024 04:48:30 PM --- Done: “NASA tìm thấy bằng chứng về vũ trụ song song”
03/09/2024 04:48:30 PM --- Done: Tóm Lại Là: Extraction đã phá đảo Netflix Việt Nam như nào?
03/09/2024 04:48:30 PM --- Done page: 39/10000
03/09/2024 04:48:30 PM --- Number of posts for page 39: 12
03/09/2024 04:48:30 PM --- Number of posts added on 2024-09-03: 468
03/09/2024 04:48:31 PM --- Done: Tóm Lại Là: Bi hài lễ tốt nghiệp online
03/09/2024 04:48:32 PM --- Done: Tóm Lại Là: Extracurricular - Phim giả, tệ nạn thật
03/09/2024 04:48:32 PM --- Done: Tóm Lại Là: Làm gì để tránh một IELTS Tuấn Quỳnh thứ hai?
03/09/2024 04:48:33 PM --- Done: Hospital Playlist = Reply 1988 + Good Doctor?
03/09/2024 04:48:34 PM --- Done: Tóm Lại Là: Chính phủ "giục đẻ", người trẻ giật mình
03/09/2024 04:48:34 PM --- Done: Tóm Lại Là: Mùng 104 Tết, hàng triệu học sinh đi học lại
03/09/2024 04:48:35 PM --- Done: Tóm lại là: Thế giới Hôn nhân xấu xí đến mức nào?
03/09/2024 04:48:36 PM --- Done: Tóm Lại Là: Bao giờ Sài Gòn được đi metro nè?
03/09/2024 04:48:36 PM --- Done: Tóm Lại Là: 22/04 Rồi! Còn phải cách ly xã hội nữa không?
03/09/2024 04:48:37 PM --- Done: Tóm Lại Là: The King vừa ra đã dẫn đầu Netflix Việt Nam
03/09/2024 04:48:37 PM --- Done: Tóm Lại Là: 100.000 chữ A, tin hay không tin?
03/09/2024 04:48:37 PM --- Done: Vì sao đã 5 năm mà Reply 1988 vẫn được xem nhiều nhất Việt Nam?
03/09/2024 04:48:37 PM --- Done page: 40/10000
03/09/2024 04:48:37 PM --- Number of posts for page 40: 12
03/09/2024 04:48:37 PM --- Number of posts added on 2024-09-03: 480
03/09/2024 04:48:38 PM --- Done: Tóm Lại Là: Vì sao 1 triệu người Việt tham gia "ghét bếp"?
03/09/2024 04:48:39 PM --- Done: Tóm Lại Là: COVID-19 đã thay đổi văn hóa Tinder như nào?
03/09/2024 04:48:40 PM --- Done: Money Heist trở thành phim được người Việt xem nhiều nhất trên Netflix
03/09/2024 04:48:40 PM --- Done: Tóm Lại Là: Zoom không an toàn như bạn tưởng
03/09/2024 04:48:41 PM --- Done: Tóm Lại Là: Khủng hoảng lương thực toàn cầu sắp nổ ra
03/09/2024 04:48:41 PM --- Done: Tóm Lại Là: Ngày đầu cách ly toàn quốc qua lời nhạc Trịnh
03/09/2024 04:48:42 PM --- Done: Tóm Lại Là: Cách ly xã hội toàn quốc là đến mức nào?
03/09/2024 04:48:42 PM --- Done: Animal Crossing có gì mà ai cũng chơi vậy?
03/09/2024 04:48:43 PM --- Done: Tóm Lại Là: The Platform liên quan gì đến COVID-19?
03/09/2024 04:48:44 PM --- Done: Tóm Lại Là: Olympics vẫn diễn ra, chỉ là không phải 2020!
03/09/2024 04:48:44 PM --- Done: Tóm Lại Là: Vì sao bánh mì lên trang chủ của Google?
03/09/2024 04:48:45 PM --- Done: Tóm Lại Là: Vì sao bây giờ Google mới có chuyên trang COVID-19?
03/09/2024 04:48:45 PM --- Done page: 41/10000
03/09/2024 04:48:45 PM --- Number of posts for page 41: 12
03/09/2024 04:48:45 PM --- Number of posts added on 2024-09-03: 492
03/09/2024 04:48:45 PM --- Done: Vì sao Zoom bị hàng ngàn học sinh Việt cho 1 sao?
03/09/2024 04:48:46 PM --- Done: Social distancing là gì? Đã đến lúc công ty cho bạn ở nhà?
03/09/2024 04:48:47 PM --- Done: Ra đúng mùa dịch, Kingdom là phim Netflix nhiều view nhất Việt Nam
03/09/2024 04:48:47 PM --- Done: Tóm Lại Là: Nhiễm COVID-19, vợ chồng Tom Hanks phản ứng thế nào?
03/09/2024 04:48:48 PM --- Done: Pandemic, endemic, epidemic là gì? COVID-19 ở mức nào rồi?
03/09/2024 04:48:48 PM --- Done: Tóm Lại Là: Vì sao hạn mặn Cửu Long không viral như cháy rừng Úc?
03/09/2024 04:48:49 PM --- Done: Tóm Lại Là: Ứng dụng NCOVI chính thức ra mắt, cùng thực hiện khai báo y tế toàn dân
03/09/2024 04:48:49 PM --- Done: Tóm Lại Là: Nhật ký cách ly của Châu Bùi dạy ta điều gì?
03/09/2024 04:48:50 PM --- Done: Itaewon Class có gì mà ai cũng xem?
03/09/2024 04:48:50 PM --- Done: Tóm Lại Là: Mưa đá phủ trắng 7 tỉnh miền Bắc, tại sao?
03/09/2024 04:48:50 PM --- Done: Ở Việt Nam, tiếng Anh là "công cụ" gây war?
03/09/2024 04:48:51 PM --- Done: Tại sao giá vàng lúc lên lúc xuống?
03/09/2024 04:48:51 PM --- Done page: 42/10000
03/09/2024 04:48:51 PM --- Number of posts for page 42: 12
03/09/2024 04:48:51 PM --- Number of posts added on 2024-09-03: 504
03/09/2024 04:48:52 PM --- Done: Tóm Lại Là: Lễ tưởng niệm Kobe Bryant nhắc chúng ta trân trọng cuộc sống
03/09/2024 04:48:52 PM --- Done: Adorable Home có gì mà ai cũng chơi vậy?
03/09/2024 04:48:53 PM --- Done: Machine learning là gì? Bao giờ robot gây chiến với con người?
03/09/2024 04:48:53 PM --- Done: Tóm Lại Là: Vì sao 'Parasite' gây chấn động tại Oscar?
03/09/2024 04:48:54 PM --- Done: Brexit - Giải thích ngắn gọn dễ hiểu nhất Trái Đất
03/09/2024 04:48:54 PM --- Done: Tóm Lại Là: Virus corona là gì? Đi đến đâu rồi?
03/09/2024 04:48:55 PM --- Done: Tưởng không có Táo quân mà cuối cùng vẫn có à?
03/09/2024 04:48:56 PM --- Done: Tóm Lại Là: Gucci thay avatar sao người Việt hưởng ứng thế?
03/09/2024 04:48:56 PM --- Done: Tóm Lại Là: Tại sao rừng ở Úc cháy?
03/09/2024 04:48:56 PM --- Done page: 43/10000
03/09/2024 04:48:56 PM --- Number of posts for page 43: 9
03/09/2024 04:48:56 PM --- Number of posts added on 2024-09-03: 513
03/09/2024 12:24:33 PM --- Done page: 1/1
03/09/2024 12:24:33 PM --- Number of posts for page 1: 12
03/09/2024 12:24:33 PM --- Number of posts added on 2024-09-03: 0
03/09/2024 04:36:21 PM --- Done page: 1/1
03/09/2024 04:36:21 PM --- Number of posts for page 1: 12
03/09/2024 04:36:21 PM --- Number of posts added on 2024-09-03: 0
06/09/2024 04:37:55 PM --- Done page: 1/1
06/09/2024 04:37:55 PM --- Number of posts for page 1: 12
06/09/2024 04:37:55 PM --- Number of posts added on 2024-09-06: 0
07/09/2024 04:33:33 PM --- Done page: 1/1
07/09/2024 04:33:33 PM --- Number of posts for page 1: 12
07/09/2024 04:33:33 PM --- Number of posts added on 2024-09-07: 0
08/09/2024 04:34:08 PM --- Done page: 1/1
08/09/2024 04:34:08 PM --- Number of posts for page 1: 12
08/09/2024 04:34:08 PM --- Number of posts added on 2024-09-08: 0
09/09/2024 04:35:10 PM --- Done: 7 Năm sau bi kịch, Linkin Park tái hợp với giọng ca mới
09/09/2024 04:35:30 PM --- Done page: 1/1
09/09/2024 04:35:30 PM --- Number of posts for page 1: 12
09/09/2024 04:35:30 PM --- Number of posts added on 2024-09-09: 1
12/09/2024 04:37:10 PM --- Done page: 1/1
12/09/2024 04:37:10 PM --- Number of posts for page 1: 12
12/09/2024 04:37:10 PM --- Number of posts added on 2024-09-12: 0
13/09/2024 04:34:14 PM --- Done: Chiến dịch của KATINAT nói lên điều gì về mô hình marketing kết hợp từ thiện?
13/09/2024 04:34:32 PM --- Done page: 1/1
13/09/2024 04:34:32 PM --- Number of posts for page 1: 12
13/09/2024 04:34:32 PM --- Number of posts added on 2024-09-13: 1
14/09/2024 04:34:16 PM --- Done page: 1/1
14/09/2024 04:34:16 PM --- Number of posts for page 1: 12
14/09/2024 04:34:16 PM --- Number of posts added on 2024-09-14: 0
15/09/2024 04:35:53 PM --- Done page: 1/1
15/09/2024 04:35:53 PM --- Number of posts for page 1: 12
15/09/2024 04:35:53 PM --- Number of posts added on 2024-09-15: 0
16/09/2024 04:38:19 PM --- Done page: 1/1
16/09/2024 04:38:19 PM --- Number of posts for page 1: 12
16/09/2024 04:38:19 PM --- Number of posts added on 2024-09-16: 0
17/09/2024 04:36:32 PM --- Done page: 1/1
17/09/2024 04:36:32 PM --- Number of posts for page 1: 12
17/09/2024 04:36:32 PM --- Number of posts added on 2024-09-17: 0
18/09/2024 04:35:40 PM --- Done: Vì sao bão Yagi “sống dai”, tàn phá đến tận Nam Á? 
18/09/2024 04:35:58 PM --- Done page: 1/1
18/09/2024 04:35:58 PM --- Number of posts for page 1: 12
18/09/2024 04:35:58 PM --- Number of posts added on 2024-09-18: 1
21/09/2024 04:35:06 PM --- Done: Google có nguy cơ “mất ngôi” với người dùng gen Z?
21/09/2024 04:35:29 PM --- Done page: 1/1
21/09/2024 04:35:29 PM --- Number of posts for page 1: 12
21/09/2024 04:35:29 PM --- Number of posts added on 2024-09-21: 1
22/09/2024 04:34:01 PM --- Done page: 1/1
22/09/2024 04:34:01 PM --- Number of posts for page 1: 12
22/09/2024 04:34:01 PM --- Number of posts added on 2024-09-22: 0
25/09/2024 04:41:36 PM --- Done: Ly trà tắc 37k “dành cho người nghèo” và bài học về cách hành văn
25/09/2024 04:41:54 PM --- Done page: 1/1
25/09/2024 04:41:54 PM --- Number of posts for page 1: 12
25/09/2024 04:41:54 PM --- Number of posts added on 2024-09-25: 1
26/09/2024 04:37:15 PM --- Done: Chuyện gì đang xảy ra với P. Diddy và Justin Bieber?
26/09/2024 04:37:17 PM --- Done: Hai chàng trai Triều Tiên “vượt ngàn chông gai” để debut ở Kpop
26/09/2024 04:37:38 PM --- Done page: 1/1
26/09/2024 04:37:38 PM --- Number of posts for page 1: 12
26/09/2024 04:37:38 PM --- Number of posts added on 2024-09-26: 2
27/09/2024 04:36:52 PM --- Done page: 1/1
27/09/2024 04:36:52 PM --- Number of posts for page 1: 12
27/09/2024 04:36:52 PM --- Number of posts added on 2024-09-27: 0
28/09/2024 04:34:22 PM --- Done: Đào, Phở và Piano đại diện Việt Nam dự thi sơ tuyển Oscar 2025
28/09/2024 04:34:41 PM --- Done page: 1/1
28/09/2024 04:34:41 PM --- Number of posts for page 1: 12
28/09/2024 04:34:41 PM --- Number of posts added on 2024-09-28: 1
29/09/2024 04:35:02 PM --- Done page: 1/1
29/09/2024 04:35:02 PM --- Number of posts for page 1: 12
29/09/2024 04:35:02 PM --- Number of posts added on 2024-09-29: 0
01/10/2024 04:39:04 PM --- Done page: 1/1
01/10/2024 04:39:04 PM --- Number of posts for page 1: 12
01/10/2024 04:39:04 PM --- Number of posts added on 2024-10-01: 0
02/10/2024 04:37:56 PM --- Done page: 1/1
02/10/2024 04:37:56 PM --- Number of posts for page 1: 12
02/10/2024 04:37:56 PM --- Number of posts added on 2024-10-02: 0
03/10/2024 04:37:46 PM --- Done page: 1/1
03/10/2024 04:37:46 PM --- Number of posts for page 1: 12
03/10/2024 04:37:46 PM --- Number of posts added on 2024-10-03: 0
04/10/2024 04:37:52 PM --- Done page: 1/1
04/10/2024 04:37:52 PM --- Number of posts for page 1: 12
04/10/2024 04:37:52 PM --- Number of posts added on 2024-10-04: 0
05/10/2024 04:34:15 PM --- Done: Mozart “comeback” sau hơn 2 thế kỷ, còn những di sản nào chưa được khám phá?
05/10/2024 04:34:36 PM --- Done page: 1/1
05/10/2024 04:34:36 PM --- Number of posts for page 1: 12
05/10/2024 04:34:36 PM --- Number of posts added on 2024-10-05: 1
06/10/2024 04:34:13 PM --- Done page: 1/1
06/10/2024 04:34:13 PM --- Number of posts for page 1: 12
06/10/2024 04:34:13 PM --- Number of posts added on 2024-10-06: 0
07/10/2024 04:37:35 PM --- Done page: 1/1
07/10/2024 04:37:35 PM --- Number of posts for page 1: 12
07/10/2024 04:37:35 PM --- Number of posts added on 2024-10-07: 0
09/10/2024 04:36:12 PM --- Done page: 1/1
09/10/2024 04:36:12 PM --- Number of posts for page 1: 12
09/10/2024 04:36:12 PM --- Number of posts added on 2024-10-09: 0
10/10/2024 04:36:48 PM --- Done page: 1/1
10/10/2024 04:36:48 PM --- Number of posts for page 1: 12
10/10/2024 04:36:48 PM --- Number of posts added on 2024-10-10: 0
12/10/2024 04:35:59 PM --- Done page: 1/1
12/10/2024 04:35:59 PM --- Number of posts for page 1: 12
12/10/2024 04:35:59 PM --- Number of posts added on 2024-10-12: 0
13/10/2024 04:34:36 PM --- Done page: 1/1
13/10/2024 04:34:36 PM --- Number of posts for page 1: 12
13/10/2024 04:34:36 PM --- Number of posts added on 2024-10-13: 0
14/10/2024 04:36:46 PM --- Done page: 1/1
14/10/2024 04:36:46 PM --- Number of posts for page 1: 12
14/10/2024 04:36:46 PM --- Number of posts added on 2024-10-14: 0
16/10/2024 04:38:13 PM --- Done page: 1/1
16/10/2024 04:38:13 PM --- Number of posts for page 1: 12
16/10/2024 04:38:13 PM --- Number of posts added on 2024-10-16: 0
18/10/2024 04:36:44 PM --- Done page: 1/1
18/10/2024 04:36:44 PM --- Number of posts for page 1: 12
18/10/2024 04:36:44 PM --- Number of posts added on 2024-10-18: 0
19/10/2024 04:35:06 PM --- Done page: 1/1
19/10/2024 04:35:06 PM --- Number of posts for page 1: 12
19/10/2024 04:35:06 PM --- Number of posts added on 2024-10-19: 0
20/10/2024 04:34:35 PM --- Done page: 1/1
20/10/2024 04:34:35 PM --- Number of posts for page 1: 12
20/10/2024 04:34:35 PM --- Number of posts added on 2024-10-20: 0
21/10/2024 04:38:06 PM --- Done page: 1/1
21/10/2024 04:38:06 PM --- Number of posts for page 1: 12
21/10/2024 04:38:06 PM --- Number of posts added on 2024-10-21: 0
22/10/2024 04:37:38 PM --- Done: Phát hiện hơn 100 mộ cổ ở Hà Nội: Minh chứng cho 4000 năm an cư của người Việt nơi đây
22/10/2024 04:38:03 PM --- Done page: 1/1
22/10/2024 04:38:03 PM --- Number of posts for page 1: 12
22/10/2024 04:38:03 PM --- Number of posts added on 2024-10-22: 1
23/10/2024 04:39:45 PM --- Done page: 1/1
23/10/2024 04:39:45 PM --- Number of posts for page 1: 12
23/10/2024 04:39:45 PM --- Number of posts added on 2024-10-23: 0
24/10/2024 04:37:38 PM --- Done: Trong túi mù có gì mà khiến ai cũng muốn xé?
24/10/2024 04:38:00 PM --- Done page: 1/1
24/10/2024 04:38:00 PM --- Number of posts for page 1: 12
24/10/2024 04:38:00 PM --- Number of posts added on 2024-10-24: 1
25/10/2024 04:36:38 PM --- Done: Temu đổ bộ, Shopee không còn là "sàn cam" duy nhất tại Việt Nam? 
25/10/2024 04:37:01 PM --- Done page: 1/1
25/10/2024 04:37:01 PM --- Number of posts for page 1: 12
25/10/2024 04:37:01 PM --- Number of posts added on 2024-10-25: 1
26/10/2024 04:33:48 PM --- Done: Vì sao ngày càng nhiều nhân sự gen Z không muốn làm sếp? 
26/10/2024 04:34:09 PM --- Done page: 1/1
26/10/2024 04:34:09 PM --- Number of posts for page 1: 12
26/10/2024 04:34:09 PM --- Number of posts added on 2024-10-26: 1
27/10/2024 04:35:43 PM --- Done page: 1/1
27/10/2024 04:35:43 PM --- Number of posts for page 1: 12
27/10/2024 04:35:43 PM --- Number of posts added on 2024-10-27: 0
28/10/2024 04:40:09 PM --- Done page: 1/1
28/10/2024 04:40:09 PM --- Number of posts for page 1: 12
28/10/2024 04:40:09 PM --- Number of posts added on 2024-10-28: 0
29/10/2024 04:38:58 PM --- Done: Khi Yoga “đi khắp muôn nơi”: Nên tập thế nào cho đúng cách?
29/10/2024 04:39:15 PM --- Done page: 1/1
29/10/2024 04:39:15 PM --- Number of posts for page 1: 12
29/10/2024 04:39:15 PM --- Number of posts added on 2024-10-29: 1
30/10/2024 04:39:05 PM --- Done page: 1/1
30/10/2024 04:39:05 PM --- Number of posts for page 1: 12
30/10/2024 04:39:05 PM --- Number of posts added on 2024-10-30: 0
31/10/2024 04:37:50 PM --- Done page: 1/1
31/10/2024 04:37:50 PM --- Number of posts for page 1: 12
31/10/2024 04:37:50 PM --- Number of posts added on 2024-10-31: 0
01/11/2024 04:35:39 PM --- Done: “Lối sống phông bạt của giới trẻ" được đưa vào đề văn
01/11/2024 04:35:58 PM --- Done page: 1/1
01/11/2024 04:35:58 PM --- Number of posts for page 1: 12
01/11/2024 04:35:58 PM --- Number of posts added on 2024-11-01: 1
02/11/2024 04:35:04 PM --- Done page: 1/1
02/11/2024 04:35:04 PM --- Number of posts for page 1: 12
02/11/2024 04:35:04 PM --- Number of posts added on 2024-11-02: 0
03/11/2024 04:34:07 PM --- Done page: 1/1
03/11/2024 04:34:07 PM --- Number of posts for page 1: 12
03/11/2024 04:34:07 PM --- Number of posts added on 2024-11-03: 0
04/11/2024 04:35:03 PM --- Done page: 1/1
04/11/2024 04:35:03 PM --- Number of posts for page 1: 12
04/11/2024 04:35:03 PM --- Number of posts added on 2024-11-04: 0
05/11/2024 04:37:01 PM --- Done page: 1/1
05/11/2024 04:37:01 PM --- Number of posts for page 1: 12
05/11/2024 04:37:01 PM --- Number of posts added on 2024-11-05: 0
07/11/2024 04:36:54 PM --- Done page: 1/1
07/11/2024 04:36:54 PM --- Number of posts for page 1: 12
07/11/2024 04:36:54 PM --- Number of posts added on 2024-11-07: 0
08/11/2024 04:36:37 PM --- Done page: 1/1
08/11/2024 04:36:37 PM --- Number of posts for page 1: 12
08/11/2024 04:36:37 PM --- Number of posts added on 2024-11-08: 0
09/11/2024 04:33:06 PM --- Done page: 1/1
09/11/2024 04:33:06 PM --- Number of posts for page 1: 12
09/11/2024 04:33:06 PM --- Number of posts added on 2024-11-09: 0
10/11/2024 04:33:15 PM --- Done page: 1/1
10/11/2024 04:33:15 PM --- Number of posts for page 1: 12
10/11/2024 04:33:15 PM --- Number of posts added on 2024-11-10: 0
11/11/2024 04:37:04 PM --- Done page: 1/1
11/11/2024 04:37:04 PM --- Number of posts for page 1: 12
11/11/2024 04:37:04 PM --- Number of posts added on 2024-11-11: 0
13/11/2024 04:35:32 PM --- Done page: 1/1
13/11/2024 04:35:32 PM --- Number of posts for page 1: 12
13/11/2024 04:35:32 PM --- Number of posts added on 2024-11-13: 0
14/11/2024 04:38:17 PM --- Done: Vì sao gen Z Việt ngày càng chi mạnh tay cho các trải nghiệm?
14/11/2024 04:38:41 PM --- Done page: 1/1
14/11/2024 04:38:41 PM --- Number of posts for page 1: 12
14/11/2024 04:38:41 PM --- Number of posts added on 2024-11-14: 1
15/11/2024 04:38:58 PM --- Done page: 1/1
15/11/2024 04:38:58 PM --- Number of posts for page 1: 12
15/11/2024 04:38:58 PM --- Number of posts added on 2024-11-15: 0
16/11/2024 04:36:14 PM --- Done: Thanh Thủy đăng quang Miss International, tiêu chuẩn "đẹp ngọt ngào" từ đâu mà có?
16/11/2024 04:36:38 PM --- Done page: 1/1
16/11/2024 04:36:38 PM --- Number of posts for page 1: 12
16/11/2024 04:36:38 PM --- Number of posts added on 2024-11-16: 1
17/11/2024 04:34:24 PM --- Done page: 1/1
17/11/2024 04:34:24 PM --- Number of posts for page 1: 12
17/11/2024 04:34:24 PM --- Number of posts added on 2024-11-17: 0
18/11/2024 04:40:41 PM --- Done page: 1/1
18/11/2024 04:40:41 PM --- Number of posts for page 1: 12
18/11/2024 04:40:41 PM --- Number of posts added on 2024-11-18: 0
19/11/2024 04:39:21 PM --- Done page: 1/1
19/11/2024 04:39:21 PM --- Number of posts for page 1: 12
19/11/2024 04:39:21 PM --- Number of posts added on 2024-11-19: 0
20/11/2024 04:40:53 PM --- Done page: 1/1
20/11/2024 04:40:53 PM --- Number of posts for page 1: 12
20/11/2024 04:40:53 PM --- Number of posts added on 2024-11-20: 0
21/11/2024 04:40:03 PM --- Done page: 1/1
21/11/2024 04:40:03 PM --- Number of posts for page 1: 12
21/11/2024 04:40:03 PM --- Number of posts added on 2024-11-21: 0
22/11/2024 04:39:04 PM --- Done page: 1/1
22/11/2024 04:39:04 PM --- Number of posts for page 1: 12
22/11/2024 04:39:04 PM --- Number of posts added on 2024-11-22: 0
23/11/2024 04:35:54 PM --- Done page: 1/1
23/11/2024 04:35:54 PM --- Number of posts for page 1: 12
23/11/2024 04:35:54 PM --- Number of posts added on 2024-11-23: 0
24/11/2024 04:35:01 PM --- Done page: 1/1
24/11/2024 04:35:01 PM --- Number of posts for page 1: 12
24/11/2024 04:35:01 PM --- Number of posts added on 2024-11-24: 0
25/11/2024 04:40:08 PM --- Done page: 1/1
25/11/2024 04:40:08 PM --- Number of posts for page 1: 12
25/11/2024 04:40:08 PM --- Number of posts added on 2024-11-25: 0
26/11/2024 04:41:33 PM --- Done page: 1/1
26/11/2024 04:41:33 PM --- Number of posts for page 1: 12
26/11/2024 04:41:33 PM --- Number of posts added on 2024-11-26: 0
28/11/2024 04:39:05 PM --- Done page: 1/1
28/11/2024 04:39:05 PM --- Number of posts for page 1: 12
28/11/2024 04:39:05 PM --- Number of posts added on 2024-11-28: 0
29/11/2024 04:39:33 PM --- Done page: 1/1
29/11/2024 04:39:33 PM --- Number of posts for page 1: 12
29/11/2024 04:39:33 PM --- Number of posts added on 2024-11-29: 0
30/11/2024 04:35:23 PM --- Done page: 1/1
30/11/2024 04:35:23 PM --- Number of posts for page 1: 12
30/11/2024 04:35:23 PM --- Number of posts added on 2024-11-30: 0
01/12/2024 04:36:27 PM --- Done page: 1/1
01/12/2024 04:36:27 PM --- Number of posts for page 1: 12
01/12/2024 04:36:27 PM --- Number of posts added on 2024-12-01: 0
02/12/2024 04:41:35 PM --- Done page: 1/1
02/12/2024 04:41:35 PM --- Number of posts for page 1: 12
02/12/2024 04:41:35 PM --- Number of posts added on 2024-12-02: 0
03/12/2024 04:41:39 PM --- Done page: 1/1
03/12/2024 04:41:39 PM --- Number of posts for page 1: 12
03/12/2024 04:41:39 PM --- Number of posts added on 2024-12-03: 0
04/12/2024 04:42:32 PM --- Done page: 1/1
04/12/2024 04:42:32 PM --- Number of posts for page 1: 12
04/12/2024 04:42:32 PM --- Number of posts added on 2024-12-04: 0
05/12/2024 04:42:12 PM --- Done page: 1/1
05/12/2024 04:42:12 PM --- Number of posts for page 1: 12
05/12/2024 04:42:12 PM --- Number of posts added on 2024-12-05: 0
06/12/2024 04:37:47 PM --- Done page: 1/1
06/12/2024 04:37:47 PM --- Number of posts for page 1: 12
06/12/2024 04:37:47 PM --- Number of posts added on 2024-12-06: 0
07/12/2024 04:36:35 PM --- Done page: 1/1
07/12/2024 04:36:35 PM --- Number of posts for page 1: 12
07/12/2024 04:36:35 PM --- Number of posts added on 2024-12-07: 0
08/12/2024 04:36:05 PM --- Done page: 1/1
08/12/2024 04:36:05 PM --- Number of posts for page 1: 12
08/12/2024 04:36:05 PM --- Number of posts added on 2024-12-08: 0
09/12/2024 04:42:00 PM --- Done page: 1/1
09/12/2024 04:42:00 PM --- Number of posts for page 1: 12
09/12/2024 04:42:00 PM --- Number of posts added on 2024-12-09: 0
10/12/2024 04:42:19 PM --- Done page: 1/1
10/12/2024 04:42:19 PM --- Number of posts for page 1: 12
10/12/2024 04:42:19 PM --- Number of posts added on 2024-12-10: 0
11/12/2024 04:42:07 PM --- Done page: 1/1
11/12/2024 04:42:07 PM --- Number of posts for page 1: 12
11/12/2024 04:42:07 PM --- Number of posts added on 2024-12-11: 0
12/12/2024 04:41:55 PM --- Done page: 1/1
12/12/2024 04:41:55 PM --- Number of posts for page 1: 12
12/12/2024 04:41:55 PM --- Number of posts added on 2024-12-12: 0
13/12/2024 04:39:50 PM --- Done page: 1/1
13/12/2024 04:39:50 PM --- Number of posts for page 1: 12
13/12/2024 04:39:50 PM --- Number of posts added on 2024-12-13: 0
14/12/2024 04:35:52 PM --- Done page: 1/1
14/12/2024 04:35:52 PM --- Number of posts for page 1: 12
14/12/2024 04:35:52 PM --- Number of posts added on 2024-12-14: 0
15/12/2024 04:36:08 PM --- Done page: 1/1
15/12/2024 04:36:08 PM --- Number of posts for page 1: 12
15/12/2024 04:36:08 PM --- Number of posts added on 2024-12-15: 0
16/12/2024 04:41:48 PM --- Done page: 1/1
16/12/2024 04:41:48 PM --- Number of posts for page 1: 12
16/12/2024 04:41:48 PM --- Number of posts added on 2024-12-16: 0
17/12/2024 04:41:32 PM --- Done page: 1/1
17/12/2024 04:41:32 PM --- Number of posts for page 1: 12
17/12/2024 04:41:32 PM --- Number of posts added on 2024-12-17: 0
18/12/2024 04:39:02 PM --- Done page: 1/1
18/12/2024 04:39:02 PM --- Number of posts for page 1: 12
18/12/2024 04:39:02 PM --- Number of posts added on 2024-12-18: 0
19/12/2024 04:35:48 PM --- Done page: 1/1
19/12/2024 04:35:48 PM --- Number of posts for page 1: 12
19/12/2024 04:35:48 PM --- Number of posts added on 2024-12-19: 0
20/12/2024 04:35:12 PM --- Done page: 1/1
20/12/2024 04:35:12 PM --- Number of posts for page 1: 12
20/12/2024 04:35:12 PM --- Number of posts added on 2024-12-20: 0
21/12/2024 04:33:13 PM --- Done page: 1/1
21/12/2024 04:33:13 PM --- Number of posts for page 1: 12
21/12/2024 04:33:13 PM --- Number of posts added on 2024-12-21: 0
22/12/2024 04:32:50 PM --- Done page: 1/1
22/12/2024 04:32:50 PM --- Number of posts for page 1: 12
22/12/2024 04:32:50 PM --- Number of posts added on 2024-12-22: 0
23/12/2024 04:34:57 PM --- Done page: 1/1
23/12/2024 04:34:57 PM --- Number of posts for page 1: 12
23/12/2024 04:34:57 PM --- Number of posts added on 2024-12-23: 0
24/12/2024 04:34:44 PM --- Done page: 1/1
24/12/2024 04:34:44 PM --- Number of posts for page 1: 12
24/12/2024 04:34:44 PM --- Number of posts added on 2024-12-24: 0
25/12/2024 04:34:22 PM --- Done page: 1/1
25/12/2024 04:34:22 PM --- Number of posts for page 1: 12
25/12/2024 04:34:22 PM --- Number of posts added on 2024-12-25: 0
26/12/2024 04:34:51 PM --- Done page: 1/1
26/12/2024 04:34:51 PM --- Number of posts for page 1: 12
26/12/2024 04:34:51 PM --- Number of posts added on 2024-12-26: 0
27/12/2024 04:34:17 PM --- Done page: 1/1
27/12/2024 04:34:17 PM --- Number of posts for page 1: 12
27/12/2024 04:34:17 PM --- Number of posts added on 2024-12-27: 0
28/12/2024 04:33:18 PM --- Done page: 1/1
28/12/2024 04:33:18 PM --- Number of posts for page 1: 12
28/12/2024 04:33:18 PM --- Number of posts added on 2024-12-28: 0
29/12/2024 04:32:56 PM --- Done page: 1/1
29/12/2024 04:32:56 PM --- Number of posts for page 1: 12
29/12/2024 04:32:56 PM --- Number of posts added on 2024-12-29: 0
30/12/2024 04:35:24 PM --- Done page: 1/1
30/12/2024 04:35:24 PM --- Number of posts for page 1: 12
30/12/2024 04:35:24 PM --- Number of posts added on 2024-12-30: 0
31/12/2024 04:34:42 PM --- Done page: 1/1
31/12/2024 04:34:42 PM --- Number of posts for page 1: 12
31/12/2024 04:34:42 PM --- Number of posts added on 2024-12-31: 0
01/01/2025 04:34:37 PM --- Done page: 1/1
01/01/2025 04:34:37 PM --- Number of posts for page 1: 12
01/01/2025 04:34:37 PM --- Number of posts added on 2025-01-01: 0
02/01/2025 04:35:26 PM --- Done page: 1/1
02/01/2025 04:35:26 PM --- Number of posts for page 1: 12
02/01/2025 04:35:26 PM --- Number of posts added on 2025-01-02: 0
03/01/2025 04:36:08 PM --- Done page: 1/1
03/01/2025 04:36:08 PM --- Number of posts for page 1: 12
03/01/2025 04:36:08 PM --- Number of posts added on 2025-01-03: 0
04/01/2025 04:33:37 PM --- Done page: 1/1
04/01/2025 04:33:37 PM --- Number of posts for page 1: 12
04/01/2025 04:33:37 PM --- Number of posts added on 2025-01-04: 0
05/01/2025 04:33:08 PM --- Done page: 1/1
05/01/2025 04:33:08 PM --- Number of posts for page 1: 12
05/01/2025 04:33:08 PM --- Number of posts added on 2025-01-05: 0
06/01/2025 04:37:35 PM --- Done page: 1/1
06/01/2025 04:37:35 PM --- Number of posts for page 1: 12
06/01/2025 04:37:35 PM --- Number of posts added on 2025-01-06: 0
07/01/2025 04:49:06 PM --- Done page: 1/1
07/01/2025 04:49:06 PM --- Number of posts for page 1: 12
07/01/2025 04:49:06 PM --- Number of posts added on 2025-01-07: 0
08/01/2025 04:37:19 PM --- Done page: 1/1
08/01/2025 04:37:19 PM --- Number of posts for page 1: 12
08/01/2025 04:37:19 PM --- Number of posts added on 2025-01-08: 0
09/01/2025 04:37:10 PM --- Done page: 1/1
09/01/2025 04:37:10 PM --- Number of posts for page 1: 12
09/01/2025 04:37:10 PM --- Number of posts added on 2025-01-09: 0
10/01/2025 04:37:06 PM --- Done page: 1/1
10/01/2025 04:37:06 PM --- Number of posts for page 1: 12
10/01/2025 04:37:06 PM --- Number of posts added on 2025-01-10: 0
11/01/2025 04:33:41 PM --- Done page: 1/1
11/01/2025 04:33:41 PM --- Number of posts for page 1: 12
11/01/2025 04:33:41 PM --- Number of posts added on 2025-01-11: 0
12/01/2025 04:33:05 PM --- Done page: 1/1
12/01/2025 04:33:05 PM --- Number of posts for page 1: 12
12/01/2025 04:33:05 PM --- Number of posts added on 2025-01-12: 0
13/01/2025 04:38:41 PM --- Done page: 1/1
13/01/2025 04:38:41 PM --- Number of posts for page 1: 12
13/01/2025 04:38:41 PM --- Number of posts added on 2025-01-13: 0
14/01/2025 04:35:22 PM --- Done page: 1/1
14/01/2025 04:35:22 PM --- Number of posts for page 1: 12
14/01/2025 04:35:22 PM --- Number of posts added on 2025-01-14: 0
15/01/2025 04:33:38 PM --- Done page: 1/1
15/01/2025 04:33:38 PM --- Number of posts for page 1: 12
15/01/2025 04:33:38 PM --- Number of posts added on 2025-01-15: 0
16/01/2025 04:34:51 PM --- Done page: 1/1
16/01/2025 04:34:51 PM --- Number of posts for page 1: 12
16/01/2025 04:34:51 PM --- Number of posts added on 2025-01-16: 0
17/01/2025 04:34:21 PM --- Done page: 1/1
17/01/2025 04:34:21 PM --- Number of posts for page 1: 12
17/01/2025 04:34:21 PM --- Number of posts added on 2025-01-17: 0
18/01/2025 04:32:00 PM --- Done page: 1/1
18/01/2025 04:32:00 PM --- Number of posts for page 1: 12
18/01/2025 04:32:00 PM --- Number of posts added on 2025-01-18: 0
19/01/2025 04:32:28 PM --- Done page: 1/1
19/01/2025 04:32:28 PM --- Number of posts for page 1: 12
19/01/2025 04:32:28 PM --- Number of posts added on 2025-01-19: 0
20/01/2025 04:34:57 PM --- Done page: 1/1
20/01/2025 04:34:57 PM --- Number of posts for page 1: 12
20/01/2025 04:34:57 PM --- Number of posts added on 2025-01-20: 0
21/01/2025 04:36:39 PM --- Done page: 1/1
21/01/2025 04:36:39 PM --- Number of posts for page 1: 12
21/01/2025 04:36:39 PM --- Number of posts added on 2025-01-21: 0
22/01/2025 04:35:06 PM --- Done page: 1/1
22/01/2025 04:35:06 PM --- Number of posts for page 1: 12
22/01/2025 04:35:06 PM --- Number of posts added on 2025-01-22: 0
23/01/2025 04:35:56 PM --- Done page: 1/1
23/01/2025 04:35:56 PM --- Number of posts for page 1: 12
23/01/2025 04:35:56 PM --- Number of posts added on 2025-01-23: 0
24/01/2025 04:35:03 PM --- Done page: 1/1
24/01/2025 04:35:03 PM --- Number of posts for page 1: 12
24/01/2025 04:35:03 PM --- Number of posts added on 2025-01-24: 0
25/01/2025 04:34:41 PM --- Done page: 1/1
25/01/2025 04:34:41 PM --- Number of posts for page 1: 12
25/01/2025 04:34:41 PM --- Number of posts added on 2025-01-25: 0
26/01/2025 04:31:57 PM --- Done page: 1/1
26/01/2025 04:31:57 PM --- Number of posts for page 1: 12
26/01/2025 04:31:57 PM --- Number of posts added on 2025-01-26: 0
27/01/2025 04:34:36 PM --- Done page: 1/1
27/01/2025 04:34:36 PM --- Number of posts for page 1: 12
27/01/2025 04:34:36 PM --- Number of posts added on 2025-01-27: 0
28/01/2025 04:35:27 PM --- Done page: 1/1
28/01/2025 04:35:27 PM --- Number of posts for page 1: 12
28/01/2025 04:35:27 PM --- Number of posts added on 2025-01-28: 0
29/01/2025 04:35:15 PM --- Done page: 1/1
29/01/2025 04:35:15 PM --- Number of posts for page 1: 12
