02/09/2024 04:08:57 PM --- Done: Silent Treatment: Sự im lặng độc hại đã thao túng ta như thế nào?
02/09/2024 04:08:57 PM --- Done: Tình bạn cong - thẳng và những điểm cộng không phải ai cũng biết 
02/09/2024 04:08:58 PM --- Done: Liệu nỗi sợ và chấn thương tâm lý có thể giúp bạn sống tốt hơn?
02/09/2024 04:08:58 PM --- Done: Laws of Detachment: Cách buông bỏ để thấy đời dễ thở hơn
02/09/2024 04:08:59 PM --- Done: Làm thế nào để tìm được ý nghĩa cuộc sống và giá trị của bản thân?
02/09/2024 04:08:59 PM --- Done: Thói quen và mục tiêu: Điều gì quan trọng hơn?
02/09/2024 04:09:00 PM --- Done: 5 Kiểu suy nghĩ dễ khiến bạn lo lắng quá mức 
02/09/2024 04:09:00 PM --- Done: Guilty pleasure - Đã ưng quá chừng mà sao cứ phải giấu?
02/09/2024 04:09:01 PM --- Done: Cẩm nang giúp bạn “kiến tạo” thói quen tốt
02/09/2024 04:09:01 PM --- Done: 3 Bài học trước khi quyết định trốn khỏi thực tại
02/09/2024 04:09:02 PM --- Done: Có phải “cái tôi lớn” lúc nào cũng không tốt?
02/09/2024 04:09:02 PM --- Done: Fawning: Giải quyết xung đột bằng cách vỗ về đối phương
02/09/2024 04:09:02 PM --- Done page: 1/6
02/09/2024 04:09:02 PM --- Number of posts for page 1: 12
02/09/2024 04:09:02 PM --- Number of posts added on 2024-09-02: 12
02/09/2024 04:09:03 PM --- Done: Positive stress: Làm sao để biến căng thẳng thành động lực?
02/09/2024 04:09:04 PM --- Done: Vì sao bạn yêu ai cũng thấy mình thiệt thòi và bất an hơn?
02/09/2024 04:09:04 PM --- Done: Làm sao để kiểm soát sự ái kỷ trong chính mình?
02/09/2024 04:09:05 PM --- Done: Vì sao có những người bị bạo hành vẫn không rời đi?
02/09/2024 04:09:05 PM --- Done: Điều gì cản trở bạn vượt ra khỏi những giới hạn của chính mình?
02/09/2024 04:09:05 PM --- Done: Điều gì làm con người ta ái kỷ? 
02/09/2024 04:09:06 PM --- Done: Đời sống ẩn danh cũng cần được yêu thương và tôn trọng
02/09/2024 04:09:06 PM --- Done: “Sống thật” với cảm xúc - Mấu chốt giúp bạn thực sự “sống tốt”
02/09/2024 04:09:07 PM --- Done: Cẩm nang "giữ lửa" khi sống chung cùng bạn thân
02/09/2024 04:09:07 PM --- Done: 4 Bước giúp bạn có một trải nghiệm “self-date” tự tin ở nhà hàng
02/09/2024 04:09:08 PM --- Done: Ngộ độc Self-help: Lý do bạn biết mình phải thay đổi, nhưng lại chưa thể thay đổi
02/09/2024 04:09:08 PM --- Done: Yêu bản thân để không đánh mất mình trong thế giới muôn hình vạn trạng
02/09/2024 04:09:08 PM --- Done page: 2/6
02/09/2024 04:09:08 PM --- Number of posts for page 2: 12
02/09/2024 04:09:08 PM --- Number of posts added on 2024-09-02: 24
02/09/2024 04:09:09 PM --- Done: Bạn đã bao giờ cho đi nhiều nhưng chẳng nhận lại bao nhiêu trong tình yêu?
02/09/2024 04:09:10 PM --- Done: High-functioning anxiety - Đừng để bị đánh lừa bởi câu “Tôi ổn”
02/09/2024 04:09:10 PM --- Done: Đừng vội chọn con đường “giải thoát,” vì nơi nương tựa là cả thế giới
02/09/2024 04:09:10 PM --- Done: Đi chơi xa, “trách nhiệm” quá liệu có tốt?
02/09/2024 04:09:11 PM --- Done: Tốt bụng thế nào để không bị lợi dụng lòng tốt?
02/09/2024 04:09:11 PM --- Done: Đi trekking cùng bố mẹ, tại sao không?
02/09/2024 04:09:12 PM --- Done: Học được gì từ những chuyến du lịch khác thường?
02/09/2024 04:09:12 PM --- Done: 4 Bước để có trải nghiệm du lịch “liên thế hệ” đáng nhớ bên bố mẹ
02/09/2024 04:09:13 PM --- Done: Dám yếu đuối: Cách ta biến tổn thương thành mạnh mẽ phi thường
02/09/2024 04:09:13 PM --- Done: Làm sao để thoát khỏi cảm giác phải chiều lòng, đoán ý người khác?
02/09/2024 04:09:14 PM --- Done: “Bội thực Dopamine” - Lý do ta làm gì cũng thấy chán
02/09/2024 04:09:14 PM --- Done: Ra trường xong vẫn mơ hồ tương lai, liệu có phải “thất bại”?
02/09/2024 04:09:14 PM --- Done page: 3/6
02/09/2024 04:09:14 PM --- Number of posts for page 3: 12
02/09/2024 04:09:14 PM --- Number of posts added on 2024-09-02: 36
02/09/2024 04:09:15 PM --- Done: Hygge - Hạnh phúc như một cái ôm
02/09/2024 04:09:15 PM --- Done: Làm sao để thay đổi hình ảnh của bạn trong mắt người khác?
02/09/2024 04:09:16 PM --- Done: Lần đầu du lịch 1 mình: 101 gợi ý để không "một mình"
02/09/2024 04:09:16 PM --- Done: Tận hưởng độc thân có làm ta quay lưng với kết nối tình cảm?
02/09/2024 04:09:17 PM --- Done: 4 Bí quyết cho cuộc sống độc thân nhưng vẫn vui
02/09/2024 04:09:18 PM --- Done: 4 Bước gỡ rối tơ lòng trong quá khứ 
02/09/2024 04:09:18 PM --- Done: Tắm rừng - Liệu pháp mở ra giác quan thứ 6 của hạnh phúc
02/09/2024 04:09:19 PM --- Done: 7 Cách giúp bạn cai nghiện điện thoại dễ dàng hơn
02/09/2024 04:09:19 PM --- Done: Làm thế nào để biến căn nhà thành nơi bạn muốn trở về
02/09/2024 04:09:20 PM --- Done: Học các triết gia định nghĩa của hạnh phúc
02/09/2024 04:09:20 PM --- Done: Dành thời gian cho bản thân mà không thấy tội lỗi
02/09/2024 04:09:20 PM --- Done page: 4/6
02/09/2024 04:09:20 PM --- Number of posts for page 4: 12
02/09/2024 04:09:20 PM --- Number of posts added on 2024-09-02: 47
02/09/2024 04:09:21 PM --- Done: Self-concept: Lời giải cho câu hỏi "Tôi là ai" theo tâm lý học
02/09/2024 04:09:21 PM --- Done: Vì sao bạn cần thanh lọc công nghệ trong thời đại số?
02/09/2024 04:09:21 PM --- Done page: 5/6
02/09/2024 04:09:21 PM --- Number of posts for page 5: 2
02/09/2024 04:09:21 PM --- Number of posts added on 2024-09-02: 49
02/09/2024 04:09:21 PM --- Done page: 6/6
02/09/2024 04:09:21 PM --- Number of posts for page 6: 0
02/09/2024 04:09:21 PM --- Number of posts added on 2024-09-02: 49
03/09/2024 06:35:48 PM --- Done page: 1/1
03/09/2024 06:35:48 PM --- Number of posts for page 1: 12
03/09/2024 06:35:48 PM --- Number of posts added on 2024-09-03: 0
03/09/2024 11:50:27 AM --- Done page: 1/1
03/09/2024 11:50:27 AM --- Number of posts for page 1: 12
03/09/2024 11:50:27 AM --- Number of posts added on 2024-09-03: 0
03/09/2024 04:14:19 PM --- Done page: 1/1
03/09/2024 04:14:19 PM --- Number of posts for page 1: 12
03/09/2024 04:14:19 PM --- Number of posts added on 2024-09-03: 0
04/09/2024 04:13:44 PM --- Done page: 1/1
04/09/2024 04:13:44 PM --- Number of posts for page 1: 12
04/09/2024 04:13:44 PM --- Number of posts added on 2024-09-04: 0
05/09/2024 04:13:38 PM --- Done page: 1/1
05/09/2024 04:13:38 PM --- Number of posts for page 1: 12
05/09/2024 04:13:38 PM --- Number of posts added on 2024-09-05: 0
06/09/2024 04:13:05 PM --- Done page: 1/1
06/09/2024 04:13:05 PM --- Number of posts for page 1: 12
06/09/2024 04:13:05 PM --- Number of posts added on 2024-09-06: 0
07/09/2024 04:12:12 PM --- Done page: 1/1
07/09/2024 04:12:12 PM --- Number of posts for page 1: 12
07/09/2024 04:12:12 PM --- Number of posts added on 2024-09-07: 0
08/09/2024 04:13:32 PM --- Done page: 1/1
08/09/2024 04:13:32 PM --- Number of posts for page 1: 12
08/09/2024 04:13:32 PM --- Number of posts added on 2024-09-08: 0
09/09/2024 04:13:16 PM --- Done page: 1/1
09/09/2024 04:13:16 PM --- Number of posts for page 1: 12
09/09/2024 04:13:16 PM --- Number of posts added on 2024-09-09: 0
10/09/2024 04:13:03 PM --- Done page: 1/1
10/09/2024 04:13:03 PM --- Number of posts for page 1: 12
10/09/2024 04:13:03 PM --- Number of posts added on 2024-09-10: 0
11/09/2024 04:13:36 PM --- Done page: 1/1
11/09/2024 04:13:36 PM --- Number of posts for page 1: 12
11/09/2024 04:13:36 PM --- Number of posts added on 2024-09-11: 0
12/09/2024 04:13:21 PM --- Done page: 1/1
12/09/2024 04:13:21 PM --- Number of posts for page 1: 12
12/09/2024 04:13:21 PM --- Number of posts added on 2024-09-12: 0
13/09/2024 04:12:53 PM --- Done page: 1/1
13/09/2024 04:12:53 PM --- Number of posts for page 1: 12
13/09/2024 04:12:53 PM --- Number of posts added on 2024-09-13: 0
14/09/2024 04:12:38 PM --- Done page: 1/1
14/09/2024 04:12:38 PM --- Number of posts for page 1: 12
14/09/2024 04:12:38 PM --- Number of posts added on 2024-09-14: 0
15/09/2024 04:13:09 PM --- Done page: 1/1
15/09/2024 04:13:09 PM --- Number of posts for page 1: 12
15/09/2024 04:13:09 PM --- Number of posts added on 2024-09-15: 0
16/09/2024 04:13:47 PM --- Done page: 1/1
16/09/2024 04:13:47 PM --- Number of posts for page 1: 12
16/09/2024 04:13:47 PM --- Number of posts added on 2024-09-16: 0
17/09/2024 04:14:03 PM --- Done page: 1/1
17/09/2024 04:14:03 PM --- Number of posts for page 1: 12
17/09/2024 04:14:03 PM --- Number of posts added on 2024-09-17: 0
18/09/2024 04:14:11 PM --- Done page: 1/1
18/09/2024 04:14:11 PM --- Number of posts for page 1: 12
18/09/2024 04:14:11 PM --- Number of posts added on 2024-09-18: 0
19/09/2024 04:13:43 PM --- Done page: 1/1
19/09/2024 04:13:43 PM --- Number of posts for page 1: 12
19/09/2024 04:13:43 PM --- Number of posts added on 2024-09-19: 0
20/09/2024 04:13:31 PM --- Done page: 1/1
20/09/2024 04:13:31 PM --- Number of posts for page 1: 12
20/09/2024 04:13:31 PM --- Number of posts added on 2024-09-20: 0
21/09/2024 04:13:34 PM --- Done page: 1/1
21/09/2024 04:13:34 PM --- Number of posts for page 1: 12
21/09/2024 04:13:34 PM --- Number of posts added on 2024-09-21: 0
22/09/2024 04:12:38 PM --- Done page: 1/1
22/09/2024 04:12:38 PM --- Number of posts for page 1: 12
22/09/2024 04:12:38 PM --- Number of posts added on 2024-09-22: 0
23/09/2024 04:13:33 PM --- Done page: 1/1
23/09/2024 04:13:33 PM --- Number of posts for page 1: 12
23/09/2024 04:13:33 PM --- Number of posts added on 2024-09-23: 0
24/09/2024 04:14:05 PM --- Done page: 1/1
24/09/2024 04:14:05 PM --- Number of posts for page 1: 12
24/09/2024 04:14:05 PM --- Number of posts added on 2024-09-24: 0
25/09/2024 04:15:10 PM --- Done page: 1/1
25/09/2024 04:15:10 PM --- Number of posts for page 1: 12
25/09/2024 04:15:10 PM --- Number of posts added on 2024-09-25: 0
26/09/2024 04:14:06 PM --- Done page: 1/1
26/09/2024 04:14:06 PM --- Number of posts for page 1: 12
26/09/2024 04:14:06 PM --- Number of posts added on 2024-09-26: 0
27/09/2024 04:13:47 PM --- Done page: 1/1
27/09/2024 04:13:47 PM --- Number of posts for page 1: 12
27/09/2024 04:13:47 PM --- Number of posts added on 2024-09-27: 0
28/09/2024 04:13:09 PM --- Done page: 1/1
28/09/2024 04:13:09 PM --- Number of posts for page 1: 12
28/09/2024 04:13:09 PM --- Number of posts added on 2024-09-28: 0
29/09/2024 04:13:11 PM --- Done page: 1/1
29/09/2024 04:13:11 PM --- Number of posts for page 1: 12
29/09/2024 04:13:11 PM --- Number of posts added on 2024-09-29: 0
30/09/2024 04:14:29 PM --- Done page: 1/1
30/09/2024 04:14:29 PM --- Number of posts for page 1: 12
30/09/2024 04:14:29 PM --- Number of posts added on 2024-09-30: 0
01/10/2024 04:14:22 PM --- Done page: 1/1
01/10/2024 04:14:22 PM --- Number of posts for page 1: 12
01/10/2024 04:14:22 PM --- Number of posts added on 2024-10-01: 0
02/10/2024 04:14:13 PM --- Done page: 1/1
02/10/2024 04:14:13 PM --- Number of posts for page 1: 12
02/10/2024 04:14:13 PM --- Number of posts added on 2024-10-02: 0
03/10/2024 04:14:14 PM --- Done page: 1/1
03/10/2024 04:14:14 PM --- Number of posts for page 1: 12
03/10/2024 04:14:14 PM --- Number of posts added on 2024-10-03: 0
04/10/2024 04:14:42 PM --- Done page: 1/1
04/10/2024 04:14:42 PM --- Number of posts for page 1: 12
04/10/2024 04:14:42 PM --- Number of posts added on 2024-10-04: 0
05/10/2024 04:13:06 PM --- Done page: 1/1
05/10/2024 04:13:06 PM --- Number of posts for page 1: 12
05/10/2024 04:13:06 PM --- Number of posts added on 2024-10-05: 0
06/10/2024 04:12:28 PM --- Done page: 1/1
06/10/2024 04:12:28 PM --- Number of posts for page 1: 12
06/10/2024 04:12:28 PM --- Number of posts added on 2024-10-06: 0
07/10/2024 04:13:41 PM --- Done: Điều gì khiến con người không thể bị AI thay thế?
07/10/2024 04:14:00 PM --- Done page: 1/1
07/10/2024 04:14:00 PM --- Number of posts for page 1: 12
07/10/2024 04:14:00 PM --- Number of posts added on 2024-10-07: 1
08/10/2024 04:14:40 PM --- Done page: 1/1
08/10/2024 04:14:40 PM --- Number of posts for page 1: 12
08/10/2024 04:14:40 PM --- Number of posts added on 2024-10-08: 0
09/10/2024 04:13:45 PM --- Done page: 1/1
09/10/2024 04:13:45 PM --- Number of posts for page 1: 12
09/10/2024 04:13:45 PM --- Number of posts added on 2024-10-09: 0
10/10/2024 04:14:01 PM --- Done page: 1/1
10/10/2024 04:14:01 PM --- Number of posts for page 1: 12
10/10/2024 04:14:01 PM --- Number of posts added on 2024-10-10: 0
11/10/2024 04:13:51 PM --- Done page: 1/1
11/10/2024 04:13:51 PM --- Number of posts for page 1: 12
11/10/2024 04:13:51 PM --- Number of posts added on 2024-10-11: 0
12/10/2024 04:13:33 PM --- Done page: 1/1
12/10/2024 04:13:33 PM --- Number of posts for page 1: 12
12/10/2024 04:13:33 PM --- Number of posts added on 2024-10-12: 0
13/10/2024 04:12:56 PM --- Done page: 1/1
13/10/2024 04:12:56 PM --- Number of posts for page 1: 12
13/10/2024 04:12:56 PM --- Number of posts added on 2024-10-13: 0
14/10/2024 04:14:00 PM --- Done page: 1/1
14/10/2024 04:14:00 PM --- Number of posts for page 1: 12
14/10/2024 04:14:00 PM --- Number of posts added on 2024-10-14: 0
15/10/2024 04:14:17 PM --- Done page: 1/1
15/10/2024 04:14:17 PM --- Number of posts for page 1: 12
15/10/2024 04:14:17 PM --- Number of posts added on 2024-10-15: 0
16/10/2024 04:13:14 PM --- Done page: 1/1
16/10/2024 04:13:14 PM --- Number of posts for page 1: 12
16/10/2024 04:13:14 PM --- Number of posts added on 2024-10-16: 0
17/10/2024 04:15:10 PM --- Done page: 1/1
17/10/2024 04:15:10 PM --- Number of posts for page 1: 12
17/10/2024 04:15:10 PM --- Number of posts added on 2024-10-17: 0
18/10/2024 04:14:20 PM --- Done page: 1/1
18/10/2024 04:14:20 PM --- Number of posts for page 1: 12
18/10/2024 04:14:20 PM --- Number of posts added on 2024-10-18: 0
19/10/2024 04:13:17 PM --- Done page: 1/1
19/10/2024 04:13:17 PM --- Number of posts for page 1: 12
19/10/2024 04:13:17 PM --- Number of posts added on 2024-10-19: 0
20/10/2024 04:13:08 PM --- Done page: 1/1
20/10/2024 04:13:08 PM --- Number of posts for page 1: 12
20/10/2024 04:13:08 PM --- Number of posts added on 2024-10-20: 0
21/10/2024 04:13:59 PM --- Done page: 1/1
21/10/2024 04:13:59 PM --- Number of posts for page 1: 12
21/10/2024 04:13:59 PM --- Number of posts added on 2024-10-21: 0
22/10/2024 04:14:32 PM --- Done page: 1/1
22/10/2024 04:14:32 PM --- Number of posts for page 1: 12
22/10/2024 04:14:32 PM --- Number of posts added on 2024-10-22: 0
23/10/2024 04:14:28 PM --- Done page: 1/1
23/10/2024 04:14:28 PM --- Number of posts for page 1: 12
23/10/2024 04:14:28 PM --- Number of posts added on 2024-10-23: 0
24/10/2024 04:13:38 PM --- Done page: 1/1
24/10/2024 04:13:38 PM --- Number of posts for page 1: 12
24/10/2024 04:13:38 PM --- Number of posts added on 2024-10-24: 0
25/10/2024 04:14:14 PM --- Done page: 1/1
25/10/2024 04:14:14 PM --- Number of posts for page 1: 12
25/10/2024 04:14:14 PM --- Number of posts added on 2024-10-25: 0
26/10/2024 04:13:00 PM --- Done page: 1/1
26/10/2024 04:13:00 PM --- Number of posts for page 1: 12
26/10/2024 04:13:00 PM --- Number of posts added on 2024-10-26: 0
27/10/2024 04:13:02 PM --- Done page: 1/1
27/10/2024 04:13:02 PM --- Number of posts for page 1: 12
27/10/2024 04:13:02 PM --- Number of posts added on 2024-10-27: 0
28/10/2024 04:14:34 PM --- Done page: 1/1
28/10/2024 04:14:34 PM --- Number of posts for page 1: 12
28/10/2024 04:14:34 PM --- Number of posts added on 2024-10-28: 0
29/10/2024 04:14:49 PM --- Done page: 1/1
29/10/2024 04:14:49 PM --- Number of posts for page 1: 12
29/10/2024 04:14:49 PM --- Number of posts added on 2024-10-29: 0
30/10/2024 04:14:49 PM --- Done page: 1/1
30/10/2024 04:14:49 PM --- Number of posts for page 1: 12
30/10/2024 04:14:49 PM --- Number of posts added on 2024-10-30: 0
31/10/2024 04:14:39 PM --- Done page: 1/1
31/10/2024 04:14:39 PM --- Number of posts for page 1: 12
31/10/2024 04:14:39 PM --- Number of posts added on 2024-10-31: 0
01/11/2024 04:13:59 PM --- Done page: 1/1
01/11/2024 04:13:59 PM --- Number of posts for page 1: 12
01/11/2024 04:13:59 PM --- Number of posts added on 2024-11-01: 0
02/11/2024 04:12:56 PM --- Done page: 1/1
02/11/2024 04:12:56 PM --- Number of posts for page 1: 12
02/11/2024 04:12:56 PM --- Number of posts added on 2024-11-02: 0
03/11/2024 04:13:16 PM --- Done page: 1/1
03/11/2024 04:13:16 PM --- Number of posts for page 1: 12
03/11/2024 04:13:16 PM --- Number of posts added on 2024-11-03: 0
04/11/2024 04:14:39 PM --- Done page: 1/1
04/11/2024 04:14:39 PM --- Number of posts for page 1: 12
04/11/2024 04:14:39 PM --- Number of posts added on 2024-11-04: 0
05/11/2024 04:14:25 PM --- Done page: 1/1
05/11/2024 04:14:25 PM --- Number of posts for page 1: 12
05/11/2024 04:14:25 PM --- Number of posts added on 2024-11-05: 0
06/11/2024 04:14:58 PM --- Done page: 1/1
06/11/2024 04:14:58 PM --- Number of posts for page 1: 12
06/11/2024 04:14:58 PM --- Number of posts added on 2024-11-06: 0
07/11/2024 04:14:12 PM --- Done page: 1/1
07/11/2024 04:14:12 PM --- Number of posts for page 1: 12
07/11/2024 04:14:12 PM --- Number of posts added on 2024-11-07: 0
08/11/2024 04:14:00 PM --- Done page: 1/1
08/11/2024 04:14:00 PM --- Number of posts for page 1: 12
08/11/2024 04:14:00 PM --- Number of posts added on 2024-11-08: 0
09/11/2024 04:12:15 PM --- Done page: 1/1
09/11/2024 04:12:15 PM --- Number of posts for page 1: 12
09/11/2024 04:12:15 PM --- Number of posts added on 2024-11-09: 0
10/11/2024 04:12:22 PM --- Done page: 1/1
10/11/2024 04:12:22 PM --- Number of posts for page 1: 12
10/11/2024 04:12:22 PM --- Number of posts added on 2024-11-10: 0
11/11/2024 04:14:22 PM --- Done page: 1/1
11/11/2024 04:14:22 PM --- Number of posts for page 1: 12
11/11/2024 04:14:22 PM --- Number of posts added on 2024-11-11: 0
12/11/2024 04:14:16 PM --- Done page: 1/1
12/11/2024 04:14:16 PM --- Number of posts for page 1: 12
12/11/2024 04:14:16 PM --- Number of posts added on 2024-11-12: 0
13/11/2024 04:14:39 PM --- Done page: 1/1
13/11/2024 04:14:39 PM --- Number of posts for page 1: 12
13/11/2024 04:14:39 PM --- Number of posts added on 2024-11-13: 0
14/11/2024 04:14:41 PM --- Done page: 1/1
14/11/2024 04:14:41 PM --- Number of posts for page 1: 12
14/11/2024 04:14:41 PM --- Number of posts added on 2024-11-14: 0
15/11/2024 04:14:40 PM --- Done page: 1/1
15/11/2024 04:14:40 PM --- Number of posts for page 1: 12
15/11/2024 04:14:40 PM --- Number of posts added on 2024-11-15: 0
16/11/2024 04:13:59 PM --- Done page: 1/1
16/11/2024 04:13:59 PM --- Number of posts for page 1: 12
16/11/2024 04:13:59 PM --- Number of posts added on 2024-11-16: 0
17/11/2024 04:12:55 PM --- Done page: 1/1
17/11/2024 04:12:55 PM --- Number of posts for page 1: 12
17/11/2024 04:12:55 PM --- Number of posts added on 2024-11-17: 0
18/11/2024 04:14:50 PM --- Done page: 1/1
18/11/2024 04:14:50 PM --- Number of posts for page 1: 12
18/11/2024 04:14:50 PM --- Number of posts added on 2024-11-18: 0
19/11/2024 04:15:05 PM --- Done page: 1/1
19/11/2024 04:15:05 PM --- Number of posts for page 1: 12
19/11/2024 04:15:05 PM --- Number of posts added on 2024-11-19: 0
20/11/2024 04:14:56 PM --- Done page: 1/1
20/11/2024 04:14:56 PM --- Number of posts for page 1: 12
20/11/2024 04:14:56 PM --- Number of posts added on 2024-11-20: 0
21/11/2024 04:14:58 PM --- Done page: 1/1
21/11/2024 04:14:58 PM --- Number of posts for page 1: 12
21/11/2024 04:14:58 PM --- Number of posts added on 2024-11-21: 0
22/11/2024 04:14:32 PM --- Done page: 1/1
22/11/2024 04:14:32 PM --- Number of posts for page 1: 12
22/11/2024 04:14:32 PM --- Number of posts added on 2024-11-22: 0
23/11/2024 04:13:27 PM --- Done page: 1/1
23/11/2024 04:13:27 PM --- Number of posts for page 1: 12
23/11/2024 04:13:27 PM --- Number of posts added on 2024-11-23: 0
24/11/2024 04:13:48 PM --- Done page: 1/1
24/11/2024 04:13:48 PM --- Number of posts for page 1: 12
24/11/2024 04:13:48 PM --- Number of posts added on 2024-11-24: 0
25/11/2024 04:15:00 PM --- Done page: 1/1
25/11/2024 04:15:00 PM --- Number of posts for page 1: 12
25/11/2024 04:15:00 PM --- Number of posts added on 2024-11-25: 0
26/11/2024 04:15:36 PM --- Done page: 1/1
26/11/2024 04:15:36 PM --- Number of posts for page 1: 12
26/11/2024 04:15:36 PM --- Number of posts added on 2024-11-26: 0
27/11/2024 04:14:48 PM --- Done page: 1/1
27/11/2024 04:14:48 PM --- Number of posts for page 1: 12
27/11/2024 04:14:48 PM --- Number of posts added on 2024-11-27: 0
28/11/2024 04:14:30 PM --- Done page: 1/1
28/11/2024 04:14:30 PM --- Number of posts for page 1: 12
28/11/2024 04:14:30 PM --- Number of posts added on 2024-11-28: 0
29/11/2024 04:14:56 PM --- Done page: 1/1
29/11/2024 04:14:56 PM --- Number of posts for page 1: 12
29/11/2024 04:14:56 PM --- Number of posts added on 2024-11-29: 0
30/11/2024 04:13:08 PM --- Done page: 1/1
30/11/2024 04:13:08 PM --- Number of posts for page 1: 12
30/11/2024 04:13:08 PM --- Number of posts added on 2024-11-30: 0
01/12/2024 04:13:20 PM --- Done page: 1/1
01/12/2024 04:13:20 PM --- Number of posts for page 1: 12
01/12/2024 04:13:20 PM --- Number of posts added on 2024-12-01: 0
02/12/2024 04:15:33 PM --- Done page: 1/1
02/12/2024 04:15:33 PM --- Number of posts for page 1: 12
02/12/2024 04:15:33 PM --- Number of posts added on 2024-12-02: 0
03/12/2024 04:15:20 PM --- Done page: 1/1
03/12/2024 04:15:20 PM --- Number of posts for page 1: 12
03/12/2024 04:15:20 PM --- Number of posts added on 2024-12-03: 0
04/12/2024 04:16:06 PM --- Done page: 1/1
04/12/2024 04:16:06 PM --- Number of posts for page 1: 12
04/12/2024 04:16:06 PM --- Number of posts added on 2024-12-04: 0
05/12/2024 04:15:58 PM --- Done page: 1/1
05/12/2024 04:15:58 PM --- Number of posts for page 1: 12
05/12/2024 04:15:58 PM --- Number of posts added on 2024-12-05: 0
06/12/2024 04:15:08 PM --- Done page: 1/1
06/12/2024 04:15:08 PM --- Number of posts for page 1: 12
06/12/2024 04:15:08 PM --- Number of posts added on 2024-12-06: 0
07/12/2024 04:13:26 PM --- Done page: 1/1
07/12/2024 04:13:26 PM --- Number of posts for page 1: 12
07/12/2024 04:13:26 PM --- Number of posts added on 2024-12-07: 0
08/12/2024 04:13:42 PM --- Done page: 1/1
08/12/2024 04:13:42 PM --- Number of posts for page 1: 12
08/12/2024 04:13:42 PM --- Number of posts added on 2024-12-08: 0
09/12/2024 04:16:04 PM --- Done page: 1/1
09/12/2024 04:16:04 PM --- Number of posts for page 1: 12
09/12/2024 04:16:04 PM --- Number of posts added on 2024-12-09: 0
10/12/2024 04:16:00 PM --- Done page: 1/1
10/12/2024 04:16:00 PM --- Number of posts for page 1: 12
10/12/2024 04:16:00 PM --- Number of posts added on 2024-12-10: 0
11/12/2024 04:15:44 PM --- Done page: 1/1
11/12/2024 04:15:44 PM --- Number of posts for page 1: 12
11/12/2024 04:15:44 PM --- Number of posts added on 2024-12-11: 0
12/12/2024 04:15:53 PM --- Done page: 1/1
12/12/2024 04:15:53 PM --- Number of posts for page 1: 12
12/12/2024 04:15:53 PM --- Number of posts added on 2024-12-12: 0
13/12/2024 04:14:54 PM --- Done page: 1/1
13/12/2024 04:14:54 PM --- Number of posts for page 1: 12
13/12/2024 04:14:54 PM --- Number of posts added on 2024-12-13: 0
14/12/2024 04:13:35 PM --- Done page: 1/1
14/12/2024 04:13:35 PM --- Number of posts for page 1: 12
14/12/2024 04:13:35 PM --- Number of posts added on 2024-12-14: 0
15/12/2024 04:13:21 PM --- Done page: 1/1
15/12/2024 04:13:21 PM --- Number of posts for page 1: 12
15/12/2024 04:13:21 PM --- Number of posts added on 2024-12-15: 0
16/12/2024 04:15:40 PM --- Done page: 1/1
16/12/2024 04:15:40 PM --- Number of posts for page 1: 12
16/12/2024 04:15:40 PM --- Number of posts added on 2024-12-16: 0
17/12/2024 04:15:34 PM --- Done page: 1/1
17/12/2024 04:15:34 PM --- Number of posts for page 1: 12
17/12/2024 04:15:34 PM --- Number of posts added on 2024-12-17: 0
18/12/2024 04:14:50 PM --- Done page: 1/1
18/12/2024 04:14:50 PM --- Number of posts for page 1: 12
18/12/2024 04:14:50 PM --- Number of posts added on 2024-12-18: 0
19/12/2024 04:13:20 PM --- Done page: 1/1
19/12/2024 04:13:20 PM --- Number of posts for page 1: 12
19/12/2024 04:13:20 PM --- Number of posts added on 2024-12-19: 0
20/12/2024 04:13:51 PM --- Done page: 1/1
20/12/2024 04:13:51 PM --- Number of posts for page 1: 12
20/12/2024 04:13:51 PM --- Number of posts added on 2024-12-20: 0
21/12/2024 04:12:38 PM --- Done page: 1/1
21/12/2024 04:12:38 PM --- Number of posts for page 1: 12
21/12/2024 04:12:38 PM --- Number of posts added on 2024-12-21: 0
22/12/2024 04:12:20 PM --- Done page: 1/1
22/12/2024 04:12:20 PM --- Number of posts for page 1: 12
22/12/2024 04:12:20 PM --- Number of posts added on 2024-12-22: 0
23/12/2024 04:13:52 PM --- Done page: 1/1
23/12/2024 04:13:52 PM --- Number of posts for page 1: 12
23/12/2024 04:13:52 PM --- Number of posts added on 2024-12-23: 0
24/12/2024 04:13:24 PM --- Done page: 1/1
24/12/2024 04:13:24 PM --- Number of posts for page 1: 12
24/12/2024 04:13:24 PM --- Number of posts added on 2024-12-24: 0
25/12/2024 04:13:19 PM --- Done page: 1/1
25/12/2024 04:13:19 PM --- Number of posts for page 1: 12
25/12/2024 04:13:19 PM --- Number of posts added on 2024-12-25: 0
26/12/2024 04:13:50 PM --- Done page: 1/1
26/12/2024 04:13:50 PM --- Number of posts for page 1: 12
26/12/2024 04:13:50 PM --- Number of posts added on 2024-12-26: 0
27/12/2024 04:13:31 PM --- Done page: 1/1
27/12/2024 04:13:31 PM --- Number of posts for page 1: 12
27/12/2024 04:13:31 PM --- Number of posts added on 2024-12-27: 0
28/12/2024 04:12:39 PM --- Done page: 1/1
28/12/2024 04:12:39 PM --- Number of posts for page 1: 12
28/12/2024 04:12:39 PM --- Number of posts added on 2024-12-28: 0
29/12/2024 04:12:18 PM --- Done page: 1/1
29/12/2024 04:12:18 PM --- Number of posts for page 1: 12
29/12/2024 04:12:18 PM --- Number of posts added on 2024-12-29: 0
30/12/2024 04:13:42 PM --- Done page: 1/1
30/12/2024 04:13:42 PM --- Number of posts for page 1: 12
30/12/2024 04:13:42 PM --- Number of posts added on 2024-12-30: 0
31/12/2024 04:13:24 PM --- Done page: 1/1
31/12/2024 04:13:24 PM --- Number of posts for page 1: 12
31/12/2024 04:13:24 PM --- Number of posts added on 2024-12-31: 0
01/01/2025 04:13:25 PM --- Done page: 1/1
01/01/2025 04:13:25 PM --- Number of posts for page 1: 12
01/01/2025 04:13:25 PM --- Number of posts added on 2025-01-01: 0
02/01/2025 04:14:06 PM --- Done page: 1/1
02/01/2025 04:14:06 PM --- Number of posts for page 1: 12
02/01/2025 04:14:06 PM --- Number of posts added on 2025-01-02: 0
03/01/2025 04:13:53 PM --- Done page: 1/1
03/01/2025 04:13:53 PM --- Number of posts for page 1: 12
03/01/2025 04:13:53 PM --- Number of posts added on 2025-01-03: 0
04/01/2025 04:12:41 PM --- Done page: 1/1
04/01/2025 04:12:41 PM --- Number of posts for page 1: 12
04/01/2025 04:12:41 PM --- Number of posts added on 2025-01-04: 0
05/01/2025 04:12:29 PM --- Done page: 1/1
05/01/2025 04:12:29 PM --- Number of posts for page 1: 12
05/01/2025 04:12:29 PM --- Number of posts added on 2025-01-05: 0
06/01/2025 04:14:13 PM --- Done page: 1/1
06/01/2025 04:14:13 PM --- Number of posts for page 1: 12
06/01/2025 04:14:13 PM --- Number of posts added on 2025-01-06: 0
07/01/2025 04:29:12 PM --- Done page: 1/1
07/01/2025 04:29:12 PM --- Number of posts for page 1: 12
07/01/2025 04:29:12 PM --- Number of posts added on 2025-01-07: 0
08/01/2025 04:14:05 PM --- Done page: 1/1
08/01/2025 04:14:05 PM --- Number of posts for page 1: 12
08/01/2025 04:14:05 PM --- Number of posts added on 2025-01-08: 0
09/01/2025 04:14:26 PM --- Done page: 1/1
09/01/2025 04:14:26 PM --- Number of posts for page 1: 12
09/01/2025 04:14:26 PM --- Number of posts added on 2025-01-09: 0
10/01/2025 04:14:12 PM --- Done page: 1/1
10/01/2025 04:14:12 PM --- Number of posts for page 1: 12
10/01/2025 04:14:12 PM --- Number of posts added on 2025-01-10: 0
11/01/2025 04:12:45 PM --- Done page: 1/1
11/01/2025 04:12:45 PM --- Number of posts for page 1: 12
11/01/2025 04:12:45 PM --- Number of posts added on 2025-01-11: 0
12/01/2025 04:12:23 PM --- Done page: 1/1
12/01/2025 04:12:23 PM --- Number of posts for page 1: 12
12/01/2025 04:12:23 PM --- Number of posts added on 2025-01-12: 0
13/01/2025 04:15:03 PM --- Done page: 1/1
13/01/2025 04:15:03 PM --- Number of posts for page 1: 12
13/01/2025 04:15:03 PM --- Number of posts added on 2025-01-13: 0
14/01/2025 04:15:02 PM --- Done page: 1/1
14/01/2025 04:15:02 PM --- Number of posts for page 1: 12
14/01/2025 04:15:02 PM --- Number of posts added on 2025-01-14: 0
15/01/2025 04:13:45 PM --- Done page: 1/1
15/01/2025 04:13:45 PM --- Number of posts for page 1: 12
15/01/2025 04:13:45 PM --- Number of posts added on 2025-01-15: 0
16/01/2025 04:13:44 PM --- Done page: 1/1
16/01/2025 04:13:44 PM --- Number of posts for page 1: 12
16/01/2025 04:13:44 PM --- Number of posts added on 2025-01-16: 0
17/01/2025 04:13:25 PM --- Done page: 1/1
17/01/2025 04:13:25 PM --- Number of posts for page 1: 12
17/01/2025 04:13:25 PM --- Number of posts added on 2025-01-17: 0
18/01/2025 04:12:05 PM --- Done page: 1/1
18/01/2025 04:12:05 PM --- Number of posts for page 1: 12
18/01/2025 04:12:05 PM --- Number of posts added on 2025-01-18: 0
19/01/2025 04:12:19 PM --- Done page: 1/1
19/01/2025 04:12:19 PM --- Number of posts for page 1: 12
19/01/2025 04:12:19 PM --- Number of posts added on 2025-01-19: 0
20/01/2025 04:13:42 PM --- Done page: 1/1
20/01/2025 04:13:42 PM --- Number of posts for page 1: 12
20/01/2025 04:13:42 PM --- Number of posts added on 2025-01-20: 0
21/01/2025 04:13:55 PM --- Done page: 1/1
21/01/2025 04:13:55 PM --- Number of posts for page 1: 12
21/01/2025 04:13:55 PM --- Number of posts added on 2025-01-21: 0
22/01/2025 04:14:14 PM --- Done page: 1/1
22/01/2025 04:14:14 PM --- Number of posts for page 1: 12
22/01/2025 04:14:14 PM --- Number of posts added on 2025-01-22: 0
23/01/2025 04:14:06 PM --- Done page: 1/1
23/01/2025 04:14:06 PM --- Number of posts for page 1: 12
23/01/2025 04:14:06 PM --- Number of posts added on 2025-01-23: 0
24/01/2025 04:13:46 PM --- Done page: 1/1
24/01/2025 04:13:46 PM --- Number of posts for page 1: 12
24/01/2025 04:13:46 PM --- Number of posts added on 2025-01-24: 0
25/01/2025 04:13:08 PM --- Done page: 1/1
25/01/2025 04:13:08 PM --- Number of posts for page 1: 12
25/01/2025 04:13:08 PM --- Number of posts added on 2025-01-25: 0
26/01/2025 04:12:30 PM --- Done page: 1/1
26/01/2025 04:12:30 PM --- Number of posts for page 1: 12
26/01/2025 04:12:30 PM --- Number of posts added on 2025-01-26: 0
27/01/2025 04:14:50 PM --- Done page: 1/1
27/01/2025 04:14:50 PM --- Number of posts for page 1: 12
27/01/2025 04:14:50 PM --- Number of posts added on 2025-01-27: 0
28/01/2025 04:13:55 PM --- Done page: 1/1
28/01/2025 04:13:55 PM --- Number of posts for page 1: 12
28/01/2025 04:13:55 PM --- Number of posts added on 2025-01-28: 0
29/01/2025 04:14:40 PM --- Done page: 1/1
29/01/2025 04:14:40 PM --- Number of posts for page 1: 12
29/01/2025 04:14:40 PM --- Number of posts added on 2025-01-29: 0
30/01/2025 04:14:02 PM --- Done page: 1/1
30/01/2025 04:14:02 PM --- Number of posts for page 1: 12
30/01/2025 04:14:02 PM --- Number of posts added on 2025-01-30: 0
31/01/2025 04:13:57 PM --- Done page: 1/1
31/01/2025 04:13:57 PM --- Number of posts for page 1: 12
31/01/2025 04:13:57 PM --- Number of posts added on 2025-01-31: 0
01/02/2025 04:12:10 PM --- Done page: 1/1
01/02/2025 04:12:10 PM --- Number of posts for page 1: 12
01/02/2025 04:12:10 PM --- Number of posts added on 2025-02-01: 0
02/02/2025 04:12:54 PM --- Done page: 1/1
02/02/2025 04:12:54 PM --- Number of posts for page 1: 12
02/02/2025 04:12:54 PM --- Number of posts added on 2025-02-02: 0
03/02/2025 04:14:14 PM --- Done page: 1/1
03/02/2025 04:14:14 PM --- Number of posts for page 1: 12
03/02/2025 04:14:14 PM --- Number of posts added on 2025-02-03: 0
04/02/2025 04:14:18 PM --- Done page: 1/1
04/02/2025 04:14:18 PM --- Number of posts for page 1: 12
04/02/2025 04:14:18 PM --- Number of posts added on 2025-02-04: 0
05/02/2025 04:14:27 PM --- Done page: 1/1
05/02/2025 04:14:27 PM --- Number of posts for page 1: 12
05/02/2025 04:14:27 PM --- Number of posts added on 2025-02-05: 0
06/02/2025 04:12:41 PM --- Done page: 1/1
06/02/2025 04:12:41 PM --- Number of posts for page 1: 12
06/02/2025 04:12:41 PM --- Number of posts added on 2025-02-06: 0
07/02/2025 04:14:13 PM --- Done page: 1/1
07/02/2025 04:14:13 PM --- Number of posts for page 1: 12
07/02/2025 04:14:13 PM --- Number of posts added on 2025-02-07: 0
08/02/2025 04:12:25 PM --- Done page: 1/1
08/02/2025 04:12:25 PM --- Number of posts for page 1: 12
08/02/2025 04:12:25 PM --- Number of posts added on 2025-02-08: 0
09/02/2025 04:12:19 PM --- Done page: 1/1
09/02/2025 04:12:19 PM --- Number of posts for page 1: 12
09/02/2025 04:12:19 PM --- Number of posts added on 2025-02-09: 0
10/02/2025 04:14:29 PM --- Done page: 1/1
10/02/2025 04:14:29 PM --- Number of posts for page 1: 12
10/02/2025 04:14:29 PM --- Number of posts added on 2025-02-10: 0
11/02/2025 04:15:14 PM --- Done page: 1/1
11/02/2025 04:15:14 PM --- Number of posts for page 1: 12
11/02/2025 04:15:14 PM --- Number of posts added on 2025-02-11: 0
12/02/2025 04:14:49 PM --- Done page: 1/1
12/02/2025 04:14:49 PM --- Number of posts for page 1: 12
12/02/2025 04:14:49 PM --- Number of posts added on 2025-02-12: 0
13/02/2025 04:15:03 PM --- Done page: 1/1
13/02/2025 04:15:03 PM --- Number of posts for page 1: 12
13/02/2025 04:15:03 PM --- Number of posts added on 2025-02-13: 0
14/02/2025 04:13:57 PM --- Done page: 1/1
14/02/2025 04:13:57 PM --- Number of posts for page 1: 12
14/02/2025 04:13:57 PM --- Number of posts added on 2025-02-14: 0
15/02/2025 04:12:27 PM --- Done page: 1/1
15/02/2025 04:12:27 PM --- Number of posts for page 1: 12
15/02/2025 04:12:27 PM --- Number of posts added on 2025-02-15: 0
16/02/2025 04:12:31 PM --- Done page: 1/1
16/02/2025 04:12:31 PM --- Number of posts for page 1: 12
16/02/2025 04:12:31 PM --- Number of posts added on 2025-02-16: 0
17/02/2025 04:14:24 PM --- Done page: 1/1
17/02/2025 04:14:24 PM --- Number of posts for page 1: 12
17/02/2025 04:14:24 PM --- Number of posts added on 2025-02-17: 0
18/02/2025 04:14:57 PM --- Done page: 1/1
18/02/2025 04:14:57 PM --- Number of posts for page 1: 12
18/02/2025 04:14:57 PM --- Number of posts added on 2025-02-18: 0
19/02/2025 04:14:56 PM --- Done page: 1/1
19/02/2025 04:14:56 PM --- Number of posts for page 1: 12
19/02/2025 04:14:56 PM --- Number of posts added on 2025-02-19: 0
20/02/2025 04:15:07 PM --- Done page: 1/1
20/02/2025 04:15:07 PM --- Number of posts for page 1: 12
20/02/2025 04:15:07 PM --- Number of posts added on 2025-02-20: 0
21/02/2025 04:14:13 PM --- Done page: 1/1
21/02/2025 04:14:13 PM --- Number of posts for page 1: 12
21/02/2025 04:14:13 PM --- Number of posts added on 2025-02-21: 0
22/02/2025 04:12:19 PM --- Done page: 1/1
22/02/2025 04:12:19 PM --- Number of posts for page 1: 12
22/02/2025 04:12:19 PM --- Number of posts added on 2025-02-22: 0
23/02/2025 04:12:29 PM --- Done page: 1/1
23/02/2025 04:12:29 PM --- Number of posts for page 1: 12
23/02/2025 04:12:29 PM --- Number of posts added on 2025-02-23: 0
24/02/2025 04:15:22 PM --- Done page: 1/1
24/02/2025 04:15:22 PM --- Number of posts for page 1: 12
24/02/2025 04:15:22 PM --- Number of posts added on 2025-02-24: 0
25/02/2025 04:15:00 PM --- Done page: 1/1
25/02/2025 04:15:00 PM --- Number of posts for page 1: 12
25/02/2025 04:15:00 PM --- Number of posts added on 2025-02-25: 0
26/02/2025 04:15:05 PM --- Done page: 1/1
26/02/2025 04:15:05 PM --- Number of posts for page 1: 12
26/02/2025 04:15:05 PM --- Number of posts added on 2025-02-26: 0
27/02/2025 04:15:23 PM --- Done page: 1/1
27/02/2025 04:15:23 PM --- Number of posts for page 1: 12
27/02/2025 04:15:23 PM --- Number of posts added on 2025-02-27: 0
28/02/2025 04:14:38 PM --- Done page: 1/1
28/02/2025 04:14:38 PM --- Number of posts for page 1: 12
28/02/2025 04:14:38 PM --- Number of posts added on 2025-02-28: 0
01/03/2025 04:12:48 PM --- Done page: 1/1
01/03/2025 04:12:48 PM --- Number of posts for page 1: 12
01/03/2025 04:12:48 PM --- Number of posts added on 2025-03-01: 0
02/03/2025 04:13:50 PM --- Done page: 1/1
02/03/2025 04:13:50 PM --- Number of posts for page 1: 12
02/03/2025 04:13:50 PM --- Number of posts added on 2025-03-02: 0
03/03/2025 04:14:53 PM --- Done page: 1/1
03/03/2025 04:14:53 PM --- Number of posts for page 1: 12
03/03/2025 04:14:53 PM --- Number of posts added on 2025-03-03: 0
04/03/2025 04:15:16 PM --- Done page: 1/1
04/03/2025 04:15:16 PM --- Number of posts for page 1: 12
04/03/2025 04:15:16 PM --- Number of posts added on 2025-03-04: 0
05/03/2025 04:20:17 PM --- Done page: 1/1
05/03/2025 04:20:17 PM --- Number of posts for page 1: 12
05/03/2025 04:20:17 PM --- Number of posts added on 2025-03-05: 0
06/03/2025 04:14:50 PM --- Done page: 1/1
06/03/2025 04:14:50 PM --- Number of posts for page 1: 12
06/03/2025 04:14:50 PM --- Number of posts added on 2025-03-06: 0
07/03/2025 04:14:40 PM --- Done page: 1/1
07/03/2025 04:14:40 PM --- Number of posts for page 1: 12
07/03/2025 04:14:40 PM --- Number of posts added on 2025-03-07: 0
08/03/2025 04:11:45 PM --- Done page: 1/1
08/03/2025 04:11:45 PM --- Number of posts for page 1: 12
08/03/2025 04:11:45 PM --- Number of posts added on 2025-03-08: 0
09/03/2025 04:11:34 PM --- Done page: 1/1
09/03/2025 04:11:34 PM --- Number of posts for page 1: 12
09/03/2025 04:11:34 PM --- Number of posts added on 2025-03-09: 0
10/03/2025 04:13:24 PM --- Done page: 1/1
10/03/2025 04:13:24 PM --- Number of posts for page 1: 12
10/03/2025 04:13:24 PM --- Number of posts added on 2025-03-10: 0
11/03/2025 04:15:51 PM --- Done page: 1/1
11/03/2025 04:15:51 PM --- Number of posts for page 1: 12
11/03/2025 04:15:51 PM --- Number of posts added on 2025-03-11: 0
12/03/2025 04:15:41 PM --- Done page: 1/1
12/03/2025 04:15:41 PM --- Number of posts for page 1: 12
12/03/2025 04:15:41 PM --- Number of posts added on 2025-03-12: 0
13/03/2025 04:15:44 PM --- Done page: 1/1
13/03/2025 04:15:44 PM --- Number of posts for page 1: 12
13/03/2025 04:15:44 PM --- Number of posts added on 2025-03-13: 0
14/03/2025 04:14:39 PM --- Done page: 1/1
14/03/2025 04:14:39 PM --- Number of posts for page 1: 12
14/03/2025 04:14:39 PM --- Number of posts added on 2025-03-14: 0
15/03/2025 04:13:07 PM --- Done page: 1/1
15/03/2025 04:13:07 PM --- Number of posts for page 1: 12
15/03/2025 04:13:07 PM --- Number of posts added on 2025-03-15: 0
16/03/2025 04:13:20 PM --- Done page: 1/1
16/03/2025 04:13:20 PM --- Number of posts for page 1: 12
16/03/2025 04:13:20 PM --- Number of posts added on 2025-03-16: 0
17/03/2025 04:16:12 PM --- Done page: 1/1
17/03/2025 04:16:12 PM --- Number of posts for page 1: 12
17/03/2025 04:16:12 PM --- Number of posts added on 2025-03-17: 0
18/03/2025 04:15:55 PM --- Done page: 1/1
18/03/2025 04:15:55 PM --- Number of posts for page 1: 12
18/03/2025 04:15:55 PM --- Number of posts added on 2025-03-18: 0
19/03/2025 04:15:22 PM --- Done page: 1/1
19/03/2025 04:15:22 PM --- Number of posts for page 1: 12
19/03/2025 04:15:22 PM --- Number of posts added on 2025-03-19: 0
20/03/2025 04:15:50 PM --- Done page: 1/1
20/03/2025 04:15:50 PM --- Number of posts for page 1: 12
20/03/2025 04:15:50 PM --- Number of posts added on 2025-03-20: 0
21/03/2025 04:15:27 PM --- Done page: 1/1
21/03/2025 04:15:27 PM --- Number of posts for page 1: 12
21/03/2025 04:15:27 PM --- Number of posts added on 2025-03-21: 0
22/03/2025 04:13:25 PM --- Done page: 1/1
22/03/2025 04:13:25 PM --- Number of posts for page 1: 12
22/03/2025 04:13:25 PM --- Number of posts added on 2025-03-22: 0
23/03/2025 04:13:19 PM --- Done page: 1/1
23/03/2025 04:13:19 PM --- Number of posts for page 1: 12
23/03/2025 04:13:19 PM --- Number of posts added on 2025-03-23: 0
25/03/2025 02:45:53 PM --- Done page: 1/1
25/03/2025 02:45:53 PM --- Number of posts for page 1: 12
25/03/2025 02:45:53 PM --- Number of posts added on 2025-03-25: 0
25/03/2025 04:14:30 PM --- Done page: 1/1
25/03/2025 04:14:30 PM --- Number of posts for page 1: 12
25/03/2025 04:14:30 PM --- Number of posts added on 2025-03-25: 0
26/03/2025 04:16:18 PM --- Done page: 1/1
26/03/2025 04:16:18 PM --- Number of posts for page 1: 12
26/03/2025 04:16:18 PM --- Number of posts added on 2025-03-26: 0
27/03/2025 04:15:47 PM --- Done page: 1/1
27/03/2025 04:15:47 PM --- Number of posts for page 1: 12
27/03/2025 04:15:47 PM --- Number of posts added on 2025-03-27: 0
28/03/2025 04:15:10 PM --- Done page: 1/1
28/03/2025 04:15:10 PM --- Number of posts for page 1: 12
28/03/2025 04:15:10 PM --- Number of posts added on 2025-03-28: 0
29/03/2025 04:13:28 PM --- Done page: 1/1
29/03/2025 04:13:28 PM --- Number of posts for page 1: 12
29/03/2025 04:13:28 PM --- Number of posts added on 2025-03-29: 0
30/03/2025 04:13:34 PM --- Done page: 1/1
30/03/2025 04:13:34 PM --- Number of posts for page 1: 12
30/03/2025 04:13:34 PM --- Number of posts added on 2025-03-30: 0
31/03/2025 04:15:28 PM --- Done page: 1/1
31/03/2025 04:15:28 PM --- Number of posts for page 1: 12
31/03/2025 04:15:28 PM --- Number of posts added on 2025-03-31: 0
01/04/2025 04:14:50 PM --- Done page: 1/1
01/04/2025 04:14:50 PM --- Number of posts for page 1: 12
01/04/2025 04:14:50 PM --- Number of posts added on 2025-04-01: 0
02/04/2025 04:16:21 PM --- Done page: 1/1
02/04/2025 04:16:21 PM --- Number of posts for page 1: 12
02/04/2025 04:16:21 PM --- Number of posts added on 2025-04-02: 0
03/04/2025 04:15:19 PM --- Done page: 1/1
03/04/2025 04:15:19 PM --- Number of posts for page 1: 12
03/04/2025 04:15:19 PM --- Number of posts added on 2025-04-03: 0
04/04/2025 04:14:43 PM --- Done page: 1/1
04/04/2025 04:14:43 PM --- Number of posts for page 1: 12
04/04/2025 04:14:43 PM --- Number of posts added on 2025-04-04: 0
05/04/2025 04:13:15 PM --- Done page: 1/1
05/04/2025 04:13:15 PM --- Number of posts for page 1: 12
05/04/2025 04:13:15 PM --- Number of posts added on 2025-04-05: 0
06/04/2025 04:13:29 PM --- Done page: 1/1
06/04/2025 04:13:29 PM --- Number of posts for page 1: 12
06/04/2025 04:13:29 PM --- Number of posts added on 2025-04-06: 0
07/04/2025 04:14:16 PM --- Done page: 1/1
07/04/2025 04:14:16 PM --- Number of posts for page 1: 12
07/04/2025 04:14:16 PM --- Number of posts added on 2025-04-07: 0
08/04/2025 04:15:55 PM --- Done page: 1/1
08/04/2025 04:15:55 PM --- Number of posts for page 1: 12
08/04/2025 04:15:55 PM --- Number of posts added on 2025-04-08: 0
09/04/2025 04:16:14 PM --- Done page: 1/1
09/04/2025 04:16:14 PM --- Number of posts for page 1: 12
09/04/2025 04:16:14 PM --- Number of posts added on 2025-04-09: 0
10/04/2025 04:15:20 PM --- Done page: 1/1
10/04/2025 04:15:20 PM --- Number of posts for page 1: 12
10/04/2025 04:15:20 PM --- Number of posts added on 2025-04-10: 0
11/04/2025 04:15:35 PM --- Done page: 1/1
11/04/2025 04:15:35 PM --- Number of posts for page 1: 12
11/04/2025 04:15:35 PM --- Number of posts added on 2025-04-11: 0
12/04/2025 04:13:37 PM --- Done page: 1/1
12/04/2025 04:13:37 PM --- Number of posts for page 1: 12
12/04/2025 04:13:37 PM --- Number of posts added on 2025-04-12: 0
13/04/2025 04:14:40 PM --- Done page: 1/1
13/04/2025 04:14:40 PM --- Number of posts for page 1: 12
13/04/2025 04:14:40 PM --- Number of posts added on 2025-04-13: 0
14/04/2025 04:17:19 PM --- Done page: 1/1
14/04/2025 04:17:19 PM --- Number of posts for page 1: 12
14/04/2025 04:17:19 PM --- Number of posts added on 2025-04-14: 0
15/04/2025 04:14:18 PM --- Done page: 1/1
15/04/2025 04:14:18 PM --- Number of posts for page 1: 12
15/04/2025 04:14:18 PM --- Number of posts added on 2025-04-15: 0
16/04/2025 04:16:24 PM --- Done page: 1/1
16/04/2025 04:16:24 PM --- Number of posts for page 1: 12
16/04/2025 04:16:24 PM --- Number of posts added on 2025-04-16: 0
17/04/2025 04:15:54 PM --- Done page: 1/1
17/04/2025 04:15:54 PM --- Number of posts for page 1: 12
17/04/2025 04:15:54 PM --- Number of posts added on 2025-04-17: 0
18/04/2025 04:15:01 PM --- Done page: 1/1
18/04/2025 04:15:01 PM --- Number of posts for page 1: 12
18/04/2025 04:15:01 PM --- Number of posts added on 2025-04-18: 0
19/04/2025 04:14:56 PM --- Done page: 1/1
19/04/2025 04:14:56 PM --- Number of posts for page 1: 12
19/04/2025 04:14:56 PM --- Number of posts added on 2025-04-19: 0
20/04/2025 04:13:31 PM --- Done page: 1/1
20/04/2025 04:13:31 PM --- Number of posts for page 1: 12
20/04/2025 04:13:31 PM --- Number of posts added on 2025-04-20: 0
21/04/2025 04:15:14 PM --- Done page: 1/1
21/04/2025 04:15:14 PM --- Number of posts for page 1: 12
21/04/2025 04:15:14 PM --- Number of posts added on 2025-04-21: 0
22/04/2025 04:16:00 PM --- Done page: 1/1
22/04/2025 04:16:00 PM --- Number of posts for page 1: 12
22/04/2025 04:16:00 PM --- Number of posts added on 2025-04-22: 0
23/04/2025 04:16:20 PM --- Done page: 1/1
23/04/2025 04:16:20 PM --- Number of posts for page 1: 12
23/04/2025 04:16:20 PM --- Number of posts added on 2025-04-23: 0
24/04/2025 04:16:09 PM --- Done page: 1/1
24/04/2025 04:16:09 PM --- Number of posts for page 1: 12
24/04/2025 04:16:09 PM --- Number of posts added on 2025-04-24: 0
25/04/2025 04:15:34 PM --- Done page: 1/1
25/04/2025 04:15:34 PM --- Number of posts for page 1: 12
25/04/2025 04:15:34 PM --- Number of posts added on 2025-04-25: 0
26/04/2025 04:13:54 PM --- Done page: 1/1
26/04/2025 04:13:54 PM --- Number of posts for page 1: 12
26/04/2025 04:13:54 PM --- Number of posts added on 2025-04-26: 0
27/04/2025 04:14:10 PM --- Done page: 1/1
27/04/2025 04:14:10 PM --- Number of posts for page 1: 12
27/04/2025 04:14:10 PM --- Number of posts added on 2025-04-27: 0
28/04/2025 04:15:18 PM --- Done page: 1/1
28/04/2025 04:15:18 PM --- Number of posts for page 1: 12
28/04/2025 04:15:18 PM --- Number of posts added on 2025-04-28: 0
29/04/2025 04:15:44 PM --- Done page: 1/1
29/04/2025 04:15:44 PM --- Number of posts for page 1: 12
29/04/2025 04:15:44 PM --- Number of posts added on 2025-04-29: 0
30/04/2025 04:15:58 PM --- Done page: 1/1
30/04/2025 04:15:58 PM --- Number of posts for page 1: 12
30/04/2025 04:15:58 PM --- Number of posts added on 2025-04-30: 0
01/05/2025 04:16:00 PM --- Done page: 1/1
01/05/2025 04:16:00 PM --- Number of posts for page 1: 12
01/05/2025 04:16:00 PM --- Number of posts added on 2025-05-01: 0
02/05/2025 04:15:46 PM --- Done page: 1/1
02/05/2025 04:15:46 PM --- Number of posts for page 1: 12
02/05/2025 04:15:46 PM --- Number of posts added on 2025-05-02: 0
03/05/2025 04:14:10 PM --- Done page: 1/1
03/05/2025 04:14:10 PM --- Number of posts for page 1: 12
03/05/2025 04:14:10 PM --- Number of posts added on 2025-05-03: 0
04/05/2025 04:14:18 PM --- Done page: 1/1
04/05/2025 04:14:18 PM --- Number of posts for page 1: 12
04/05/2025 04:14:18 PM --- Number of posts added on 2025-05-04: 0
05/05/2025 04:16:59 PM --- Done page: 1/1
05/05/2025 04:16:59 PM --- Number of posts for page 1: 12
05/05/2025 04:16:59 PM --- Number of posts added on 2025-05-05: 0
06/05/2025 04:15:21 PM --- Done page: 1/1
06/05/2025 04:15:21 PM --- Number of posts for page 1: 12
06/05/2025 04:15:21 PM --- Number of posts added on 2025-05-06: 0
07/05/2025 04:16:39 PM --- Done page: 1/1
07/05/2025 04:16:39 PM --- Number of posts for page 1: 12
07/05/2025 04:16:39 PM --- Number of posts added on 2025-05-07: 0
08/05/2025 04:16:31 PM --- Done page: 1/1
08/05/2025 04:16:31 PM --- Number of posts for page 1: 12
08/05/2025 04:16:31 PM --- Number of posts added on 2025-05-08: 0
09/05/2025 04:15:43 PM --- Done page: 1/1
09/05/2025 04:15:43 PM --- Number of posts for page 1: 12
09/05/2025 04:15:43 PM --- Number of posts added on 2025-05-09: 0
10/05/2025 04:14:28 PM --- Done page: 1/1
10/05/2025 04:14:28 PM --- Number of posts for page 1: 12
10/05/2025 04:14:28 PM --- Number of posts added on 2025-05-10: 0
11/05/2025 04:14:08 PM --- Done page: 1/1
11/05/2025 04:14:08 PM --- Number of posts for page 1: 12
11/05/2025 04:14:08 PM --- Number of posts added on 2025-05-11: 0
12/05/2025 04:16:53 PM --- Done page: 1/1
12/05/2025 04:16:53 PM --- Number of posts for page 1: 12
12/05/2025 04:16:53 PM --- Number of posts added on 2025-05-12: 0
13/05/2025 04:16:42 PM --- Done page: 1/1
13/05/2025 04:16:42 PM --- Number of posts for page 1: 12
13/05/2025 04:16:42 PM --- Number of posts added on 2025-05-13: 0
14/05/2025 04:16:13 PM --- Done page: 1/1
14/05/2025 04:16:13 PM --- Number of posts for page 1: 12
14/05/2025 04:16:13 PM --- Number of posts added on 2025-05-14: 0
15/05/2025 04:16:51 PM --- Done page: 1/1
15/05/2025 04:16:51 PM --- Number of posts for page 1: 12
15/05/2025 04:16:51 PM --- Number of posts added on 2025-05-15: 0
16/05/2025 04:15:46 PM --- Done page: 1/1
16/05/2025 04:15:46 PM --- Number of posts for page 1: 12
16/05/2025 04:15:46 PM --- Number of posts added on 2025-05-16: 0
17/05/2025 04:14:22 PM --- Done page: 1/1
17/05/2025 04:14:22 PM --- Number of posts for page 1: 12
17/05/2025 04:14:22 PM --- Number of posts added on 2025-05-17: 0
18/05/2025 04:14:01 PM --- Done page: 1/1
18/05/2025 04:14:01 PM --- Number of posts for page 1: 12
18/05/2025 04:14:01 PM --- Number of posts added on 2025-05-18: 0
19/05/2025 04:16:20 PM --- Done page: 1/1
19/05/2025 04:16:20 PM --- Number of posts for page 1: 12
19/05/2025 04:16:20 PM --- Number of posts added on 2025-05-19: 0
20/05/2025 04:16:29 PM --- Done page: 1/1
20/05/2025 04:16:29 PM --- Number of posts for page 1: 12
20/05/2025 04:16:29 PM --- Number of posts added on 2025-05-20: 0
21/05/2025 04:16:43 PM --- Done page: 1/1
21/05/2025 04:16:43 PM --- Number of posts for page 1: 12
21/05/2025 04:16:43 PM --- Number of posts added on 2025-05-21: 0
22/05/2025 04:16:31 PM --- Done page: 1/1
22/05/2025 04:16:31 PM --- Number of posts for page 1: 12
22/05/2025 04:16:31 PM --- Number of posts added on 2025-05-22: 0
23/05/2025 04:15:26 PM --- Done page: 1/1
23/05/2025 04:15:26 PM --- Number of posts for page 1: 12
23/05/2025 04:15:26 PM --- Number of posts added on 2025-05-23: 0
24/05/2025 04:13:55 PM --- Done page: 1/1
24/05/2025 04:13:55 PM --- Number of posts for page 1: 12
24/05/2025 04:13:55 PM --- Number of posts added on 2025-05-24: 0
25/05/2025 04:14:12 PM --- Done page: 1/1
25/05/2025 04:14:12 PM --- Number of posts for page 1: 12
25/05/2025 04:14:12 PM --- Number of posts added on 2025-05-25: 0
26/05/2025 04:15:31 PM --- Done page: 1/1
26/05/2025 04:15:31 PM --- Number of posts for page 1: 12
26/05/2025 04:15:31 PM --- Number of posts added on 2025-05-26: 0
27/05/2025 04:16:31 PM --- Done page: 1/1
27/05/2025 04:16:31 PM --- Number of posts for page 1: 12
27/05/2025 04:16:31 PM --- Number of posts added on 2025-05-27: 0
28/05/2025 04:14:50 PM --- Done page: 1/1
28/05/2025 04:14:50 PM --- Number of posts for page 1: 12
28/05/2025 04:14:50 PM --- Number of posts added on 2025-05-28: 0
29/05/2025 04:15:57 PM --- Done page: 1/1
29/05/2025 04:15:57 PM --- Number of posts for page 1: 12
29/05/2025 04:15:57 PM --- Number of posts added on 2025-05-29: 0
31/05/2025 03:14:29 AM --- Done page: 1/1
31/05/2025 03:14:29 AM --- Number of posts for page 1: 12
31/05/2025 03:14:29 AM --- Number of posts added on 2025-05-31: 0
31/05/2025 04:14:18 PM --- Done page: 1/1
31/05/2025 04:14:18 PM --- Number of posts for page 1: 12
31/05/2025 04:14:18 PM --- Number of posts added on 2025-05-31: 0
01/06/2025 04:14:38 PM --- Done page: 1/1
01/06/2025 04:14:38 PM --- Number of posts for page 1: 12
01/06/2025 04:14:38 PM --- Number of posts added on 2025-06-01: 0
02/06/2025 04:17:05 PM --- Done page: 1/1
02/06/2025 04:17:05 PM --- Number of posts for page 1: 12
02/06/2025 04:17:05 PM --- Number of posts added on 2025-06-02: 0
03/06/2025 04:17:49 PM --- Done page: 1/1
03/06/2025 04:17:49 PM --- Number of posts for page 1: 12
03/06/2025 04:17:49 PM --- Number of posts added on 2025-06-03: 0
04/06/2025 04:15:49 PM --- Done page: 1/1
04/06/2025 04:15:49 PM --- Number of posts for page 1: 12
04/06/2025 04:15:49 PM --- Number of posts added on 2025-06-04: 0
05/06/2025 04:16:50 PM --- Done page: 1/1
05/06/2025 04:16:50 PM --- Number of posts for page 1: 12
05/06/2025 04:16:50 PM --- Number of posts added on 2025-06-05: 0
06/06/2025 04:17:02 PM --- Done page: 1/1
06/06/2025 04:17:02 PM --- Number of posts for page 1: 12
06/06/2025 04:17:02 PM --- Number of posts added on 2025-06-06: 0
07/06/2025 04:14:25 PM --- Done page: 1/1
07/06/2025 04:14:25 PM --- Number of posts for page 1: 12
07/06/2025 04:14:25 PM --- Number of posts added on 2025-06-07: 0
08/06/2025 04:14:38 PM --- Done page: 1/1
08/06/2025 04:14:38 PM --- Number of posts for page 1: 12
08/06/2025 04:14:38 PM --- Number of posts added on 2025-06-08: 0
09/06/2025 04:17:02 PM --- Done page: 1/1
09/06/2025 04:17:02 PM --- Number of posts for page 1: 12
09/06/2025 04:17:02 PM --- Number of posts added on 2025-06-09: 0
10/06/2025 04:17:01 PM --- Done page: 1/1
10/06/2025 04:17:01 PM --- Number of posts for page 1: 12
10/06/2025 04:17:01 PM --- Number of posts added on 2025-06-10: 0
11/06/2025 04:17:42 PM --- Done page: 1/1
11/06/2025 04:17:42 PM --- Number of posts for page 1: 12
11/06/2025 04:17:42 PM --- Number of posts added on 2025-06-11: 0
12/06/2025 04:16:33 PM --- Done page: 1/1
12/06/2025 04:16:33 PM --- Number of posts for page 1: 12
12/06/2025 04:16:33 PM --- Number of posts added on 2025-06-12: 0
13/06/2025 04:16:34 PM --- Done page: 1/1
13/06/2025 04:16:34 PM --- Number of posts for page 1: 12
13/06/2025 04:16:34 PM --- Number of posts added on 2025-06-13: 0
14/06/2025 04:14:29 PM --- Done page: 1/1
14/06/2025 04:14:29 PM --- Number of posts for page 1: 12
14/06/2025 04:14:29 PM --- Number of posts added on 2025-06-14: 0
15/06/2025 04:14:40 PM --- Done page: 1/1
15/06/2025 04:14:40 PM --- Number of posts for page 1: 12
15/06/2025 04:14:40 PM --- Number of posts added on 2025-06-15: 0
16/06/2025 04:16:49 PM --- Done page: 1/1
16/06/2025 04:16:49 PM --- Number of posts for page 1: 12
16/06/2025 04:16:49 PM --- Number of posts added on 2025-06-16: 0
17/06/2025 04:17:20 PM --- Done page: 1/1
17/06/2025 04:17:20 PM --- Number of posts for page 1: 12
17/06/2025 04:17:20 PM --- Number of posts added on 2025-06-17: 0
18/06/2025 04:16:54 PM --- Done page: 1/1
18/06/2025 04:16:54 PM --- Number of posts for page 1: 12
18/06/2025 04:16:54 PM --- Number of posts added on 2025-06-18: 0
19/06/2025 04:16:30 PM --- Done page: 1/1
19/06/2025 04:16:30 PM --- Number of posts for page 1: 12
19/06/2025 04:16:30 PM --- Number of posts added on 2025-06-19: 0
20/06/2025 04:16:26 PM --- Done page: 1/1
20/06/2025 04:16:26 PM --- Number of posts for page 1: 12
20/06/2025 04:16:26 PM --- Number of posts added on 2025-06-20: 0
21/06/2025 04:14:32 PM --- Done page: 1/1
21/06/2025 04:14:32 PM --- Number of posts for page 1: 12
21/06/2025 04:14:32 PM --- Number of posts added on 2025-06-21: 0
22/06/2025 04:14:52 PM --- Done page: 1/1
22/06/2025 04:14:52 PM --- Number of posts for page 1: 12
22/06/2025 04:14:52 PM --- Number of posts added on 2025-06-22: 0
23/06/2025 04:17:12 PM --- Done page: 1/1
23/06/2025 04:17:12 PM --- Number of posts for page 1: 12
23/06/2025 04:17:12 PM --- Number of posts added on 2025-06-23: 0
24/06/2025 04:16:59 PM --- Done page: 1/1
24/06/2025 04:16:59 PM --- Number of posts for page 1: 12
24/06/2025 04:16:59 PM --- Number of posts added on 2025-06-24: 0
25/06/2025 04:17:16 PM --- Done page: 1/1
25/06/2025 04:17:16 PM --- Number of posts for page 1: 12
25/06/2025 04:17:16 PM --- Number of posts added on 2025-06-25: 0
26/06/2025 04:16:45 PM --- Done page: 1/1
26/06/2025 04:16:45 PM --- Number of posts for page 1: 12
26/06/2025 04:16:45 PM --- Number of posts added on 2025-06-26: 0
27/06/2025 04:16:43 PM --- Done page: 1/1
27/06/2025 04:16:43 PM --- Number of posts for page 1: 12
27/06/2025 04:16:43 PM --- Number of posts added on 2025-06-27: 0
28/06/2025 04:14:52 PM --- Done page: 1/1
28/06/2025 04:14:52 PM --- Number of posts for page 1: 12
28/06/2025 04:14:52 PM --- Number of posts added on 2025-06-28: 0
29/06/2025 04:14:40 PM --- Done page: 1/1
29/06/2025 04:14:40 PM --- Number of posts for page 1: 12
29/06/2025 04:14:40 PM --- Number of posts added on 2025-06-29: 0
30/06/2025 04:16:39 PM --- Done page: 1/1
30/06/2025 04:16:39 PM --- Number of posts for page 1: 12
30/06/2025 04:16:39 PM --- Number of posts added on 2025-06-30: 0
01/07/2025 04:17:32 PM --- Done page: 1/1
01/07/2025 04:17:32 PM --- Number of posts for page 1: 12
01/07/2025 04:17:32 PM --- Number of posts added on 2025-07-01: 0
02/07/2025 04:16:40 PM --- Done page: 1/1
02/07/2025 04:16:40 PM --- Number of posts for page 1: 12
02/07/2025 04:16:40 PM --- Number of posts added on 2025-07-02: 0
03/07/2025 04:16:44 PM --- Done page: 1/1
03/07/2025 04:16:44 PM --- Number of posts for page 1: 12
03/07/2025 04:16:44 PM --- Number of posts added on 2025-07-03: 0
04/07/2025 04:16:00 PM --- Done page: 1/1
04/07/2025 04:16:00 PM --- Number of posts for page 1: 12
04/07/2025 04:16:00 PM --- Number of posts added on 2025-07-04: 0
05/07/2025 04:15:04 PM --- Done page: 1/1
05/07/2025 04:15:04 PM --- Number of posts for page 1: 12
05/07/2025 04:15:04 PM --- Number of posts added on 2025-07-05: 0
06/07/2025 04:14:59 PM --- Done page: 1/1
06/07/2025 04:14:59 PM --- Number of posts for page 1: 12
06/07/2025 04:14:59 PM --- Number of posts added on 2025-07-06: 0
07/07/2025 04:16:57 PM --- Done page: 1/1
07/07/2025 04:16:57 PM --- Number of posts for page 1: 12
07/07/2025 04:16:57 PM --- Number of posts added on 2025-07-07: 0
08/07/2025 04:17:13 PM --- Done page: 1/1
08/07/2025 04:17:13 PM --- Number of posts for page 1: 12
08/07/2025 04:17:13 PM --- Number of posts added on 2025-07-08: 0
09/07/2025 04:14:52 PM --- Done page: 1/1
09/07/2025 04:14:52 PM --- Number of posts for page 1: 12
09/07/2025 04:14:52 PM --- Number of posts added on 2025-07-09: 0
10/07/2025 04:17:07 PM --- Done page: 1/1
10/07/2025 04:17:07 PM --- Number of posts for page 1: 12
10/07/2025 04:17:07 PM --- Number of posts added on 2025-07-10: 0
11/07/2025 04:16:36 PM --- Done page: 1/1
11/07/2025 04:16:36 PM --- Number of posts for page 1: 12
11/07/2025 04:16:36 PM --- Number of posts added on 2025-07-11: 0
12/07/2025 04:14:59 PM --- Done page: 1/1
12/07/2025 04:14:59 PM --- Number of posts for page 1: 12
12/07/2025 04:14:59 PM --- Number of posts added on 2025-07-12: 0
13/07/2025 04:15:10 PM --- Done page: 1/1
13/07/2025 04:15:10 PM --- Number of posts for page 1: 12
13/07/2025 04:15:10 PM --- Number of posts added on 2025-07-13: 0
14/07/2025 04:17:47 PM --- Done page: 1/1
14/07/2025 04:17:47 PM --- Number of posts for page 1: 12
14/07/2025 04:17:47 PM --- Number of posts added on 2025-07-14: 0
15/07/2025 04:17:51 PM --- Done page: 1/1
15/07/2025 04:17:51 PM --- Number of posts for page 1: 12
15/07/2025 04:17:51 PM --- Number of posts added on 2025-07-15: 0
16/07/2025 04:17:51 PM --- Done page: 1/1
16/07/2025 04:17:51 PM --- Number of posts for page 1: 12
16/07/2025 04:17:51 PM --- Number of posts added on 2025-07-16: 0
17/07/2025 04:17:43 PM --- Done page: 1/1
17/07/2025 04:17:43 PM --- Number of posts for page 1: 12
17/07/2025 04:17:43 PM --- Number of posts added on 2025-07-17: 0
18/07/2025 04:19:02 PM --- Done page: 1/1
18/07/2025 04:19:02 PM --- Number of posts for page 1: 12
18/07/2025 04:19:02 PM --- Number of posts added on 2025-07-18: 0
19/07/2025 04:15:23 PM --- Done page: 1/1
19/07/2025 04:15:23 PM --- Number of posts for page 1: 12
19/07/2025 04:15:23 PM --- Number of posts added on 2025-07-19: 0
20/07/2025 04:15:37 PM --- Done page: 1/1
20/07/2025 04:15:37 PM --- Number of posts for page 1: 12
20/07/2025 04:15:37 PM --- Number of posts added on 2025-07-20: 0
21/07/2025 04:17:06 PM --- Done page: 1/1
21/07/2025 04:17:06 PM --- Number of posts for page 1: 12
21/07/2025 04:17:06 PM --- Number of posts added on 2025-07-21: 0
22/07/2025 04:17:43 PM --- Done page: 1/1
22/07/2025 04:17:43 PM --- Number of posts for page 1: 12
22/07/2025 04:17:43 PM --- Number of posts added on 2025-07-22: 0
23/07/2025 04:18:13 PM --- Done page: 1/1
23/07/2025 04:18:13 PM --- Number of posts for page 1: 12
23/07/2025 04:18:13 PM --- Number of posts added on 2025-07-23: 0
24/07/2025 04:16:48 PM --- Done page: 1/1
24/07/2025 04:16:48 PM --- Number of posts for page 1: 12
24/07/2025 04:16:48 PM --- Number of posts added on 2025-07-24: 0
25/07/2025 04:17:43 PM --- Done page: 1/1
25/07/2025 04:17:43 PM --- Number of posts for page 1: 12
25/07/2025 04:17:43 PM --- Number of posts added on 2025-07-25: 0
26/07/2025 04:15:43 PM --- Done page: 1/1
26/07/2025 04:15:43 PM --- Number of posts for page 1: 12
26/07/2025 04:15:43 PM --- Number of posts added on 2025-07-26: 0
27/07/2025 04:15:50 PM --- Done page: 1/1
27/07/2025 04:15:50 PM --- Number of posts for page 1: 12
27/07/2025 04:15:50 PM --- Number of posts added on 2025-07-27: 0
28/07/2025 04:18:48 PM --- Done page: 1/1
28/07/2025 04:18:48 PM --- Number of posts for page 1: 12
28/07/2025 04:18:48 PM --- Number of posts added on 2025-07-28: 0
29/07/2025 04:17:25 PM --- Done page: 1/1
29/07/2025 04:17:25 PM --- Number of posts for page 1: 12
29/07/2025 04:17:25 PM --- Number of posts added on 2025-07-29: 0
30/07/2025 04:18:03 PM --- Done page: 1/1
30/07/2025 04:18:03 PM --- Number of posts for page 1: 12
30/07/2025 04:18:03 PM --- Number of posts added on 2025-07-30: 0
31/07/2025 04:18:25 PM --- Done page: 1/1
31/07/2025 04:18:25 PM --- Number of posts for page 1: 12
31/07/2025 04:18:25 PM --- Number of posts added on 2025-07-31: 0
01/08/2025 04:18:08 PM --- Done page: 1/1
01/08/2025 04:18:08 PM --- Number of posts for page 1: 12
01/08/2025 04:18:08 PM --- Number of posts added on 2025-08-01: 0
02/08/2025 04:15:50 PM --- Done page: 1/1
02/08/2025 04:15:50 PM --- Number of posts for page 1: 12
02/08/2025 04:15:50 PM --- Number of posts added on 2025-08-02: 0
03/08/2025 04:16:06 PM --- Done page: 1/1
03/08/2025 04:16:06 PM --- Number of posts for page 1: 12
03/08/2025 04:16:06 PM --- Number of posts added on 2025-08-03: 0
04/08/2025 04:19:39 PM --- Done page: 1/1
04/08/2025 04:19:39 PM --- Number of posts for page 1: 12
04/08/2025 04:19:39 PM --- Number of posts added on 2025-08-04: 0
05/08/2025 04:15:29 PM --- Done page: 1/1
05/08/2025 04:15:29 PM --- Number of posts for page 1: 12
05/08/2025 04:15:29 PM --- Number of posts added on 2025-08-05: 0
06/08/2025 04:18:58 PM --- Done page: 1/1
06/08/2025 04:18:58 PM --- Number of posts for page 1: 12
06/08/2025 04:18:58 PM --- Number of posts added on 2025-08-06: 0
07/08/2025 04:18:44 PM --- Done page: 1/1
07/08/2025 04:18:44 PM --- Number of posts for page 1: 12
07/08/2025 04:18:44 PM --- Number of posts added on 2025-08-07: 0
08/08/2025 04:15:53 PM --- Done page: 1/1
08/08/2025 04:15:53 PM --- Number of posts for page 1: 12
08/08/2025 04:15:53 PM --- Number of posts added on 2025-08-08: 0
09/08/2025 04:15:34 PM --- Done page: 1/1
09/08/2025 04:15:34 PM --- Number of posts for page 1: 12
09/08/2025 04:15:34 PM --- Number of posts added on 2025-08-09: 0
10/08/2025 04:15:53 PM --- Done page: 1/1
10/08/2025 04:15:53 PM --- Number of posts for page 1: 12
10/08/2025 04:15:53 PM --- Number of posts added on 2025-08-10: 0
11/08/2025 04:17:58 PM --- Done page: 1/1
11/08/2025 04:17:58 PM --- Number of posts for page 1: 12
11/08/2025 04:17:58 PM --- Number of posts added on 2025-08-11: 0
12/08/2025 04:17:24 PM --- Done page: 1/1
12/08/2025 04:17:24 PM --- Number of posts for page 1: 12
12/08/2025 04:17:24 PM --- Number of posts added on 2025-08-12: 0
13/08/2025 04:13:43 PM --- Done page: 1/1
13/08/2025 04:13:43 PM --- Number of posts for page 1: 12
13/08/2025 04:13:43 PM --- Number of posts added on 2025-08-13: 0
14/08/2025 04:17:57 PM --- Done page: 1/1
14/08/2025 04:17:57 PM --- Number of posts for page 1: 12
14/08/2025 04:17:57 PM --- Number of posts added on 2025-08-14: 0
15/08/2025 04:16:37 PM --- Done page: 1/1
15/08/2025 04:16:37 PM --- Number of posts for page 1: 12
15/08/2025 04:16:37 PM --- Number of posts added on 2025-08-15: 0
16/08/2025 04:14:47 PM --- Done page: 1/1
16/08/2025 04:14:47 PM --- Number of posts for page 1: 12
16/08/2025 04:14:47 PM --- Number of posts added on 2025-08-16: 0
17/08/2025 04:15:00 PM --- Done page: 1/1
17/08/2025 04:15:00 PM --- Number of posts for page 1: 12
17/08/2025 04:15:00 PM --- Number of posts added on 2025-08-17: 0
18/08/2025 04:17:14 PM --- Done page: 1/1
18/08/2025 04:17:14 PM --- Number of posts for page 1: 12
18/08/2025 04:17:14 PM --- Number of posts added on 2025-08-18: 0
19/08/2025 04:16:35 PM --- Done page: 1/1
19/08/2025 04:16:35 PM --- Number of posts for page 1: 12
19/08/2025 04:16:35 PM --- Number of posts added on 2025-08-19: 0
20/08/2025 04:16:30 PM --- Done page: 1/1
20/08/2025 04:16:30 PM --- Number of posts for page 1: 12
20/08/2025 04:16:30 PM --- Number of posts added on 2025-08-20: 0
21/08/2025 04:20:47 PM --- Done page: 1/1
21/08/2025 04:20:47 PM --- Number of posts for page 1: 12
21/08/2025 04:20:47 PM --- Number of posts added on 2025-08-21: 0
22/08/2025 04:15:47 PM --- Done page: 1/1
22/08/2025 04:15:47 PM --- Number of posts for page 1: 12
22/08/2025 04:15:47 PM --- Number of posts added on 2025-08-22: 0
23/08/2025 04:13:47 PM --- Done page: 1/1
23/08/2025 04:13:47 PM --- Number of posts for page 1: 12
23/08/2025 04:13:47 PM --- Number of posts added on 2025-08-23: 0
24/08/2025 12:32:06 AM --- Done page: 1/1
24/08/2025 12:32:06 AM --- Number of posts for page 1: 12
24/08/2025 12:32:06 AM --- Number of posts added on 2025-08-24: 0
24/08/2025 04:14:19 PM --- Done page: 1/57
24/08/2025 04:14:19 PM --- Number of posts for page 1: 12
24/08/2025 04:14:19 PM --- Number of posts added on 2025-08-24: 0
24/08/2025 04:14:44 PM --- Done page: 2/57
24/08/2025 04:14:44 PM --- Number of posts for page 2: 12
24/08/2025 04:14:44 PM --- Number of posts added on 2025-08-24: 0
24/08/2025 04:15:08 PM --- Done page: 3/57
24/08/2025 04:15:08 PM --- Number of posts for page 3: 12
24/08/2025 04:15:08 PM --- Number of posts added on 2025-08-24: 0
24/08/2025 04:15:33 PM --- Done page: 4/57
24/08/2025 04:15:33 PM --- Number of posts for page 4: 12
24/08/2025 04:15:33 PM --- Number of posts added on 2025-08-24: 0
24/08/2025 04:15:40 PM --- Done page: 5/57
24/08/2025 04:15:40 PM --- Number of posts for page 5: 3
24/08/2025 04:15:40 PM --- Number of posts added on 2025-08-24: 0
25/08/2025 04:16:09 PM --- Done page: 1/57
25/08/2025 04:16:09 PM --- Number of posts for page 1: 12
25/08/2025 04:16:09 PM --- Number of posts added on 2025-08-25: 0
25/08/2025 04:16:29 PM --- Done page: 2/57
25/08/2025 04:16:29 PM --- Number of posts for page 2: 12
25/08/2025 04:16:29 PM --- Number of posts added on 2025-08-25: 0
25/08/2025 04:16:50 PM --- Done page: 3/57
25/08/2025 04:16:50 PM --- Number of posts for page 3: 12
25/08/2025 04:16:50 PM --- Number of posts added on 2025-08-25: 0
25/08/2025 04:17:11 PM --- Done page: 4/57
25/08/2025 04:17:11 PM --- Number of posts for page 4: 12
25/08/2025 04:17:11 PM --- Number of posts added on 2025-08-25: 0
25/08/2025 04:17:17 PM --- Done page: 5/57
25/08/2025 04:17:17 PM --- Number of posts for page 5: 3
25/08/2025 04:17:17 PM --- Number of posts added on 2025-08-25: 0
26/08/2025 04:15:43 PM --- Done page: 1/57
26/08/2025 04:15:43 PM --- Number of posts for page 1: 12
26/08/2025 04:15:43 PM --- Number of posts added on 2025-08-26: 0
26/08/2025 04:16:04 PM --- Done page: 2/57
26/08/2025 04:16:04 PM --- Number of posts for page 2: 12
26/08/2025 04:16:04 PM --- Number of posts added on 2025-08-26: 0
26/08/2025 04:16:25 PM --- Done page: 3/57
26/08/2025 04:16:25 PM --- Number of posts for page 3: 12
26/08/2025 04:16:25 PM --- Number of posts added on 2025-08-26: 0
26/08/2025 04:16:46 PM --- Done page: 4/57
26/08/2025 04:16:46 PM --- Number of posts for page 4: 12
26/08/2025 04:16:46 PM --- Number of posts added on 2025-08-26: 0
26/08/2025 04:16:51 PM --- Done page: 5/57
26/08/2025 04:16:51 PM --- Number of posts for page 5: 3
26/08/2025 04:16:51 PM --- Number of posts added on 2025-08-26: 0
27/08/2025 04:15:42 PM --- Done page: 1/57
27/08/2025 04:15:42 PM --- Number of posts for page 1: 12
27/08/2025 04:15:42 PM --- Number of posts added on 2025-08-27: 0
27/08/2025 04:16:03 PM --- Done page: 2/57
27/08/2025 04:16:03 PM --- Number of posts for page 2: 12
27/08/2025 04:16:03 PM --- Number of posts added on 2025-08-27: 0
27/08/2025 04:16:23 PM --- Done page: 3/57
27/08/2025 04:16:23 PM --- Number of posts for page 3: 12
27/08/2025 04:16:23 PM --- Number of posts added on 2025-08-27: 0
27/08/2025 04:16:44 PM --- Done page: 4/57
27/08/2025 04:16:44 PM --- Number of posts for page 4: 12
27/08/2025 04:16:44 PM --- Number of posts added on 2025-08-27: 0
27/08/2025 04:16:50 PM --- Done page: 5/57
27/08/2025 04:16:50 PM --- Number of posts for page 5: 3
27/08/2025 04:16:50 PM --- Number of posts added on 2025-08-27: 0
28/08/2025 04:16:16 PM --- Done page: 1/57
28/08/2025 04:16:16 PM --- Number of posts for page 1: 12
28/08/2025 04:16:16 PM --- Number of posts added on 2025-08-28: 0
28/08/2025 04:16:41 PM --- Done page: 2/57
28/08/2025 04:16:41 PM --- Number of posts for page 2: 12
28/08/2025 04:16:41 PM --- Number of posts added on 2025-08-28: 0
28/08/2025 04:17:06 PM --- Done page: 3/57
28/08/2025 04:17:06 PM --- Number of posts for page 3: 12
28/08/2025 04:17:06 PM --- Number of posts added on 2025-08-28: 0
28/08/2025 04:17:30 PM --- Done page: 4/57
28/08/2025 04:17:30 PM --- Number of posts for page 4: 12
28/08/2025 04:17:30 PM --- Number of posts added on 2025-08-28: 0
28/08/2025 04:17:37 PM --- Done page: 5/57
28/08/2025 04:17:37 PM --- Number of posts for page 5: 3
28/08/2025 04:17:37 PM --- Number of posts added on 2025-08-28: 0
30/08/2025 04:13:36 PM --- Done page: 1/57
30/08/2025 04:13:36 PM --- Number of posts for page 1: 12
30/08/2025 04:13:36 PM --- Number of posts added on 2025-08-30: 0
30/08/2025 04:14:06 PM --- Done page: 2/57
30/08/2025 04:14:06 PM --- Number of posts for page 2: 12
30/08/2025 04:14:06 PM --- Number of posts added on 2025-08-30: 0
30/08/2025 04:14:33 PM --- Done page: 3/57
30/08/2025 04:14:33 PM --- Number of posts for page 3: 12
30/08/2025 04:14:33 PM --- Number of posts added on 2025-08-30: 0
30/08/2025 04:15:01 PM --- Done page: 4/57
30/08/2025 04:15:01 PM --- Number of posts for page 4: 12
30/08/2025 04:15:01 PM --- Number of posts added on 2025-08-30: 0
30/08/2025 04:15:09 PM --- Done page: 5/57
30/08/2025 04:15:09 PM --- Number of posts for page 5: 3
30/08/2025 04:15:09 PM --- Number of posts added on 2025-08-30: 0
31/08/2025 04:13:48 PM --- Done page: 1/57
31/08/2025 04:13:48 PM --- Number of posts for page 1: 12
31/08/2025 04:13:48 PM --- Number of posts added on 2025-08-31: 0
31/08/2025 04:14:14 PM --- Done page: 2/57
31/08/2025 04:14:14 PM --- Number of posts for page 2: 12
31/08/2025 04:14:14 PM --- Number of posts added on 2025-08-31: 0
31/08/2025 04:14:40 PM --- Done page: 3/57
31/08/2025 04:14:40 PM --- Number of posts for page 3: 12
31/08/2025 04:14:40 PM --- Number of posts added on 2025-08-31: 0
31/08/2025 04:15:05 PM --- Done page: 4/57
31/08/2025 04:15:05 PM --- Number of posts for page 4: 12
31/08/2025 04:15:05 PM --- Number of posts added on 2025-08-31: 0
31/08/2025 04:15:12 PM --- Done page: 5/57
31/08/2025 04:15:12 PM --- Number of posts for page 5: 3
31/08/2025 04:15:12 PM --- Number of posts added on 2025-08-31: 0
01/09/2025 04:15:08 PM --- Done page: 1/57
01/09/2025 04:15:08 PM --- Number of posts for page 1: 12
01/09/2025 04:15:08 PM --- Number of posts added on 2025-09-01: 0
01/09/2025 04:15:34 PM --- Done page: 2/57
01/09/2025 04:15:34 PM --- Number of posts for page 2: 12
01/09/2025 04:15:34 PM --- Number of posts added on 2025-09-01: 0
01/09/2025 04:15:58 PM --- Done page: 3/57
01/09/2025 04:15:58 PM --- Number of posts for page 3: 12
01/09/2025 04:15:58 PM --- Number of posts added on 2025-09-01: 0
01/09/2025 04:16:23 PM --- Done page: 4/57
01/09/2025 04:16:23 PM --- Number of posts for page 4: 12
01/09/2025 04:16:23 PM --- Number of posts added on 2025-09-01: 0
01/09/2025 04:16:30 PM --- Done page: 5/57
01/09/2025 04:16:30 PM --- Number of posts for page 5: 3
01/09/2025 04:16:30 PM --- Number of posts added on 2025-09-01: 0
02/09/2025 04:15:57 PM --- Done page: 1/57
02/09/2025 04:15:57 PM --- Number of posts for page 1: 12
02/09/2025 04:15:57 PM --- Number of posts added on 2025-09-02: 0
02/09/2025 04:16:22 PM --- Done page: 2/57
02/09/2025 04:16:22 PM --- Number of posts for page 2: 12
02/09/2025 04:16:22 PM --- Number of posts added on 2025-09-02: 0
02/09/2025 04:16:47 PM --- Done page: 3/57
02/09/2025 04:16:47 PM --- Number of posts for page 3: 12
02/09/2025 04:16:47 PM --- Number of posts added on 2025-09-02: 0
02/09/2025 04:17:11 PM --- Done page: 4/57
02/09/2025 04:17:11 PM --- Number of posts for page 4: 12
02/09/2025 04:17:11 PM --- Number of posts added on 2025-09-02: 0
02/09/2025 04:17:18 PM --- Done page: 5/57
02/09/2025 04:17:18 PM --- Number of posts for page 5: 3
02/09/2025 04:17:18 PM --- Number of posts added on 2025-09-02: 0
03/09/2025 04:15:14 PM --- Done page: 1/57
03/09/2025 04:15:14 PM --- Number of posts for page 1: 12
03/09/2025 04:15:14 PM --- Number of posts added on 2025-09-03: 0
03/09/2025 04:15:43 PM --- Done page: 2/57
03/09/2025 04:15:43 PM --- Number of posts for page 2: 12
03/09/2025 04:15:43 PM --- Number of posts added on 2025-09-03: 0
03/09/2025 04:16:11 PM --- Done page: 3/57
03/09/2025 04:16:11 PM --- Number of posts for page 3: 12
03/09/2025 04:16:11 PM --- Number of posts added on 2025-09-03: 0
03/09/2025 04:16:39 PM --- Done page: 4/57
03/09/2025 04:16:39 PM --- Number of posts for page 4: 12
03/09/2025 04:16:39 PM --- Number of posts added on 2025-09-03: 0
03/09/2025 04:16:46 PM --- Done page: 5/57
03/09/2025 04:16:46 PM --- Number of posts for page 5: 3
03/09/2025 04:16:46 PM --- Number of posts added on 2025-09-03: 0
04/09/2025 04:15:41 PM --- Done page: 1/57
04/09/2025 04:15:41 PM --- Number of posts for page 1: 12
04/09/2025 04:15:41 PM --- Number of posts added on 2025-09-04: 0
04/09/2025 04:16:07 PM --- Done page: 2/57
04/09/2025 04:16:07 PM --- Number of posts for page 2: 12
04/09/2025 04:16:07 PM --- Number of posts added on 2025-09-04: 0
04/09/2025 04:16:32 PM --- Done page: 3/57
04/09/2025 04:16:32 PM --- Number of posts for page 3: 12
04/09/2025 04:16:32 PM --- Number of posts added on 2025-09-04: 0
04/09/2025 04:16:57 PM --- Done page: 4/57
04/09/2025 04:16:57 PM --- Number of posts for page 4: 12
04/09/2025 04:16:57 PM --- Number of posts added on 2025-09-04: 0
04/09/2025 04:17:04 PM --- Done page: 5/57
04/09/2025 04:17:04 PM --- Number of posts for page 5: 3
04/09/2025 04:17:04 PM --- Number of posts added on 2025-09-04: 0
05/09/2025 04:15:21 PM --- Done page: 1/57
05/09/2025 04:15:21 PM --- Number of posts for page 1: 12
05/09/2025 04:15:21 PM --- Number of posts added on 2025-09-05: 0
05/09/2025 04:15:47 PM --- Done page: 2/57
05/09/2025 04:15:47 PM --- Number of posts for page 2: 12
05/09/2025 04:15:47 PM --- Number of posts added on 2025-09-05: 0
05/09/2025 04:16:14 PM --- Done page: 3/57
05/09/2025 04:16:14 PM --- Number of posts for page 3: 12
05/09/2025 04:16:14 PM --- Number of posts added on 2025-09-05: 0
05/09/2025 04:16:40 PM --- Done page: 4/57
05/09/2025 04:16:40 PM --- Number of posts for page 4: 12
05/09/2025 04:16:40 PM --- Number of posts added on 2025-09-05: 0
05/09/2025 04:16:47 PM --- Done page: 5/57
05/09/2025 04:16:47 PM --- Number of posts for page 5: 3
05/09/2025 04:16:47 PM --- Number of posts added on 2025-09-05: 0
06/09/2025 04:13:46 PM --- Done page: 1/57
06/09/2025 04:13:46 PM --- Number of posts for page 1: 12
06/09/2025 04:13:46 PM --- Number of posts added on 2025-09-06: 0
06/09/2025 04:14:17 PM --- Done page: 2/57
06/09/2025 04:14:17 PM --- Number of posts for page 2: 12
06/09/2025 04:14:17 PM --- Number of posts added on 2025-09-06: 0
06/09/2025 04:14:49 PM --- Done page: 3/57
06/09/2025 04:14:49 PM --- Number of posts for page 3: 12
06/09/2025 04:14:49 PM --- Number of posts added on 2025-09-06: 0
06/09/2025 04:15:20 PM --- Done page: 4/57
06/09/2025 04:15:20 PM --- Number of posts for page 4: 12
06/09/2025 04:15:20 PM --- Number of posts added on 2025-09-06: 0
06/09/2025 04:15:28 PM --- Done page: 5/57
06/09/2025 04:15:28 PM --- Number of posts for page 5: 3
06/09/2025 04:15:28 PM --- Number of posts added on 2025-09-06: 0
07/09/2025 04:13:41 PM --- Done page: 1/57
07/09/2025 04:13:41 PM --- Number of posts for page 1: 12
07/09/2025 04:13:41 PM --- Number of posts added on 2025-09-07: 0
07/09/2025 04:14:08 PM --- Done page: 2/57
07/09/2025 04:14:08 PM --- Number of posts for page 2: 12
07/09/2025 04:14:08 PM --- Number of posts added on 2025-09-07: 0
07/09/2025 04:14:33 PM --- Done page: 3/57
07/09/2025 04:14:33 PM --- Number of posts for page 3: 12
07/09/2025 04:14:33 PM --- Number of posts added on 2025-09-07: 0
07/09/2025 04:14:58 PM --- Done page: 4/57
07/09/2025 04:14:58 PM --- Number of posts for page 4: 12
07/09/2025 04:14:58 PM --- Number of posts added on 2025-09-07: 0
07/09/2025 04:15:05 PM --- Done page: 5/57
07/09/2025 04:15:05 PM --- Number of posts for page 5: 3
07/09/2025 04:15:05 PM --- Number of posts added on 2025-09-07: 0
08/09/2025 04:14:50 PM --- Done page: 1/57
08/09/2025 04:14:50 PM --- Number of posts for page 1: 12
08/09/2025 04:14:50 PM --- Number of posts added on 2025-09-08: 0
08/09/2025 04:15:20 PM --- Done page: 2/57
08/09/2025 04:15:20 PM --- Number of posts for page 2: 12
08/09/2025 04:15:20 PM --- Number of posts added on 2025-09-08: 0
08/09/2025 04:15:49 PM --- Done page: 3/57
08/09/2025 04:15:49 PM --- Number of posts for page 3: 12
08/09/2025 04:15:49 PM --- Number of posts added on 2025-09-08: 0
08/09/2025 04:16:18 PM --- Done page: 4/57
08/09/2025 04:16:18 PM --- Number of posts for page 4: 12
08/09/2025 04:16:18 PM --- Number of posts added on 2025-09-08: 0
08/09/2025 04:16:26 PM --- Done page: 5/57
08/09/2025 04:16:26 PM --- Number of posts for page 5: 3
08/09/2025 04:16:26 PM --- Number of posts added on 2025-09-08: 0
10/09/2025 04:15:29 PM --- Done page: 1/57
10/09/2025 04:15:29 PM --- Number of posts for page 1: 12
10/09/2025 04:15:29 PM --- Number of posts added on 2025-09-10: 0
10/09/2025 04:15:53 PM --- Done page: 2/57
10/09/2025 04:15:53 PM --- Number of posts for page 2: 12
10/09/2025 04:15:53 PM --- Number of posts added on 2025-09-10: 0
10/09/2025 04:16:16 PM --- Done page: 3/57
10/09/2025 04:16:16 PM --- Number of posts for page 3: 12
10/09/2025 04:16:16 PM --- Number of posts added on 2025-09-10: 0
10/09/2025 04:16:38 PM --- Done page: 4/57
10/09/2025 04:16:38 PM --- Number of posts for page 4: 12
10/09/2025 04:16:38 PM --- Number of posts added on 2025-09-10: 0
10/09/2025 04:16:44 PM --- Done page: 5/57
10/09/2025 04:16:44 PM --- Number of posts for page 5: 3
10/09/2025 04:16:44 PM --- Number of posts added on 2025-09-10: 0
11/09/2025 04:15:25 PM --- Done page: 1/57
11/09/2025 04:15:25 PM --- Number of posts for page 1: 12
11/09/2025 04:15:25 PM --- Number of posts added on 2025-09-11: 0
11/09/2025 04:15:47 PM --- Done page: 2/57
11/09/2025 04:15:47 PM --- Number of posts for page 2: 12
11/09/2025 04:15:47 PM --- Number of posts added on 2025-09-11: 0
11/09/2025 04:16:11 PM --- Done page: 3/57
11/09/2025 04:16:11 PM --- Number of posts for page 3: 12
11/09/2025 04:16:11 PM --- Number of posts added on 2025-09-11: 0
11/09/2025 04:16:35 PM --- Done page: 4/57
11/09/2025 04:16:35 PM --- Number of posts for page 4: 12
11/09/2025 04:16:35 PM --- Number of posts added on 2025-09-11: 0
11/09/2025 04:16:41 PM --- Done page: 5/57
11/09/2025 04:16:41 PM --- Number of posts for page 5: 3
11/09/2025 04:16:41 PM --- Number of posts added on 2025-09-11: 0
12/09/2025 04:13:14 PM --- Done page: 1/57
12/09/2025 04:13:14 PM --- Number of posts for page 1: 12
12/09/2025 04:13:14 PM --- Number of posts added on 2025-09-12: 0
12/09/2025 04:13:40 PM --- Done page: 2/57
12/09/2025 04:13:40 PM --- Number of posts for page 2: 12
12/09/2025 04:13:40 PM --- Number of posts added on 2025-09-12: 0
12/09/2025 04:14:07 PM --- Done page: 3/57
12/09/2025 04:14:07 PM --- Number of posts for page 3: 12
12/09/2025 04:14:07 PM --- Number of posts added on 2025-09-12: 0
12/09/2025 04:14:33 PM --- Done page: 4/57
12/09/2025 04:14:33 PM --- Number of posts for page 4: 12
12/09/2025 04:14:33 PM --- Number of posts added on 2025-09-12: 0
12/09/2025 04:14:40 PM --- Done page: 5/57
12/09/2025 04:14:40 PM --- Number of posts for page 5: 3
12/09/2025 04:14:40 PM --- Number of posts added on 2025-09-12: 0
13/09/2025 04:12:48 PM --- Done page: 1/57
13/09/2025 04:12:48 PM --- Number of posts for page 1: 12
13/09/2025 04:12:48 PM --- Number of posts added on 2025-09-13: 0
13/09/2025 04:13:13 PM --- Done page: 2/57
13/09/2025 04:13:13 PM --- Number of posts for page 2: 12
13/09/2025 04:13:13 PM --- Number of posts added on 2025-09-13: 0
13/09/2025 04:13:37 PM --- Done page: 3/57
13/09/2025 04:13:37 PM --- Number of posts for page 3: 12
13/09/2025 04:13:37 PM --- Number of posts added on 2025-09-13: 0
13/09/2025 04:14:00 PM --- Done page: 4/57
13/09/2025 04:14:00 PM --- Number of posts for page 4: 12
13/09/2025 04:14:00 PM --- Number of posts added on 2025-09-13: 0
13/09/2025 04:14:07 PM --- Done page: 5/57
13/09/2025 04:14:07 PM --- Number of posts for page 5: 3
13/09/2025 04:14:07 PM --- Number of posts added on 2025-09-13: 0
14/09/2025 04:12:42 PM --- Done page: 1/57
14/09/2025 04:12:42 PM --- Number of posts for page 1: 12
14/09/2025 04:12:42 PM --- Number of posts added on 2025-09-14: 0
14/09/2025 04:13:11 PM --- Done page: 2/57
14/09/2025 04:13:11 PM --- Number of posts for page 2: 12
14/09/2025 04:13:11 PM --- Number of posts added on 2025-09-14: 0
14/09/2025 04:13:39 PM --- Done page: 3/57
14/09/2025 04:13:39 PM --- Number of posts for page 3: 12
14/09/2025 04:13:39 PM --- Number of posts added on 2025-09-14: 0
14/09/2025 04:14:07 PM --- Done page: 4/57
14/09/2025 04:14:07 PM --- Number of posts for page 4: 12
14/09/2025 04:14:07 PM --- Number of posts added on 2025-09-14: 0
14/09/2025 04:14:15 PM --- Done page: 5/57
14/09/2025 04:14:15 PM --- Number of posts for page 5: 3
14/09/2025 04:14:15 PM --- Number of posts added on 2025-09-14: 0
15/09/2025 04:15:37 PM --- Done page: 1/57
15/09/2025 04:15:37 PM --- Number of posts for page 1: 12
15/09/2025 04:15:37 PM --- Number of posts added on 2025-09-15: 0
15/09/2025 04:16:01 PM --- Done page: 2/57
15/09/2025 04:16:01 PM --- Number of posts for page 2: 12
15/09/2025 04:16:01 PM --- Number of posts added on 2025-09-15: 0
15/09/2025 04:16:25 PM --- Done page: 3/57
15/09/2025 04:16:25 PM --- Number of posts for page 3: 12
15/09/2025 04:16:25 PM --- Number of posts added on 2025-09-15: 0
15/09/2025 04:16:50 PM --- Done page: 4/57
15/09/2025 04:16:50 PM --- Number of posts for page 4: 12
15/09/2025 04:16:50 PM --- Number of posts added on 2025-09-15: 0
15/09/2025 04:16:57 PM --- Done page: 5/57
15/09/2025 04:16:57 PM --- Number of posts for page 5: 3
15/09/2025 04:16:57 PM --- Number of posts added on 2025-09-15: 0
16/09/2025 04:16:00 PM --- Done page: 1/57
16/09/2025 04:16:00 PM --- Number of posts for page 1: 12
16/09/2025 04:16:00 PM --- Number of posts added on 2025-09-16: 0
16/09/2025 04:16:29 PM --- Done page: 2/57
16/09/2025 04:16:29 PM --- Number of posts for page 2: 12
16/09/2025 04:16:29 PM --- Number of posts added on 2025-09-16: 0
16/09/2025 04:17:00 PM --- Done page: 3/57
16/09/2025 04:17:00 PM --- Number of posts for page 3: 12
16/09/2025 04:17:00 PM --- Number of posts added on 2025-09-16: 0
16/09/2025 04:17:29 PM --- Done page: 4/57
16/09/2025 04:17:29 PM --- Number of posts for page 4: 12
16/09/2025 04:17:29 PM --- Number of posts added on 2025-09-16: 0
16/09/2025 04:17:37 PM --- Done page: 5/57
16/09/2025 04:17:37 PM --- Number of posts for page 5: 3
16/09/2025 04:17:37 PM --- Number of posts added on 2025-09-16: 0
17/09/2025 04:15:59 PM --- Done page: 1/57
17/09/2025 04:15:59 PM --- Number of posts for page 1: 12
17/09/2025 04:15:59 PM --- Number of posts added on 2025-09-17: 0
17/09/2025 04:16:27 PM --- Done page: 2/57
17/09/2025 04:16:27 PM --- Number of posts for page 2: 12
17/09/2025 04:16:27 PM --- Number of posts added on 2025-09-17: 0
17/09/2025 04:16:55 PM --- Done page: 3/57
17/09/2025 04:16:55 PM --- Number of posts for page 3: 12
17/09/2025 04:16:55 PM --- Number of posts added on 2025-09-17: 0
17/09/2025 04:17:23 PM --- Done page: 4/57
17/09/2025 04:17:23 PM --- Number of posts for page 4: 12
17/09/2025 04:17:23 PM --- Number of posts added on 2025-09-17: 0
17/09/2025 04:17:31 PM --- Done page: 5/57
17/09/2025 04:17:31 PM --- Number of posts for page 5: 3
17/09/2025 04:17:31 PM --- Number of posts added on 2025-09-17: 0
18/09/2025 04:15:11 PM --- Done page: 1/57
18/09/2025 04:15:11 PM --- Number of posts for page 1: 12
18/09/2025 04:15:11 PM --- Number of posts added on 2025-09-18: 0
18/09/2025 04:15:35 PM --- Done page: 2/57
18/09/2025 04:15:35 PM --- Number of posts for page 2: 12
18/09/2025 04:15:35 PM --- Number of posts added on 2025-09-18: 0
18/09/2025 04:15:57 PM --- Done page: 3/57
18/09/2025 04:15:57 PM --- Number of posts for page 3: 12
18/09/2025 04:15:57 PM --- Number of posts added on 2025-09-18: 0
18/09/2025 04:16:20 PM --- Done page: 4/57
18/09/2025 04:16:20 PM --- Number of posts for page 4: 12
18/09/2025 04:16:20 PM --- Number of posts added on 2025-09-18: 0
18/09/2025 04:16:26 PM --- Done page: 5/57
18/09/2025 04:16:26 PM --- Number of posts for page 5: 3
18/09/2025 04:16:26 PM --- Number of posts added on 2025-09-18: 0
19/09/2025 04:15:16 PM --- Done page: 1/57
19/09/2025 04:15:16 PM --- Number of posts for page 1: 12
19/09/2025 04:15:16 PM --- Number of posts added on 2025-09-19: 0
19/09/2025 04:15:41 PM --- Done page: 2/57
19/09/2025 04:15:41 PM --- Number of posts for page 2: 12
19/09/2025 04:15:41 PM --- Number of posts added on 2025-09-19: 0
19/09/2025 04:16:07 PM --- Done page: 3/57
19/09/2025 04:16:07 PM --- Number of posts for page 3: 12
19/09/2025 04:16:07 PM --- Number of posts added on 2025-09-19: 0
19/09/2025 04:16:32 PM --- Done page: 4/57
19/09/2025 04:16:32 PM --- Number of posts for page 4: 12
19/09/2025 04:16:32 PM --- Number of posts added on 2025-09-19: 0
19/09/2025 04:16:39 PM --- Done page: 5/57
19/09/2025 04:16:39 PM --- Number of posts for page 5: 3
19/09/2025 04:16:39 PM --- Number of posts added on 2025-09-19: 0
20/09/2025 04:13:41 PM --- Done page: 1/57
20/09/2025 04:13:41 PM --- Number of posts for page 1: 12
20/09/2025 04:13:41 PM --- Number of posts added on 2025-09-20: 0
20/09/2025 04:14:12 PM --- Done page: 2/57
20/09/2025 04:14:12 PM --- Number of posts for page 2: 12
20/09/2025 04:14:12 PM --- Number of posts added on 2025-09-20: 0
20/09/2025 04:14:41 PM --- Done page: 3/57
20/09/2025 04:14:41 PM --- Number of posts for page 3: 12
20/09/2025 04:14:41 PM --- Number of posts added on 2025-09-20: 0
20/09/2025 04:15:09 PM --- Done page: 4/57
20/09/2025 04:15:09 PM --- Number of posts for page 4: 12
20/09/2025 04:15:09 PM --- Number of posts added on 2025-09-20: 0
20/09/2025 04:15:17 PM --- Done page: 5/57
20/09/2025 04:15:17 PM --- Number of posts for page 5: 3
20/09/2025 04:15:17 PM --- Number of posts added on 2025-09-20: 0
21/09/2025 04:13:42 PM --- Done page: 1/57
21/09/2025 04:13:42 PM --- Number of posts for page 1: 12
21/09/2025 04:13:42 PM --- Number of posts added on 2025-09-21: 0
21/09/2025 04:14:10 PM --- Done page: 2/57
21/09/2025 04:14:10 PM --- Number of posts for page 2: 12
21/09/2025 04:14:10 PM --- Number of posts added on 2025-09-21: 0
21/09/2025 04:14:35 PM --- Done page: 3/57
21/09/2025 04:14:35 PM --- Number of posts for page 3: 12
21/09/2025 04:14:35 PM --- Number of posts added on 2025-09-21: 0
21/09/2025 04:15:02 PM --- Done page: 4/57
21/09/2025 04:15:02 PM --- Number of posts for page 4: 12
21/09/2025 04:15:02 PM --- Number of posts added on 2025-09-21: 0
21/09/2025 04:15:09 PM --- Done page: 5/57
21/09/2025 04:15:09 PM --- Number of posts for page 5: 3
21/09/2025 04:15:09 PM --- Number of posts added on 2025-09-21: 0
22/09/2025 04:16:23 PM --- Done page: 1/57
22/09/2025 04:16:23 PM --- Number of posts for page 1: 12
22/09/2025 04:16:23 PM --- Number of posts added on 2025-09-22: 0
22/09/2025 04:16:51 PM --- Done page: 2/57
22/09/2025 04:16:51 PM --- Number of posts for page 2: 12
22/09/2025 04:16:51 PM --- Number of posts added on 2025-09-22: 0
22/09/2025 04:17:18 PM --- Done page: 3/57
22/09/2025 04:17:18 PM --- Number of posts for page 3: 12
22/09/2025 04:17:18 PM --- Number of posts added on 2025-09-22: 0
22/09/2025 04:17:44 PM --- Done page: 4/57
22/09/2025 04:17:44 PM --- Number of posts for page 4: 12
22/09/2025 04:17:44 PM --- Number of posts added on 2025-09-22: 0
22/09/2025 04:17:51 PM --- Done page: 5/57
22/09/2025 04:17:51 PM --- Number of posts for page 5: 3
22/09/2025 04:17:51 PM --- Number of posts added on 2025-09-22: 0
23/09/2025 04:16:01 PM --- Done page: 1/57
23/09/2025 04:16:01 PM --- Number of posts for page 1: 12
23/09/2025 04:16:01 PM --- Number of posts added on 2025-09-23: 0
23/09/2025 04:16:23 PM --- Done page: 2/57
23/09/2025 04:16:23 PM --- Number of posts for page 2: 12
23/09/2025 04:16:23 PM --- Number of posts added on 2025-09-23: 0
23/09/2025 04:16:44 PM --- Done page: 3/57
23/09/2025 04:16:44 PM --- Number of posts for page 3: 12
23/09/2025 04:16:44 PM --- Number of posts added on 2025-09-23: 0
23/09/2025 04:17:06 PM --- Done page: 4/57
23/09/2025 04:17:06 PM --- Number of posts for page 4: 12
23/09/2025 04:17:06 PM --- Number of posts added on 2025-09-23: 0
23/09/2025 04:17:13 PM --- Done page: 5/57
23/09/2025 04:17:13 PM --- Number of posts for page 5: 3
23/09/2025 04:17:13 PM --- Number of posts added on 2025-09-23: 0
24/09/2025 04:16:27 PM --- Done page: 1/57
24/09/2025 04:16:27 PM --- Number of posts for page 1: 12
24/09/2025 04:16:27 PM --- Number of posts added on 2025-09-24: 0
24/09/2025 04:16:58 PM --- Done page: 2/57
24/09/2025 04:16:58 PM --- Number of posts for page 2: 12
24/09/2025 04:16:58 PM --- Number of posts added on 2025-09-24: 0
24/09/2025 04:17:28 PM --- Done page: 3/57
24/09/2025 04:17:28 PM --- Number of posts for page 3: 12
24/09/2025 04:17:28 PM --- Number of posts added on 2025-09-24: 0
24/09/2025 04:17:58 PM --- Done page: 4/57
24/09/2025 04:17:58 PM --- Number of posts for page 4: 12
24/09/2025 04:17:58 PM --- Number of posts added on 2025-09-24: 0
24/09/2025 04:18:07 PM --- Done page: 5/57
24/09/2025 04:18:07 PM --- Number of posts for page 5: 3
24/09/2025 04:18:07 PM --- Number of posts added on 2025-09-24: 0
25/09/2025 04:15:37 PM --- Done page: 1/57
25/09/2025 04:15:37 PM --- Number of posts for page 1: 12
25/09/2025 04:15:37 PM --- Number of posts added on 2025-09-25: 0
25/09/2025 04:15:59 PM --- Done page: 2/57
25/09/2025 04:15:59 PM --- Number of posts for page 2: 12
25/09/2025 04:15:59 PM --- Number of posts added on 2025-09-25: 0
25/09/2025 04:16:22 PM --- Done page: 3/57
25/09/2025 04:16:22 PM --- Number of posts for page 3: 12
25/09/2025 04:16:22 PM --- Number of posts added on 2025-09-25: 0
25/09/2025 04:16:45 PM --- Done page: 4/57
25/09/2025 04:16:45 PM --- Number of posts for page 4: 12
25/09/2025 04:16:45 PM --- Number of posts added on 2025-09-25: 0
25/09/2025 04:16:51 PM --- Done page: 5/57
25/09/2025 04:16:51 PM --- Number of posts for page 5: 3
25/09/2025 04:16:51 PM --- Number of posts added on 2025-09-25: 0
26/09/2025 04:15:28 PM --- Done page: 1/57
26/09/2025 04:15:28 PM --- Number of posts for page 1: 12
26/09/2025 04:15:28 PM --- Number of posts added on 2025-09-26: 0
26/09/2025 04:15:50 PM --- Done page: 2/57
26/09/2025 04:15:50 PM --- Number of posts for page 2: 12
26/09/2025 04:15:50 PM --- Number of posts added on 2025-09-26: 0
26/09/2025 04:16:12 PM --- Done page: 3/57
26/09/2025 04:16:12 PM --- Number of posts for page 3: 12
26/09/2025 04:16:12 PM --- Number of posts added on 2025-09-26: 0
26/09/2025 04:16:33 PM --- Done page: 4/57
26/09/2025 04:16:33 PM --- Number of posts for page 4: 12
26/09/2025 04:16:33 PM --- Number of posts added on 2025-09-26: 0
26/09/2025 04:16:39 PM --- Done page: 5/57
26/09/2025 04:16:39 PM --- Number of posts for page 5: 3
26/09/2025 04:16:39 PM --- Number of posts added on 2025-09-26: 0
27/09/2025 04:13:26 PM --- Done page: 1/57
27/09/2025 04:13:26 PM --- Number of posts for page 1: 12
27/09/2025 04:13:26 PM --- Number of posts added on 2025-09-27: 0
27/09/2025 04:13:48 PM --- Done page: 2/57
27/09/2025 04:13:48 PM --- Number of posts for page 2: 12
27/09/2025 04:13:48 PM --- Number of posts added on 2025-09-27: 0
27/09/2025 04:14:11 PM --- Done page: 3/57
27/09/2025 04:14:11 PM --- Number of posts for page 3: 12
27/09/2025 04:14:11 PM --- Number of posts added on 2025-09-27: 0
27/09/2025 04:14:34 PM --- Done page: 4/57
27/09/2025 04:14:34 PM --- Number of posts for page 4: 12
27/09/2025 04:14:34 PM --- Number of posts added on 2025-09-27: 0
27/09/2025 04:14:41 PM --- Done page: 5/57
27/09/2025 04:14:41 PM --- Number of posts for page 5: 3
27/09/2025 04:14:41 PM --- Number of posts added on 2025-09-27: 0
28/09/2025 04:12:55 PM --- Done page: 1/57
28/09/2025 04:12:55 PM --- Number of posts for page 1: 12
28/09/2025 04:12:55 PM --- Number of posts added on 2025-09-28: 0
28/09/2025 04:13:18 PM --- Done page: 2/57
28/09/2025 04:13:18 PM --- Number of posts for page 2: 12
28/09/2025 04:13:18 PM --- Number of posts added on 2025-09-28: 0
28/09/2025 04:13:42 PM --- Done page: 3/57
28/09/2025 04:13:42 PM --- Number of posts for page 3: 12
28/09/2025 04:13:42 PM --- Number of posts added on 2025-09-28: 0
28/09/2025 04:14:05 PM --- Done page: 4/57
28/09/2025 04:14:05 PM --- Number of posts for page 4: 12
28/09/2025 04:14:05 PM --- Number of posts added on 2025-09-28: 0
28/09/2025 04:14:12 PM --- Done page: 5/57
28/09/2025 04:14:12 PM --- Number of posts for page 5: 3
28/09/2025 04:14:12 PM --- Number of posts added on 2025-09-28: 0
29/09/2025 04:13:26 PM --- Done page: 1/57
29/09/2025 04:13:26 PM --- Number of posts for page 1: 12
29/09/2025 04:13:26 PM --- Number of posts added on 2025-09-29: 0
29/09/2025 04:13:50 PM --- Done page: 2/57
29/09/2025 04:13:50 PM --- Number of posts for page 2: 12
29/09/2025 04:13:50 PM --- Number of posts added on 2025-09-29: 0
29/09/2025 04:14:13 PM --- Done page: 3/57
29/09/2025 04:14:13 PM --- Number of posts for page 3: 12
29/09/2025 04:14:13 PM --- Number of posts added on 2025-09-29: 0
29/09/2025 04:14:36 PM --- Done page: 4/57
29/09/2025 04:14:36 PM --- Number of posts for page 4: 12
29/09/2025 04:14:36 PM --- Number of posts added on 2025-09-29: 0
29/09/2025 04:14:42 PM --- Done page: 5/57
29/09/2025 04:14:42 PM --- Number of posts for page 5: 3
29/09/2025 04:14:42 PM --- Number of posts added on 2025-09-29: 0
30/09/2025 04:16:26 PM --- Done page: 1/57
30/09/2025 04:16:26 PM --- Number of posts for page 1: 12
30/09/2025 04:16:26 PM --- Number of posts added on 2025-09-30: 0
30/09/2025 04:16:55 PM --- Done page: 2/57
30/09/2025 04:16:55 PM --- Number of posts for page 2: 12
30/09/2025 04:16:55 PM --- Number of posts added on 2025-09-30: 0
30/09/2025 04:17:23 PM --- Done page: 3/57
30/09/2025 04:17:23 PM --- Number of posts for page 3: 12
30/09/2025 04:17:23 PM --- Number of posts added on 2025-09-30: 0
30/09/2025 04:17:52 PM --- Done page: 4/57
30/09/2025 04:17:52 PM --- Number of posts for page 4: 12
30/09/2025 04:17:52 PM --- Number of posts added on 2025-09-30: 0
30/09/2025 04:18:00 PM --- Done page: 5/57
30/09/2025 04:18:00 PM --- Number of posts for page 5: 3
30/09/2025 04:18:00 PM --- Number of posts added on 2025-09-30: 0
01/10/2025 04:15:58 PM --- Done page: 1/57
01/10/2025 04:15:58 PM --- Number of posts for page 1: 12
01/10/2025 04:15:58 PM --- Number of posts added on 2025-10-01: 0
01/10/2025 04:16:21 PM --- Done page: 2/57
01/10/2025 04:16:21 PM --- Number of posts for page 2: 12
01/10/2025 04:16:21 PM --- Number of posts added on 2025-10-01: 0
01/10/2025 04:16:43 PM --- Done page: 3/57
01/10/2025 04:16:43 PM --- Number of posts for page 3: 12
01/10/2025 04:16:43 PM --- Number of posts added on 2025-10-01: 0
01/10/2025 04:17:06 PM --- Done page: 4/57
01/10/2025 04:17:06 PM --- Number of posts for page 4: 12
01/10/2025 04:17:06 PM --- Number of posts added on 2025-10-01: 0
01/10/2025 04:17:12 PM --- Done page: 5/57
01/10/2025 04:17:12 PM --- Number of posts for page 5: 3
01/10/2025 04:17:12 PM --- Number of posts added on 2025-10-01: 0
02/10/2025 04:15:18 PM --- Done page: 1/57
02/10/2025 04:15:18 PM --- Number of posts for page 1: 12
02/10/2025 04:15:18 PM --- Number of posts added on 2025-10-02: 0
02/10/2025 04:15:47 PM --- Done page: 2/57
02/10/2025 04:15:47 PM --- Number of posts for page 2: 12
02/10/2025 04:15:47 PM --- Number of posts added on 2025-10-02: 0
02/10/2025 04:16:16 PM --- Done page: 3/57
02/10/2025 04:16:16 PM --- Number of posts for page 3: 12
02/10/2025 04:16:16 PM --- Number of posts added on 2025-10-02: 0
02/10/2025 04:16:45 PM --- Done page: 4/57
02/10/2025 04:16:45 PM --- Number of posts for page 4: 12
02/10/2025 04:16:45 PM --- Number of posts added on 2025-10-02: 0
02/10/2025 04:16:53 PM --- Done page: 5/57
02/10/2025 04:16:53 PM --- Number of posts for page 5: 3
02/10/2025 04:16:53 PM --- Number of posts added on 2025-10-02: 0
03/10/2025 04:14:52 PM --- Done page: 1/57
03/10/2025 04:14:52 PM --- Number of posts for page 1: 12
03/10/2025 04:14:52 PM --- Number of posts added on 2025-10-03: 0
03/10/2025 04:15:23 PM --- Done page: 2/57
03/10/2025 04:15:23 PM --- Number of posts for page 2: 12
03/10/2025 04:15:23 PM --- Number of posts added on 2025-10-03: 0
03/10/2025 04:15:51 PM --- Done page: 3/57
03/10/2025 04:15:51 PM --- Number of posts for page 3: 12
03/10/2025 04:15:51 PM --- Number of posts added on 2025-10-03: 0
03/10/2025 04:16:19 PM --- Done page: 4/57
03/10/2025 04:16:19 PM --- Number of posts for page 4: 12
03/10/2025 04:16:19 PM --- Number of posts added on 2025-10-03: 0
03/10/2025 04:16:26 PM --- Done page: 5/57
03/10/2025 04:16:26 PM --- Number of posts for page 5: 3
03/10/2025 04:16:26 PM --- Number of posts added on 2025-10-03: 0
04/10/2025 04:13:56 PM --- Done page: 1/57
04/10/2025 04:13:56 PM --- Number of posts for page 1: 12
04/10/2025 04:13:56 PM --- Number of posts added on 2025-10-04: 0
04/10/2025 04:14:19 PM --- Done page: 2/57
04/10/2025 04:14:19 PM --- Number of posts for page 2: 12
04/10/2025 04:14:19 PM --- Number of posts added on 2025-10-04: 0
04/10/2025 04:14:40 PM --- Done page: 3/57
04/10/2025 04:14:40 PM --- Number of posts for page 3: 12
04/10/2025 04:14:40 PM --- Number of posts added on 2025-10-04: 0
04/10/2025 04:15:01 PM --- Done page: 4/57
04/10/2025 04:15:01 PM --- Number of posts for page 4: 12
04/10/2025 04:15:01 PM --- Number of posts added on 2025-10-04: 0
04/10/2025 04:15:06 PM --- Done page: 5/57
04/10/2025 04:15:06 PM --- Number of posts for page 5: 3
04/10/2025 04:15:06 PM --- Number of posts added on 2025-10-04: 0
05/10/2025 04:13:23 PM --- Done page: 1/57
05/10/2025 04:13:23 PM --- Number of posts for page 1: 12
05/10/2025 04:13:23 PM --- Number of posts added on 2025-10-05: 0
05/10/2025 04:13:46 PM --- Done page: 2/57
05/10/2025 04:13:46 PM --- Number of posts for page 2: 12
05/10/2025 04:13:46 PM --- Number of posts added on 2025-10-05: 0
05/10/2025 04:14:08 PM --- Done page: 3/57
05/10/2025 04:14:08 PM --- Number of posts for page 3: 12
05/10/2025 04:14:08 PM --- Number of posts added on 2025-10-05: 0
05/10/2025 04:14:31 PM --- Done page: 4/57
05/10/2025 04:14:31 PM --- Number of posts for page 4: 12
05/10/2025 04:14:31 PM --- Number of posts added on 2025-10-05: 0
05/10/2025 04:14:37 PM --- Done page: 5/57
05/10/2025 04:14:37 PM --- Number of posts for page 5: 3
05/10/2025 04:14:37 PM --- Number of posts added on 2025-10-05: 0
06/10/2025 04:15:39 PM --- Done page: 1/57
06/10/2025 04:15:39 PM --- Number of posts for page 1: 12
06/10/2025 04:15:39 PM --- Number of posts added on 2025-10-06: 0
06/10/2025 04:16:09 PM --- Done page: 2/57
06/10/2025 04:16:09 PM --- Number of posts for page 2: 12
06/10/2025 04:16:09 PM --- Number of posts added on 2025-10-06: 0
06/10/2025 04:16:38 PM --- Done page: 3/57
06/10/2025 04:16:38 PM --- Number of posts for page 3: 12
06/10/2025 04:16:38 PM --- Number of posts added on 2025-10-06: 0
06/10/2025 04:17:07 PM --- Done page: 4/57
06/10/2025 04:17:07 PM --- Number of posts for page 4: 12
06/10/2025 04:17:07 PM --- Number of posts added on 2025-10-06: 0
06/10/2025 04:17:15 PM --- Done page: 5/57
06/10/2025 04:17:15 PM --- Number of posts for page 5: 3
06/10/2025 04:17:15 PM --- Number of posts added on 2025-10-06: 0
07/10/2025 04:15:44 PM --- Done page: 1/57
07/10/2025 04:15:44 PM --- Number of posts for page 1: 12
