02/09/2024 01:12:32 PM --- Done: Silent Treatment: Sự im lặng độc hại đã thao túng ta như thế nào?
02/09/2024 01:12:32 PM --- Done: Tình bạn cong - thẳng và những điểm cộng không phải ai cũng biết 
02/09/2024 01:12:33 PM --- Done: Liệu nỗi sợ và chấn thương tâm lý có thể giúp bạn sống tốt hơn?
02/09/2024 01:12:33 PM --- Done: Laws of Detachment: Cách buông bỏ để thấy đời dễ thở hơn
02/09/2024 01:12:33 PM --- Done: Làm thế nào để tìm được ý nghĩa cuộc sống và giá trị của bản thân?
02/09/2024 01:12:34 PM --- Done: Thói quen và mục tiêu: Điều gì quan trọng hơn?
02/09/2024 01:12:35 PM --- Done: 5 Kiểu suy nghĩ dễ khiến bạn lo lắng quá mức 
02/09/2024 01:12:35 PM --- Done: Guilty pleasure - Đã ưng quá chừng mà sao cứ phải giấu?
02/09/2024 01:12:36 PM --- Done: Cẩm nang giúp bạn “kiến tạo” thói quen tốt
02/09/2024 01:12:36 PM --- Done: 3 Bài học trước khi quyết định trốn khỏi thực tại
02/09/2024 01:12:37 PM --- Done: Có phải “cái tôi lớn” lúc nào cũng không tốt?
02/09/2024 01:12:37 PM --- Done: Fawning: Giải quyết xung đột bằng cách vỗ về đối phương
02/09/2024 01:12:37 PM --- Done page: 1/1
02/09/2024 01:12:37 PM --- Number of posts for page 1: 12
02/09/2024 01:13:12 PM --- Done: Silent Treatment: Sự im lặng độc hại đã thao túng ta như thế nào?
02/09/2024 01:13:13 PM --- Done: Tình bạn cong - thẳng và những điểm cộng không phải ai cũng biết 
02/09/2024 01:13:13 PM --- Done: Liệu nỗi sợ và chấn thương tâm lý có thể giúp bạn sống tốt hơn?
02/09/2024 01:13:14 PM --- Done: Laws of Detachment: Cách buông bỏ để thấy đời dễ thở hơn
02/09/2024 01:13:14 PM --- Done: Làm thế nào để tìm được ý nghĩa cuộc sống và giá trị của bản thân?
02/09/2024 01:13:15 PM --- Done: Thói quen và mục tiêu: Điều gì quan trọng hơn?
02/09/2024 01:13:15 PM --- Done: 5 Kiểu suy nghĩ dễ khiến bạn lo lắng quá mức 
02/09/2024 01:13:16 PM --- Done: Guilty pleasure - Đã ưng quá chừng mà sao cứ phải giấu?
02/09/2024 01:13:16 PM --- Done: Cẩm nang giúp bạn “kiến tạo” thói quen tốt
02/09/2024 01:13:17 PM --- Done: 3 Bài học trước khi quyết định trốn khỏi thực tại
02/09/2024 01:13:17 PM --- Done: Có phải “cái tôi lớn” lúc nào cũng không tốt?
02/09/2024 01:13:18 PM --- Done: Fawning: Giải quyết xung đột bằng cách vỗ về đối phương
02/09/2024 01:13:18 PM --- Done page: 1/1
02/09/2024 01:13:18 PM --- Number of posts for page 1: 12
02/09/2024 01:13:18 PM --- Number of posts added on 2024-09-02: 12
02/09/2024 01:13:41 PM --- Done: Silent Treatment: Sự im lặng độc hại đã thao túng ta như thế nào?
02/09/2024 01:13:42 PM --- Done: Tình bạn cong - thẳng và những điểm cộng không phải ai cũng biết 
02/09/2024 01:13:42 PM --- Done: Liệu nỗi sợ và chấn thương tâm lý có thể giúp bạn sống tốt hơn?
02/09/2024 01:13:43 PM --- Done: Laws of Detachment: Cách buông bỏ để thấy đời dễ thở hơn
02/09/2024 01:13:43 PM --- Done: Làm thế nào để tìm được ý nghĩa cuộc sống và giá trị của bản thân?
02/09/2024 01:13:44 PM --- Done: Thói quen và mục tiêu: Điều gì quan trọng hơn?
02/09/2024 01:13:44 PM --- Done: 5 Kiểu suy nghĩ dễ khiến bạn lo lắng quá mức 
02/09/2024 01:13:44 PM --- Done: Guilty pleasure - Đã ưng quá chừng mà sao cứ phải giấu?
02/09/2024 01:13:45 PM --- Done: Cẩm nang giúp bạn “kiến tạo” thói quen tốt
02/09/2024 01:13:45 PM --- Done: 3 Bài học trước khi quyết định trốn khỏi thực tại
02/09/2024 01:13:46 PM --- Done: Có phải “cái tôi lớn” lúc nào cũng không tốt?
02/09/2024 01:13:46 PM --- Done: Fawning: Giải quyết xung đột bằng cách vỗ về đối phương
02/09/2024 01:13:46 PM --- Done page: 1/1
02/09/2024 01:13:46 PM --- Number of posts for page 1: 12
02/09/2024 01:13:46 PM --- Number of posts added on 2024-09-02: 12
02/09/2024 01:15:37 PM --- Done: Silent Treatment: Sự im lặng độc hại đã thao túng ta như thế nào?
02/09/2024 01:15:37 PM --- Done: Tình bạn cong - thẳng và những điểm cộng không phải ai cũng biết 
02/09/2024 01:15:38 PM --- Done: Liệu nỗi sợ và chấn thương tâm lý có thể giúp bạn sống tốt hơn?
02/09/2024 01:15:38 PM --- Done: Laws of Detachment: Cách buông bỏ để thấy đời dễ thở hơn
02/09/2024 01:15:38 PM --- Done: Làm thế nào để tìm được ý nghĩa cuộc sống và giá trị của bản thân?
02/09/2024 01:15:39 PM --- Done: Thói quen và mục tiêu: Điều gì quan trọng hơn?
02/09/2024 01:15:39 PM --- Done: 5 Kiểu suy nghĩ dễ khiến bạn lo lắng quá mức 
02/09/2024 01:15:40 PM --- Done: Guilty pleasure - Đã ưng quá chừng mà sao cứ phải giấu?
02/09/2024 01:15:40 PM --- Done: Cẩm nang giúp bạn “kiến tạo” thói quen tốt
02/09/2024 01:15:41 PM --- Done: 3 Bài học trước khi quyết định trốn khỏi thực tại
02/09/2024 01:15:41 PM --- Done: Có phải “cái tôi lớn” lúc nào cũng không tốt?
02/09/2024 01:15:41 PM --- Done: Fawning: Giải quyết xung đột bằng cách vỗ về đối phương
02/09/2024 01:15:41 PM --- Done page: 1/1
02/09/2024 01:15:41 PM --- Number of posts for page 1: 12
02/09/2024 01:15:41 PM --- Number of posts added on 2024-09-02: 12
02/09/2024 01:16:07 PM --- Done: Silent Treatment: Sự im lặng độc hại đã thao túng ta như thế nào?
02/09/2024 01:16:07 PM --- Done: Tình bạn cong - thẳng và những điểm cộng không phải ai cũng biết 
02/09/2024 01:16:07 PM --- Done: Liệu nỗi sợ và chấn thương tâm lý có thể giúp bạn sống tốt hơn?
02/09/2024 01:16:08 PM --- Done: Laws of Detachment: Cách buông bỏ để thấy đời dễ thở hơn
02/09/2024 01:16:08 PM --- Done: Làm thế nào để tìm được ý nghĩa cuộc sống và giá trị của bản thân?
02/09/2024 01:16:09 PM --- Done: Thói quen và mục tiêu: Điều gì quan trọng hơn?
02/09/2024 01:16:09 PM --- Done: 5 Kiểu suy nghĩ dễ khiến bạn lo lắng quá mức 
02/09/2024 01:16:09 PM --- Done: Guilty pleasure - Đã ưng quá chừng mà sao cứ phải giấu?
02/09/2024 01:16:10 PM --- Done: Cẩm nang giúp bạn “kiến tạo” thói quen tốt
02/09/2024 01:16:10 PM --- Done: 3 Bài học trước khi quyết định trốn khỏi thực tại
02/09/2024 01:16:11 PM --- Done: Có phải “cái tôi lớn” lúc nào cũng không tốt?
02/09/2024 01:16:11 PM --- Done: Fawning: Giải quyết xung đột bằng cách vỗ về đối phương
02/09/2024 01:16:11 PM --- Done page: 1/1
02/09/2024 01:16:11 PM --- Number of posts for page 1: 12
02/09/2024 01:16:11 PM --- Number of posts added on 2024-09-02: 12
02/09/2024 01:16:36 PM --- Done: Silent Treatment: Sự im lặng độc hại đã thao túng ta như thế nào?
02/09/2024 01:16:37 PM --- Done: Tình bạn cong - thẳng và những điểm cộng không phải ai cũng biết 
02/09/2024 01:16:37 PM --- Done: Liệu nỗi sợ và chấn thương tâm lý có thể giúp bạn sống tốt hơn?
02/09/2024 01:16:38 PM --- Done: Laws of Detachment: Cách buông bỏ để thấy đời dễ thở hơn
02/09/2024 01:16:38 PM --- Done: Làm thế nào để tìm được ý nghĩa cuộc sống và giá trị của bản thân?
02/09/2024 01:16:39 PM --- Done: Thói quen và mục tiêu: Điều gì quan trọng hơn?
02/09/2024 01:16:39 PM --- Done: 5 Kiểu suy nghĩ dễ khiến bạn lo lắng quá mức 
02/09/2024 01:16:40 PM --- Done: Guilty pleasure - Đã ưng quá chừng mà sao cứ phải giấu?
02/09/2024 01:16:40 PM --- Done: Cẩm nang giúp bạn “kiến tạo” thói quen tốt
02/09/2024 01:16:40 PM --- Done: 3 Bài học trước khi quyết định trốn khỏi thực tại
02/09/2024 01:16:41 PM --- Done: Có phải “cái tôi lớn” lúc nào cũng không tốt?
02/09/2024 01:16:41 PM --- Done: Fawning: Giải quyết xung đột bằng cách vỗ về đối phương
02/09/2024 01:16:41 PM --- Done page: 1/1
02/09/2024 01:16:41 PM --- Number of posts for page 1: 12
02/09/2024 01:16:41 PM --- Number of posts added on 2024-09-02: 12
02/09/2024 01:18:42 PM --- Done page: 1/1
02/09/2024 01:19:00 PM --- Done page: 1/1
02/09/2024 01:19:00 PM --- Number of posts for page 1: 0
02/09/2024 01:19:00 PM --- Number of posts added on 2024-09-02: 0
02/09/2024 01:19:17 PM --- Done page: 1/1
02/09/2024 01:19:17 PM --- Number of posts for page 1: 0
02/09/2024 01:19:17 PM --- Number of posts added on 2024-09-02: 0
02/09/2024 01:19:45 PM --- Done page: 1/1
02/09/2024 01:19:45 PM --- Number of posts for page 1: 0
02/09/2024 01:19:45 PM --- Number of posts added on 2024-09-02: 0
02/09/2024 01:20:29 PM --- Done page: 1/1
02/09/2024 01:20:29 PM --- Number of posts for page 1: 0
02/09/2024 01:20:29 PM --- Number of posts added on 2024-09-02: 0
02/09/2024 01:22:50 PM --- Done page: 1/1
02/09/2024 01:22:50 PM --- Number of posts for page 1: 0
02/09/2024 01:22:50 PM --- Number of posts added on 2024-09-02: 0
02/09/2024 01:23:19 PM --- Done page: 1/1
02/09/2024 01:23:19 PM --- Number of posts for page 1: 0
02/09/2024 01:23:19 PM --- Number of posts added on 2024-09-02: 0
02/09/2024 01:23:39 PM --- Done page: 1/1
02/09/2024 01:23:39 PM --- Number of posts for page 1: 0
02/09/2024 01:23:39 PM --- Number of posts added on 2024-09-02: 0
02/09/2024 01:25:44 PM --- Done: Đằng sau sự hào nhoáng của văn hóa “girlboss”
02/09/2024 01:25:45 PM --- Done: KBank trao quyền tự tin và nâng cao tự tôn tại môi trường làm việc
02/09/2024 01:25:45 PM --- Done: 3 Bài học về năng suất làm việc từ content creator mà nghề nào cũng nên biết
02/09/2024 01:25:46 PM --- Done: Bạn muốn thăng tiến: Chăm chỉ rồi làm gì nữa?
02/09/2024 01:25:46 PM --- Done: Mơ hồ trong công việc: Nên làm gì khi không biết làm gì?
02/09/2024 01:25:47 PM --- Done: Lộc Lê - creator "mặn mòi" trên LinkedIn bật mí cách làm content sáng tạo 
02/09/2024 01:25:47 PM --- Done: Thế hệ trẻ tìm kiếm sự ổn định trong nghề nghiệp
02/09/2024 01:25:48 PM --- Done: 4 Dấu hiệu để an tâm nhận thêm việc mà không sợ chịu thiệt
02/09/2024 01:25:48 PM --- Done: Coi internet là “chân ái”: Người trẻ tìm việc bớt lo hay lại càng thêm khó? 
02/09/2024 01:25:49 PM --- Done: Moonlighting là gì? Nhân sự ánh trăng, sống nhiều cuộc đời ai biết chăng?
02/09/2024 01:25:49 PM --- Done page: 1/1
02/09/2024 01:25:49 PM --- Number of posts for page 1: 10
02/09/2024 01:25:49 PM --- Number of posts added on 2024-09-02: 10
02/09/2024 01:27:18 PM --- Done: Đằng sau sự hào nhoáng của văn hóa “girlboss”
02/09/2024 01:27:18 PM --- Done: KBank trao quyền tự tin và nâng cao tự tôn tại môi trường làm việc
02/09/2024 01:27:19 PM --- Done: 3 Bài học về năng suất làm việc từ content creator mà nghề nào cũng nên biết
02/09/2024 01:27:19 PM --- Done: Bạn muốn thăng tiến: Chăm chỉ rồi làm gì nữa?
02/09/2024 01:27:20 PM --- Done: Mơ hồ trong công việc: Nên làm gì khi không biết làm gì?
02/09/2024 01:27:20 PM --- Done: Lộc Lê - creator "mặn mòi" trên LinkedIn bật mí cách làm content sáng tạo 
02/09/2024 01:27:21 PM --- Done: Thế hệ trẻ tìm kiếm sự ổn định trong nghề nghiệp
02/09/2024 01:27:21 PM --- Done: 4 Dấu hiệu để an tâm nhận thêm việc mà không sợ chịu thiệt
02/09/2024 01:27:22 PM --- Done: Coi internet là “chân ái”: Người trẻ tìm việc bớt lo hay lại càng thêm khó? 
02/09/2024 01:27:23 PM --- Done: Moonlighting là gì? Nhân sự ánh trăng, sống nhiều cuộc đời ai biết chăng?
02/09/2024 01:27:23 PM --- Done page: 1/1
02/09/2024 01:27:23 PM --- Number of posts for page 1: 10
02/09/2024 01:27:23 PM --- Number of posts added on 2024-09-02: 10
02/09/2024 01:32:25 PM --- Done: Đằng sau sự hào nhoáng của văn hóa “girlboss”
02/09/2024 01:32:26 PM --- Done: KBank trao quyền tự tin và nâng cao tự tôn tại môi trường làm việc
02/09/2024 01:32:27 PM --- Done: 3 Bài học về năng suất làm việc từ content creator mà nghề nào cũng nên biết
02/09/2024 01:32:27 PM --- Done: Bạn muốn thăng tiến: Chăm chỉ rồi làm gì nữa?
02/09/2024 01:32:28 PM --- Done: Mơ hồ trong công việc: Nên làm gì khi không biết làm gì?
02/09/2024 01:32:28 PM --- Done: Lộc Lê - creator "mặn mòi" trên LinkedIn bật mí cách làm content sáng tạo 
02/09/2024 01:32:29 PM --- Done: Thế hệ trẻ tìm kiếm sự ổn định trong nghề nghiệp
02/09/2024 01:32:29 PM --- Done: 4 Dấu hiệu để an tâm nhận thêm việc mà không sợ chịu thiệt
02/09/2024 01:32:30 PM --- Done: Coi internet là “chân ái”: Người trẻ tìm việc bớt lo hay lại càng thêm khó? 
02/09/2024 01:32:30 PM --- Done: Moonlighting là gì? Nhân sự ánh trăng, sống nhiều cuộc đời ai biết chăng?
02/09/2024 01:32:30 PM --- Done page: 1/1
02/09/2024 01:32:30 PM --- Number of posts for page 1: 10
02/09/2024 01:32:30 PM --- Number of posts added on 2024-09-02: 10
02/09/2024 01:33:49 PM --- Done: Đằng sau sự hào nhoáng của văn hóa “girlboss”
02/09/2024 01:33:49 PM --- Done: KBank trao quyền tự tin và nâng cao tự tôn tại môi trường làm việc
02/09/2024 01:33:50 PM --- Done: 3 Bài học về năng suất làm việc từ content creator mà nghề nào cũng nên biết
02/09/2024 01:33:50 PM --- Done: Bạn muốn thăng tiến: Chăm chỉ rồi làm gì nữa?
02/09/2024 01:33:51 PM --- Done: Mơ hồ trong công việc: Nên làm gì khi không biết làm gì?
02/09/2024 01:33:51 PM --- Done: Lộc Lê - creator "mặn mòi" trên LinkedIn bật mí cách làm content sáng tạo 
02/09/2024 01:33:52 PM --- Done: Thế hệ trẻ tìm kiếm sự ổn định trong nghề nghiệp
02/09/2024 01:33:53 PM --- Done: 4 Dấu hiệu để an tâm nhận thêm việc mà không sợ chịu thiệt
02/09/2024 01:33:53 PM --- Done: Coi internet là “chân ái”: Người trẻ tìm việc bớt lo hay lại càng thêm khó? 
02/09/2024 01:33:54 PM --- Done: Moonlighting là gì? Nhân sự ánh trăng, sống nhiều cuộc đời ai biết chăng?
02/09/2024 01:33:54 PM --- Done page: 1/1
02/09/2024 01:33:54 PM --- Number of posts for page 1: 10
02/09/2024 01:33:54 PM --- Number of posts added on 2024-09-02: 10
02/09/2024 03:14:46 PM --- Done: Đằng sau sự hào nhoáng của văn hóa “girlboss”
02/09/2024 03:14:46 PM --- Done: KBank trao quyền tự tin và nâng cao tự tôn tại môi trường làm việc
02/09/2024 03:14:47 PM --- Done: 3 Bài học về năng suất làm việc từ content creator mà nghề nào cũng nên biết
02/09/2024 03:14:47 PM --- Done: Bạn muốn thăng tiến: Chăm chỉ rồi làm gì nữa?
02/09/2024 03:14:48 PM --- Done: Mơ hồ trong công việc: Nên làm gì khi không biết làm gì?
02/09/2024 03:14:48 PM --- Done: Lộc Lê - creator "mặn mòi" trên LinkedIn bật mí cách làm content sáng tạo 
02/09/2024 03:14:49 PM --- Done: Thế hệ trẻ tìm kiếm sự ổn định trong nghề nghiệp
02/09/2024 03:14:49 PM --- Done: 4 Dấu hiệu để an tâm nhận thêm việc mà không sợ chịu thiệt
02/09/2024 03:14:50 PM --- Done: Coi internet là “chân ái”: Người trẻ tìm việc bớt lo hay lại càng thêm khó? 
02/09/2024 03:14:50 PM --- Done: Moonlighting là gì? Nhân sự ánh trăng, sống nhiều cuộc đời ai biết chăng?
02/09/2024 03:14:50 PM --- Done page: 1/15
02/09/2024 03:14:50 PM --- Number of posts for page 1: 10
02/09/2024 03:14:50 PM --- Number of posts added on 2024-09-02: 10
02/09/2024 03:15:08 PM --- Done: "Nghịch lý kinh nghiệm" và 3 tư duy cho người trẻ khi đi làm
02/09/2024 03:15:09 PM --- Done: Làm sao để “bơi” dần khỏi vùng an toàn mà không đuối sức?
02/09/2024 03:15:09 PM --- Done: Khủng hoảng niềm tin nói gì về nhu cầu khi đi làm của người trẻ?
02/09/2024 03:15:10 PM --- Done: 4 Cấp độ an toàn tâm lý khi đi làm, bạn đang ở đâu?
02/09/2024 03:15:10 PM --- Done: Làm sao để bớt “ngột ngạt” trong các mối quan hệ công việc?
02/09/2024 03:15:11 PM --- Done: Phỏng vấn với sếp lớn có gì khác? 4 Tư duy cần có để ghi điểm
02/09/2024 03:15:12 PM --- Done:  Nghỉ việc không tùy tiện, hãy làm điều đó thật “ngầu”
02/09/2024 03:15:12 PM --- Done: Sidebarring - Khi bạn bí mật "tám chuyện" về người ngồi trước mặt 
02/09/2024 03:15:12 PM --- Done: 4 Thông tin cần biết trước để ngồi vững trên bàn đàm phán lương
02/09/2024 03:15:12 PM --- Done page: 2/15
02/09/2024 03:15:12 PM --- Number of posts for page 2: 10
02/09/2024 03:15:12 PM --- Number of posts added on 2024-09-02: 19
02/09/2024 03:15:44 PM --- Done: Người trẻ và nhà tuyển dụng đang tìm nhau trên TikTok như thế nào?
02/09/2024 03:15:44 PM --- Done: New collar - Lực lượng lao động mới, không bằng đại học có chới với?
02/09/2024 03:15:45 PM --- Done: “Quản trị sếp”: Mất nề nếp hay thêm gắn kết?
02/09/2024 03:15:45 PM --- Done: Nhà tuyển dụng công khai dải lương: Để "cho có" hay nhiều ý nghĩa chưa tỏ?
02/09/2024 03:15:46 PM --- Done: Lên chức quản lý, mức lương sao cho vừa ý?
02/09/2024 03:15:46 PM --- Done: Techcombank mang đến cơ hội nào cho nhân tài Việt kiều?
02/09/2024 03:15:47 PM --- Done: Minh bạch lương là gì? Khi người đi làm và nhà tuyển dụng cùng hưởng lợi
02/09/2024 03:15:47 PM --- Done: Quiet managing: Quản lý như không quản lý
02/09/2024 03:15:48 PM --- Done: Phụ nữ đã đòi công bằng về lương bằng LinkedIn như thế nào?
02/09/2024 03:15:48 PM --- Done: Tết bị hỏi lương tháng bao nhiêu, trả lời sao để cô bác nhớ mãi?
02/09/2024 03:15:48 PM --- Done page: 3/15
02/09/2024 03:15:48 PM --- Number of posts for page 3: 10
02/09/2024 03:15:48 PM --- Number of posts added on 2024-09-02: 29
02/09/2024 03:17:01 PM --- Done: Những chia sẻ và đúc kết từ hội nghị 'OV Summit: HOMECOMING' 
02/09/2024 03:17:01 PM --- Done: Bạn muốn tăng lương? 5 Câu tự hỏi mình trước khi hỏi sếp
02/09/2024 03:17:02 PM --- Done: Thế hệ trẻ “Táo bạo tạo ảnh hưởng" chinh phục ngành tài chính bảo hiểm 
02/09/2024 03:17:02 PM --- Done: LinkedIn và Tinder đổi vị trí: Tìm việc như tìm người yêu không chỉ là lời khuyên
02/09/2024 03:17:03 PM --- Done: Nhân tố nào tạo nên một “Nơi làm việc tốt nhất châu Á”?
02/09/2024 03:17:04 PM --- Done: Hai xu hướng "side hustles" và "lazy girl jobs" nói gì về người trẻ?
02/09/2024 03:17:04 PM --- Done: Mình học được gì sau khi hỏi lương của hơn 50 người lạ?
02/09/2024 03:17:05 PM --- Done: Làm việc chăm chỉ để lương cao hơn? - Những điều cần biết để kỳ vọng phù hợp
02/09/2024 03:17:05 PM --- Done: 5 Điều “có thì giữ, mất đi tìm” trong văn hóa đi làm
02/09/2024 03:17:06 PM --- Done: Funemployment: Khi thất nghiệp không tệ như ta tưởng
02/09/2024 03:17:06 PM --- Done page: 4/15
02/09/2024 03:17:06 PM --- Number of posts for page 4: 10
02/09/2024 03:17:06 PM --- Number of posts added on 2024-09-02: 39
02/09/2024 03:18:10 PM --- Done: 7 Kiểu đồng nghiệp bạn đã gặp ít nhất một lần trong đời
02/09/2024 03:18:10 PM --- Done: Bạn là ai trong phòng họp? 4 kiểu tính cách phổ biến
02/09/2024 03:18:11 PM --- Done: Tại sao lương thưởng không còn là yếu tố giữ chân người lao động?
02/09/2024 03:18:12 PM --- Done: Tán gẫu với đồng nghiệp giúp gì cho công việc của bạn?
02/09/2024 03:18:13 PM --- Done: “Làm content” và 3 mộng tưởng của kẻ mới vào nghề
02/09/2024 03:18:14 PM --- Done: Bạn có thua cuộc không khi vẫn đi “làm công”, trong khi ai cũng muốn làm chủ?
02/09/2024 03:18:14 PM --- Done: Khủng hoảng lắng nghe và chuyện sợ bị “vô hình” trong công ty
02/09/2024 03:18:15 PM --- Done: 4 Điều không còn giúp CV của bạn toả sáng
02/09/2024 03:18:15 PM --- Done page: 5/15
02/09/2024 03:18:15 PM --- Number of posts for page 5: 10
02/09/2024 03:18:15 PM --- Number of posts added on 2024-09-02: 47
02/09/2024 03:19:26 PM --- Done: Đùa chuyện “người lớn” khi đi làm: Làm sao để không bị xa lánh?
02/09/2024 03:19:27 PM --- Done: 5 Bước giúp bạn không còn “vò đầu bứt tai" khi ra quyết định
02/09/2024 03:19:27 PM --- Done: Nhảy việc và 3 niềm tin đã cũ
02/09/2024 03:19:28 PM --- Done: 5 Cấp độ chán việc, bạn đang ở đâu?
02/09/2024 03:19:28 PM --- Done: Làm sao để trở thành tân binh xuất sắc trong thị trường công việc 4.0?
02/09/2024 03:19:28 PM --- Done: Quiet hiring: Tuyển dụng mà như không tuyển
02/09/2024 03:19:29 PM --- Done: Productivity paranoia - Khi năng suất trở thành nỗi ám ảnh chốn văn phòng
02/09/2024 03:19:30 PM --- Done: Quiet Firing: Sa thải hay không, xin nói một lời!
02/09/2024 03:19:30 PM --- Done: Rage applying: Tức sếp, đừng xin nghỉ vội mà hãy rải đơn xin việc trước!
02/09/2024 03:19:31 PM --- Done: Bí kíp gì giúp Techcombank thu hút nhân tài năm châu về nước?
02/09/2024 03:19:31 PM --- Done page: 6/15
02/09/2024 03:19:31 PM --- Number of posts for page 6: 10
02/09/2024 03:19:31 PM --- Number of posts added on 2024-09-02: 57
02/09/2024 03:22:57 PM --- Done: Giảm năng suất lao động: Không thể đổ lỗi cho làm việc từ xa!
02/09/2024 03:22:57 PM --- Done: Humble-brag: Tưởng không khoe nhưng khoe không tưởng
02/09/2024 03:22:58 PM --- Done: Môi trường làm việc tốt lành bắt nguồn từ đâu?
02/09/2024 03:22:59 PM --- Done: Vì sao cần xây dựng môi trường làm việc hiện đại, tốt lành?
02/09/2024 03:22:59 PM --- Done: Bare minimum mondays: Cơ chế đối phó để không kiệt sức từ đầu tuần
02/09/2024 03:23:00 PM --- Done: Khi nào biết mình đã sẵn sàng cho sự nghiệp thứ 2?
02/09/2024 03:23:01 PM --- Done: Goldbricker: “Không làm nhưng vẫn có ăn” là có thật!
02/09/2024 03:23:01 PM --- Done: Làm “bạn” với nhân viên, làm “lính” cho lãnh đạo – Chức quản lý có đáng mơ ước?
02/09/2024 03:23:02 PM --- Done: Faux pas là gì mà khiến Hugh Grant bị chỉ trích “kém duyên”?
02/09/2024 03:23:02 PM --- Done: Vì sao bạn muốn nghỉ việc nhưng lại chần chừ?
02/09/2024 03:23:02 PM --- Done page: 7/15
02/09/2024 03:23:02 PM --- Number of posts for page 7: 10
02/09/2024 03:23:02 PM --- Number of posts added on 2024-09-02: 67
02/09/2024 03:26:26 PM --- Done: Vì sao người ta theo đuổi “đa sự nghiệp”?
02/09/2024 03:26:26 PM --- Done: Fudgel - Khi văn phòng trở thành “vở kịch” năng suất
02/09/2024 03:26:27 PM --- Done: Tăng ca ở văn phòng: Đâu là những “red flag” cần tránh?
02/09/2024 03:26:27 PM --- Done: Những “bệnh văn phòng” tiềm ẩn: Bạn có thấy chính mình trong đó? 
02/09/2024 03:26:28 PM --- Done: Vì sao năm nay các công ty chấm dứt tổ chức tiệc tất niên?
02/09/2024 03:26:29 PM --- Done: Ưu tiên sức khoẻ tinh thần để không trở thành “zombie công sở”
02/09/2024 03:26:29 PM --- Done: Mondaze: Khi Thứ Hai biến thành một trò đùa nhiều buồn hơn cười
02/09/2024 03:26:30 PM --- Done: 3 Cái “lỡ” của Intern lần đầu đi làm công ăn lương
02/09/2024 03:26:31 PM --- Done: Workation: Vừa du lịch vừa làm việc có gì vui?
02/09/2024 03:26:31 PM --- Done: Elon Musk dạy ta điều gì về một môi trường làm việc lành mạnh?
02/09/2024 03:26:31 PM --- Done page: 8/15
02/09/2024 03:26:31 PM --- Number of posts for page 8: 10
02/09/2024 03:26:31 PM --- Number of posts added on 2024-09-02: 77
02/09/2024 03:29:34 PM --- Done: “Nữ công” thế kỷ 20 - nhiều hơn là “mũi kim nhỏ nhặt”
02/09/2024 03:29:35 PM --- Done: Định kiến về sếp nữ - Có hay không?
02/09/2024 03:29:36 PM --- Done: Tìm việc “hợp" có khó như bạn nghĩ?
02/09/2024 03:29:36 PM --- Done: "Hành trang" lý tưởng cho xu hướng nghề nghiệp tương lai
02/09/2024 03:29:37 PM --- Done: Techcombank thu hút nhân tài quốc tế về Việt Nam
02/09/2024 03:29:37 PM --- Done: Đi thi IETLS, mất gần 5 triệu lãi cả trăm meme
02/09/2024 03:29:38 PM --- Done: Permalancer - Liệu có thể làm việc linh hoạt mà thu nhập vẫn ổn định?
02/09/2024 03:29:38 PM --- Done: Thời nào có chuyện "công ty là một gia đình"?
02/09/2024 03:29:39 PM --- Done: Watercooler chat - Những cuộc trò chuyện “nhỏ mà có võ” nơi công sở 
02/09/2024 03:29:39 PM --- Done: Clout chaser - Theo đuổi tiếng tăm nhưng nhầm đường lạc lối
02/09/2024 03:29:39 PM --- Done page: 9/15
02/09/2024 03:29:39 PM --- Number of posts for page 9: 10
02/09/2024 03:29:39 PM --- Number of posts added on 2024-09-02: 87
02/09/2024 03:32:55 PM --- Done: Thể hiện cảm xúc trong công việc, làm sao không "ô dề"? 
02/09/2024 03:32:55 PM --- Done: 5 Câu hỏi phỏng vấn xin việc đã lỗi thời nhưng bạn vẫn phải trả lời
02/09/2024 03:32:56 PM --- Done: Góp ý mang tính xây dựng: Hành xử sao cho không "ô dề"
02/09/2024 03:32:58 PM --- Done: Người trẻ đi làm: Đến văn phòng hay ra “hoang đảo ký giả”?
02/09/2024 03:32:58 PM --- Done: Khủng hoảng 30: Luôn có ai đó đồng hành cùng ta
02/09/2024 03:32:59 PM --- Done: Khám phá môi trường công sở xưa và nay qua 8 từ lóng tiếng Anh
02/09/2024 03:33:00 PM --- Done: Gen Z và chuyện thực tập: Bước chuyển từ nhà trường đến thực tế
02/09/2024 03:33:01 PM --- Done: Freelancer sống rủi ro trong "nền kinh tế tạm bợ"
02/09/2024 03:33:01 PM --- Done page: 10/15
02/09/2024 03:33:01 PM --- Number of posts for page 10: 10
02/09/2024 03:33:01 PM --- Number of posts added on 2024-09-02: 95
02/09/2024 03:38:39 PM --- Done: Đằng sau sự hào nhoáng của văn hóa “girlboss”
02/09/2024 03:38:39 PM --- Done: KBank trao quyền tự tin và nâng cao tự tôn tại môi trường làm việc
02/09/2024 03:38:40 PM --- Done: 3 Bài học về năng suất làm việc từ content creator mà nghề nào cũng nên biết
02/09/2024 03:38:40 PM --- Done: Bạn muốn thăng tiến: Chăm chỉ rồi làm gì nữa?
02/09/2024 03:38:41 PM --- Done: Mơ hồ trong công việc: Nên làm gì khi không biết làm gì?
02/09/2024 03:38:41 PM --- Done: Lộc Lê - creator "mặn mòi" trên LinkedIn bật mí cách làm content sáng tạo 
02/09/2024 03:38:42 PM --- Done: Thế hệ trẻ tìm kiếm sự ổn định trong nghề nghiệp
02/09/2024 03:38:42 PM --- Done: 4 Dấu hiệu để an tâm nhận thêm việc mà không sợ chịu thiệt
02/09/2024 03:38:43 PM --- Done: Coi internet là “chân ái”: Người trẻ tìm việc bớt lo hay lại càng thêm khó? 
02/09/2024 03:38:43 PM --- Done: Moonlighting là gì? Nhân sự ánh trăng, sống nhiều cuộc đời ai biết chăng?
02/09/2024 03:38:43 PM --- Done page: 1/15
02/09/2024 03:38:43 PM --- Number of posts for page 1: 10
02/09/2024 03:38:43 PM --- Number of posts added on 2024-09-02: 10
02/09/2024 03:39:03 PM --- Done: "Nghịch lý kinh nghiệm" và 3 tư duy cho người trẻ khi đi làm
02/09/2024 03:39:03 PM --- Done: Làm sao để “bơi” dần khỏi vùng an toàn mà không đuối sức?
02/09/2024 03:39:04 PM --- Done: Khủng hoảng niềm tin nói gì về nhu cầu khi đi làm của người trẻ?
02/09/2024 03:39:04 PM --- Done: 4 Cấp độ an toàn tâm lý khi đi làm, bạn đang ở đâu?
02/09/2024 03:39:05 PM --- Done: Làm sao để bớt “ngột ngạt” trong các mối quan hệ công việc?
02/09/2024 03:39:05 PM --- Done: Phỏng vấn với sếp lớn có gì khác? 4 Tư duy cần có để ghi điểm
02/09/2024 03:39:06 PM --- Done:  Nghỉ việc không tùy tiện, hãy làm điều đó thật “ngầu”
02/09/2024 03:39:06 PM --- Done: Sidebarring - Khi bạn bí mật "tám chuyện" về người ngồi trước mặt 
02/09/2024 03:39:07 PM --- Done: 4 Thông tin cần biết trước để ngồi vững trên bàn đàm phán lương
02/09/2024 03:39:07 PM --- Done page: 2/15
02/09/2024 03:39:07 PM --- Number of posts for page 2: 10
02/09/2024 03:39:07 PM --- Number of posts added on 2024-09-02: 19
02/09/2024 03:42:54 PM --- Done post: Đằng sau sự hào nhoáng của văn hóa “girlboss”
02/09/2024 03:42:55 PM --- Done post: KBank trao quyền tự tin và nâng cao tự tôn tại môi trường làm việc
02/09/2024 03:42:55 PM --- Done post: 3 Bài học về năng suất làm việc từ content creator mà nghề nào cũng nên biết
02/09/2024 03:42:56 PM --- Done post: Bạn muốn thăng tiến: Chăm chỉ rồi làm gì nữa?
02/09/2024 03:42:57 PM --- Done post: Mơ hồ trong công việc: Nên làm gì khi không biết làm gì?
02/09/2024 03:42:57 PM --- Done post: Lộc Lê - creator "mặn mòi" trên LinkedIn bật mí cách làm content sáng tạo 
02/09/2024 03:42:58 PM --- Done post: Thế hệ trẻ tìm kiếm sự ổn định trong nghề nghiệp
02/09/2024 03:42:58 PM --- Done post: 4 Dấu hiệu để an tâm nhận thêm việc mà không sợ chịu thiệt
02/09/2024 03:42:59 PM --- Done post: Coi internet là “chân ái”: Người trẻ tìm việc bớt lo hay lại càng thêm khó? 
02/09/2024 03:42:59 PM --- Done post: Moonlighting là gì? Nhân sự ánh trăng, sống nhiều cuộc đời ai biết chăng?
02/09/2024 03:42:59 PM --- Done page: 1/15
02/09/2024 03:42:59 PM --- Number of posts for page 1: 10
02/09/2024 03:42:59 PM --- Number of posts added on 2024-09-02: 10
02/09/2024 03:43:01 PM --- Done post: "Nghịch lý kinh nghiệm" và 3 tư duy cho người trẻ khi đi làm
02/09/2024 03:43:01 PM --- Done post: Làm sao để “bơi” dần khỏi vùng an toàn mà không đuối sức?
02/09/2024 03:43:01 PM --- Done post: Khủng hoảng niềm tin nói gì về nhu cầu khi đi làm của người trẻ?
02/09/2024 03:43:02 PM --- Done post: 4 Cấp độ an toàn tâm lý khi đi làm, bạn đang ở đâu?
02/09/2024 03:43:03 PM --- Done post: Làm sao để bớt “ngột ngạt” trong các mối quan hệ công việc?
02/09/2024 03:43:03 PM --- Done post: Phỏng vấn với sếp lớn có gì khác? 4 Tư duy cần có để ghi điểm
02/09/2024 03:43:03 PM --- Done post:  Nghỉ việc không tùy tiện, hãy làm điều đó thật “ngầu”
02/09/2024 03:43:04 PM --- Done post: Sidebarring - Khi bạn bí mật "tám chuyện" về người ngồi trước mặt 
02/09/2024 03:43:04 PM --- Done post: 4 Thông tin cần biết trước để ngồi vững trên bàn đàm phán lương
02/09/2024 03:43:04 PM --- Done page: 2/15
02/09/2024 03:43:04 PM --- Number of posts for page 2: 10
02/09/2024 03:43:04 PM --- Number of posts added on 2024-09-02: 19
02/09/2024 03:43:05 PM --- Done post: Người trẻ và nhà tuyển dụng đang tìm nhau trên TikTok như thế nào?
02/09/2024 03:43:06 PM --- Done post: New collar - Lực lượng lao động mới, không bằng đại học có chới với?
02/09/2024 03:43:06 PM --- Done post: “Quản trị sếp”: Mất nề nếp hay thêm gắn kết?
02/09/2024 03:43:07 PM --- Done post: Nhà tuyển dụng công khai dải lương: Để "cho có" hay nhiều ý nghĩa chưa tỏ?
02/09/2024 03:43:07 PM --- Done post: Lên chức quản lý, mức lương sao cho vừa ý?
02/09/2024 03:43:07 PM --- Done post: Techcombank mang đến cơ hội nào cho nhân tài Việt kiều?
02/09/2024 03:43:08 PM --- Done post: Minh bạch lương là gì? Khi người đi làm và nhà tuyển dụng cùng hưởng lợi
02/09/2024 03:43:08 PM --- Done post: Quiet managing: Quản lý như không quản lý
02/09/2024 03:43:09 PM --- Done post: Phụ nữ đã đòi công bằng về lương bằng LinkedIn như thế nào?
02/09/2024 03:43:09 PM --- Done post: Tết bị hỏi lương tháng bao nhiêu, trả lời sao để cô bác nhớ mãi?
02/09/2024 03:43:09 PM --- Done page: 3/15
02/09/2024 03:43:09 PM --- Number of posts for page 3: 10
02/09/2024 03:43:09 PM --- Number of posts added on 2024-09-02: 29
02/09/2024 03:43:10 PM --- Done post: Những chia sẻ và đúc kết từ hội nghị 'OV Summit: HOMECOMING' 
02/09/2024 03:43:10 PM --- Done post: Bạn muốn tăng lương? 5 Câu tự hỏi mình trước khi hỏi sếp
02/09/2024 03:43:11 PM --- Done post: Thế hệ trẻ “Táo bạo tạo ảnh hưởng" chinh phục ngành tài chính bảo hiểm 
02/09/2024 03:43:11 PM --- Done post: LinkedIn và Tinder đổi vị trí: Tìm việc như tìm người yêu không chỉ là lời khuyên
02/09/2024 03:43:12 PM --- Done post: Nhân tố nào tạo nên một “Nơi làm việc tốt nhất châu Á”?
02/09/2024 03:43:12 PM --- Done post: Hai xu hướng "side hustles" và "lazy girl jobs" nói gì về người trẻ?
02/09/2024 03:43:13 PM --- Done post: Mình học được gì sau khi hỏi lương của hơn 50 người lạ?
02/09/2024 03:43:13 PM --- Done post: Làm việc chăm chỉ để lương cao hơn? - Những điều cần biết để kỳ vọng phù hợp
02/09/2024 03:43:13 PM --- Done post: 5 Điều “có thì giữ, mất đi tìm” trong văn hóa đi làm
02/09/2024 03:43:14 PM --- Done post: Funemployment: Khi thất nghiệp không tệ như ta tưởng
02/09/2024 03:43:14 PM --- Done page: 4/15
02/09/2024 03:43:14 PM --- Number of posts for page 4: 10
02/09/2024 03:43:14 PM --- Number of posts added on 2024-09-02: 39
02/09/2024 03:43:15 PM --- Done post: 7 Kiểu đồng nghiệp bạn đã gặp ít nhất một lần trong đời
02/09/2024 03:43:15 PM --- Done post: Bạn là ai trong phòng họp? 4 kiểu tính cách phổ biến
02/09/2024 03:43:16 PM --- Done post: Tại sao lương thưởng không còn là yếu tố giữ chân người lao động?
02/09/2024 03:43:17 PM --- Done post: Tán gẫu với đồng nghiệp giúp gì cho công việc của bạn?
02/09/2024 03:43:18 PM --- Done post: “Làm content” và 3 mộng tưởng của kẻ mới vào nghề
02/09/2024 03:43:18 PM --- Done post: Bạn có thua cuộc không khi vẫn đi “làm công”, trong khi ai cũng muốn làm chủ?
02/09/2024 03:43:19 PM --- Done post: Khủng hoảng lắng nghe và chuyện sợ bị “vô hình” trong công ty
02/09/2024 03:43:19 PM --- Done post: 4 Điều không còn giúp CV của bạn toả sáng
02/09/2024 03:43:19 PM --- Done page: 5/15
02/09/2024 03:43:19 PM --- Number of posts for page 5: 10
02/09/2024 03:43:19 PM --- Number of posts added on 2024-09-02: 47
02/09/2024 03:43:20 PM --- Done post: Đùa chuyện “người lớn” khi đi làm: Làm sao để không bị xa lánh?
02/09/2024 03:43:21 PM --- Done post: 5 Bước giúp bạn không còn “vò đầu bứt tai" khi ra quyết định
02/09/2024 03:43:21 PM --- Done post: Nhảy việc và 3 niềm tin đã cũ
02/09/2024 03:43:22 PM --- Done post: 5 Cấp độ chán việc, bạn đang ở đâu?
02/09/2024 03:43:22 PM --- Done post: Làm sao để trở thành tân binh xuất sắc trong thị trường công việc 4.0?
02/09/2024 03:43:23 PM --- Done post: Quiet hiring: Tuyển dụng mà như không tuyển
02/09/2024 03:43:23 PM --- Done post: Productivity paranoia - Khi năng suất trở thành nỗi ám ảnh chốn văn phòng
02/09/2024 03:43:24 PM --- Done post: Quiet Firing: Sa thải hay không, xin nói một lời!
02/09/2024 03:43:24 PM --- Done post: Rage applying: Tức sếp, đừng xin nghỉ vội mà hãy rải đơn xin việc trước!
02/09/2024 03:43:25 PM --- Done post: Bí kíp gì giúp Techcombank thu hút nhân tài năm châu về nước?
02/09/2024 03:43:25 PM --- Done page: 6/15
02/09/2024 03:43:25 PM --- Number of posts for page 6: 10
02/09/2024 03:43:25 PM --- Number of posts added on 2024-09-02: 57
02/09/2024 03:43:25 PM --- Done post: Giảm năng suất lao động: Không thể đổ lỗi cho làm việc từ xa!
02/09/2024 03:43:26 PM --- Done post: Humble-brag: Tưởng không khoe nhưng khoe không tưởng
02/09/2024 03:43:26 PM --- Done post: Môi trường làm việc tốt lành bắt nguồn từ đâu?
02/09/2024 03:43:27 PM --- Done post: Vì sao cần xây dựng môi trường làm việc hiện đại, tốt lành?
02/09/2024 03:43:27 PM --- Done post: Bare minimum mondays: Cơ chế đối phó để không kiệt sức từ đầu tuần
02/09/2024 03:43:28 PM --- Done post: Khi nào biết mình đã sẵn sàng cho sự nghiệp thứ 2?
02/09/2024 03:43:28 PM --- Done post: Goldbricker: “Không làm nhưng vẫn có ăn” là có thật!
02/09/2024 03:43:29 PM --- Done post: Làm “bạn” với nhân viên, làm “lính” cho lãnh đạo – Chức quản lý có đáng mơ ước?
02/09/2024 03:43:29 PM --- Done post: Faux pas là gì mà khiến Hugh Grant bị chỉ trích “kém duyên”?
02/09/2024 03:43:30 PM --- Done post: Vì sao bạn muốn nghỉ việc nhưng lại chần chừ?
02/09/2024 03:43:30 PM --- Done page: 7/15
02/09/2024 03:43:30 PM --- Number of posts for page 7: 10
02/09/2024 03:43:30 PM --- Number of posts added on 2024-09-02: 67
02/09/2024 03:43:31 PM --- Done post: Vì sao người ta theo đuổi “đa sự nghiệp”?
02/09/2024 03:43:31 PM --- Done post: Fudgel - Khi văn phòng trở thành “vở kịch” năng suất
02/09/2024 03:43:31 PM --- Done post: Tăng ca ở văn phòng: Đâu là những “red flag” cần tránh?
02/09/2024 03:43:32 PM --- Done post: Những “bệnh văn phòng” tiềm ẩn: Bạn có thấy chính mình trong đó? 
02/09/2024 03:43:32 PM --- Done post: Vì sao năm nay các công ty chấm dứt tổ chức tiệc tất niên?
02/09/2024 03:43:33 PM --- Done post: Ưu tiên sức khoẻ tinh thần để không trở thành “zombie công sở”
02/09/2024 03:43:33 PM --- Done post: Mondaze: Khi Thứ Hai biến thành một trò đùa nhiều buồn hơn cười
02/09/2024 03:43:34 PM --- Done post: 3 Cái “lỡ” của Intern lần đầu đi làm công ăn lương
02/09/2024 03:43:34 PM --- Done post: Workation: Vừa du lịch vừa làm việc có gì vui?
02/09/2024 03:43:35 PM --- Done post: Elon Musk dạy ta điều gì về một môi trường làm việc lành mạnh?
02/09/2024 03:43:35 PM --- Done page: 8/15
02/09/2024 03:43:35 PM --- Number of posts for page 8: 10
02/09/2024 03:43:35 PM --- Number of posts added on 2024-09-02: 77
02/09/2024 03:43:35 PM --- Done post: “Nữ công” thế kỷ 20 - nhiều hơn là “mũi kim nhỏ nhặt”
02/09/2024 03:43:36 PM --- Done post: Định kiến về sếp nữ - Có hay không?
02/09/2024 03:43:36 PM --- Done post: Tìm việc “hợp" có khó như bạn nghĩ?
02/09/2024 03:43:37 PM --- Done post: "Hành trang" lý tưởng cho xu hướng nghề nghiệp tương lai
02/09/2024 03:43:37 PM --- Done post: Techcombank thu hút nhân tài quốc tế về Việt Nam
02/09/2024 03:43:38 PM --- Done post: Đi thi IETLS, mất gần 5 triệu lãi cả trăm meme
02/09/2024 03:43:38 PM --- Done post: Permalancer - Liệu có thể làm việc linh hoạt mà thu nhập vẫn ổn định?
02/09/2024 03:43:38 PM --- Done post: Thời nào có chuyện "công ty là một gia đình"?
02/09/2024 03:43:39 PM --- Done post: Watercooler chat - Những cuộc trò chuyện “nhỏ mà có võ” nơi công sở 
02/09/2024 03:43:39 PM --- Done post: Clout chaser - Theo đuổi tiếng tăm nhưng nhầm đường lạc lối
02/09/2024 03:43:39 PM --- Done page: 9/15
02/09/2024 03:43:39 PM --- Number of posts for page 9: 10
02/09/2024 03:43:39 PM --- Number of posts added on 2024-09-02: 87
02/09/2024 03:43:40 PM --- Done post: Thể hiện cảm xúc trong công việc, làm sao không "ô dề"? 
02/09/2024 03:43:41 PM --- Done post: 5 Câu hỏi phỏng vấn xin việc đã lỗi thời nhưng bạn vẫn phải trả lời
02/09/2024 03:43:41 PM --- Done post: Góp ý mang tính xây dựng: Hành xử sao cho không "ô dề"
02/09/2024 03:43:42 PM --- Done post: Người trẻ đi làm: Đến văn phòng hay ra “hoang đảo ký giả”?
02/09/2024 03:43:43 PM --- Done post: Khủng hoảng 30: Luôn có ai đó đồng hành cùng ta
02/09/2024 03:43:43 PM --- Done post: Khám phá môi trường công sở xưa và nay qua 8 từ lóng tiếng Anh
02/09/2024 03:43:44 PM --- Done post: Gen Z và chuyện thực tập: Bước chuyển từ nhà trường đến thực tế
02/09/2024 03:43:44 PM --- Done post: Freelancer sống rủi ro trong "nền kinh tế tạm bợ"
02/09/2024 03:43:44 PM --- Done page: 10/15
02/09/2024 03:43:44 PM --- Number of posts for page 10: 10
02/09/2024 03:43:44 PM --- Number of posts added on 2024-09-02: 95
02/09/2024 03:43:45 PM --- Done post: Tư duy "gia tộc hoá" trong cơ quan và vấn đề lạm dụng tình dục
02/09/2024 03:43:46 PM --- Done post:  Làm tại văn phòng, chỉ một-hai ngày là đủ!
02/09/2024 03:43:46 PM --- Done post: 7 Dấu hiệu bạn đang bị sếp soi quá mức
02/09/2024 03:43:47 PM --- Done post: “Muốn cải thiện giao tiếp nội bộ, hãy chơi game online” - Anh Ngô Trần Hải Nam, PR Manager từ Box Studio
02/09/2024 03:43:47 PM --- Done post: Golden handcuffs - Phần thưởng xứng đáng hay chiếc còng giữ chân?
02/09/2024 03:43:48 PM --- Done post: Work-Life balance: Khi cân bằng đến từ phía công việc
02/09/2024 03:43:48 PM --- Done post: Trở về công ty cũ làm việc, bạn cần chú ý những gì?
02/09/2024 03:43:49 PM --- Done post: Work zombie - Bạn có đang nghỉ việc trong tư tưởng?
02/09/2024 03:43:50 PM --- Done post: Scope creep - Cơn ác mộng "Ủa em"
02/09/2024 03:43:50 PM --- Done post: Karoshi - Khi “làm việc đến chết” là có thật
02/09/2024 03:43:50 PM --- Done page: 11/15
02/09/2024 03:43:50 PM --- Number of posts for page 11: 10
02/09/2024 03:43:50 PM --- Number of posts added on 2024-09-02: 105
02/09/2024 03:43:51 PM --- Done post: Trí thông minh văn hóa – "Biết người biết ta" khi ra thế giới
02/09/2024 03:43:52 PM --- Done post: Đổi mới trong ngành nhân sự với Sakshi Jawa - Recap “Vietnam Innovators” | Mùa 2 - Tập 4 
02/09/2024 03:43:52 PM --- Done post: Trách nhiệm của bộ phận quản trị nhân sự chỉ bao gồm việc hành chính và quản lý? - Recap “Vietnam Innovators” | Mùa 2 - Tập 3
02/09/2024 03:43:54 PM --- Done post: Những thủ thuật cần biết để có một cuộc tranh luận văn minh
02/09/2024 03:43:54 PM --- Done post: Black company là gì? Dấu hiệu nhận biết công ty đen
02/09/2024 03:43:54 PM --- Done post: 8 Sai lầm sự nghiệp tuổi 20 mình đã tha thứ cho bản thân
02/09/2024 03:43:55 PM --- Done post: Cách chúng ta nghĩ về công việc sau đại dịch liệu có thay đổi?
02/09/2024 03:43:56 PM --- Done post: Work-from-home có tước đi của chúng ta thời gian biểu lành mạnh?
02/09/2024 03:43:56 PM --- Done post: Kudos hay "Ờ mây zing gút chóp em" kiểu Tây!
02/09/2024 03:43:56 PM --- Done page: 12/15
02/09/2024 03:43:56 PM --- Number of posts for page 12: 10
02/09/2024 03:43:56 PM --- Number of posts added on 2024-09-02: 114
02/09/2024 03:43:57 PM --- Done post: 7 Dấu hiệu nhận diện gaslighting nơi công sở
02/09/2024 03:43:58 PM --- Done post: Để đi làm không chỉ đơn thuần là “chuỗi ngày chấm công”
02/09/2024 03:43:58 PM --- Done post: Khi sự tôn thờ công việc cản trở những thay đổi trong sự nghiệp
02/09/2024 03:43:59 PM --- Done post: Cẩm nang sinh tồn khi “nhảy việc”
02/09/2024 03:43:59 PM --- Done post: Hành trang cần chuẩn bị trước khi “nhảy ngành” 
02/09/2024 03:44:00 PM --- Done post: Năm-hai-mươi-mấy, nhảy việc nghe cũng không tệ lắm!
02/09/2024 03:44:01 PM --- Done post: Work spouse – Khi đồng nghiệp trở thành một phần quan trọng trong công việc
02/09/2024 03:44:01 PM --- Done post: Vì sao các bếp trưởng là "kẻ bắt nạt"?
02/09/2024 03:44:02 PM --- Done post: Control freak: Bạn có đang làm việc cho một vị sếp ám ảnh kiểm soát?
02/09/2024 03:44:03 PM --- Done post: Gen Z ở Việt Nam nghĩ gì về “Tính cá nhân hóa” và “Quyền lựa chọn”?
02/09/2024 03:44:03 PM --- Done page: 13/15
02/09/2024 03:44:03 PM --- Number of posts for page 13: 10
02/09/2024 03:44:03 PM --- Number of posts added on 2024-09-02: 124
02/09/2024 03:44:03 PM --- Done post: Bắt nạt công sở: Tại sao nơi làm việc cũng có thể trở nên "độc hại"
02/09/2024 03:44:04 PM --- Done post: Toilet nữ, muôn vàn chuyện "khó xử"
02/09/2024 03:44:04 PM --- Done post: Đi làm mà cứ bị hỏi tuổi thì phải làm sao?
02/09/2024 03:44:05 PM --- Done post: Từ làng quê Việt đến bờ Đông nước Mỹ: Hành trình chinh phục giấc mơ du học của Toàn Võ
02/09/2024 03:44:06 PM --- Done post: Billy Phạm: Từ Thung lũng Silicon đến sân khấu Người Ấy Là Ai
02/09/2024 03:44:06 PM --- Done post: Đồng nghiệp mắc lỗi phục trang - Làm thế nào góp ý cho khéo?
02/09/2024 03:44:07 PM --- Done post: Cách xử lý 5 vấn đề thường gặp cho người mới đi làm
02/09/2024 03:44:07 PM --- Done post: Bí quyết chống "ngây thơ" khi đi thực tập
02/09/2024 03:44:08 PM --- Done post: Những liều thuốc ngừa drama khi làm việc nhóm
02/09/2024 03:44:08 PM --- Done post: 5 Điều cần lưu ý để hoà nhập vào môi trường làm việc mới
02/09/2024 03:44:08 PM --- Done page: 14/15
02/09/2024 03:44:08 PM --- Number of posts for page 14: 10
02/09/2024 03:44:08 PM --- Number of posts added on 2024-09-02: 134
02/09/2024 03:44:09 PM --- Done post: Gây hấn thụ động (passive-aggressive) là gì?
02/09/2024 03:44:10 PM --- Done post: Làm gì khi cân bằng cuộc sống và công việc là điều không tưởng?
02/09/2024 03:44:11 PM --- Done post: Office Gossip: “Liệu pháp" sống ôn hoà chốn công sở
02/09/2024 03:44:11 PM --- Done post: 'Nhậu' có phải một loại kỹ năng mềm?
02/09/2024 03:44:12 PM --- Done post: Nhận diện ‘sếp xấu tính’ và ‘sếp khó tính’
02/09/2024 03:44:12 PM --- Done post: 7 Điều chỉ những người làm việc trong môi trường song ngữ mới hiểu
02/09/2024 03:44:13 PM --- Done post: Lỡ đi trễ? 3 bước giúp bạn giữ điểm với nhà tuyển dụng
02/09/2024 03:44:13 PM --- Done page: 15/15
02/09/2024 03:44:13 PM --- Number of posts for page 15: 7
02/09/2024 03:44:13 PM --- Number of posts added on 2024-09-02: 14103/09/2024 06:39:37 PM --- Done page: 1/1
03/09/2024 06:39:37 PM --- Number of posts for page 1: 10
03/09/2024 06:39:37 PM --- Number of posts added on 2024-09-03: 0
03/09/2024 04:40:21 PM --- Done page: 1/1
03/09/2024 04:40:21 PM --- Number of posts for page 1: 10
03/09/2024 04:40:21 PM --- Number of posts added on 2024-09-03: 0
04/09/2024 04:39:14 PM --- Done page: 1/1
04/09/2024 04:39:14 PM --- Number of posts for page 1: 10
04/09/2024 04:39:14 PM --- Number of posts added on 2024-09-04: 0
05/09/2024 04:39:36 PM --- Done page: 1/1
05/09/2024 04:39:36 PM --- Number of posts for page 1: 10
05/09/2024 04:39:36 PM --- Number of posts added on 2024-09-05: 0
06/09/2024 04:41:55 PM --- Done page: 1/1
06/09/2024 04:41:55 PM --- Number of posts for page 1: 10
06/09/2024 04:41:55 PM --- Number of posts added on 2024-09-06: 0
07/09/2024 04:37:18 PM --- Done page: 1/1
07/09/2024 04:37:18 PM --- Number of posts for page 1: 10
07/09/2024 04:37:18 PM --- Number of posts added on 2024-09-07: 0
08/09/2024 04:38:48 PM --- Done page: 1/1
08/09/2024 04:38:48 PM --- Number of posts for page 1: 10
08/09/2024 04:38:48 PM --- Number of posts added on 2024-09-08: 0
09/09/2024 04:39:35 PM --- Done page: 1/1
09/09/2024 04:39:35 PM --- Number of posts for page 1: 10
09/09/2024 04:39:35 PM --- Number of posts added on 2024-09-09: 0
10/09/2024 04:39:46 PM --- Done page: 1/1
10/09/2024 04:39:46 PM --- Number of posts for page 1: 10
10/09/2024 04:39:46 PM --- Number of posts added on 2024-09-10: 0
11/09/2024 04:39:45 PM --- Done page: 1/1
11/09/2024 04:39:45 PM --- Number of posts for page 1: 10
11/09/2024 04:39:45 PM --- Number of posts added on 2024-09-11: 0
12/09/2024 04:40:31 PM --- Done page: 1/1
12/09/2024 04:40:31 PM --- Number of posts for page 1: 10
12/09/2024 04:40:31 PM --- Number of posts added on 2024-09-12: 0
13/09/2024 04:38:39 PM --- Done page: 1/1
13/09/2024 04:38:39 PM --- Number of posts for page 1: 10
13/09/2024 04:38:39 PM --- Number of posts added on 2024-09-13: 0
14/09/2024 04:38:07 PM --- Done page: 1/1
14/09/2024 04:38:07 PM --- Number of posts for page 1: 10
14/09/2024 04:38:07 PM --- Number of posts added on 2024-09-14: 0
15/09/2024 04:39:48 PM --- Done page: 1/1
15/09/2024 04:39:48 PM --- Number of posts for page 1: 10
15/09/2024 04:39:48 PM --- Number of posts added on 2024-09-15: 0
16/09/2024 04:41:24 PM --- Done post: Ghost job - Nghịch lý đăng tuyển dụng nhưng không tuyển người
16/09/2024 04:41:46 PM --- Done page: 1/1
16/09/2024 04:41:46 PM --- Number of posts for page 1: 10
16/09/2024 04:41:46 PM --- Number of posts added on 2024-09-16: 1
17/09/2024 04:40:19 PM --- Done page: 1/1
17/09/2024 04:40:19 PM --- Number of posts for page 1: 10
17/09/2024 04:40:19 PM --- Number of posts added on 2024-09-17: 0
18/09/2024 04:40:06 PM --- Done page: 1/1
18/09/2024 04:40:06 PM --- Number of posts for page 1: 10
18/09/2024 04:40:06 PM --- Number of posts added on 2024-09-18: 0
19/09/2024 04:40:38 PM --- Done page: 1/1
19/09/2024 04:40:38 PM --- Number of posts for page 1: 10
19/09/2024 04:40:38 PM --- Number of posts added on 2024-09-19: 0
20/09/2024 04:40:25 PM --- Done page: 1/1
20/09/2024 04:40:25 PM --- Number of posts for page 1: 10
20/09/2024 04:40:25 PM --- Number of posts added on 2024-09-20: 0
21/09/2024 04:39:17 PM --- Done page: 1/1
21/09/2024 04:39:17 PM --- Number of posts for page 1: 10
21/09/2024 04:39:17 PM --- Number of posts added on 2024-09-21: 0
22/09/2024 04:37:32 PM --- Done page: 1/1
22/09/2024 04:37:32 PM --- Number of posts for page 1: 10
22/09/2024 04:37:32 PM --- Number of posts added on 2024-09-22: 0
23/09/2024 04:40:15 PM --- Done page: 1/1
23/09/2024 04:40:15 PM --- Number of posts for page 1: 10
23/09/2024 04:40:15 PM --- Number of posts added on 2024-09-23: 0
24/09/2024 04:41:32 PM --- Done page: 1/1
24/09/2024 04:41:32 PM --- Number of posts for page 1: 10
24/09/2024 04:41:32 PM --- Number of posts added on 2024-09-24: 0
25/09/2024 04:43:54 PM --- Done page: 1/1
25/09/2024 04:43:54 PM --- Number of posts for page 1: 10
25/09/2024 04:43:54 PM --- Number of posts added on 2024-09-25: 0
26/09/2024 04:41:08 PM --- Done page: 1/1
26/09/2024 04:41:08 PM --- Number of posts for page 1: 10
26/09/2024 04:41:08 PM --- Number of posts added on 2024-09-26: 0
27/09/2024 04:40:59 PM --- Done page: 1/1
27/09/2024 04:40:59 PM --- Number of posts for page 1: 10
27/09/2024 04:40:59 PM --- Number of posts added on 2024-09-27: 0
28/09/2024 04:38:45 PM --- Done page: 1/1
28/09/2024 04:38:45 PM --- Number of posts for page 1: 10
28/09/2024 04:38:45 PM --- Number of posts added on 2024-09-28: 0
29/09/2024 04:39:13 PM --- Done page: 1/1
29/09/2024 04:39:13 PM --- Number of posts for page 1: 10
29/09/2024 04:39:13 PM --- Number of posts added on 2024-09-29: 0
30/09/2024 04:42:11 PM --- Done page: 1/1
30/09/2024 04:42:11 PM --- Number of posts for page 1: 10
30/09/2024 04:42:11 PM --- Number of posts added on 2024-09-30: 0
01/10/2024 04:42:13 PM --- Done page: 1/1
01/10/2024 04:42:13 PM --- Number of posts for page 1: 10
01/10/2024 04:42:13 PM --- Number of posts added on 2024-10-01: 0
02/10/2024 04:41:32 PM --- Done page: 1/1
02/10/2024 04:41:32 PM --- Number of posts for page 1: 10
02/10/2024 04:41:32 PM --- Number of posts added on 2024-10-02: 0
03/10/2024 04:41:44 PM --- Done page: 1/1
03/10/2024 04:41:44 PM --- Number of posts for page 1: 10
03/10/2024 04:41:44 PM --- Number of posts added on 2024-10-03: 0
04/10/2024 04:40:58 PM --- Done post: 4 Dấu hiệu nhận biết “cờ xanh" trong văn hoá làm việc
04/10/2024 04:41:20 PM --- Done page: 1/1
04/10/2024 04:41:20 PM --- Number of posts for page 1: 10
04/10/2024 04:41:20 PM --- Number of posts added on 2024-10-04: 1
05/10/2024 04:38:32 PM --- Done page: 1/1
05/10/2024 04:38:32 PM --- Number of posts for page 1: 10
05/10/2024 04:38:32 PM --- Number of posts added on 2024-10-05: 0
06/10/2024 04:38:09 PM --- Done page: 1/1
06/10/2024 04:38:09 PM --- Number of posts for page 1: 10
06/10/2024 04:38:09 PM --- Number of posts added on 2024-10-06: 0
07/10/2024 04:41:23 PM --- Done page: 1/1
07/10/2024 04:41:23 PM --- Number of posts for page 1: 10
07/10/2024 04:41:23 PM --- Number of posts added on 2024-10-07: 0
08/10/2024 04:42:04 PM --- Done page: 1/1
08/10/2024 04:42:04 PM --- Number of posts for page 1: 10
08/10/2024 04:42:04 PM --- Number of posts added on 2024-10-08: 0
09/10/2024 04:40:18 PM --- Done page: 1/1
09/10/2024 04:40:18 PM --- Number of posts for page 1: 10
09/10/2024 04:40:18 PM --- Number of posts added on 2024-10-09: 0
10/10/2024 04:39:46 PM --- Done page: 1/1
10/10/2024 04:39:46 PM --- Number of posts for page 1: 10
10/10/2024 04:39:46 PM --- Number of posts added on 2024-10-10: 0
11/10/2024 04:40:26 PM --- Done page: 1/1
11/10/2024 04:40:26 PM --- Number of posts for page 1: 10
11/10/2024 04:40:26 PM --- Number of posts added on 2024-10-11: 0
12/10/2024 04:40:01 PM --- Done page: 1/1
12/10/2024 04:40:01 PM --- Number of posts for page 1: 10
12/10/2024 04:40:01 PM --- Number of posts added on 2024-10-12: 0
13/10/2024 04:38:54 PM --- Done page: 1/1
13/10/2024 04:38:54 PM --- Number of posts for page 1: 10
13/10/2024 04:38:54 PM --- Number of posts added on 2024-10-13: 0
14/10/2024 04:41:56 PM --- Done page: 1/1
14/10/2024 04:41:56 PM --- Number of posts for page 1: 10
14/10/2024 04:41:56 PM --- Number of posts added on 2024-10-14: 0
15/10/2024 04:41:25 PM --- Done page: 1/1
15/10/2024 04:41:25 PM --- Number of posts for page 1: 10
15/10/2024 04:41:25 PM --- Number of posts added on 2024-10-15: 0
16/10/2024 04:40:53 PM --- Done page: 1/1
16/10/2024 04:40:53 PM --- Number of posts for page 1: 10
16/10/2024 04:40:53 PM --- Number of posts added on 2024-10-16: 0
17/10/2024 04:42:06 PM --- Done page: 1/1
17/10/2024 04:42:06 PM --- Number of posts for page 1: 10
17/10/2024 04:42:06 PM --- Number of posts added on 2024-10-17: 0
18/10/2024 04:40:51 PM --- Done page: 1/1
18/10/2024 04:40:51 PM --- Number of posts for page 1: 10
18/10/2024 04:40:51 PM --- Number of posts added on 2024-10-18: 0
19/10/2024 04:39:30 PM --- Done page: 1/1
19/10/2024 04:39:30 PM --- Number of posts for page 1: 10
19/10/2024 04:39:30 PM --- Number of posts added on 2024-10-19: 0
20/10/2024 04:38:52 PM --- Done page: 1/1
20/10/2024 04:38:52 PM --- Number of posts for page 1: 10
20/10/2024 04:38:52 PM --- Number of posts added on 2024-10-20: 0
21/10/2024 04:42:24 PM --- Done page: 1/1
21/10/2024 04:42:24 PM --- Number of posts for page 1: 10
21/10/2024 04:42:24 PM --- Number of posts added on 2024-10-21: 0
22/10/2024 04:42:00 PM --- Done page: 1/1
22/10/2024 04:42:00 PM --- Number of posts for page 1: 10
22/10/2024 04:42:00 PM --- Number of posts added on 2024-10-22: 0
24/10/2024 04:42:53 PM --- Done page: 1/1
24/10/2024 04:42:53 PM --- Number of posts for page 1: 10
24/10/2024 04:42:53 PM --- Number of posts added on 2024-10-24: 0
25/10/2024 04:40:47 PM --- Done page: 1/1
25/10/2024 04:40:47 PM --- Number of posts for page 1: 10
25/10/2024 04:40:47 PM --- Number of posts added on 2024-10-25: 0
26/10/2024 04:38:13 PM --- Done post: Vì sao ngày càng nhiều nhân sự gen Z không muốn làm sếp? 
26/10/2024 04:38:29 PM --- Done page: 1/1
26/10/2024 04:38:29 PM --- Number of posts for page 1: 10
26/10/2024 04:38:29 PM --- Number of posts added on 2024-10-26: 1
27/10/2024 04:39:41 PM --- Done page: 1/1
27/10/2024 04:39:41 PM --- Number of posts for page 1: 10
27/10/2024 04:39:41 PM --- Number of posts added on 2024-10-27: 0
28/10/2024 04:43:23 PM --- Done page: 1/1
28/10/2024 04:43:23 PM --- Number of posts for page 1: 10
28/10/2024 04:43:23 PM --- Number of posts added on 2024-10-28: 0
29/10/2024 04:42:25 PM --- Done page: 1/1
29/10/2024 04:42:25 PM --- Number of posts for page 1: 10
29/10/2024 04:42:25 PM --- Number of posts added on 2024-10-29: 0
30/10/2024 04:43:20 PM --- Done page: 1/1
30/10/2024 04:43:20 PM --- Number of posts for page 1: 10
30/10/2024 04:43:20 PM --- Number of posts added on 2024-10-30: 0
31/10/2024 04:41:23 PM --- Done page: 1/1
31/10/2024 04:41:23 PM --- Number of posts for page 1: 10
31/10/2024 04:41:23 PM --- Number of posts added on 2024-10-31: 0
01/11/2024 04:39:43 PM --- Done post: Ngày hội việc làm dành cho người đi làm, tại sao không?
01/11/2024 04:40:04 PM --- Done page: 1/1
01/11/2024 04:40:04 PM --- Number of posts for page 1: 10
01/11/2024 04:40:04 PM --- Number of posts added on 2024-11-01: 1
02/11/2024 04:40:51 PM --- Done page: 1/1
02/11/2024 04:40:51 PM --- Number of posts for page 1: 10
02/11/2024 04:40:51 PM --- Number of posts added on 2024-11-02: 0
03/11/2024 04:38:02 PM --- Done page: 1/1
03/11/2024 04:38:02 PM --- Number of posts for page 1: 10
03/11/2024 04:38:02 PM --- Number of posts added on 2024-11-03: 0
04/11/2024 04:40:13 PM --- Done page: 1/1
04/11/2024 04:40:13 PM --- Number of posts for page 1: 10
04/11/2024 04:40:13 PM --- Number of posts added on 2024-11-04: 0
05/11/2024 04:39:53 PM --- Done page: 1/1
05/11/2024 04:39:53 PM --- Number of posts for page 1: 10
05/11/2024 04:39:53 PM --- Number of posts added on 2024-11-05: 0
06/11/2024 04:40:10 PM --- Done post: Bạn phải làm việc với người không hợp cạ? 3 Nguyên tắc để “mưa thuận gió hoà”
06/11/2024 04:40:30 PM --- Done page: 1/1
06/11/2024 04:40:30 PM --- Number of posts for page 1: 10
06/11/2024 04:40:30 PM --- Number of posts added on 2024-11-06: 1
07/11/2024 04:40:26 PM --- Done post: Rướn - Chấp nhận "mạo hiểm" để mối quan hệ không dừng ở xã giao
07/11/2024 04:40:41 PM --- Done page: 1/1
07/11/2024 04:40:41 PM --- Number of posts for page 1: 10
07/11/2024 04:40:41 PM --- Number of posts added on 2024-11-07: 1
08/11/2024 04:40:06 PM --- Done page: 1/1
08/11/2024 04:40:06 PM --- Number of posts for page 1: 10
08/11/2024 04:40:06 PM --- Number of posts added on 2024-11-08: 0
09/11/2024 04:38:00 PM --- Done page: 1/1
09/11/2024 04:38:00 PM --- Number of posts for page 1: 10
09/11/2024 04:38:00 PM --- Number of posts added on 2024-11-09: 0
10/11/2024 04:37:14 PM --- Done page: 1/1
10/11/2024 04:37:14 PM --- Number of posts for page 1: 10
10/11/2024 04:37:14 PM --- Number of posts added on 2024-11-10: 0
11/11/2024 04:40:14 PM --- Done post: Đi làm "chọn sếp" thế nào? 5 Điều bạn nên biết
11/11/2024 04:40:34 PM --- Done page: 1/1
11/11/2024 04:40:34 PM --- Number of posts for page 1: 10
11/11/2024 04:40:34 PM --- Number of posts added on 2024-11-11: 1
12/11/2024 04:41:38 PM --- Done page: 1/1
12/11/2024 04:41:38 PM --- Number of posts for page 1: 10
12/11/2024 04:41:38 PM --- Number of posts added on 2024-11-12: 0
13/11/2024 04:40:37 PM --- Done post: 8 Điều mình đã hành động để sự nghiệp vững vàng sau 8 năm đi làm
13/11/2024 04:40:56 PM --- Done page: 1/1
13/11/2024 04:40:56 PM --- Number of posts for page 1: 10
13/11/2024 04:40:56 PM --- Number of posts added on 2024-11-13: 1
14/11/2024 04:41:57 PM --- Done page: 1/1
14/11/2024 04:41:57 PM --- Number of posts for page 1: 10
14/11/2024 04:41:57 PM --- Number of posts added on 2024-11-14: 0
15/11/2024 04:42:26 PM --- Done page: 1/1
15/11/2024 04:42:26 PM --- Number of posts for page 1: 10
15/11/2024 04:42:26 PM --- Number of posts added on 2024-11-15: 0
16/11/2024 04:41:02 PM --- Done page: 1/1
16/11/2024 04:41:02 PM --- Number of posts for page 1: 10
16/11/2024 04:41:02 PM --- Number of posts added on 2024-11-16: 0
17/11/2024 04:38:39 PM --- Done page: 1/1
17/11/2024 04:38:39 PM --- Number of posts for page 1: 10
17/11/2024 04:38:39 PM --- Number of posts added on 2024-11-17: 0
18/11/2024 04:43:39 PM --- Done page: 1/1
18/11/2024 04:43:39 PM --- Number of posts for page 1: 10
18/11/2024 04:43:39 PM --- Number of posts added on 2024-11-18: 0
19/11/2024 04:42:24 PM --- Done page: 1/1
19/11/2024 04:42:24 PM --- Number of posts for page 1: 10
19/11/2024 04:42:24 PM --- Number of posts added on 2024-11-19: 0
20/11/2024 04:43:10 PM --- Done page: 1/1
20/11/2024 04:43:10 PM --- Number of posts for page 1: 10
20/11/2024 04:43:10 PM --- Number of posts added on 2024-11-20: 0
21/11/2024 04:42:43 PM --- Done page: 1/1
21/11/2024 04:42:43 PM --- Number of posts for page 1: 10
21/11/2024 04:42:43 PM --- Number of posts added on 2024-11-21: 0
22/11/2024 04:42:21 PM --- Done page: 1/1
22/11/2024 04:42:21 PM --- Number of posts for page 1: 10
22/11/2024 04:42:21 PM --- Number of posts added on 2024-11-22: 0
23/11/2024 04:39:25 PM --- Done page: 1/1
23/11/2024 04:39:25 PM --- Number of posts for page 1: 10
23/11/2024 04:39:25 PM --- Number of posts added on 2024-11-23: 0
24/11/2024 04:39:33 PM --- Done page: 1/1
24/11/2024 04:39:33 PM --- Number of posts for page 1: 10
24/11/2024 04:39:33 PM --- Number of posts added on 2024-11-24: 0
25/11/2024 04:43:02 PM --- Done page: 1/1
25/11/2024 04:43:02 PM --- Number of posts for page 1: 10
25/11/2024 04:43:02 PM --- Number of posts added on 2024-11-25: 0
26/11/2024 04:44:13 PM --- Done page: 1/1
26/11/2024 04:44:13 PM --- Number of posts for page 1: 10
26/11/2024 04:44:13 PM --- Number of posts added on 2024-11-26: 0
27/11/2024 04:43:30 PM --- Done page: 1/1
27/11/2024 04:43:30 PM --- Number of posts for page 1: 10
27/11/2024 04:43:30 PM --- Number of posts added on 2024-11-27: 0
28/11/2024 04:42:14 PM --- Done page: 1/1
28/11/2024 04:42:14 PM --- Number of posts for page 1: 10
28/11/2024 04:42:14 PM --- Number of posts added on 2024-11-28: 0
29/11/2024 04:42:33 PM --- Done page: 1/1
29/11/2024 04:42:33 PM --- Number of posts for page 1: 10
29/11/2024 04:42:33 PM --- Number of posts added on 2024-11-29: 0
30/11/2024 04:40:48 PM --- Done page: 1/1
30/11/2024 04:40:48 PM --- Number of posts for page 1: 10
30/11/2024 04:40:48 PM --- Number of posts added on 2024-11-30: 0
01/12/2024 04:40:08 PM --- Done page: 1/1
01/12/2024 04:40:08 PM --- Number of posts for page 1: 10
01/12/2024 04:40:08 PM --- Number of posts added on 2024-12-01: 0
02/12/2024 04:43:50 PM --- Done page: 1/1
02/12/2024 04:43:50 PM --- Number of posts for page 1: 10
02/12/2024 04:43:50 PM --- Number of posts added on 2024-12-02: 0
03/12/2024 04:44:39 PM --- Done page: 1/1
03/12/2024 04:44:39 PM --- Number of posts for page 1: 10
03/12/2024 04:44:39 PM --- Number of posts added on 2024-12-03: 0
04/12/2024 04:45:02 PM --- Done page: 1/1
04/12/2024 04:45:02 PM --- Number of posts for page 1: 10
04/12/2024 04:45:02 PM --- Number of posts added on 2024-12-04: 0
05/12/2024 04:44:23 PM --- Done page: 1/1
05/12/2024 04:44:23 PM --- Number of posts for page 1: 10
05/12/2024 04:44:23 PM --- Number of posts added on 2024-12-05: 0
06/12/2024 04:42:32 PM --- Done page: 1/1
06/12/2024 04:42:32 PM --- Number of posts for page 1: 10
06/12/2024 04:42:32 PM --- Number of posts added on 2024-12-06: 0
07/12/2024 04:41:00 PM --- Done page: 1/1
07/12/2024 04:41:00 PM --- Number of posts for page 1: 10
07/12/2024 04:41:00 PM --- Number of posts added on 2024-12-07: 0
08/12/2024 04:39:49 PM --- Done page: 1/1
08/12/2024 04:39:49 PM --- Number of posts for page 1: 10
08/12/2024 04:39:49 PM --- Number of posts added on 2024-12-08: 0
09/12/2024 04:44:27 PM --- Done page: 1/1
09/12/2024 04:44:27 PM --- Number of posts for page 1: 10
09/12/2024 04:44:27 PM --- Number of posts added on 2024-12-09: 0
10/12/2024 04:44:44 PM --- Done page: 1/1
10/12/2024 04:44:44 PM --- Number of posts for page 1: 10
10/12/2024 04:44:44 PM --- Number of posts added on 2024-12-10: 0
11/12/2024 04:44:30 PM --- Done page: 1/1
11/12/2024 04:44:30 PM --- Number of posts for page 1: 10
11/12/2024 04:44:30 PM --- Number of posts added on 2024-12-11: 0
12/12/2024 04:45:01 PM --- Done page: 1/1
12/12/2024 04:45:01 PM --- Number of posts for page 1: 10
12/12/2024 04:45:01 PM --- Number of posts added on 2024-12-12: 0
13/12/2024 04:42:50 PM --- Done page: 1/1
13/12/2024 04:42:50 PM --- Number of posts for page 1: 10
13/12/2024 04:42:50 PM --- Number of posts added on 2024-12-13: 0
14/12/2024 04:39:57 PM --- Done page: 1/1
14/12/2024 04:39:57 PM --- Number of posts for page 1: 10
14/12/2024 04:39:57 PM --- Number of posts added on 2024-12-14: 0
15/12/2024 04:40:10 PM --- Done page: 1/1
15/12/2024 04:40:10 PM --- Number of posts for page 1: 10
15/12/2024 04:40:10 PM --- Number of posts added on 2024-12-15: 0
16/12/2024 04:44:10 PM --- Done page: 1/1
16/12/2024 04:44:10 PM --- Number of posts for page 1: 10
16/12/2024 04:44:10 PM --- Number of posts added on 2024-12-16: 0
17/12/2024 04:44:23 PM --- Done page: 1/1
17/12/2024 04:44:23 PM --- Number of posts for page 1: 10
17/12/2024 04:44:23 PM --- Number of posts added on 2024-12-17: 0
18/12/2024 04:42:19 PM --- Done page: 1/1
18/12/2024 04:42:19 PM --- Number of posts for page 1: 10
18/12/2024 04:42:19 PM --- Number of posts added on 2024-12-18: 0
19/12/2024 04:39:53 PM --- Done page: 1/1
19/12/2024 04:39:53 PM --- Number of posts for page 1: 10
19/12/2024 04:39:53 PM --- Number of posts added on 2024-12-19: 0
20/12/2024 04:39:13 PM --- Done page: 1/1
20/12/2024 04:39:13 PM --- Number of posts for page 1: 10
20/12/2024 04:39:13 PM --- Number of posts added on 2024-12-20: 0
21/12/2024 04:36:59 PM --- Done page: 1/1
21/12/2024 04:36:59 PM --- Number of posts for page 1: 10
21/12/2024 04:36:59 PM --- Number of posts added on 2024-12-21: 0
22/12/2024 04:36:22 PM --- Done page: 1/1
22/12/2024 04:36:22 PM --- Number of posts for page 1: 10
22/12/2024 04:36:22 PM --- Number of posts added on 2024-12-22: 0
23/12/2024 04:39:10 PM --- Done page: 1/1
23/12/2024 04:39:10 PM --- Number of posts for page 1: 10
23/12/2024 04:39:10 PM --- Number of posts added on 2024-12-23: 0
24/12/2024 04:38:36 PM --- Done page: 1/1
24/12/2024 04:38:36 PM --- Number of posts for page 1: 10
24/12/2024 04:38:36 PM --- Number of posts added on 2024-12-24: 0
25/12/2024 04:38:41 PM --- Done page: 1/1
25/12/2024 04:38:41 PM --- Number of posts for page 1: 10
25/12/2024 04:38:41 PM --- Number of posts added on 2024-12-25: 0
26/12/2024 04:39:07 PM --- Done page: 1/1
26/12/2024 04:39:07 PM --- Number of posts for page 1: 10
26/12/2024 04:39:07 PM --- Number of posts added on 2024-12-26: 0
27/12/2024 04:38:21 PM --- Done page: 1/1
27/12/2024 04:38:21 PM --- Number of posts for page 1: 10
27/12/2024 04:38:21 PM --- Number of posts added on 2024-12-27: 0
28/12/2024 04:36:57 PM --- Done page: 1/1
28/12/2024 04:36:57 PM --- Number of posts for page 1: 10
28/12/2024 04:36:57 PM --- Number of posts added on 2024-12-28: 0
29/12/2024 04:36:23 PM --- Done page: 1/1
29/12/2024 04:36:23 PM --- Number of posts for page 1: 10
29/12/2024 04:36:23 PM --- Number of posts added on 2024-12-29: 0
30/12/2024 04:39:40 PM --- Done page: 1/1
30/12/2024 04:39:40 PM --- Number of posts for page 1: 10
30/12/2024 04:39:40 PM --- Number of posts added on 2024-12-30: 0
31/12/2024 04:39:17 PM --- Done page: 1/1
31/12/2024 04:39:17 PM --- Number of posts for page 1: 10
31/12/2024 04:39:17 PM --- Number of posts added on 2024-12-31: 0
01/01/2025 04:38:32 PM --- Done page: 1/1
01/01/2025 04:38:32 PM --- Number of posts for page 1: 10
01/01/2025 04:38:32 PM --- Number of posts added on 2025-01-01: 0
02/01/2025 04:39:55 PM --- Done page: 1/1
02/01/2025 04:39:55 PM --- Number of posts for page 1: 10
02/01/2025 04:39:55 PM --- Number of posts added on 2025-01-02: 0
03/01/2025 04:40:04 PM --- Done page: 1/1
03/01/2025 04:40:04 PM --- Number of posts for page 1: 10
03/01/2025 04:40:04 PM --- Number of posts added on 2025-01-03: 0
04/01/2025 04:37:22 PM --- Done page: 1/1
04/01/2025 04:37:22 PM --- Number of posts for page 1: 10
04/01/2025 04:37:22 PM --- Number of posts added on 2025-01-04: 0
05/01/2025 04:37:39 PM --- Done page: 1/1
05/01/2025 04:37:39 PM --- Number of posts for page 1: 10
05/01/2025 04:37:39 PM --- Number of posts added on 2025-01-05: 0
06/01/2025 04:41:04 PM --- Done page: 1/1
06/01/2025 04:41:04 PM --- Number of posts for page 1: 10
06/01/2025 04:41:04 PM --- Number of posts added on 2025-01-06: 0
07/01/2025 04:51:21 PM --- Done page: 1/1
07/01/2025 04:51:21 PM --- Number of posts for page 1: 10
07/01/2025 04:51:21 PM --- Number of posts added on 2025-01-07: 0
08/01/2025 04:41:08 PM --- Done page: 1/1
08/01/2025 04:41:08 PM --- Number of posts for page 1: 10
08/01/2025 04:41:08 PM --- Number of posts added on 2025-01-08: 0
09/01/2025 04:41:02 PM --- Done page: 1/1
09/01/2025 04:41:02 PM --- Number of posts for page 1: 10
09/01/2025 04:41:02 PM --- Number of posts added on 2025-01-09: 0
10/01/2025 04:40:36 PM --- Done page: 1/1
10/01/2025 04:40:36 PM --- Number of posts for page 1: 10
10/01/2025 04:40:36 PM --- Number of posts added on 2025-01-10: 0
11/01/2025 04:37:20 PM --- Done page: 1/1
11/01/2025 04:37:20 PM --- Number of posts for page 1: 10
11/01/2025 04:37:20 PM --- Number of posts added on 2025-01-11: 0
12/01/2025 04:36:45 PM --- Done page: 1/1
12/01/2025 04:36:45 PM --- Number of posts for page 1: 10
12/01/2025 04:36:45 PM --- Number of posts added on 2025-01-12: 0
13/01/2025 04:42:13 PM --- Done page: 1/1
13/01/2025 04:42:13 PM --- Number of posts for page 1: 10
13/01/2025 04:42:13 PM --- Number of posts added on 2025-01-13: 0
14/01/2025 04:39:31 PM --- Done page: 1/1
14/01/2025 04:39:31 PM --- Number of posts for page 1: 10
14/01/2025 04:39:31 PM --- Number of posts added on 2025-01-14: 0
15/01/2025 04:37:22 PM --- Done page: 1/1
15/01/2025 04:37:22 PM --- Number of posts for page 1: 10
15/01/2025 04:37:22 PM --- Number of posts added on 2025-01-15: 0
16/01/2025 04:38:55 PM --- Done page: 1/1
16/01/2025 04:38:55 PM --- Number of posts for page 1: 10
16/01/2025 04:38:55 PM --- Number of posts added on 2025-01-16: 0
17/01/2025 04:38:18 PM --- Done page: 1/1
17/01/2025 04:38:18 PM --- Number of posts for page 1: 10
17/01/2025 04:38:18 PM --- Number of posts added on 2025-01-17: 0
18/01/2025 04:35:29 PM --- Done page: 1/1
18/01/2025 04:35:29 PM --- Number of posts for page 1: 10
18/01/2025 04:35:29 PM --- Number of posts added on 2025-01-18: 0
19/01/2025 04:35:37 PM --- Done page: 1/1
19/01/2025 04:35:37 PM --- Number of posts for page 1: 10
19/01/2025 04:35:37 PM --- Number of posts added on 2025-01-19: 0
20/01/2025 04:38:48 PM --- Done page: 1/1
20/01/2025 04:38:48 PM --- Number of posts for page 1: 10
20/01/2025 04:38:48 PM --- Number of posts added on 2025-01-20: 0
21/01/2025 04:40:23 PM --- Done page: 1/1
21/01/2025 04:40:23 PM --- Number of posts for page 1: 10
21/01/2025 04:40:23 PM --- Number of posts added on 2025-01-21: 0
22/01/2025 04:38:58 PM --- Done page: 1/1
22/01/2025 04:38:58 PM --- Number of posts for page 1: 10
22/01/2025 04:38:58 PM --- Number of posts added on 2025-01-22: 0
23/01/2025 04:40:25 PM --- Done page: 1/1
23/01/2025 04:40:25 PM --- Number of posts for page 1: 10
23/01/2025 04:40:25 PM --- Number of posts added on 2025-01-23: 0
24/01/2025 04:39:04 PM --- Done page: 1/1
24/01/2025 04:39:04 PM --- Number of posts for page 1: 10
24/01/2025 04:39:04 PM --- Number of posts added on 2025-01-24: 0
25/01/2025 04:38:09 PM --- Done page: 1/1
25/01/2025 04:38:09 PM --- Number of posts for page 1: 10
25/01/2025 04:38:09 PM --- Number of posts added on 2025-01-25: 0
26/01/2025 04:34:59 PM --- Done page: 1/1
26/01/2025 04:34:59 PM --- Number of posts for page 1: 10
26/01/2025 04:34:59 PM --- Number of posts added on 2025-01-26: 0
27/01/2025 04:38:45 PM --- Done page: 1/1
27/01/2025 04:38:45 PM --- Number of posts for page 1: 10
27/01/2025 04:38:45 PM --- Number of posts added on 2025-01-27: 0
28/01/2025 04:39:44 PM --- Done page: 1/1
28/01/2025 04:39:44 PM --- Number of posts for page 1: 10
28/01/2025 04:39:44 PM --- Number of posts added on 2025-01-28: 0
29/01/2025 04:38:41 PM --- Done page: 1/1
29/01/2025 04:38:41 PM --- Number of posts for page 1: 10
29/01/2025 04:38:41 PM --- Number of posts added on 2025-01-29: 0
30/01/2025 04:39:54 PM --- Done page: 1/1
30/01/2025 04:39:54 PM --- Number of posts for page 1: 10
30/01/2025 04:39:54 PM --- Number of posts added on 2025-01-30: 0
31/01/2025 04:39:19 PM --- Done page: 1/1
31/01/2025 04:39:19 PM --- Number of posts for page 1: 10
31/01/2025 04:39:19 PM --- Number of posts added on 2025-01-31: 0
01/02/2025 04:35:09 PM --- Done page: 1/1
01/02/2025 04:35:09 PM --- Number of posts for page 1: 10
01/02/2025 04:35:09 PM --- Number of posts added on 2025-02-01: 0
02/02/2025 04:36:47 PM --- Done page: 1/1
02/02/2025 04:36:47 PM --- Number of posts for page 1: 10
02/02/2025 04:36:47 PM --- Number of posts added on 2025-02-02: 0
03/02/2025 04:40:03 PM --- Done page: 1/1
03/02/2025 04:40:03 PM --- Number of posts for page 1: 10
03/02/2025 04:40:03 PM --- Number of posts added on 2025-02-03: 0
04/02/2025 04:40:07 PM --- Done page: 1/1
04/02/2025 04:40:07 PM --- Number of posts for page 1: 10
04/02/2025 04:40:07 PM --- Number of posts added on 2025-02-04: 0
05/02/2025 04:41:28 PM --- Done page: 1/1
05/02/2025 04:41:28 PM --- Number of posts for page 1: 10
05/02/2025 04:41:28 PM --- Number of posts added on 2025-02-05: 0
06/02/2025 04:39:16 PM --- Done page: 1/1
06/02/2025 04:39:16 PM --- Number of posts for page 1: 10
06/02/2025 04:39:16 PM --- Number of posts added on 2025-02-06: 0
07/02/2025 04:40:55 PM --- Done page: 1/1
07/02/2025 04:40:55 PM --- Number of posts for page 1: 10
07/02/2025 04:40:55 PM --- Number of posts added on 2025-02-07: 0
08/02/2025 04:35:20 PM --- Done page: 1/1
08/02/2025 04:35:20 PM --- Number of posts for page 1: 10
08/02/2025 04:35:20 PM --- Number of posts added on 2025-02-08: 0
09/02/2025 04:35:06 PM --- Done page: 1/1
09/02/2025 04:35:06 PM --- Number of posts for page 1: 10
09/02/2025 04:35:06 PM --- Number of posts added on 2025-02-09: 0
10/02/2025 04:40:27 PM --- Done page: 1/1
10/02/2025 04:40:27 PM --- Number of posts for page 1: 10
10/02/2025 04:40:27 PM --- Number of posts added on 2025-02-10: 0
11/02/2025 04:41:39 PM --- Done page: 1/1
11/02/2025 04:41:39 PM --- Number of posts for page 1: 10
11/02/2025 04:41:39 PM --- Number of posts added on 2025-02-11: 0
12/02/2025 04:40:06 PM --- Done page: 1/1
12/02/2025 04:40:06 PM --- Number of posts for page 1: 10
12/02/2025 04:40:06 PM --- Number of posts added on 2025-02-12: 0
13/02/2025 04:41:04 PM --- Done page: 1/1
13/02/2025 04:41:04 PM --- Number of posts for page 1: 10
13/02/2025 04:41:04 PM --- Number of posts added on 2025-02-13: 0
14/02/2025 04:39:17 PM --- Done page: 1/1
14/02/2025 04:39:17 PM --- Number of posts for page 1: 10
14/02/2025 04:39:17 PM --- Number of posts added on 2025-02-14: 0
15/02/2025 04:38:43 PM --- Done page: 1/1
15/02/2025 04:38:43 PM --- Number of posts for page 1: 10
15/02/2025 04:38:43 PM --- Number of posts added on 2025-02-15: 0
16/02/2025 04:36:53 PM --- Done page: 1/1
16/02/2025 04:36:53 PM --- Number of posts for page 1: 10
16/02/2025 04:36:53 PM --- Number of posts added on 2025-02-16: 0
17/02/2025 04:38:33 PM --- Done page: 1/1
17/02/2025 04:38:33 PM --- Number of posts for page 1: 10
17/02/2025 04:38:33 PM --- Number of posts added on 2025-02-17: 0
18/02/2025 04:41:38 PM --- Done page: 1/1
18/02/2025 04:41:38 PM --- Number of posts for page 1: 10
18/02/2025 04:41:38 PM --- Number of posts added on 2025-02-18: 0
19/02/2025 04:40:16 PM --- Done page: 1/1
19/02/2025 04:40:16 PM --- Number of posts for page 1: 10
19/02/2025 04:40:16 PM --- Number of posts added on 2025-02-19: 0
20/02/2025 04:42:05 PM --- Done page: 1/1
20/02/2025 04:42:05 PM --- Number of posts for page 1: 10
20/02/2025 04:42:05 PM --- Number of posts added on 2025-02-20: 0
21/02/2025 04:39:23 PM --- Done page: 1/1
21/02/2025 04:39:23 PM --- Number of posts for page 1: 10
21/02/2025 04:39:23 PM --- Number of posts added on 2025-02-21: 0
22/02/2025 04:36:34 PM --- Done page: 1/1
22/02/2025 04:36:34 PM --- Number of posts for page 1: 10
22/02/2025 04:36:34 PM --- Number of posts added on 2025-02-22: 0
23/02/2025 04:36:22 PM --- Done page: 1/1
23/02/2025 04:36:22 PM --- Number of posts for page 1: 10
23/02/2025 04:36:22 PM --- Number of posts added on 2025-02-23: 0
24/02/2025 04:42:42 PM --- Done page: 1/1
24/02/2025 04:42:42 PM --- Number of posts for page 1: 10
24/02/2025 04:42:42 PM --- Number of posts added on 2025-02-24: 0
25/02/2025 04:41:59 PM --- Done page: 1/1
25/02/2025 04:41:59 PM --- Number of posts for page 1: 10
25/02/2025 04:41:59 PM --- Number of posts added on 2025-02-25: 0
26/02/2025 04:42:04 PM --- Done page: 1/1
26/02/2025 04:42:04 PM --- Number of posts for page 1: 10
26/02/2025 04:42:04 PM --- Number of posts added on 2025-02-26: 0
27/02/2025 04:42:23 PM --- Done page: 1/1
27/02/2025 04:42:23 PM --- Number of posts for page 1: 10
27/02/2025 04:42:23 PM --- Number of posts added on 2025-02-27: 0
28/02/2025 04:41:13 PM --- Done page: 1/1
28/02/2025 04:41:13 PM --- Number of posts for page 1: 10
28/02/2025 04:41:13 PM --- Number of posts added on 2025-02-28: 0
01/03/2025 04:37:17 PM --- Done page: 1/1
01/03/2025 04:37:17 PM --- Number of posts for page 1: 10
01/03/2025 04:37:17 PM --- Number of posts added on 2025-03-01: 0
02/03/2025 04:37:52 PM --- Done page: 1/1
02/03/2025 04:37:52 PM --- Number of posts for page 1: 10
02/03/2025 04:37:52 PM --- Number of posts added on 2025-03-02: 0
03/03/2025 04:41:25 PM --- Done page: 1/1
03/03/2025 04:41:25 PM --- Number of posts for page 1: 10
03/03/2025 04:41:25 PM --- Number of posts added on 2025-03-03: 0
04/03/2025 04:42:29 PM --- Done page: 1/1
04/03/2025 04:42:29 PM --- Number of posts for page 1: 10
04/03/2025 04:42:29 PM --- Number of posts added on 2025-03-04: 0
05/03/2025 04:46:51 PM --- Done page: 1/1
05/03/2025 04:46:51 PM --- Number of posts for page 1: 10
05/03/2025 04:46:51 PM --- Number of posts added on 2025-03-05: 0
06/03/2025 04:41:55 PM --- Done page: 1/1
06/03/2025 04:41:55 PM --- Number of posts for page 1: 10
06/03/2025 04:41:55 PM --- Number of posts added on 2025-03-06: 0
07/03/2025 04:41:05 PM --- Done page: 1/1
07/03/2025 04:41:05 PM --- Number of posts for page 1: 10
07/03/2025 04:41:05 PM --- Number of posts added on 2025-03-07: 0
08/03/2025 04:31:34 PM --- Done page: 1/1
08/03/2025 04:31:34 PM --- Number of posts for page 1: 10
08/03/2025 04:31:34 PM --- Number of posts added on 2025-03-08: 0
09/03/2025 04:31:28 PM --- Done page: 1/1
09/03/2025 04:31:28 PM --- Number of posts for page 1: 10
09/03/2025 04:31:28 PM --- Number of posts added on 2025-03-09: 0
10/03/2025 04:41:25 PM --- Done page: 1/1
10/03/2025 04:41:25 PM --- Number of posts for page 1: 10
10/03/2025 04:41:25 PM --- Number of posts added on 2025-03-10: 0
11/03/2025 04:43:05 PM --- Done page: 1/1
11/03/2025 04:43:05 PM --- Number of posts for page 1: 10
11/03/2025 04:43:05 PM --- Number of posts added on 2025-03-11: 0
12/03/2025 04:43:09 PM --- Done page: 1/1
12/03/2025 04:43:09 PM --- Number of posts for page 1: 10
12/03/2025 04:43:09 PM --- Number of posts added on 2025-03-12: 0
13/03/2025 04:44:31 PM --- Done page: 1/1
13/03/2025 04:44:31 PM --- Number of posts for page 1: 10
13/03/2025 04:44:31 PM --- Number of posts added on 2025-03-13: 0
14/03/2025 04:40:44 PM --- Done page: 1/1
14/03/2025 04:40:44 PM --- Number of posts for page 1: 10
14/03/2025 04:40:44 PM --- Number of posts added on 2025-03-14: 0
15/03/2025 04:38:28 PM --- Done page: 1/1
15/03/2025 04:38:28 PM --- Number of posts for page 1: 10
15/03/2025 04:38:28 PM --- Number of posts added on 2025-03-15: 0
16/03/2025 04:40:36 PM --- Done page: 1/1
16/03/2025 04:40:36 PM --- Number of posts for page 1: 10
16/03/2025 04:40:36 PM --- Number of posts added on 2025-03-16: 0
17/03/2025 04:43:30 PM --- Done page: 1/1
17/03/2025 04:43:30 PM --- Number of posts for page 1: 10
17/03/2025 04:43:30 PM --- Number of posts added on 2025-03-17: 0
18/03/2025 04:43:27 PM --- Done page: 1/1
18/03/2025 04:43:27 PM --- Number of posts for page 1: 10
18/03/2025 04:43:27 PM --- Number of posts added on 2025-03-18: 0
19/03/2025 04:42:51 PM --- Done page: 1/1
19/03/2025 04:42:51 PM --- Number of posts for page 1: 10
19/03/2025 04:42:51 PM --- Number of posts added on 2025-03-19: 0
20/03/2025 04:43:07 PM --- Done page: 1/1
20/03/2025 04:43:07 PM --- Number of posts for page 1: 10
20/03/2025 04:43:07 PM --- Number of posts added on 2025-03-20: 0
21/03/2025 04:42:09 PM --- Done page: 1/1
21/03/2025 04:42:09 PM --- Number of posts for page 1: 10
21/03/2025 04:42:09 PM --- Number of posts added on 2025-03-21: 0
22/03/2025 04:38:15 PM --- Done page: 1/1
22/03/2025 04:38:15 PM --- Number of posts for page 1: 10
22/03/2025 04:38:15 PM --- Number of posts added on 2025-03-22: 0
23/03/2025 04:39:00 PM --- Done page: 1/1
23/03/2025 04:39:00 PM --- Number of posts for page 1: 10
23/03/2025 04:39:00 PM --- Number of posts added on 2025-03-23: 0
25/03/2025 02:46:59 PM --- Done page: 1/1
25/03/2025 02:46:59 PM --- Number of posts for page 1: 10
25/03/2025 02:46:59 PM --- Number of posts added on 2025-03-25: 0
25/03/2025 04:42:18 PM --- Done page: 1/1
25/03/2025 04:42:18 PM --- Number of posts for page 1: 10
25/03/2025 04:42:18 PM --- Number of posts added on 2025-03-25: 0
26/03/2025 04:43:52 PM --- Done page: 1/1
26/03/2025 04:43:52 PM --- Number of posts for page 1: 10
26/03/2025 04:43:52 PM --- Number of posts added on 2025-03-26: 0
27/03/2025 04:43:10 PM --- Done page: 1/1
27/03/2025 04:43:10 PM --- Number of posts for page 1: 10
27/03/2025 04:43:10 PM --- Number of posts added on 2025-03-27: 0
28/03/2025 04:41:59 PM --- Done page: 1/1
28/03/2025 04:41:59 PM --- Number of posts for page 1: 10
28/03/2025 04:41:59 PM --- Number of posts added on 2025-03-28: 0
29/03/2025 04:40:59 PM --- Done page: 1/1
29/03/2025 04:40:59 PM --- Number of posts for page 1: 10
29/03/2025 04:40:59 PM --- Number of posts added on 2025-03-29: 0
30/03/2025 04:40:05 PM --- Done page: 1/1
30/03/2025 04:40:05 PM --- Number of posts for page 1: 10
30/03/2025 04:40:05 PM --- Number of posts added on 2025-03-30: 0
31/03/2025 04:43:18 PM --- Done page: 1/1
31/03/2025 04:43:18 PM --- Number of posts for page 1: 10
31/03/2025 04:43:18 PM --- Number of posts added on 2025-03-31: 0
01/04/2025 04:42:28 PM --- Done page: 1/1
01/04/2025 04:42:28 PM --- Number of posts for page 1: 10
01/04/2025 04:42:28 PM --- Number of posts added on 2025-04-01: 0
02/04/2025 04:45:26 PM --- Done page: 1/1
02/04/2025 04:45:26 PM --- Number of posts for page 1: 10
02/04/2025 04:45:26 PM --- Number of posts added on 2025-04-02: 0
03/04/2025 04:43:30 PM --- Done page: 1/1
03/04/2025 04:43:30 PM --- Number of posts for page 1: 10
03/04/2025 04:43:30 PM --- Number of posts added on 2025-04-03: 0
04/04/2025 04:42:33 PM --- Done page: 1/1
04/04/2025 04:42:33 PM --- Number of posts for page 1: 10
04/04/2025 04:42:33 PM --- Number of posts added on 2025-04-04: 0
05/04/2025 04:39:58 PM --- Done page: 1/1
05/04/2025 04:39:58 PM --- Number of posts for page 1: 10
05/04/2025 04:39:58 PM --- Number of posts added on 2025-04-05: 0
06/04/2025 04:39:38 PM --- Done page: 1/1
06/04/2025 04:39:38 PM --- Number of posts for page 1: 10
06/04/2025 04:39:38 PM --- Number of posts added on 2025-04-06: 0
07/04/2025 04:43:24 PM --- Done page: 1/1
07/04/2025 04:43:24 PM --- Number of posts for page 1: 10
07/04/2025 04:43:24 PM --- Number of posts added on 2025-04-07: 0
08/04/2025 04:43:37 PM --- Done page: 1/1
08/04/2025 04:43:37 PM --- Number of posts for page 1: 10
08/04/2025 04:43:37 PM --- Number of posts added on 2025-04-08: 0
09/04/2025 04:45:27 PM --- Done page: 1/1
09/04/2025 04:45:27 PM --- Number of posts for page 1: 10
09/04/2025 04:45:27 PM --- Number of posts added on 2025-04-09: 0
10/04/2025 04:43:49 PM --- Done page: 1/1
10/04/2025 04:43:49 PM --- Number of posts for page 1: 10
10/04/2025 04:43:49 PM --- Number of posts added on 2025-04-10: 0
11/04/2025 04:43:07 PM --- Done page: 1/1
11/04/2025 04:43:07 PM --- Number of posts for page 1: 10
11/04/2025 04:43:07 PM --- Number of posts added on 2025-04-11: 0
12/04/2025 04:39:07 PM --- Done page: 1/1
12/04/2025 04:39:07 PM --- Number of posts for page 1: 10
12/04/2025 04:39:07 PM --- Number of posts added on 2025-04-12: 0
13/04/2025 04:41:37 PM --- Done page: 1/1
13/04/2025 04:41:37 PM --- Number of posts for page 1: 10
13/04/2025 04:41:37 PM --- Number of posts added on 2025-04-13: 0
14/04/2025 04:44:02 PM --- Done page: 1/1
14/04/2025 04:44:02 PM --- Number of posts for page 1: 10
14/04/2025 04:44:02 PM --- Number of posts added on 2025-04-14: 0
15/04/2025 04:42:49 PM --- Done page: 1/1
15/04/2025 04:42:49 PM --- Number of posts for page 1: 10
15/04/2025 04:42:49 PM --- Number of posts added on 2025-04-15: 0
16/04/2025 04:44:49 PM --- Done page: 1/1
16/04/2025 04:44:49 PM --- Number of posts for page 1: 10
16/04/2025 04:44:49 PM --- Number of posts added on 2025-04-16: 0
17/04/2025 04:44:16 PM --- Done page: 1/1
17/04/2025 04:44:16 PM --- Number of posts for page 1: 10
17/04/2025 04:44:16 PM --- Number of posts added on 2025-04-17: 0
18/04/2025 04:41:26 PM --- Done page: 1/1
18/04/2025 04:41:26 PM --- Number of posts for page 1: 10
18/04/2025 04:41:26 PM --- Number of posts added on 2025-04-18: 0
19/04/2025 04:40:26 PM --- Done page: 1/1
19/04/2025 04:40:26 PM --- Number of posts for page 1: 10
19/04/2025 04:40:26 PM --- Number of posts added on 2025-04-19: 0
20/04/2025 04:40:16 PM --- Done page: 1/1
20/04/2025 04:40:16 PM --- Number of posts for page 1: 10
20/04/2025 04:40:16 PM --- Number of posts added on 2025-04-20: 0
21/04/2025 04:43:42 PM --- Done page: 1/1
21/04/2025 04:43:42 PM --- Number of posts for page 1: 10
21/04/2025 04:43:42 PM --- Number of posts added on 2025-04-21: 0
22/04/2025 04:43:30 PM --- Done page: 1/1
22/04/2025 04:43:30 PM --- Number of posts for page 1: 10
22/04/2025 04:43:30 PM --- Number of posts added on 2025-04-22: 0
23/04/2025 04:45:46 PM --- Done page: 1/1
23/04/2025 04:45:46 PM --- Number of posts for page 1: 10
23/04/2025 04:45:46 PM --- Number of posts added on 2025-04-23: 0
24/04/2025 04:43:44 PM --- Done page: 1/1
24/04/2025 04:43:44 PM --- Number of posts for page 1: 10
24/04/2025 04:43:44 PM --- Number of posts added on 2025-04-24: 0
25/04/2025 04:43:06 PM --- Done page: 1/1
25/04/2025 04:43:06 PM --- Number of posts for page 1: 10
25/04/2025 04:43:06 PM --- Number of posts added on 2025-04-25: 0
26/04/2025 04:39:48 PM --- Done page: 1/1
26/04/2025 04:39:48 PM --- Number of posts for page 1: 10
26/04/2025 04:39:48 PM --- Number of posts added on 2025-04-26: 0
27/04/2025 04:39:57 PM --- Done page: 1/1
27/04/2025 04:39:57 PM --- Number of posts for page 1: 10
27/04/2025 04:39:57 PM --- Number of posts added on 2025-04-27: 0
28/04/2025 04:42:45 PM --- Done page: 1/1
28/04/2025 04:42:45 PM --- Number of posts for page 1: 10
28/04/2025 04:42:45 PM --- Number of posts added on 2025-04-28: 0
29/04/2025 04:43:35 PM --- Done page: 1/1
29/04/2025 04:43:35 PM --- Number of posts for page 1: 10
29/04/2025 04:43:35 PM --- Number of posts added on 2025-04-29: 0
30/04/2025 04:43:59 PM --- Done page: 1/1
30/04/2025 04:43:59 PM --- Number of posts for page 1: 10
30/04/2025 04:43:59 PM --- Number of posts added on 2025-04-30: 0
01/05/2025 04:43:07 PM --- Done page: 1/1
01/05/2025 04:43:07 PM --- Number of posts for page 1: 10
01/05/2025 04:43:07 PM --- Number of posts added on 2025-05-01: 0
02/05/2025 04:43:26 PM --- Done page: 1/1
02/05/2025 04:43:26 PM --- Number of posts for page 1: 10
02/05/2025 04:43:26 PM --- Number of posts added on 2025-05-02: 0
03/05/2025 04:40:35 PM --- Done page: 1/1
03/05/2025 04:40:35 PM --- Number of posts for page 1: 10
03/05/2025 04:40:35 PM --- Number of posts added on 2025-05-03: 0
04/05/2025 04:40:48 PM --- Done page: 1/1
04/05/2025 04:40:48 PM --- Number of posts for page 1: 10
04/05/2025 04:40:48 PM --- Number of posts added on 2025-05-04: 0
05/05/2025 04:43:57 PM --- Done page: 1/1
05/05/2025 04:43:57 PM --- Number of posts for page 1: 10
05/05/2025 04:43:57 PM --- Number of posts added on 2025-05-05: 0
06/05/2025 04:43:04 PM --- Done page: 1/1
06/05/2025 04:43:04 PM --- Number of posts for page 1: 10
06/05/2025 04:43:04 PM --- Number of posts added on 2025-05-06: 0
07/05/2025 04:45:29 PM --- Done page: 1/1
07/05/2025 04:45:29 PM --- Number of posts for page 1: 10
07/05/2025 04:45:29 PM --- Number of posts added on 2025-05-07: 0
08/05/2025 04:45:12 PM --- Done page: 1/1
08/05/2025 04:45:12 PM --- Number of posts for page 1: 10
08/05/2025 04:45:12 PM --- Number of posts added on 2025-05-08: 0
09/05/2025 04:41:55 PM --- Done page: 1/1
09/05/2025 04:41:55 PM --- Number of posts for page 1: 10
09/05/2025 04:41:55 PM --- Number of posts added on 2025-05-09: 0
10/05/2025 04:41:47 PM --- Done page: 1/1
10/05/2025 04:41:47 PM --- Number of posts for page 1: 10
10/05/2025 04:41:47 PM --- Number of posts added on 2025-05-10: 0
11/05/2025 04:41:06 PM --- Done page: 1/1
11/05/2025 04:41:06 PM --- Number of posts for page 1: 10
11/05/2025 04:41:06 PM --- Number of posts added on 2025-05-11: 0
12/05/2025 04:45:23 PM --- Done page: 1/1
12/05/2025 04:45:23 PM --- Number of posts for page 1: 10
12/05/2025 04:45:23 PM --- Number of posts added on 2025-05-12: 0
13/05/2025 04:45:10 PM --- Done page: 1/1
13/05/2025 04:45:10 PM --- Number of posts for page 1: 10
13/05/2025 04:45:10 PM --- Number of posts added on 2025-05-13: 0
14/05/2025 04:44:21 PM --- Done page: 1/1
14/05/2025 04:44:21 PM --- Number of posts for page 1: 10
14/05/2025 04:44:21 PM --- Number of posts added on 2025-05-14: 0
15/05/2025 04:45:03 PM --- Done page: 1/1
15/05/2025 04:45:03 PM --- Number of posts for page 1: 10
15/05/2025 04:45:03 PM --- Number of posts added on 2025-05-15: 0
16/05/2025 04:43:34 PM --- Done page: 1/1
16/05/2025 04:43:34 PM --- Number of posts for page 1: 10
16/05/2025 04:43:34 PM --- Number of posts added on 2025-05-16: 0
17/05/2025 04:41:54 PM --- Done page: 1/1
17/05/2025 04:41:54 PM --- Number of posts for page 1: 10
17/05/2025 04:41:54 PM --- Number of posts added on 2025-05-17: 0
18/05/2025 04:40:29 PM --- Done page: 1/1
18/05/2025 04:40:29 PM --- Number of posts for page 1: 10
18/05/2025 04:40:29 PM --- Number of posts added on 2025-05-18: 0
19/05/2025 04:44:54 PM --- Done page: 1/1
19/05/2025 04:44:54 PM --- Number of posts for page 1: 10
19/05/2025 04:44:54 PM --- Number of posts added on 2025-05-19: 0
20/05/2025 04:44:35 PM --- Done page: 1/1
20/05/2025 04:44:35 PM --- Number of posts for page 1: 10
20/05/2025 04:44:35 PM --- Number of posts added on 2025-05-20: 0
21/05/2025 04:45:07 PM --- Done page: 1/1
21/05/2025 04:45:07 PM --- Number of posts for page 1: 10
21/05/2025 04:45:07 PM --- Number of posts added on 2025-05-21: 0
22/05/2025 04:44:38 PM --- Done page: 1/1
22/05/2025 04:44:38 PM --- Number of posts for page 1: 10
22/05/2025 04:44:38 PM --- Number of posts added on 2025-05-22: 0
23/05/2025 04:43:14 PM --- Done page: 1/1
23/05/2025 04:43:14 PM --- Number of posts for page 1: 10
23/05/2025 04:43:14 PM --- Number of posts added on 2025-05-23: 0
24/05/2025 04:40:53 PM --- Done page: 1/1
24/05/2025 04:40:53 PM --- Number of posts for page 1: 10
24/05/2025 04:40:53 PM --- Number of posts added on 2025-05-24: 0
25/05/2025 04:42:37 PM --- Done page: 1/1
25/05/2025 04:42:37 PM --- Number of posts for page 1: 10
25/05/2025 04:42:37 PM --- Number of posts added on 2025-05-25: 0
26/05/2025 04:43:48 PM --- Done page: 1/1
26/05/2025 04:43:48 PM --- Number of posts for page 1: 10
26/05/2025 04:43:48 PM --- Number of posts added on 2025-05-26: 0
27/05/2025 04:45:18 PM --- Done page: 1/1
27/05/2025 04:45:18 PM --- Number of posts for page 1: 10
27/05/2025 04:45:18 PM --- Number of posts added on 2025-05-27: 0
28/05/2025 04:44:27 PM --- Done page: 1/1
28/05/2025 04:44:27 PM --- Number of posts for page 1: 10
28/05/2025 04:44:27 PM --- Number of posts added on 2025-05-28: 0
29/05/2025 04:45:00 PM --- Done page: 1/1
29/05/2025 04:45:00 PM --- Number of posts for page 1: 10
29/05/2025 04:45:00 PM --- Number of posts added on 2025-05-29: 0
31/05/2025 03:16:10 AM --- Done page: 1/1
31/05/2025 03:16:10 AM --- Number of posts for page 1: 10
31/05/2025 03:16:10 AM --- Number of posts added on 2025-05-31: 0
31/05/2025 04:43:21 PM --- Done page: 1/1
31/05/2025 04:43:21 PM --- Number of posts for page 1: 10
31/05/2025 04:43:21 PM --- Number of posts added on 2025-05-31: 0
01/06/2025 04:43:01 PM --- Done page: 1/1
01/06/2025 04:43:01 PM --- Number of posts for page 1: 10
01/06/2025 04:43:01 PM --- Number of posts added on 2025-06-01: 0
02/06/2025 04:47:37 PM --- Done page: 1/1
02/06/2025 04:47:37 PM --- Number of posts for page 1: 10
02/06/2025 04:47:37 PM --- Number of posts added on 2025-06-02: 0
03/06/2025 04:47:19 PM --- Done page: 1/1
03/06/2025 04:47:19 PM --- Number of posts for page 1: 10
03/06/2025 04:47:19 PM --- Number of posts added on 2025-06-03: 0
04/06/2025 04:42:44 PM --- Done page: 1/1
04/06/2025 04:42:44 PM --- Number of posts for page 1: 10
04/06/2025 04:42:44 PM --- Number of posts added on 2025-06-04: 0
05/06/2025 04:44:04 PM --- Done page: 1/1
05/06/2025 04:44:04 PM --- Number of posts for page 1: 10
05/06/2025 04:44:04 PM --- Number of posts added on 2025-06-05: 0
06/06/2025 04:45:26 PM --- Done page: 1/1
06/06/2025 04:45:26 PM --- Number of posts for page 1: 10
06/06/2025 04:45:26 PM --- Number of posts added on 2025-06-06: 0
07/06/2025 04:43:39 PM --- Done page: 1/1
07/06/2025 04:43:39 PM --- Number of posts for page 1: 10
07/06/2025 04:43:39 PM --- Number of posts added on 2025-06-07: 0
08/06/2025 04:42:23 PM --- Done page: 1/1
08/06/2025 04:42:23 PM --- Number of posts for page 1: 10
08/06/2025 04:42:23 PM --- Number of posts added on 2025-06-08: 0
09/06/2025 04:46:39 PM --- Done page: 1/1
09/06/2025 04:46:39 PM --- Number of posts for page 1: 10
09/06/2025 04:46:39 PM --- Number of posts added on 2025-06-09: 0
10/06/2025 04:45:29 PM --- Done page: 1/1
10/06/2025 04:45:29 PM --- Number of posts for page 1: 10
10/06/2025 04:45:29 PM --- Number of posts added on 2025-06-10: 0
11/06/2025 04:45:55 PM --- Done page: 1/1
11/06/2025 04:45:55 PM --- Number of posts for page 1: 10
11/06/2025 04:45:55 PM --- Number of posts added on 2025-06-11: 0
12/06/2025 04:45:40 PM --- Done page: 1/1
12/06/2025 04:45:40 PM --- Number of posts for page 1: 10
12/06/2025 04:45:40 PM --- Number of posts added on 2025-06-12: 0
13/06/2025 04:44:40 PM --- Done page: 1/1
13/06/2025 04:44:40 PM --- Number of posts for page 1: 10
13/06/2025 04:44:40 PM --- Number of posts added on 2025-06-13: 0
14/06/2025 04:41:24 PM --- Done page: 1/1
14/06/2025 04:41:24 PM --- Number of posts for page 1: 10
14/06/2025 04:41:24 PM --- Number of posts added on 2025-06-14: 0
15/06/2025 04:43:10 PM --- Done page: 1/1
15/06/2025 04:43:10 PM --- Number of posts for page 1: 10
15/06/2025 04:43:10 PM --- Number of posts added on 2025-06-15: 0
16/06/2025 04:45:40 PM --- Done page: 1/1
16/06/2025 04:45:40 PM --- Number of posts for page 1: 10
16/06/2025 04:45:40 PM --- Number of posts added on 2025-06-16: 0
17/06/2025 04:46:59 PM --- Done page: 1/1
17/06/2025 04:46:59 PM --- Number of posts for page 1: 10
17/06/2025 04:46:59 PM --- Number of posts added on 2025-06-17: 0
18/06/2025 04:46:54 PM --- Done page: 1/1
18/06/2025 04:46:54 PM --- Number of posts for page 1: 10
18/06/2025 04:46:54 PM --- Number of posts added on 2025-06-18: 0
19/06/2025 04:44:55 PM --- Done page: 1/1
19/06/2025 04:44:55 PM --- Number of posts for page 1: 10
19/06/2025 04:44:55 PM --- Number of posts added on 2025-06-19: 0
20/06/2025 04:44:21 PM --- Done page: 1/1
20/06/2025 04:44:21 PM --- Number of posts for page 1: 10
20/06/2025 04:44:21 PM --- Number of posts added on 2025-06-20: 0
21/06/2025 04:43:39 PM --- Done page: 1/1
21/06/2025 04:43:39 PM --- Number of posts for page 1: 10
21/06/2025 04:43:39 PM --- Number of posts added on 2025-06-21: 0
22/06/2025 04:43:13 PM --- Done page: 1/1
22/06/2025 04:43:13 PM --- Number of posts for page 1: 10
22/06/2025 04:43:13 PM --- Number of posts added on 2025-06-22: 0
23/06/2025 04:46:38 PM --- Done page: 1/1
23/06/2025 04:46:38 PM --- Number of posts for page 1: 10
23/06/2025 04:46:38 PM --- Number of posts added on 2025-06-23: 0
24/06/2025 04:46:26 PM --- Done page: 1/1
24/06/2025 04:46:26 PM --- Number of posts for page 1: 10
24/06/2025 04:46:26 PM --- Number of posts added on 2025-06-24: 0
25/06/2025 04:46:42 PM --- Done page: 1/1
25/06/2025 04:46:42 PM --- Number of posts for page 1: 10
25/06/2025 04:46:42 PM --- Number of posts added on 2025-06-25: 0
26/06/2025 04:45:20 PM --- Done page: 1/1
26/06/2025 04:45:20 PM --- Number of posts for page 1: 10
26/06/2025 04:45:20 PM --- Number of posts added on 2025-06-26: 0
27/06/2025 04:43:31 PM --- Done page: 1/1
27/06/2025 04:43:31 PM --- Number of posts for page 1: 10
27/06/2025 04:43:31 PM --- Number of posts added on 2025-06-27: 0
28/06/2025 04:42:51 PM --- Done page: 1/1
28/06/2025 04:42:51 PM --- Number of posts for page 1: 10
28/06/2025 04:42:51 PM --- Number of posts added on 2025-06-28: 0
29/06/2025 04:43:30 PM --- Done page: 1/1
29/06/2025 04:43:30 PM --- Number of posts for page 1: 10
29/06/2025 04:43:30 PM --- Number of posts added on 2025-06-29: 0
30/06/2025 04:45:56 PM --- Done page: 1/1
30/06/2025 04:45:56 PM --- Number of posts for page 1: 10
30/06/2025 04:45:56 PM --- Number of posts added on 2025-06-30: 0
01/07/2025 04:46:36 PM --- Done page: 1/1
01/07/2025 04:46:36 PM --- Number of posts for page 1: 10
01/07/2025 04:46:36 PM --- Number of posts added on 2025-07-01: 0
02/07/2025 04:46:29 PM --- Done page: 1/1
02/07/2025 04:46:29 PM --- Number of posts for page 1: 10
02/07/2025 04:46:29 PM --- Number of posts added on 2025-07-02: 0
03/07/2025 04:45:58 PM --- Done page: 1/1
03/07/2025 04:45:58 PM --- Number of posts for page 1: 10
03/07/2025 04:45:58 PM --- Number of posts added on 2025-07-03: 0
04/07/2025 04:43:56 PM --- Done page: 1/1
04/07/2025 04:43:56 PM --- Number of posts for page 1: 10
04/07/2025 04:43:56 PM --- Number of posts added on 2025-07-04: 0
05/07/2025 04:42:48 PM --- Done page: 1/1
05/07/2025 04:42:48 PM --- Number of posts for page 1: 10
05/07/2025 04:42:48 PM --- Number of posts added on 2025-07-05: 0
06/07/2025 04:43:46 PM --- Done page: 1/1
06/07/2025 04:43:46 PM --- Number of posts for page 1: 10
06/07/2025 04:43:46 PM --- Number of posts added on 2025-07-06: 0
07/07/2025 04:45:55 PM --- Done page: 1/1
07/07/2025 04:45:55 PM --- Number of posts for page 1: 10
07/07/2025 04:45:55 PM --- Number of posts added on 2025-07-07: 0
08/07/2025 04:46:14 PM --- Done page: 1/1
08/07/2025 04:46:14 PM --- Number of posts for page 1: 10
08/07/2025 04:46:14 PM --- Number of posts added on 2025-07-08: 0
09/07/2025 04:46:49 PM --- Done page: 1/1
09/07/2025 04:46:49 PM --- Number of posts for page 1: 10
09/07/2025 04:46:49 PM --- Number of posts added on 2025-07-09: 0
10/07/2025 04:48:00 PM --- Done page: 1/1
10/07/2025 04:48:00 PM --- Number of posts for page 1: 10
10/07/2025 04:48:00 PM --- Number of posts added on 2025-07-10: 0
11/07/2025 04:45:49 PM --- Done page: 1/1
11/07/2025 04:45:49 PM --- Number of posts for page 1: 10
11/07/2025 04:45:49 PM --- Number of posts added on 2025-07-11: 0
12/07/2025 04:43:23 PM --- Done page: 1/1
12/07/2025 04:43:23 PM --- Number of posts for page 1: 10
12/07/2025 04:43:23 PM --- Number of posts added on 2025-07-12: 0
13/07/2025 04:43:12 PM --- Done page: 1/1
13/07/2025 04:43:12 PM --- Number of posts for page 1: 10
13/07/2025 04:43:12 PM --- Number of posts added on 2025-07-13: 0
14/07/2025 04:47:05 PM --- Done page: 1/1
14/07/2025 04:47:05 PM --- Number of posts for page 1: 10
14/07/2025 04:47:05 PM --- Number of posts added on 2025-07-14: 0
15/07/2025 04:47:33 PM --- Done page: 1/1
15/07/2025 04:47:33 PM --- Number of posts for page 1: 10
15/07/2025 04:47:33 PM --- Number of posts added on 2025-07-15: 0
16/07/2025 04:48:20 PM --- Done page: 1/1
16/07/2025 04:48:20 PM --- Number of posts for page 1: 10
16/07/2025 04:48:20 PM --- Number of posts added on 2025-07-16: 0
17/07/2025 04:47:47 PM --- Done page: 1/1
17/07/2025 04:47:47 PM --- Number of posts for page 1: 10
17/07/2025 04:47:47 PM --- Number of posts added on 2025-07-17: 0
18/07/2025 04:48:11 PM --- Done page: 1/1
18/07/2025 04:48:11 PM --- Number of posts for page 1: 10
18/07/2025 04:48:11 PM --- Number of posts added on 2025-07-18: 0
19/07/2025 04:45:25 PM --- Done page: 1/1
19/07/2025 04:45:25 PM --- Number of posts for page 1: 10
19/07/2025 04:45:25 PM --- Number of posts added on 2025-07-19: 0
20/07/2025 04:44:26 PM --- Done page: 1/1
20/07/2025 04:44:26 PM --- Number of posts for page 1: 10
20/07/2025 04:44:26 PM --- Number of posts added on 2025-07-20: 0
21/07/2025 04:48:53 PM --- Done page: 1/1
21/07/2025 04:48:53 PM --- Number of posts for page 1: 10
21/07/2025 04:48:53 PM --- Number of posts added on 2025-07-21: 0
22/07/2025 04:48:32 PM --- Done page: 1/1
22/07/2025 04:48:32 PM --- Number of posts for page 1: 10
22/07/2025 04:48:32 PM --- Number of posts added on 2025-07-22: 0
23/07/2025 04:49:10 PM --- Done page: 1/1
23/07/2025 04:49:10 PM --- Number of posts for page 1: 10
23/07/2025 04:49:10 PM --- Number of posts added on 2025-07-23: 0
24/07/2025 04:46:38 PM --- Done page: 1/1
24/07/2025 04:46:38 PM --- Number of posts for page 1: 10
24/07/2025 04:46:38 PM --- Number of posts added on 2025-07-24: 0
25/07/2025 04:47:15 PM --- Done page: 1/1
25/07/2025 04:47:15 PM --- Number of posts for page 1: 10
25/07/2025 04:47:15 PM --- Number of posts added on 2025-07-25: 0
26/07/2025 04:45:17 PM --- Done page: 1/1
26/07/2025 04:45:17 PM --- Number of posts for page 1: 10
26/07/2025 04:45:17 PM --- Number of posts added on 2025-07-26: 0
27/07/2025 04:44:47 PM --- Done page: 1/1
27/07/2025 04:44:47 PM --- Number of posts for page 1: 10
27/07/2025 04:44:47 PM --- Number of posts added on 2025-07-27: 0
28/07/2025 04:49:40 PM --- Done page: 1/1
28/07/2025 04:49:40 PM --- Number of posts for page 1: 10
28/07/2025 04:49:40 PM --- Number of posts added on 2025-07-28: 0
29/07/2025 04:49:40 PM --- Done page: 1/1
29/07/2025 04:49:40 PM --- Number of posts for page 1: 10
29/07/2025 04:49:40 PM --- Number of posts added on 2025-07-29: 0
30/07/2025 04:47:31 PM --- Done page: 1/1
30/07/2025 04:47:31 PM --- Number of posts for page 1: 10
30/07/2025 04:47:31 PM --- Number of posts added on 2025-07-30: 0
31/07/2025 04:48:23 PM --- Done page: 1/1
31/07/2025 04:48:23 PM --- Number of posts for page 1: 10
31/07/2025 04:48:23 PM --- Number of posts added on 2025-07-31: 0
01/08/2025 04:49:13 PM --- Done page: 1/1
01/08/2025 04:49:13 PM --- Number of posts for page 1: 10
01/08/2025 04:49:13 PM --- Number of posts added on 2025-08-01: 0
02/08/2025 04:46:02 PM --- Done page: 1/1
02/08/2025 04:46:02 PM --- Number of posts for page 1: 10
02/08/2025 04:46:02 PM --- Number of posts added on 2025-08-02: 0
03/08/2025 04:45:25 PM --- Done page: 1/1
03/08/2025 04:45:25 PM --- Number of posts for page 1: 10
03/08/2025 04:45:25 PM --- Number of posts added on 2025-08-03: 0
04/08/2025 04:51:09 PM --- Done page: 1/1
04/08/2025 04:51:09 PM --- Number of posts for page 1: 10
04/08/2025 04:51:09 PM --- Number of posts added on 2025-08-04: 0
05/08/2025 04:42:37 PM --- Done page: 1/1
05/08/2025 04:42:37 PM --- Number of posts for page 1: 10
05/08/2025 04:42:37 PM --- Number of posts added on 2025-08-05: 0
06/08/2025 04:49:25 PM --- Done page: 1/1
06/08/2025 04:49:25 PM --- Number of posts for page 1: 10
06/08/2025 04:49:25 PM --- Number of posts added on 2025-08-06: 0
07/08/2025 04:47:50 PM --- Done page: 1/1
07/08/2025 04:47:50 PM --- Number of posts for page 1: 10
07/08/2025 04:47:50 PM --- Number of posts added on 2025-08-07: 0
08/08/2025 04:43:29 PM --- Done page: 1/1
08/08/2025 04:43:29 PM --- Number of posts for page 1: 10
08/08/2025 04:43:29 PM --- Number of posts added on 2025-08-08: 0
09/08/2025 04:43:48 PM --- Done page: 1/1
09/08/2025 04:43:48 PM --- Number of posts for page 1: 10
09/08/2025 04:43:48 PM --- Number of posts added on 2025-08-09: 0
10/08/2025 04:44:05 PM --- Done page: 1/1
10/08/2025 04:44:05 PM --- Number of posts for page 1: 10
10/08/2025 04:44:05 PM --- Number of posts added on 2025-08-10: 0
11/08/2025 04:47:34 PM --- Done page: 1/1
11/08/2025 04:47:34 PM --- Number of posts for page 1: 10
11/08/2025 04:47:34 PM --- Number of posts added on 2025-08-11: 0
12/08/2025 04:46:38 PM --- Done page: 1/1
12/08/2025 04:46:38 PM --- Number of posts for page 1: 10
12/08/2025 04:46:38 PM --- Number of posts added on 2025-08-12: 0
13/08/2025 04:41:55 PM --- Done page: 1/1
13/08/2025 04:41:55 PM --- Number of posts for page 1: 10
13/08/2025 04:41:55 PM --- Number of posts added on 2025-08-13: 0
14/08/2025 04:46:03 PM --- Done page: 1/1
14/08/2025 04:46:03 PM --- Number of posts for page 1: 10
14/08/2025 04:46:03 PM --- Number of posts added on 2025-08-14: 0
15/08/2025 04:44:54 PM --- Done page: 1/1
15/08/2025 04:44:54 PM --- Number of posts for page 1: 10
15/08/2025 04:44:54 PM --- Number of posts added on 2025-08-15: 0
