23/10/2024 10:12:57 PM --- Done post: Quán quân “Đường lên đỉnh Olympia" có thực sự dùng tiểu xảo như lời đồn?
23/10/2024 10:12:57 PM --- Done post: Han Kang - Đang ăn cơm tối thì... thắng Nobel
23/10/2024 10:12:58 PM --- Done post: Mỳ trà sữa trân châu bắp bò: Sản phẩm sáng tạo hay marketing?
23/10/2024 10:12:58 PM --- Done post: Chuyện gì đang xảy ra với P. Diddy và Justin Bieber?
23/10/2024 10:12:59 PM --- Done post: Công Phượng sang Nhật đá bóng nhưng lại được khen “pha cà phê rất ngon”
23/10/2024 10:12:59 PM --- Done post: Vì sao bão Yagi “sống dai”, tàn phá đến tận Nam Á? 
23/10/2024 10:13:00 PM --- Done post: Nước Úc sắp cấm trẻ em dùng mạng xã hội
23/10/2024 10:13:00 PM --- Done post: Đưa Sao Nhập Ngũ lên màn ảnh cũng là một cuộc chiến
23/10/2024 10:13:01 PM --- Done post: Từ câu chuyện “Sự phẫn nội của người lửa”, đặt câu hỏi về A.I trong giáo dục
23/10/2024 10:13:01 PM --- Done post: "Về nguồn" qua những câu chuyện của bà
23/10/2024 10:13:01 PM --- Done page: 1/11
23/10/2024 10:13:01 PM --- Number of posts for page 1: 10
23/10/2024 10:13:01 PM --- Number of posts added on 2024-10-23: 10
23/10/2024 10:13:02 PM --- Done post: Sao Nhập Ngũ và 5 điều có thể bạn chưa hề biết!
23/10/2024 10:13:02 PM --- Done post: Vì sao CEO của Telegram bị bắt? “Vấn đề kiểm duyệt”
23/10/2024 10:13:03 PM --- Done post: “Hình phạt” cho người độc thân: Thực hư ra sao, hiệu quả liệu đến mức nào?
23/10/2024 10:13:03 PM --- Done post: Nhìn lại những khoảnh khắc đáng nhớ nhất của Olympic 2024
23/10/2024 10:13:04 PM --- Done post: Olympic năm nay “bất ổn”? Chưa là gì so với 120 năm trước đâu
23/10/2024 10:13:05 PM --- Done post: 10 Điều người trẻ cần biết về Tổng Bí thư Nguyễn Phú Trọng
23/10/2024 10:13:05 PM --- Done post: Biểu tình, chất thải sinh học và giường chống QHTD: Vì sao Olympic Paris “bất ổn” đến thế?
23/10/2024 10:13:06 PM --- Done post: Vietcetera Goes Abroad: Một vòng quanh thế giới để kết nối cộng đồng Việt kiều
23/10/2024 10:13:06 PM --- Done post: Toàn cảnh vụ bê bối Burning Sun qua phim tài liệu của BBC
23/10/2024 10:13:07 PM --- Done post: Tôi có hai người bạn từng bị cáo buộc xâm hại tình dục
23/10/2024 10:13:07 PM --- Done page: 2/11
23/10/2024 10:13:07 PM --- Number of posts for page 2: 10
23/10/2024 10:13:07 PM --- Number of posts added on 2024-10-23: 20
23/10/2024 10:13:08 PM --- Done post: VGLF 2024: Tận dụng tiềm lực của kiều bào Việt Nam để phát triển đất nước
23/10/2024 10:13:09 PM --- Done post: Những điều thú vị về Quốc tế Phụ nữ 8/3 mà chắc chắn bạn chưa biết
23/10/2024 10:13:09 PM --- Done post: 4 Thuật ngữ giúp bạn không lỡ nhịp khi nói về HPV
23/10/2024 10:13:10 PM --- Done post: Đến Busan để học kinh doanh, mình bắt đầu bằng công việc làm nông 
23/10/2024 10:13:10 PM --- Done post: Mình thấy điều gì khi “du học” 5 trường đại học Hàn Quốc trong 5 ngày?
23/10/2024 10:13:11 PM --- Done post: Học sinh hành hung cô giáo ở Tuyên Quang: Để yên cho nhà giáo hiền 
23/10/2024 10:13:12 PM --- Done post: "Về nhà": Buổi họp mặt của những người con xa xứ
23/10/2024 10:13:12 PM --- Done post: The Grand Ho Tram chuyển mình với định vị ‘Quận Vui’, mở ra niềm vui và tự do bất tận
23/10/2024 10:13:13 PM --- Done post: Singapore Changi Airport : Khi sân bay trở thành điểm du lịch "hút khách"
23/10/2024 10:13:13 PM --- Done post: Shadowban: Bạn có đang bị Zuck hay Elon "cấm khẩu" mà không hay biết?
23/10/2024 10:13:13 PM --- Done page: 3/11
23/10/2024 10:13:13 PM --- Number of posts for page 3: 10
23/10/2024 10:13:13 PM --- Number of posts added on 2024-10-23: 30
23/10/2024 10:13:14 PM --- Done post: Now and Then - Khúc ca cuối có đặt dấu chấm hết cho The Beatles?
23/10/2024 10:13:15 PM --- Done post: Mùa nóng đã qua nhưng Hà Nội vẫn "hạn hán" nước sạch
23/10/2024 10:13:15 PM --- Done post: Gặp gỡ Ban giám khảo của 'GREEN HORIZON Pitch Contest'
23/10/2024 10:13:16 PM --- Done post: 4 Thuật ngữ để hiểu chuyện gì đang xảy ra giữa Israel và Palestine
23/10/2024 10:13:17 PM --- Done post: Quá khứ đau thương đang lặp lại tại Israel-Palestine
23/10/2024 10:13:17 PM --- Done post: Giáo viên kéo lê học trò: Nhiều hơn chuyện cô, trò, và cái bánh
23/10/2024 10:13:18 PM --- Done post: "Check Var" Chủ tịch Liên đoàn Bóng đá Tây Ban Nha, penalty sút bay ghế
23/10/2024 10:13:19 PM --- Done post: Chuẩn bị những gì đây khi phải chuyển nhà tới trời Tây?
23/10/2024 10:13:19 PM --- Done post: Làm thế nào để tìm được ý nghĩa cuộc sống và giá trị của bản thân?
23/10/2024 10:13:20 PM --- Done post: Ấn Độ trở thành nước đầu tiên hạ cánh tại vùng tối của mặt trăng
23/10/2024 10:13:20 PM --- Done page: 4/11
23/10/2024 10:13:20 PM --- Number of posts for page 4: 10
23/10/2024 10:13:20 PM --- Number of posts added on 2024-10-23: 40
23/10/2024 10:13:21 PM --- Done post: 4 Tin xấu bạn cần biết trong nửa đầu 2023
23/10/2024 10:13:22 PM --- Done post: Ngoài cấm thịt chó, Hà Nội còn những lựa chọn nào khác?
23/10/2024 10:13:22 PM --- Done post: Luyện thi ở lò và một thời để nhớ
23/10/2024 10:13:23 PM --- Done post: Khi học sinh giỏi bị ghét
23/10/2024 10:13:23 PM --- Done post: Điều tra Binance và Coinbase: Còn cửa nào cho tiền mã hóa?
23/10/2024 10:13:24 PM --- Done post: Vẹt cũng biết "video call" để bớt cô đơn
23/10/2024 10:13:24 PM --- Done post: Thương hiệu bia hơn 150 tuổi bắt tay với Hoàng Thùy Linh, 16 Typh và Touliver 
23/10/2024 10:13:25 PM --- Done post: Gặp gỡ 50 doanh nghiệp đầu tư ESG Việt Nam
23/10/2024 10:13:26 PM --- Done post: Mơ ước của bố mẹ 40 năm về trước có thành hiện thực?
23/10/2024 10:13:26 PM --- Done post: Những thành tựu mới nhất của kính James Webb định hình lại hiểu biết về vũ trụ
23/10/2024 10:13:26 PM --- Done page: 5/11
23/10/2024 10:13:26 PM --- Number of posts for page 5: 10
23/10/2024 10:13:26 PM --- Number of posts added on 2024-10-23: 50
23/10/2024 10:13:27 PM --- Done post: Hành trình tìm mình của những người trẻ chơi hệ "tâm linh" ở Việt Nam
23/10/2024 10:13:28 PM --- Done post: Trào lưu "chữa lành", "tìm kiếm bản thân" từ đâu mà ra?
23/10/2024 10:13:28 PM --- Done post: “Van Gogh: The Immersive Experience”: Nghệ Thuật Giữa Lòng Nghệ Thuật
23/10/2024 10:13:29 PM --- Done post: Khi tài liệu mật Mỹ rò rỉ trên Discord, 4Chan, Telegram
23/10/2024 10:13:29 PM --- Done post: Từ "Những đứa trẻ trong sương," vén màn sương định kiến văn hoá
23/10/2024 10:13:30 PM --- Done post: Y tá Úc bị cấm làm OnlyFans và tranh luận về nội dung 18+ có trả phí
23/10/2024 10:13:31 PM --- Done post: Vào hang cùng Manchester United
23/10/2024 10:13:31 PM --- Done post: Nhật Bản đề xuất tăng tuổi đồng thuận tình dục từ 13 lên 16
23/10/2024 10:13:32 PM --- Done post: Di cư vì biến đổi khí hậu toàn cầu: Đâu là tương lai của chúng ta?
23/10/2024 10:13:32 PM --- Done post: Overeducated: Khi bằng cấp bị “rớt giá”
23/10/2024 10:13:32 PM --- Done page: 6/11
23/10/2024 10:13:32 PM --- Number of posts for page 6: 10
23/10/2024 10:13:32 PM --- Number of posts added on 2024-10-23: 60
23/10/2024 10:13:33 PM --- Done post: Động đất ở Thổ Nhĩ Kỳ và Syria: Thương vong có thể lên đến 20.000 người
23/10/2024 10:13:33 PM --- Done post: 5 Cảnh sát Mỹ đánh người đến thiệt mạng: Nên cảnh báo về độ bạo lực khi đưa tin
23/10/2024 10:13:34 PM --- Done post: Tết vẫn tròn dù bao mùa đi qua
23/10/2024 10:13:34 PM --- Done post: Huấn luyện viên Park Hang-seo: 5 năm, 3 dấu ấn, 1 hành trình
23/10/2024 10:13:35 PM --- Done post: Tạm biệt World Cup 2022 với 5 khoảnh khắc ấn tượng 
23/10/2024 10:13:35 PM --- Done post: Binance "lên thớt" với Bộ Tư pháp Hoa Kỳ
23/10/2024 10:13:36 PM --- Done post: Toxic professionalism: Khi sự độc hại núp bóng môi trường chuyên nghiệp
23/10/2024 10:13:37 PM --- Done post: 1,5 Triệu USD bồi thường cáo buộc sai về gian lận thi cử
23/10/2024 10:13:38 PM --- Done post: "Khủng hoảng kết hôn": Không chỉ là câu chuyện của riêng Trung Quốc 
23/10/2024 10:13:39 PM --- Done post: Công nghệ khiến bóng đá công bằng hơn hay thiếu hấp dẫn hơn?
23/10/2024 10:13:39 PM --- Done page: 7/11
23/10/2024 10:13:39 PM --- Number of posts for page 7: 10
23/10/2024 10:13:39 PM --- Number of posts added on 2024-10-23: 70
23/10/2024 10:13:39 PM --- Done post: Hơn 6500 công nhân thiệt mạng để phục vụ cho World Cup Qatar 2022
23/10/2024 10:13:40 PM --- Done post: Câu chuyện Nờ Ô Nô và việc lắng nghe tiếng nói của nhóm yếu thế
23/10/2024 10:13:40 PM --- Done post: Chọn gì giữa ra sân và lên giường?  
23/10/2024 10:13:41 PM --- Done post: Tuổi 35 mình chuẩn bị cho cuộc sống độc thân lâu dài
23/10/2024 10:13:41 PM --- Done post: Tăng cơ hội việc làm CNTT với mạng lưới đối tác của FUNiX
23/10/2024 10:13:42 PM --- Done post: Sau Itaewon, tôi nhận ra mình là người may mắn
23/10/2024 10:13:42 PM --- Done post: Chuyển giờ học chính có ý nghĩa gì khi vẫn phải học thêm?
23/10/2024 10:13:43 PM --- Done post: 5 Tiệm hoa thơ mộng ở Hà Nội để check in đón mùa thu sang
23/10/2024 10:13:44 PM --- Done post: Tìm thấy bản thân khi đi làm kiếm sống trước 18 tuổi
23/10/2024 10:13:44 PM --- Done post: Mình từng bị giáo viên chủ nhiệm “trù” cả 4 năm
23/10/2024 10:13:44 PM --- Done page: 8/11
23/10/2024 10:13:44 PM --- Number of posts for page 8: 10
23/10/2024 10:13:44 PM --- Number of posts added on 2024-10-23: 80
23/10/2024 10:13:45 PM --- Done post: iPhone 14 series ra mắt: Màn hình “viên thuốc” mới khẳng định độ dày của ví bạn
23/10/2024 10:13:45 PM --- Done post: Xin in tư - Dấu hiệu của một trò đùa kém duyên
23/10/2024 10:13:46 PM --- Done post: Từ xã hội không tiền mặt nhớ lại thời “1 nghìn một chiếc cu đơ”
23/10/2024 10:13:47 PM --- Done post: Chiếc quyền trượng ở trường đại học: Cần phải bàn xa hơn câu chuyện thẩm mỹ
23/10/2024 10:13:47 PM --- Done post: 5 Điểm đến quanh Hà Nội để bạn vi vu tận hưởng cuối tuần
23/10/2024 10:13:48 PM --- Done post: 1 Năm trước, Hà Nội giãn cách xã hội lần thứ tư
23/10/2024 10:13:49 PM --- Done post: 5 Thuật ngữ chính trị để hiểu về cuộc khủng hoảng tại Sri Lanka
23/10/2024 10:13:49 PM --- Done post: 4.7 Tỷ năm của vũ trụ qua kính thiên văn James Webb
23/10/2024 10:13:50 PM --- Done post: Nước Nhật thay đổi thế nào sau vụ ám sát Abe Shinzo?
23/10/2024 10:13:50 PM --- Done post: Yu-Gi-Oh! - Tác giả ra đi, kỷ niệm ở lại
23/10/2024 10:13:50 PM --- Done page: 9/11
23/10/2024 10:13:50 PM --- Number of posts for page 9: 10
23/10/2024 10:13:50 PM --- Number of posts added on 2024-10-23: 90
23/10/2024 10:13:51 PM --- Done post: Cựu Thủ tướng Nhật Bản Abe Shinzo qua đời sau khi bị bắn
23/10/2024 10:13:52 PM --- Done post: Làm mới bản thân với 5 workshop mùa hè ở Hà Nội
23/10/2024 10:13:52 PM --- Done post: Tóm Lại Là: Nghệ sĩ Việt bị cáo buộc hiếp dâm ở Tây Ban Nha
23/10/2024 10:13:53 PM --- Done post: 5 Thuật ngữ để có góc nhìn đa chiều về khủng hoảng di cư
23/10/2024 10:13:53 PM --- Done post: “Bẻ khoá” Photoshop có trở thành câu chuyện dĩ vãng?
23/10/2024 10:13:54 PM --- Done post: 46 thi thể trong xe container tại Texas: Cái giá quá đắt cho ước mơ đổi đời
23/10/2024 10:13:55 PM --- Done post: Internet Explorer ơi, vĩnh biệt!
23/10/2024 10:13:55 PM --- Done post: Red Flag Law - "Sao đỏ" kiểm soát người sở hữu súng đạn
23/10/2024 10:13:56 PM --- Done post: Nháy mắt là quấy rối tình dục?
23/10/2024 10:13:56 PM --- Done post: "Anh đợi đi, em tưới cây xong rồi tính."
23/10/2024 10:13:56 PM --- Done page: 10/11
23/10/2024 10:13:56 PM --- Number of posts for page 10: 10
23/10/2024 10:13:56 PM --- Number of posts added on 2024-10-23: 100
23/10/2024 10:13:57 PM --- Done post: Xả súng tại Mỹ: tiếp tục chia buồn tới bao giờ?
23/10/2024 10:13:58 PM --- Done post: Đề văn lớp 8 về xâm hại tình dục trẻ em: Hay nhưng đã đủ để học sinh “cởi mở”?
23/10/2024 10:13:58 PM --- Done post: Nốt lặng trong bản nhạc giao tiếp
23/10/2024 10:13:59 PM --- Done post: Hiểu đúng về chiếm dụng văn hóa cùng Tiến sĩ Lư Thị Thanh Lê
23/10/2024 10:13:59 PM --- Done post: Lại có thêm học sinh tự sát
23/10/2024 10:13:59 PM --- Done page: 11/11
23/10/2024 10:13:59 PM --- Number of posts for page 11: 5
23/10/2024 10:13:59 PM --- Number of posts added on 2024-10-23: 105
23/10/2024 04:49:00 PM --- Done page: 1/1
23/10/2024 04:49:00 PM --- Number of posts for page 1: 10
23/10/2024 04:49:00 PM --- Number of posts added on 2024-10-23: 0
24/10/2024 04:48:05 PM --- Done page: 1/1
24/10/2024 04:48:05 PM --- Number of posts for page 1: 10
24/10/2024 04:48:05 PM --- Number of posts added on 2024-10-24: 0
25/10/2024 04:46:57 PM --- Done page: 1/1
25/10/2024 04:46:57 PM --- Number of posts for page 1: 10
25/10/2024 04:46:57 PM --- Number of posts added on 2024-10-25: 0
26/10/2024 04:44:52 PM --- Done page: 1/1
26/10/2024 04:44:52 PM --- Number of posts for page 1: 10
26/10/2024 04:44:52 PM --- Number of posts added on 2024-10-26: 0
27/10/2024 04:45:48 PM --- Done page: 1/1
27/10/2024 04:45:48 PM --- Number of posts for page 1: 10
27/10/2024 04:45:48 PM --- Number of posts added on 2024-10-27: 0
28/10/2024 04:50:04 PM --- Done page: 1/1
28/10/2024 04:50:04 PM --- Number of posts for page 1: 10
28/10/2024 04:50:04 PM --- Number of posts added on 2024-10-28: 0
29/10/2024 04:48:29 PM --- Done page: 1/1
29/10/2024 04:48:29 PM --- Number of posts for page 1: 10
29/10/2024 04:48:29 PM --- Number of posts added on 2024-10-29: 0
30/10/2024 04:49:43 PM --- Done page: 1/1
30/10/2024 04:49:43 PM --- Number of posts for page 1: 10
30/10/2024 04:49:43 PM --- Number of posts added on 2024-10-30: 0
31/10/2024 04:47:30 PM --- Done page: 1/1
31/10/2024 04:47:30 PM --- Number of posts for page 1: 10
31/10/2024 04:47:30 PM --- Number of posts added on 2024-10-31: 0
01/11/2024 04:46:32 PM --- Done page: 1/1
01/11/2024 04:46:32 PM --- Number of posts for page 1: 10
01/11/2024 04:46:32 PM --- Number of posts added on 2024-11-01: 0
02/11/2024 04:47:22 PM --- Done page: 1/1
02/11/2024 04:47:22 PM --- Number of posts for page 1: 10
02/11/2024 04:47:22 PM --- Number of posts added on 2024-11-02: 0
03/11/2024 04:44:37 PM --- Done page: 1/1
03/11/2024 04:44:37 PM --- Number of posts for page 1: 10
03/11/2024 04:44:37 PM --- Number of posts added on 2024-11-03: 0
04/11/2024 04:46:47 PM --- Done page: 1/1
04/11/2024 04:46:47 PM --- Number of posts for page 1: 10
04/11/2024 04:46:47 PM --- Number of posts added on 2024-11-04: 0
05/11/2024 04:45:18 PM --- Done page: 1/1
05/11/2024 04:45:18 PM --- Number of posts for page 1: 10
05/11/2024 04:45:18 PM --- Number of posts added on 2024-11-05: 0
06/11/2024 04:47:04 PM --- Done page: 1/1
06/11/2024 04:47:04 PM --- Number of posts for page 1: 10
06/11/2024 04:47:04 PM --- Number of posts added on 2024-11-06: 0
07/11/2024 04:47:00 PM --- Done page: 1/1
07/11/2024 04:47:00 PM --- Number of posts for page 1: 10
07/11/2024 04:47:00 PM --- Number of posts added on 2024-11-07: 0
08/11/2024 04:46:44 PM --- Done page: 1/1
08/11/2024 04:46:44 PM --- Number of posts for page 1: 10
08/11/2024 04:46:44 PM --- Number of posts added on 2024-11-08: 0
09/11/2024 04:44:46 PM --- Done page: 1/1
09/11/2024 04:44:46 PM --- Number of posts for page 1: 10
09/11/2024 04:44:46 PM --- Number of posts added on 2024-11-09: 0
10/11/2024 04:43:42 PM --- Done page: 1/1
10/11/2024 04:43:42 PM --- Number of posts for page 1: 10
10/11/2024 04:43:42 PM --- Number of posts added on 2024-11-10: 0
11/11/2024 04:46:25 PM --- Done page: 1/1
11/11/2024 04:46:25 PM --- Number of posts for page 1: 10
11/11/2024 04:46:25 PM --- Number of posts added on 2024-11-11: 0
12/11/2024 04:47:19 PM --- Done page: 1/1
12/11/2024 04:47:19 PM --- Number of posts for page 1: 10
12/11/2024 04:47:19 PM --- Number of posts added on 2024-11-12: 0
13/11/2024 04:47:42 PM --- Done page: 1/1
13/11/2024 04:47:42 PM --- Number of posts for page 1: 10
13/11/2024 04:47:42 PM --- Number of posts added on 2024-11-13: 0
14/11/2024 04:48:37 PM --- Done page: 1/1
14/11/2024 04:48:37 PM --- Number of posts for page 1: 10
14/11/2024 04:48:37 PM --- Number of posts added on 2024-11-14: 0
15/11/2024 04:48:23 PM --- Done page: 1/1
15/11/2024 04:48:23 PM --- Number of posts for page 1: 10
15/11/2024 04:48:23 PM --- Number of posts added on 2024-11-15: 0
16/11/2024 04:47:46 PM --- Done page: 1/1
16/11/2024 04:47:46 PM --- Number of posts for page 1: 10
16/11/2024 04:47:46 PM --- Number of posts added on 2024-11-16: 0
17/11/2024 04:45:42 PM --- Done page: 1/1
17/11/2024 04:45:42 PM --- Number of posts for page 1: 10
17/11/2024 04:45:42 PM --- Number of posts added on 2024-11-17: 0
18/11/2024 04:50:19 PM --- Done page: 1/1
18/11/2024 04:50:19 PM --- Number of posts for page 1: 10
18/11/2024 04:50:19 PM --- Number of posts added on 2024-11-18: 0
19/11/2024 04:49:33 PM --- Done page: 1/1
19/11/2024 04:49:33 PM --- Number of posts for page 1: 10
19/11/2024 04:49:33 PM --- Number of posts added on 2024-11-19: 0
20/11/2024 04:50:04 PM --- Done page: 1/1
20/11/2024 04:50:04 PM --- Number of posts for page 1: 10
20/11/2024 04:50:04 PM --- Number of posts added on 2024-11-20: 0
21/11/2024 04:49:27 PM --- Done page: 1/1
21/11/2024 04:49:27 PM --- Number of posts for page 1: 10
21/11/2024 04:49:27 PM --- Number of posts added on 2024-11-21: 0
22/11/2024 04:48:44 PM --- Done page: 1/1
22/11/2024 04:48:44 PM --- Number of posts for page 1: 10
22/11/2024 04:48:44 PM --- Number of posts added on 2024-11-22: 0
23/11/2024 04:46:52 PM --- Done page: 1/1
23/11/2024 04:46:52 PM --- Number of posts for page 1: 10
23/11/2024 04:46:52 PM --- Number of posts added on 2024-11-23: 0
24/11/2024 04:46:13 PM --- Done page: 1/1
24/11/2024 04:46:13 PM --- Number of posts for page 1: 10
24/11/2024 04:46:13 PM --- Number of posts added on 2024-11-24: 0
25/11/2024 04:49:38 PM --- Done page: 1/1
25/11/2024 04:49:38 PM --- Number of posts for page 1: 10
25/11/2024 04:49:38 PM --- Number of posts added on 2024-11-25: 0
26/11/2024 04:51:11 PM --- Done page: 1/1
26/11/2024 04:51:11 PM --- Number of posts for page 1: 10
26/11/2024 04:51:11 PM --- Number of posts added on 2024-11-26: 0
27/11/2024 04:50:34 PM --- Done page: 1/1
27/11/2024 04:50:34 PM --- Number of posts for page 1: 10
27/11/2024 04:50:34 PM --- Number of posts added on 2024-11-27: 0
28/11/2024 04:49:36 PM --- Done post: Đáng tiền: Chi 6 triệu cho máy nước nóng thông minh để dọn bớt nỗi lo cho tâm trí
28/11/2024 04:49:50 PM --- Done page: 1/1
28/11/2024 04:49:50 PM --- Number of posts for page 1: 10
28/11/2024 04:49:50 PM --- Number of posts added on 2024-11-28: 1
29/11/2024 04:48:44 PM --- Done page: 1/1
29/11/2024 04:48:44 PM --- Number of posts for page 1: 10
29/11/2024 04:48:44 PM --- Number of posts added on 2024-11-29: 0
30/11/2024 04:47:21 PM --- Done page: 1/1
30/11/2024 04:47:21 PM --- Number of posts for page 1: 10
30/11/2024 04:47:21 PM --- Number of posts added on 2024-11-30: 0
01/12/2024 04:46:46 PM --- Done page: 1/1
01/12/2024 04:46:46 PM --- Number of posts for page 1: 10
01/12/2024 04:46:46 PM --- Number of posts added on 2024-12-01: 0
02/12/2024 04:50:54 PM --- Done page: 1/1
02/12/2024 04:50:54 PM --- Number of posts for page 1: 10
02/12/2024 04:50:54 PM --- Number of posts added on 2024-12-02: 0
03/12/2024 04:51:48 PM --- Done page: 1/1
03/12/2024 04:51:48 PM --- Number of posts for page 1: 10
03/12/2024 04:51:48 PM --- Number of posts added on 2024-12-03: 0
04/12/2024 04:52:12 PM --- Done page: 1/1
04/12/2024 04:52:12 PM --- Number of posts for page 1: 10
04/12/2024 04:52:12 PM --- Number of posts added on 2024-12-04: 0
05/12/2024 04:50:51 PM --- Done page: 1/1
05/12/2024 04:50:51 PM --- Number of posts for page 1: 10
05/12/2024 04:50:51 PM --- Number of posts added on 2024-12-05: 0
06/12/2024 04:49:29 PM --- Done page: 1/1
06/12/2024 04:49:29 PM --- Number of posts for page 1: 10
06/12/2024 04:49:29 PM --- Number of posts added on 2024-12-06: 0
07/12/2024 04:47:06 PM --- Done page: 1/1
07/12/2024 04:47:06 PM --- Number of posts for page 1: 10
07/12/2024 04:47:06 PM --- Number of posts added on 2024-12-07: 0
08/12/2024 04:46:22 PM --- Done page: 1/1
08/12/2024 04:46:22 PM --- Number of posts for page 1: 10
08/12/2024 04:46:22 PM --- Number of posts added on 2024-12-08: 0
09/12/2024 04:51:27 PM --- Done page: 1/1
09/12/2024 04:51:27 PM --- Number of posts for page 1: 10
09/12/2024 04:51:27 PM --- Number of posts added on 2024-12-09: 0
10/12/2024 04:51:15 PM --- Done page: 1/1
10/12/2024 04:51:15 PM --- Number of posts for page 1: 10
10/12/2024 04:51:15 PM --- Number of posts added on 2024-12-10: 0
11/12/2024 04:51:33 PM --- Done page: 1/1
11/12/2024 04:51:33 PM --- Number of posts for page 1: 10
11/12/2024 04:51:33 PM --- Number of posts added on 2024-12-11: 0
12/12/2024 04:51:23 PM --- Done page: 1/1
12/12/2024 04:51:23 PM --- Number of posts for page 1: 10
12/12/2024 04:51:23 PM --- Number of posts added on 2024-12-12: 0
13/12/2024 04:49:00 PM --- Done page: 1/1
13/12/2024 04:49:00 PM --- Number of posts for page 1: 10
13/12/2024 04:49:00 PM --- Number of posts added on 2024-12-13: 0
14/12/2024 04:46:19 PM --- Done page: 1/1
14/12/2024 04:46:19 PM --- Number of posts for page 1: 10
14/12/2024 04:46:19 PM --- Number of posts added on 2024-12-14: 0
15/12/2024 04:46:22 PM --- Done page: 1/1
15/12/2024 04:46:22 PM --- Number of posts for page 1: 10
15/12/2024 04:46:22 PM --- Number of posts added on 2024-12-15: 0
16/12/2024 04:50:38 PM --- Done page: 1/1
16/12/2024 04:50:38 PM --- Number of posts for page 1: 10
16/12/2024 04:50:38 PM --- Number of posts added on 2024-12-16: 0
17/12/2024 04:50:49 PM --- Done page: 1/1
17/12/2024 04:50:49 PM --- Number of posts for page 1: 10
17/12/2024 04:50:49 PM --- Number of posts added on 2024-12-17: 0
18/12/2024 04:48:53 PM --- Done page: 1/1
18/12/2024 04:48:53 PM --- Number of posts for page 1: 10
18/12/2024 04:48:53 PM --- Number of posts added on 2024-12-18: 0
19/12/2024 04:46:25 PM --- Done page: 1/1
19/12/2024 04:46:25 PM --- Number of posts for page 1: 10
19/12/2024 04:46:25 PM --- Number of posts added on 2024-12-19: 0
20/12/2024 04:45:24 PM --- Done page: 1/1
20/12/2024 04:45:24 PM --- Number of posts for page 1: 10
20/12/2024 04:45:24 PM --- Number of posts added on 2024-12-20: 0
21/12/2024 04:44:10 PM --- Done page: 1/1
21/12/2024 04:44:10 PM --- Number of posts for page 1: 10
21/12/2024 04:44:10 PM --- Number of posts added on 2024-12-21: 0
22/12/2024 04:43:16 PM --- Done page: 1/1
22/12/2024 04:43:16 PM --- Number of posts for page 1: 10
22/12/2024 04:43:16 PM --- Number of posts added on 2024-12-22: 0
23/12/2024 04:45:09 PM --- Done post: TP.HCM vận hành tuyến metro số 1, người dân nhận thẻ đi metro VikkiGO miễn phí
23/12/2024 04:45:28 PM --- Done page: 1/1
23/12/2024 04:45:28 PM --- Number of posts for page 1: 10
23/12/2024 04:45:28 PM --- Number of posts added on 2024-12-23: 1
24/12/2024 04:44:54 PM --- Done page: 1/1
24/12/2024 04:44:54 PM --- Number of posts for page 1: 10
24/12/2024 04:44:54 PM --- Number of posts added on 2024-12-24: 0
25/12/2024 04:45:00 PM --- Done page: 1/1
25/12/2024 04:45:00 PM --- Number of posts for page 1: 10
25/12/2024 04:45:00 PM --- Number of posts added on 2024-12-25: 0
26/12/2024 04:45:16 PM --- Done page: 1/1
26/12/2024 04:45:16 PM --- Number of posts for page 1: 10
26/12/2024 04:45:16 PM --- Number of posts added on 2024-12-26: 0
27/12/2024 04:44:28 PM --- Done page: 1/1
27/12/2024 04:44:28 PM --- Number of posts for page 1: 10
27/12/2024 04:44:28 PM --- Number of posts added on 2024-12-27: 0
28/12/2024 04:43:47 PM --- Done page: 1/1
28/12/2024 04:43:47 PM --- Number of posts for page 1: 10
28/12/2024 04:43:47 PM --- Number of posts added on 2024-12-28: 0
29/12/2024 04:43:37 PM --- Done page: 1/1
29/12/2024 04:43:37 PM --- Number of posts for page 1: 10
29/12/2024 04:43:37 PM --- Number of posts added on 2024-12-29: 0
30/12/2024 04:45:46 PM --- Done page: 1/1
30/12/2024 04:45:46 PM --- Number of posts for page 1: 10
30/12/2024 04:45:46 PM --- Number of posts added on 2024-12-30: 0
31/12/2024 04:46:01 PM --- Done page: 1/1
31/12/2024 04:46:01 PM --- Number of posts for page 1: 10
31/12/2024 04:46:01 PM --- Number of posts added on 2024-12-31: 0
01/01/2025 04:45:57 PM --- Done page: 1/1
01/01/2025 04:45:57 PM --- Number of posts for page 1: 10
01/01/2025 04:45:57 PM --- Number of posts added on 2025-01-01: 0
02/01/2025 04:46:06 PM --- Done page: 1/1
02/01/2025 04:46:06 PM --- Number of posts for page 1: 10
02/01/2025 04:46:06 PM --- Number of posts added on 2025-01-02: 0
03/01/2025 04:46:10 PM --- Done page: 1/1
03/01/2025 04:46:10 PM --- Number of posts for page 1: 10
03/01/2025 04:46:10 PM --- Number of posts added on 2025-01-03: 0
04/01/2025 04:44:11 PM --- Done page: 1/1
04/01/2025 04:44:11 PM --- Number of posts for page 1: 10
04/01/2025 04:44:11 PM --- Number of posts added on 2025-01-04: 0
05/01/2025 04:44:18 PM --- Done page: 1/1
05/01/2025 04:44:18 PM --- Number of posts for page 1: 10
05/01/2025 04:44:18 PM --- Number of posts added on 2025-01-05: 0
06/01/2025 04:47:57 PM --- Done page: 1/1
06/01/2025 04:47:57 PM --- Number of posts for page 1: 10
06/01/2025 04:47:57 PM --- Number of posts added on 2025-01-06: 0
07/01/2025 04:55:37 PM --- Done post: Từ doanh nghiệp quốc tế đến doanh nghiệp Việt: Cơ hội nào dành cho cộng đồng Việt kiều?
07/01/2025 04:55:58 PM --- Done page: 1/1
07/01/2025 04:55:58 PM --- Number of posts for page 1: 10
07/01/2025 04:55:58 PM --- Number of posts added on 2025-01-07: 1
08/01/2025 04:47:02 PM --- Done post: Techcombank Career Tour 2024: Đưa cơ hội đến mọi vùng miền
08/01/2025 04:47:18 PM --- Done page: 1/1
08/01/2025 04:47:18 PM --- Number of posts for page 1: 10
08/01/2025 04:47:18 PM --- Number of posts added on 2025-01-08: 1
09/01/2025 04:46:45 PM --- Done page: 1/1
09/01/2025 04:46:45 PM --- Number of posts for page 1: 10
09/01/2025 04:46:45 PM --- Number of posts added on 2025-01-09: 0
10/01/2025 04:46:45 PM --- Done page: 1/1
10/01/2025 04:46:45 PM --- Number of posts for page 1: 10
10/01/2025 04:46:45 PM --- Number of posts added on 2025-01-10: 0
11/01/2025 04:43:52 PM --- Done page: 1/1
11/01/2025 04:43:52 PM --- Number of posts for page 1: 10
11/01/2025 04:43:52 PM --- Number of posts added on 2025-01-11: 0
12/01/2025 04:43:29 PM --- Done page: 1/1
12/01/2025 04:43:29 PM --- Number of posts for page 1: 10
12/01/2025 04:43:29 PM --- Number of posts added on 2025-01-12: 0
13/01/2025 04:48:14 PM --- Done page: 1/1
13/01/2025 04:48:14 PM --- Number of posts for page 1: 10
13/01/2025 04:48:14 PM --- Number of posts added on 2025-01-13: 0
14/01/2025 04:45:50 PM --- Done page: 1/1
14/01/2025 04:45:50 PM --- Number of posts for page 1: 10
14/01/2025 04:45:50 PM --- Number of posts added on 2025-01-14: 0
15/01/2025 04:45:06 PM --- Done page: 1/1
15/01/2025 04:45:06 PM --- Number of posts for page 1: 10
15/01/2025 04:45:06 PM --- Number of posts added on 2025-01-15: 0
16/01/2025 04:45:17 PM --- Done page: 1/1
16/01/2025 04:45:17 PM --- Number of posts for page 1: 10
16/01/2025 04:45:17 PM --- Number of posts added on 2025-01-16: 0
17/01/2025 04:44:24 PM --- Done post: OV Summit 2025: Bức tranh toàn cảnh về thị trường Việt Nam cho cộng đồng Việt kiều  
17/01/2025 04:44:41 PM --- Done page: 1/1
17/01/2025 04:44:41 PM --- Number of posts for page 1: 10
17/01/2025 04:44:41 PM --- Number of posts added on 2025-01-17: 1
18/01/2025 04:42:25 PM --- Done page: 1/1
18/01/2025 04:42:25 PM --- Number of posts for page 1: 10
18/01/2025 04:42:25 PM --- Number of posts added on 2025-01-18: 0
19/01/2025 04:42:43 PM --- Done page: 1/1
19/01/2025 04:42:43 PM --- Number of posts for page 1: 10
19/01/2025 04:42:43 PM --- Number of posts added on 2025-01-19: 0
20/01/2025 04:45:16 PM --- Done page: 1/1
20/01/2025 04:45:16 PM --- Number of posts for page 1: 10
20/01/2025 04:45:16 PM --- Number of posts added on 2025-01-20: 0
21/01/2025 04:46:26 PM --- Done page: 1/1
21/01/2025 04:46:26 PM --- Number of posts for page 1: 10
21/01/2025 04:46:26 PM --- Number of posts added on 2025-01-21: 0
22/01/2025 04:46:02 PM --- Done page: 1/1
22/01/2025 04:46:02 PM --- Number of posts for page 1: 10
22/01/2025 04:46:02 PM --- Number of posts added on 2025-01-22: 0
23/01/2025 04:46:30 PM --- Done page: 1/1
23/01/2025 04:46:30 PM --- Number of posts for page 1: 10
23/01/2025 04:46:30 PM --- Number of posts added on 2025-01-23: 0
24/01/2025 04:45:21 PM --- Done page: 1/1
24/01/2025 04:45:21 PM --- Number of posts for page 1: 10
24/01/2025 04:45:21 PM --- Number of posts added on 2025-01-24: 0
25/01/2025 04:44:39 PM --- Done page: 1/1
25/01/2025 04:44:39 PM --- Number of posts for page 1: 10
25/01/2025 04:44:39 PM --- Number of posts added on 2025-01-25: 0
26/01/2025 04:43:02 PM --- Done page: 1/1
26/01/2025 04:43:02 PM --- Number of posts for page 1: 10
26/01/2025 04:43:02 PM --- Number of posts added on 2025-01-26: 0
27/01/2025 04:45:44 PM --- Done page: 1/1
27/01/2025 04:45:44 PM --- Number of posts for page 1: 10
27/01/2025 04:45:44 PM --- Number of posts added on 2025-01-27: 0
28/01/2025 04:45:53 PM --- Done page: 1/1
28/01/2025 04:45:53 PM --- Number of posts for page 1: 10
28/01/2025 04:45:53 PM --- Number of posts added on 2025-01-28: 0
29/01/2025 04:45:12 PM --- Done page: 1/1
29/01/2025 04:45:12 PM --- Number of posts for page 1: 10
29/01/2025 04:45:12 PM --- Number of posts added on 2025-01-29: 0
30/01/2025 04:46:12 PM --- Done page: 1/1
30/01/2025 04:46:12 PM --- Number of posts for page 1: 10
30/01/2025 04:46:12 PM --- Number of posts added on 2025-01-30: 0
31/01/2025 04:45:54 PM --- Done page: 1/1
31/01/2025 04:45:54 PM --- Number of posts for page 1: 10
31/01/2025 04:45:54 PM --- Number of posts added on 2025-01-31: 0
01/02/2025 04:42:07 PM --- Done page: 1/1
01/02/2025 04:42:07 PM --- Number of posts for page 1: 10
01/02/2025 04:42:07 PM --- Number of posts added on 2025-02-01: 0
02/02/2025 04:43:04 PM --- Done page: 1/1
02/02/2025 04:43:04 PM --- Number of posts for page 1: 10
02/02/2025 04:43:04 PM --- Number of posts added on 2025-02-02: 0
03/02/2025 04:46:00 PM --- Done page: 1/1
03/02/2025 04:46:00 PM --- Number of posts for page 1: 10
03/02/2025 04:46:00 PM --- Number of posts added on 2025-02-03: 0
04/02/2025 04:46:17 PM --- Done page: 1/1
04/02/2025 04:46:17 PM --- Number of posts for page 1: 10
04/02/2025 04:46:17 PM --- Number of posts added on 2025-02-04: 0
05/02/2025 04:47:32 PM --- Done page: 1/1
05/02/2025 04:47:32 PM --- Number of posts for page 1: 10
05/02/2025 04:47:32 PM --- Number of posts added on 2025-02-05: 0
06/02/2025 04:46:03 PM --- Done page: 1/1
06/02/2025 04:46:03 PM --- Number of posts for page 1: 10
06/02/2025 04:46:03 PM --- Number of posts added on 2025-02-06: 0
07/02/2025 04:46:49 PM --- Done page: 1/1
07/02/2025 04:46:49 PM --- Number of posts for page 1: 10
07/02/2025 04:46:49 PM --- Number of posts added on 2025-02-07: 0
08/02/2025 04:42:25 PM --- Done page: 1/1
08/02/2025 04:42:25 PM --- Number of posts for page 1: 10
08/02/2025 04:42:25 PM --- Number of posts added on 2025-02-08: 0
09/02/2025 04:42:08 PM --- Done page: 1/1
09/02/2025 04:42:08 PM --- Number of posts for page 1: 10
09/02/2025 04:42:08 PM --- Number of posts added on 2025-02-09: 0
10/02/2025 04:45:12 PM --- Done page: 1/1
10/02/2025 04:45:12 PM --- Number of posts for page 1: 10
10/02/2025 04:45:12 PM --- Number of posts added on 2025-02-10: 0
11/02/2025 04:47:49 PM --- Done page: 1/1
11/02/2025 04:47:49 PM --- Number of posts for page 1: 10
11/02/2025 04:47:49 PM --- Number of posts added on 2025-02-11: 0
12/02/2025 04:46:42 PM --- Done page: 1/1
12/02/2025 04:46:42 PM --- Number of posts for page 1: 10
12/02/2025 04:46:42 PM --- Number of posts added on 2025-02-12: 0
13/02/2025 04:47:10 PM --- Done page: 1/1
13/02/2025 04:47:10 PM --- Number of posts for page 1: 10
13/02/2025 04:47:10 PM --- Number of posts added on 2025-02-13: 0
14/02/2025 04:45:59 PM --- Done page: 1/1
14/02/2025 04:45:59 PM --- Number of posts for page 1: 10
14/02/2025 04:45:59 PM --- Number of posts added on 2025-02-14: 0
15/02/2025 04:44:31 PM --- Done page: 1/1
15/02/2025 04:44:31 PM --- Number of posts for page 1: 10
15/02/2025 04:44:31 PM --- Number of posts added on 2025-02-15: 0
16/02/2025 04:44:00 PM --- Done page: 1/1
16/02/2025 04:44:00 PM --- Number of posts for page 1: 10
16/02/2025 04:44:00 PM --- Number of posts added on 2025-02-16: 0
17/02/2025 04:45:19 PM --- Done page: 1/1
17/02/2025 04:45:19 PM --- Number of posts for page 1: 10
17/02/2025 04:45:19 PM --- Number of posts added on 2025-02-17: 0
18/02/2025 04:47:27 PM --- Done page: 1/1
18/02/2025 04:47:27 PM --- Number of posts for page 1: 10
18/02/2025 04:47:27 PM --- Number of posts added on 2025-02-18: 0
19/02/2025 04:46:17 PM --- Done post: Trần Lê Minh Trúc: Gieo dắt tâm tư về cà phê xuống biển để tạo làn sóng lớn lao hơn
19/02/2025 04:46:35 PM --- Done page: 1/1
19/02/2025 04:46:35 PM --- Number of posts for page 1: 10
19/02/2025 04:46:35 PM --- Number of posts added on 2025-02-19: 1
20/02/2025 04:47:51 PM --- Done page: 1/1
20/02/2025 04:47:51 PM --- Number of posts for page 1: 10
20/02/2025 04:47:51 PM --- Number of posts added on 2025-02-20: 0
21/02/2025 04:44:21 PM --- Done page: 1/1
21/02/2025 04:44:21 PM --- Number of posts for page 1: 10
21/02/2025 04:44:21 PM --- Number of posts added on 2025-02-21: 0
22/02/2025 04:43:16 PM --- Done page: 1/1
22/02/2025 04:43:16 PM --- Number of posts for page 1: 10
22/02/2025 04:43:16 PM --- Number of posts added on 2025-02-22: 0
23/02/2025 04:43:17 PM --- Done page: 1/1
23/02/2025 04:43:17 PM --- Number of posts for page 1: 10
23/02/2025 04:43:17 PM --- Number of posts added on 2025-02-23: 0
24/02/2025 04:48:22 PM --- Done page: 1/1
24/02/2025 04:48:22 PM --- Number of posts for page 1: 10
24/02/2025 04:48:22 PM --- Number of posts added on 2025-02-24: 0
25/02/2025 04:48:07 PM --- Done page: 1/1
25/02/2025 04:48:07 PM --- Number of posts for page 1: 10
25/02/2025 04:48:07 PM --- Number of posts added on 2025-02-25: 0
26/02/2025 04:48:14 PM --- Done page: 1/1
26/02/2025 04:48:14 PM --- Number of posts for page 1: 10
26/02/2025 04:48:14 PM --- Number of posts added on 2025-02-26: 0
27/02/2025 04:48:30 PM --- Done page: 1/1
27/02/2025 04:48:30 PM --- Number of posts for page 1: 10
27/02/2025 04:48:30 PM --- Number of posts added on 2025-02-27: 0
28/02/2025 04:46:49 PM --- Done page: 1/1
28/02/2025 04:46:49 PM --- Number of posts for page 1: 10
28/02/2025 04:46:49 PM --- Number of posts added on 2025-02-28: 0
01/03/2025 04:44:05 PM --- Done page: 1/1
01/03/2025 04:44:05 PM --- Number of posts for page 1: 10
01/03/2025 04:44:05 PM --- Number of posts added on 2025-03-01: 0
02/03/2025 04:44:16 PM --- Done page: 1/1
02/03/2025 04:44:16 PM --- Number of posts for page 1: 10
02/03/2025 04:44:16 PM --- Number of posts added on 2025-03-02: 0
03/03/2025 04:48:37 PM --- Done page: 1/1
03/03/2025 04:48:37 PM --- Number of posts for page 1: 10
03/03/2025 04:48:37 PM --- Number of posts added on 2025-03-03: 0
04/03/2025 04:48:41 PM --- Done page: 1/1
04/03/2025 04:48:41 PM --- Number of posts for page 1: 10
04/03/2025 04:48:41 PM --- Number of posts added on 2025-03-04: 0
05/03/2025 04:53:14 PM --- Done page: 1/1
05/03/2025 04:53:14 PM --- Number of posts for page 1: 10
05/03/2025 04:53:14 PM --- Number of posts added on 2025-03-05: 0
06/03/2025 04:48:11 PM --- Done page: 1/1
06/03/2025 04:48:11 PM --- Number of posts for page 1: 10
06/03/2025 04:48:11 PM --- Number of posts added on 2025-03-06: 0
07/03/2025 04:47:08 PM --- Done page: 1/1
07/03/2025 04:47:08 PM --- Number of posts for page 1: 10
07/03/2025 04:47:08 PM --- Number of posts added on 2025-03-07: 0
08/03/2025 04:41:00 PM --- Done page: 1/1
08/03/2025 04:41:00 PM --- Number of posts for page 1: 10
08/03/2025 04:41:00 PM --- Number of posts added on 2025-03-08: 0
09/03/2025 04:41:09 PM --- Done page: 1/1
09/03/2025 04:41:09 PM --- Number of posts for page 1: 10
09/03/2025 04:41:09 PM --- Number of posts added on 2025-03-09: 0
10/03/2025 04:48:32 PM --- Done page: 1/1
10/03/2025 04:48:32 PM --- Number of posts for page 1: 10
10/03/2025 04:48:32 PM --- Number of posts added on 2025-03-10: 0
11/03/2025 04:49:29 PM --- Done page: 1/1
11/03/2025 04:49:29 PM --- Number of posts for page 1: 10
11/03/2025 04:49:29 PM --- Number of posts added on 2025-03-11: 0
12/03/2025 04:49:38 PM --- Done page: 1/1
12/03/2025 04:49:38 PM --- Number of posts for page 1: 10
12/03/2025 04:49:38 PM --- Number of posts added on 2025-03-12: 0
13/03/2025 04:50:40 PM --- Done page: 1/1
13/03/2025 04:50:40 PM --- Number of posts for page 1: 10
13/03/2025 04:50:40 PM --- Number of posts added on 2025-03-13: 0
14/03/2025 04:47:06 PM --- Done page: 1/1
14/03/2025 04:47:06 PM --- Number of posts for page 1: 10
14/03/2025 04:47:06 PM --- Number of posts added on 2025-03-14: 0
15/03/2025 04:44:47 PM --- Done page: 1/1
15/03/2025 04:44:47 PM --- Number of posts for page 1: 10
15/03/2025 04:44:47 PM --- Number of posts added on 2025-03-15: 0
16/03/2025 04:46:17 PM --- Done page: 1/1
16/03/2025 04:46:17 PM --- Number of posts for page 1: 10
16/03/2025 04:46:17 PM --- Number of posts added on 2025-03-16: 0
17/03/2025 04:49:18 PM --- Done page: 1/1
17/03/2025 04:49:18 PM --- Number of posts for page 1: 10
17/03/2025 04:49:18 PM --- Number of posts added on 2025-03-17: 0
18/03/2025 04:49:14 PM --- Done page: 1/1
18/03/2025 04:49:14 PM --- Number of posts for page 1: 10
18/03/2025 04:49:14 PM --- Number of posts added on 2025-03-18: 0
19/03/2025 04:49:07 PM --- Done page: 1/1
19/03/2025 04:49:07 PM --- Number of posts for page 1: 10
19/03/2025 04:49:07 PM --- Number of posts added on 2025-03-19: 0
20/03/2025 04:49:23 PM --- Done page: 1/1
20/03/2025 04:49:23 PM --- Number of posts for page 1: 10
20/03/2025 04:49:23 PM --- Number of posts added on 2025-03-20: 0
21/03/2025 04:49:07 PM --- Done page: 1/1
21/03/2025 04:49:07 PM --- Number of posts for page 1: 10
21/03/2025 04:49:07 PM --- Number of posts added on 2025-03-21: 0
22/03/2025 04:44:24 PM --- Done page: 1/1
22/03/2025 04:44:24 PM --- Number of posts for page 1: 10
22/03/2025 04:44:24 PM --- Number of posts added on 2025-03-22: 0
23/03/2025 04:45:26 PM --- Done page: 1/1
23/03/2025 04:45:26 PM --- Number of posts for page 1: 10
23/03/2025 04:45:26 PM --- Number of posts added on 2025-03-23: 0
25/03/2025 02:44:57 PM --- Done page: 1/1
25/03/2025 02:44:57 PM --- Number of posts for page 1: 10
25/03/2025 02:44:57 PM --- Number of posts added on 2025-03-25: 0
25/03/2025 04:48:36 PM --- Done page: 1/1
25/03/2025 04:48:36 PM --- Number of posts for page 1: 10
25/03/2025 04:48:36 PM --- Number of posts added on 2025-03-25: 0
26/03/2025 04:50:21 PM --- Done page: 1/1
26/03/2025 04:50:21 PM --- Number of posts for page 1: 10
26/03/2025 04:50:21 PM --- Number of posts added on 2025-03-26: 0
27/03/2025 04:50:08 PM --- Done page: 1/1
27/03/2025 04:50:08 PM --- Number of posts for page 1: 10
27/03/2025 04:50:08 PM --- Number of posts added on 2025-03-27: 0
28/03/2025 04:48:04 PM --- Done page: 1/1
28/03/2025 04:48:04 PM --- Number of posts for page 1: 10
28/03/2025 04:48:04 PM --- Number of posts added on 2025-03-28: 0
29/03/2025 04:46:47 PM --- Done page: 1/1
29/03/2025 04:46:47 PM --- Number of posts for page 1: 10
29/03/2025 04:46:47 PM --- Number of posts added on 2025-03-29: 0
30/03/2025 04:46:34 PM --- Done page: 1/1
30/03/2025 04:46:34 PM --- Number of posts for page 1: 10
30/03/2025 04:46:34 PM --- Number of posts added on 2025-03-30: 0
31/03/2025 04:50:31 PM --- Done page: 1/1
31/03/2025 04:50:31 PM --- Number of posts for page 1: 10
31/03/2025 04:50:31 PM --- Number of posts added on 2025-03-31: 0
01/04/2025 04:50:12 PM --- Done page: 1/1
01/04/2025 04:50:12 PM --- Number of posts for page 1: 10
01/04/2025 04:50:12 PM --- Number of posts added on 2025-04-01: 0
02/04/2025 04:50:59 PM --- Done page: 1/1
02/04/2025 04:50:59 PM --- Number of posts for page 1: 10
02/04/2025 04:50:59 PM --- Number of posts added on 2025-04-02: 0
03/04/2025 04:49:29 PM --- Done page: 1/1
03/04/2025 04:49:29 PM --- Number of posts for page 1: 10
03/04/2025 04:49:29 PM --- Number of posts added on 2025-04-03: 0
04/04/2025 04:48:23 PM --- Done page: 1/1
04/04/2025 04:48:23 PM --- Number of posts for page 1: 10
04/04/2025 04:48:23 PM --- Number of posts added on 2025-04-04: 0
05/04/2025 04:46:13 PM --- Done page: 1/1
05/04/2025 04:46:13 PM --- Number of posts for page 1: 10
05/04/2025 04:46:13 PM --- Number of posts added on 2025-04-05: 0
06/04/2025 04:46:13 PM --- Done page: 1/1
06/04/2025 04:46:13 PM --- Number of posts for page 1: 10
06/04/2025 04:46:13 PM --- Number of posts added on 2025-04-06: 0
07/04/2025 04:49:09 PM --- Done page: 1/1
07/04/2025 04:49:09 PM --- Number of posts for page 1: 10
07/04/2025 04:49:09 PM --- Number of posts added on 2025-04-07: 0
08/04/2025 04:50:26 PM --- Done page: 1/1
08/04/2025 04:50:26 PM --- Number of posts for page 1: 10
08/04/2025 04:50:26 PM --- Number of posts added on 2025-04-08: 0
09/04/2025 04:52:15 PM --- Done page: 1/1
09/04/2025 04:52:15 PM --- Number of posts for page 1: 10
09/04/2025 04:52:15 PM --- Number of posts added on 2025-04-09: 0
10/04/2025 04:50:38 PM --- Done page: 1/1
10/04/2025 04:50:38 PM --- Number of posts for page 1: 10
10/04/2025 04:50:38 PM --- Number of posts added on 2025-04-10: 0
11/04/2025 04:49:05 PM --- Done page: 1/1
11/04/2025 04:49:05 PM --- Number of posts for page 1: 10
11/04/2025 04:49:05 PM --- Number of posts added on 2025-04-11: 0
12/04/2025 04:45:19 PM --- Done page: 1/1
12/04/2025 04:45:19 PM --- Number of posts for page 1: 10
12/04/2025 04:45:19 PM --- Number of posts added on 2025-04-12: 0
13/04/2025 04:47:26 PM --- Done page: 1/1
13/04/2025 04:47:26 PM --- Number of posts for page 1: 10
13/04/2025 04:47:26 PM --- Number of posts added on 2025-04-13: 0
14/04/2025 04:50:24 PM --- Done page: 1/1
14/04/2025 04:50:24 PM --- Number of posts for page 1: 10
14/04/2025 04:50:24 PM --- Number of posts added on 2025-04-14: 0
15/04/2025 04:48:57 PM --- Done page: 1/1
15/04/2025 04:48:57 PM --- Number of posts for page 1: 10
15/04/2025 04:48:57 PM --- Number of posts added on 2025-04-15: 0
16/04/2025 04:51:41 PM --- Done page: 1/1
16/04/2025 04:51:41 PM --- Number of posts for page 1: 10
16/04/2025 04:51:41 PM --- Number of posts added on 2025-04-16: 0
17/04/2025 04:50:17 PM --- Done page: 1/1
17/04/2025 04:50:17 PM --- Number of posts for page 1: 10
17/04/2025 04:50:17 PM --- Number of posts added on 2025-04-17: 0
18/04/2025 04:46:31 PM --- Done page: 1/1
18/04/2025 04:46:31 PM --- Number of posts for page 1: 10
18/04/2025 04:46:31 PM --- Number of posts added on 2025-04-18: 0
19/04/2025 04:46:09 PM --- Done page: 1/1
19/04/2025 04:46:09 PM --- Number of posts for page 1: 10
19/04/2025 04:46:09 PM --- Number of posts added on 2025-04-19: 0
20/04/2025 04:46:46 PM --- Done page: 1/1
20/04/2025 04:46:46 PM --- Number of posts for page 1: 10
20/04/2025 04:46:46 PM --- Number of posts added on 2025-04-20: 0
21/04/2025 04:49:53 PM --- Done page: 1/1
21/04/2025 04:49:53 PM --- Number of posts for page 1: 10
21/04/2025 04:49:53 PM --- Number of posts added on 2025-04-21: 0
22/04/2025 04:49:37 PM --- Done page: 1/1
22/04/2025 04:49:37 PM --- Number of posts for page 1: 10
22/04/2025 04:49:37 PM --- Number of posts added on 2025-04-22: 0
23/04/2025 04:52:12 PM --- Done page: 1/1
23/04/2025 04:52:12 PM --- Number of posts for page 1: 10
23/04/2025 04:52:12 PM --- Number of posts added on 2025-04-23: 0
24/04/2025 04:50:56 PM --- Done page: 1/1
24/04/2025 04:50:56 PM --- Number of posts for page 1: 10
24/04/2025 04:50:56 PM --- Number of posts added on 2025-04-24: 0
25/04/2025 04:50:31 PM --- Done page: 1/1
25/04/2025 04:50:31 PM --- Number of posts for page 1: 10
25/04/2025 04:50:31 PM --- Number of posts added on 2025-04-25: 0
26/04/2025 04:45:50 PM --- Done page: 1/1
26/04/2025 04:45:50 PM --- Number of posts for page 1: 10
26/04/2025 04:45:50 PM --- Number of posts added on 2025-04-26: 0
27/04/2025 04:47:16 PM --- Done page: 1/1
27/04/2025 04:47:16 PM --- Number of posts for page 1: 10
27/04/2025 04:47:16 PM --- Number of posts added on 2025-04-27: 0
28/04/2025 04:48:46 PM --- Done page: 1/1
28/04/2025 04:48:46 PM --- Number of posts for page 1: 10
28/04/2025 04:48:46 PM --- Number of posts added on 2025-04-28: 0
29/04/2025 04:49:41 PM --- Done page: 1/1
29/04/2025 04:49:41 PM --- Number of posts for page 1: 10
29/04/2025 04:49:41 PM --- Number of posts added on 2025-04-29: 0
30/04/2025 04:50:44 PM --- Done page: 1/1
30/04/2025 04:50:44 PM --- Number of posts for page 1: 10
30/04/2025 04:50:44 PM --- Number of posts added on 2025-04-30: 0
01/05/2025 04:49:23 PM --- Done page: 1/1
01/05/2025 04:49:23 PM --- Number of posts for page 1: 10
01/05/2025 04:49:23 PM --- Number of posts added on 2025-05-01: 0
02/05/2025 04:49:32 PM --- Done page: 1/1
02/05/2025 04:49:32 PM --- Number of posts for page 1: 10
02/05/2025 04:49:32 PM --- Number of posts added on 2025-05-02: 0
03/05/2025 04:47:04 PM --- Done page: 1/1
03/05/2025 04:47:04 PM --- Number of posts for page 1: 10
03/05/2025 04:47:04 PM --- Number of posts added on 2025-05-03: 0
04/05/2025 04:46:45 PM --- Done page: 1/1
04/05/2025 04:46:45 PM --- Number of posts for page 1: 10
04/05/2025 04:46:45 PM --- Number of posts added on 2025-05-04: 0
05/05/2025 04:50:41 PM --- Done page: 1/1
05/05/2025 04:50:41 PM --- Number of posts for page 1: 10
05/05/2025 04:50:41 PM --- Number of posts added on 2025-05-05: 0
06/05/2025 04:49:28 PM --- Done post: Mừng sinh nhật một tuổi FRONT ROW: Điểm đến TMĐT đang được lòng giới trẻ Việt Nam
06/05/2025 04:49:44 PM --- Done page: 1/1
06/05/2025 04:49:44 PM --- Number of posts for page 1: 10
06/05/2025 04:49:44 PM --- Number of posts added on 2025-05-06: 1
07/05/2025 04:52:51 PM --- Done page: 1/1
07/05/2025 04:52:51 PM --- Number of posts for page 1: 10
07/05/2025 04:52:51 PM --- Number of posts added on 2025-05-07: 0
08/05/2025 04:52:11 PM --- Done page: 1/1
08/05/2025 04:52:11 PM --- Number of posts for page 1: 10
08/05/2025 04:52:11 PM --- Number of posts added on 2025-05-08: 0
09/05/2025 04:48:15 PM --- Done page: 1/1
09/05/2025 04:48:15 PM --- Number of posts for page 1: 10
09/05/2025 04:48:15 PM --- Number of posts added on 2025-05-09: 0
10/05/2025 04:48:45 PM --- Done page: 1/1
10/05/2025 04:48:45 PM --- Number of posts for page 1: 10
10/05/2025 04:48:45 PM --- Number of posts added on 2025-05-10: 0
11/05/2025 04:46:58 PM --- Done page: 1/1
11/05/2025 04:46:58 PM --- Number of posts for page 1: 10
11/05/2025 04:46:58 PM --- Number of posts added on 2025-05-11: 0
12/05/2025 04:52:23 PM --- Done page: 1/1
12/05/2025 04:52:23 PM --- Number of posts for page 1: 10
12/05/2025 04:52:23 PM --- Number of posts added on 2025-05-12: 0
13/05/2025 04:51:43 PM --- Done page: 1/1
13/05/2025 04:51:43 PM --- Number of posts for page 1: 10
13/05/2025 04:51:43 PM --- Number of posts added on 2025-05-13: 0
14/05/2025 04:51:00 PM --- Done page: 1/1
14/05/2025 04:51:00 PM --- Number of posts for page 1: 10
14/05/2025 04:51:00 PM --- Number of posts added on 2025-05-14: 0
15/05/2025 04:51:34 PM --- Done page: 1/1
15/05/2025 04:51:34 PM --- Number of posts for page 1: 10
15/05/2025 04:51:34 PM --- Number of posts added on 2025-05-15: 0
16/05/2025 04:51:03 PM --- Done page: 1/1
16/05/2025 04:51:03 PM --- Number of posts for page 1: 10
16/05/2025 04:51:03 PM --- Number of posts added on 2025-05-16: 0
17/05/2025 04:49:13 PM --- Done page: 1/1
17/05/2025 04:49:13 PM --- Number of posts for page 1: 10
17/05/2025 04:49:13 PM --- Number of posts added on 2025-05-17: 0
18/05/2025 04:46:53 PM --- Done page: 1/1
18/05/2025 04:46:53 PM --- Number of posts for page 1: 10
18/05/2025 04:46:53 PM --- Number of posts added on 2025-05-18: 0
19/05/2025 04:51:06 PM --- Done page: 1/1
19/05/2025 04:51:06 PM --- Number of posts for page 1: 10
19/05/2025 04:51:06 PM --- Number of posts added on 2025-05-19: 0
20/05/2025 04:51:25 PM --- Done page: 1/1
20/05/2025 04:51:25 PM --- Number of posts for page 1: 10
20/05/2025 04:51:25 PM --- Number of posts added on 2025-05-20: 0
21/05/2025 04:52:09 PM --- Done page: 1/1
21/05/2025 04:52:09 PM --- Number of posts for page 1: 10
21/05/2025 04:52:09 PM --- Number of posts added on 2025-05-21: 0
22/05/2025 04:51:16 PM --- Done page: 1/1
22/05/2025 04:51:16 PM --- Number of posts for page 1: 10
22/05/2025 04:51:16 PM --- Number of posts added on 2025-05-22: 0
23/05/2025 04:49:43 PM --- Done page: 1/1
23/05/2025 04:49:43 PM --- Number of posts for page 1: 10
23/05/2025 04:49:43 PM --- Number of posts added on 2025-05-23: 0
24/05/2025 04:47:19 PM --- Done page: 1/1
24/05/2025 04:47:19 PM --- Number of posts for page 1: 10
24/05/2025 04:47:19 PM --- Number of posts added on 2025-05-24: 0
25/05/2025 04:48:30 PM --- Done page: 1/1
25/05/2025 04:48:30 PM --- Number of posts for page 1: 10
25/05/2025 04:48:30 PM --- Number of posts added on 2025-05-25: 0
26/05/2025 04:50:19 PM --- Done page: 1/1
26/05/2025 04:50:19 PM --- Number of posts for page 1: 10
26/05/2025 04:50:19 PM --- Number of posts added on 2025-05-26: 0
27/05/2025 04:51:37 PM --- Done page: 1/1
27/05/2025 04:51:37 PM --- Number of posts for page 1: 10
27/05/2025 04:51:37 PM --- Number of posts added on 2025-05-27: 0
28/05/2025 04:51:25 PM --- Done page: 1/1
28/05/2025 04:51:25 PM --- Number of posts for page 1: 10
28/05/2025 04:51:25 PM --- Number of posts added on 2025-05-28: 0
29/05/2025 04:52:23 PM --- Done page: 1/1
29/05/2025 04:52:23 PM --- Number of posts for page 1: 10
29/05/2025 04:52:23 PM --- Number of posts added on 2025-05-29: 0
31/05/2025 03:12:58 AM --- Done page: 1/1
31/05/2025 03:12:58 AM --- Number of posts for page 1: 10
31/05/2025 03:12:58 AM --- Number of posts added on 2025-05-31: 0
31/05/2025 04:49:46 PM --- Done page: 1/1
31/05/2025 04:49:46 PM --- Number of posts for page 1: 10
31/05/2025 04:49:46 PM --- Number of posts added on 2025-05-31: 0
01/06/2025 04:49:23 PM --- Done page: 1/1
01/06/2025 04:49:23 PM --- Number of posts for page 1: 10
01/06/2025 04:49:23 PM --- Number of posts added on 2025-06-01: 0
02/06/2025 04:53:56 PM --- Done page: 1/1
02/06/2025 04:53:56 PM --- Number of posts for page 1: 10
02/06/2025 04:53:56 PM --- Number of posts added on 2025-06-02: 0
03/06/2025 04:54:15 PM --- Done page: 1/1
03/06/2025 04:54:15 PM --- Number of posts for page 1: 10
03/06/2025 04:54:15 PM --- Number of posts added on 2025-06-03: 0
04/06/2025 04:49:45 PM --- Done page: 1/1
04/06/2025 04:49:45 PM --- Number of posts for page 1: 10
04/06/2025 04:49:45 PM --- Number of posts added on 2025-06-04: 0
05/06/2025 04:50:18 PM --- Done page: 1/1
05/06/2025 04:50:18 PM --- Number of posts for page 1: 10
05/06/2025 04:50:18 PM --- Number of posts added on 2025-06-05: 0
06/06/2025 04:52:18 PM --- Done page: 1/1
06/06/2025 04:52:18 PM --- Number of posts for page 1: 10
06/06/2025 04:52:18 PM --- Number of posts added on 2025-06-06: 0
07/06/2025 04:50:58 PM --- Done page: 1/1
07/06/2025 04:50:58 PM --- Number of posts for page 1: 10
07/06/2025 04:50:58 PM --- Number of posts added on 2025-06-07: 0
08/06/2025 04:48:08 PM --- Done page: 1/1
08/06/2025 04:48:08 PM --- Number of posts for page 1: 10
08/06/2025 04:48:08 PM --- Number of posts added on 2025-06-08: 0
09/06/2025 04:53:36 PM --- Done page: 1/1
09/06/2025 04:53:36 PM --- Number of posts for page 1: 10
09/06/2025 04:53:36 PM --- Number of posts added on 2025-06-09: 0
10/06/2025 04:52:31 PM --- Done page: 1/1
10/06/2025 04:52:31 PM --- Number of posts for page 1: 10
10/06/2025 04:52:31 PM --- Number of posts added on 2025-06-10: 0
11/06/2025 04:53:00 PM --- Done page: 1/1
11/06/2025 04:53:00 PM --- Number of posts for page 1: 10
11/06/2025 04:53:00 PM --- Number of posts added on 2025-06-11: 0
12/06/2025 04:52:43 PM --- Done page: 1/1
12/06/2025 04:52:43 PM --- Number of posts for page 1: 10
12/06/2025 04:52:43 PM --- Number of posts added on 2025-06-12: 0
13/06/2025 04:51:55 PM --- Done page: 1/1
13/06/2025 04:51:55 PM --- Number of posts for page 1: 10
13/06/2025 04:51:55 PM --- Number of posts added on 2025-06-13: 0
14/06/2025 04:47:43 PM --- Done page: 1/1
14/06/2025 04:47:43 PM --- Number of posts for page 1: 10
14/06/2025 04:47:43 PM --- Number of posts added on 2025-06-14: 0
15/06/2025 04:50:13 PM --- Done page: 1/1
15/06/2025 04:50:13 PM --- Number of posts for page 1: 10
15/06/2025 04:50:13 PM --- Number of posts added on 2025-06-15: 0
16/06/2025 04:53:01 PM --- Done page: 1/1
16/06/2025 04:53:01 PM --- Number of posts for page 1: 10
16/06/2025 04:53:01 PM --- Number of posts added on 2025-06-16: 0
17/06/2025 04:53:46 PM --- Done page: 1/1
17/06/2025 04:53:46 PM --- Number of posts for page 1: 10
17/06/2025 04:53:46 PM --- Number of posts added on 2025-06-17: 0
18/06/2025 04:53:59 PM --- Done page: 1/1
18/06/2025 04:53:59 PM --- Number of posts for page 1: 10
18/06/2025 04:53:59 PM --- Number of posts added on 2025-06-18: 0
19/06/2025 04:51:36 PM --- Done page: 1/1
19/06/2025 04:51:36 PM --- Number of posts for page 1: 10
19/06/2025 04:51:36 PM --- Number of posts added on 2025-06-19: 0
20/06/2025 04:52:13 PM --- Done page: 1/1
20/06/2025 04:52:13 PM --- Number of posts for page 1: 10
20/06/2025 04:52:13 PM --- Number of posts added on 2025-06-20: 0
21/06/2025 04:50:47 PM --- Done page: 1/1
21/06/2025 04:50:47 PM --- Number of posts for page 1: 10
21/06/2025 04:50:47 PM --- Number of posts added on 2025-06-21: 0
22/06/2025 04:49:46 PM --- Done page: 1/1
22/06/2025 04:49:46 PM --- Number of posts for page 1: 10
22/06/2025 04:49:46 PM --- Number of posts added on 2025-06-22: 0
23/06/2025 04:53:24 PM --- Done page: 1/1
23/06/2025 04:53:24 PM --- Number of posts for page 1: 10
23/06/2025 04:53:24 PM --- Number of posts added on 2025-06-23: 0
24/06/2025 04:53:25 PM --- Done page: 1/1
24/06/2025 04:53:25 PM --- Number of posts for page 1: 10
24/06/2025 04:53:25 PM --- Number of posts added on 2025-06-24: 0
25/06/2025 04:53:43 PM --- Done page: 1/1
25/06/2025 04:53:43 PM --- Number of posts for page 1: 10
25/06/2025 04:53:43 PM --- Number of posts added on 2025-06-25: 0
26/06/2025 04:52:19 PM --- Done page: 1/1
26/06/2025 04:52:19 PM --- Number of posts for page 1: 10
26/06/2025 04:52:19 PM --- Number of posts added on 2025-06-26: 0
27/06/2025 04:50:17 PM --- Done page: 1/1
27/06/2025 04:50:17 PM --- Number of posts for page 1: 10
27/06/2025 04:50:17 PM --- Number of posts added on 2025-06-27: 0
28/06/2025 04:49:48 PM --- Done page: 1/1
28/06/2025 04:49:48 PM --- Number of posts for page 1: 10
28/06/2025 04:49:48 PM --- Number of posts added on 2025-06-28: 0
29/06/2025 04:50:07 PM --- Done page: 1/1
29/06/2025 04:50:07 PM --- Number of posts for page 1: 10
29/06/2025 04:50:07 PM --- Number of posts added on 2025-06-29: 0
30/06/2025 04:52:51 PM --- Done page: 1/1
30/06/2025 04:52:51 PM --- Number of posts for page 1: 10
30/06/2025 04:52:51 PM --- Number of posts added on 2025-06-30: 0
01/07/2025 04:53:59 PM --- Done page: 1/1
01/07/2025 04:53:59 PM --- Number of posts for page 1: 10
01/07/2025 04:53:59 PM --- Number of posts added on 2025-07-01: 0
02/07/2025 04:53:14 PM --- Done page: 1/1
02/07/2025 04:53:14 PM --- Number of posts for page 1: 10
02/07/2025 04:53:14 PM --- Number of posts added on 2025-07-02: 0
03/07/2025 04:53:27 PM --- Done page: 1/1
03/07/2025 04:53:27 PM --- Number of posts for page 1: 10
03/07/2025 04:53:27 PM --- Number of posts added on 2025-07-03: 0
04/07/2025 04:51:40 PM --- Done page: 1/1
04/07/2025 04:51:40 PM --- Number of posts for page 1: 10
04/07/2025 04:51:40 PM --- Number of posts added on 2025-07-04: 0
05/07/2025 04:49:17 PM --- Done page: 1/1
05/07/2025 04:49:17 PM --- Number of posts for page 1: 10
05/07/2025 04:49:17 PM --- Number of posts added on 2025-07-05: 0
06/07/2025 04:50:33 PM --- Done page: 1/1
06/07/2025 04:50:33 PM --- Number of posts for page 1: 10
06/07/2025 04:50:33 PM --- Number of posts added on 2025-07-06: 0
07/07/2025 04:52:57 PM --- Done page: 1/1
07/07/2025 04:52:57 PM --- Number of posts for page 1: 10
07/07/2025 04:52:57 PM --- Number of posts added on 2025-07-07: 0
08/07/2025 04:53:01 PM --- Done page: 1/1
08/07/2025 04:53:01 PM --- Number of posts for page 1: 10
08/07/2025 04:53:01 PM --- Number of posts added on 2025-07-08: 0
09/07/2025 04:54:15 PM --- Done page: 1/1
09/07/2025 04:54:15 PM --- Number of posts for page 1: 10
09/07/2025 04:54:15 PM --- Number of posts added on 2025-07-09: 0
10/07/2025 04:55:00 PM --- Done page: 1/1
10/07/2025 04:55:00 PM --- Number of posts for page 1: 10
10/07/2025 04:55:00 PM --- Number of posts added on 2025-07-10: 0
11/07/2025 04:53:19 PM --- Done page: 1/1
11/07/2025 04:53:19 PM --- Number of posts for page 1: 10
11/07/2025 04:53:19 PM --- Number of posts added on 2025-07-11: 0
12/07/2025 04:49:54 PM --- Done page: 1/1
12/07/2025 04:49:54 PM --- Number of posts for page 1: 10
12/07/2025 04:49:54 PM --- Number of posts added on 2025-07-12: 0
13/07/2025 04:49:49 PM --- Done page: 1/1
13/07/2025 04:49:49 PM --- Number of posts for page 1: 10
13/07/2025 04:49:49 PM --- Number of posts added on 2025-07-13: 0
14/07/2025 04:54:24 PM --- Done page: 1/1
14/07/2025 04:54:24 PM --- Number of posts for page 1: 10
14/07/2025 04:54:24 PM --- Number of posts added on 2025-07-14: 0
15/07/2025 04:54:33 PM --- Done page: 1/1
15/07/2025 04:54:33 PM --- Number of posts for page 1: 10
15/07/2025 04:54:33 PM --- Number of posts added on 2025-07-15: 0
16/07/2025 04:55:19 PM --- Done page: 1/1
16/07/2025 04:55:19 PM --- Number of posts for page 1: 10
16/07/2025 04:55:19 PM --- Number of posts added on 2025-07-16: 0
17/07/2025 04:54:00 PM --- Done page: 1/1
17/07/2025 04:54:00 PM --- Number of posts for page 1: 10
17/07/2025 04:54:00 PM --- Number of posts added on 2025-07-17: 0
18/07/2025 04:56:28 PM --- Done page: 1/1
18/07/2025 04:56:28 PM --- Number of posts for page 1: 10
18/07/2025 04:56:28 PM --- Number of posts added on 2025-07-18: 0
19/07/2025 04:51:57 PM --- Done page: 1/1
19/07/2025 04:51:57 PM --- Number of posts for page 1: 10
19/07/2025 04:51:57 PM --- Number of posts added on 2025-07-19: 0
20/07/2025 04:51:07 PM --- Done page: 1/1
20/07/2025 04:51:07 PM --- Number of posts for page 1: 10
20/07/2025 04:51:07 PM --- Number of posts added on 2025-07-20: 0
21/07/2025 04:55:32 PM --- Done page: 1/1
21/07/2025 04:55:32 PM --- Number of posts for page 1: 10
21/07/2025 04:55:32 PM --- Number of posts added on 2025-07-21: 0
22/07/2025 04:55:35 PM --- Done page: 1/1
22/07/2025 04:55:35 PM --- Number of posts for page 1: 10
22/07/2025 04:55:35 PM --- Number of posts added on 2025-07-22: 0
23/07/2025 04:56:59 PM --- Done page: 1/1
23/07/2025 04:56:59 PM --- Number of posts for page 1: 10
23/07/2025 04:56:59 PM --- Number of posts added on 2025-07-23: 0
24/07/2025 04:54:15 PM --- Done page: 1/1
24/07/2025 04:54:15 PM --- Number of posts for page 1: 10
24/07/2025 04:54:15 PM --- Number of posts added on 2025-07-24: 0
25/07/2025 04:54:23 PM --- Done page: 1/1
25/07/2025 04:54:23 PM --- Number of posts for page 1: 10
25/07/2025 04:54:23 PM --- Number of posts added on 2025-07-25: 0
26/07/2025 04:51:58 PM --- Done page: 1/1
26/07/2025 04:51:58 PM --- Number of posts for page 1: 10
26/07/2025 04:51:58 PM --- Number of posts added on 2025-07-26: 0
27/07/2025 04:51:47 PM --- Done page: 1/1
27/07/2025 04:51:47 PM --- Number of posts for page 1: 10
27/07/2025 04:51:47 PM --- Number of posts added on 2025-07-27: 0
28/07/2025 04:57:38 PM --- Done page: 1/1
28/07/2025 04:57:38 PM --- Number of posts for page 1: 10
28/07/2025 04:57:38 PM --- Number of posts added on 2025-07-28: 0
29/07/2025 04:56:53 PM --- Done page: 1/1
29/07/2025 04:56:53 PM --- Number of posts for page 1: 10
29/07/2025 04:56:53 PM --- Number of posts added on 2025-07-29: 0
30/07/2025 04:55:27 PM --- Done page: 1/1
30/07/2025 04:55:27 PM --- Number of posts for page 1: 10
30/07/2025 04:55:27 PM --- Number of posts added on 2025-07-30: 0
31/07/2025 04:56:21 PM --- Done page: 1/1
31/07/2025 04:56:21 PM --- Number of posts for page 1: 10
31/07/2025 04:56:21 PM --- Number of posts added on 2025-07-31: 0
01/08/2025 04:56:12 PM --- Done page: 1/1
01/08/2025 04:56:12 PM --- Number of posts for page 1: 10
01/08/2025 04:56:12 PM --- Number of posts added on 2025-08-01: 0
02/08/2025 04:52:51 PM --- Done page: 1/1
02/08/2025 04:52:51 PM --- Number of posts for page 1: 10
02/08/2025 04:52:51 PM --- Number of posts added on 2025-08-02: 0
03/08/2025 04:53:03 PM --- Done page: 1/1
03/08/2025 04:53:03 PM --- Number of posts for page 1: 10
03/08/2025 04:53:03 PM --- Number of posts added on 2025-08-03: 0
04/08/2025 04:58:38 PM --- Done page: 1/1
04/08/2025 04:58:38 PM --- Number of posts for page 1: 10
04/08/2025 04:58:38 PM --- Number of posts added on 2025-08-04: 0
05/08/2025 04:50:39 PM --- Done page: 1/1
05/08/2025 04:50:39 PM --- Number of posts for page 1: 10
05/08/2025 04:50:39 PM --- Number of posts added on 2025-08-05: 0
06/08/2025 04:57:17 PM --- Done page: 1/1
06/08/2025 04:57:17 PM --- Number of posts for page 1: 10
06/08/2025 04:57:17 PM --- Number of posts added on 2025-08-06: 0
08/08/2025 04:50:23 PM --- Done page: 1/1
08/08/2025 04:50:23 PM --- Number of posts for page 1: 10
08/08/2025 04:50:23 PM --- Number of posts added on 2025-08-08: 0
09/08/2025 04:50:47 PM --- Done page: 1/1
09/08/2025 04:50:47 PM --- Number of posts for page 1: 10
09/08/2025 04:50:47 PM --- Number of posts added on 2025-08-09: 0
10/08/2025 04:50:55 PM --- Done page: 1/1
10/08/2025 04:50:55 PM --- Number of posts for page 1: 10
10/08/2025 04:50:55 PM --- Number of posts added on 2025-08-10: 0
11/08/2025 04:55:00 PM --- Done page: 1/1
11/08/2025 04:55:00 PM --- Number of posts for page 1: 10
11/08/2025 04:55:00 PM --- Number of posts added on 2025-08-11: 0
12/08/2025 04:53:33 PM --- Done page: 1/1
12/08/2025 04:53:33 PM --- Number of posts for page 1: 10
12/08/2025 04:53:33 PM --- Number of posts added on 2025-08-12: 0
13/08/2025 04:48:31 PM --- Done page: 1/1
13/08/2025 04:48:31 PM --- Number of posts for page 1: 10
13/08/2025 04:48:31 PM --- Number of posts added on 2025-08-13: 0
14/08/2025 04:51:47 PM --- Done page: 1/1
14/08/2025 04:51:47 PM --- Number of posts for page 1: 10
14/08/2025 04:51:47 PM --- Number of posts added on 2025-08-14: 0
15/08/2025 04:51:45 PM --- Done page: 1/1
15/08/2025 04:51:45 PM --- Number of posts for page 1: 10
15/08/2025 04:51:45 PM --- Number of posts added on 2025-08-15: 0
16/08/2025 04:48:19 PM --- Done page: 1/1
16/08/2025 04:48:19 PM --- Number of posts for page 1: 10
16/08/2025 04:48:19 PM --- Number of posts added on 2025-08-16: 0
17/08/2025 04:49:29 PM --- Done page: 1/1
17/08/2025 04:49:29 PM --- Number of posts for page 1: 10
17/08/2025 04:49:29 PM --- Number of posts added on 2025-08-17: 0
18/08/2025 04:54:03 PM --- Done page: 1/1
18/08/2025 04:54:03 PM --- Number of posts for page 1: 10
18/08/2025 04:54:03 PM --- Number of posts added on 2025-08-18: 0
19/08/2025 04:50:11 PM --- Done page: 1/1
19/08/2025 04:50:11 PM --- Number of posts for page 1: 10
19/08/2025 04:50:11 PM --- Number of posts added on 2025-08-19: 0
20/08/2025 04:49:46 PM --- Done page: 1/1
20/08/2025 04:49:46 PM --- Number of posts for page 1: 10
20/08/2025 04:49:46 PM --- Number of posts added on 2025-08-20: 0
21/08/2025 04:55:31 PM --- Done page: 1/1
21/08/2025 04:55:31 PM --- Number of posts for page 1: 10
21/08/2025 04:55:31 PM --- Number of posts added on 2025-08-21: 0
22/08/2025 04:49:09 PM --- Done page: 1/1
22/08/2025 04:49:09 PM --- Number of posts for page 1: 10
22/08/2025 04:49:09 PM --- Number of posts added on 2025-08-22: 0
23/08/2025 04:45:26 PM --- Done page: 1/1
23/08/2025 04:45:26 PM --- Number of posts for page 1: 10
23/08/2025 04:45:26 PM --- Number of posts added on 2025-08-23: 0
24/08/2025 12:50:33 AM --- Done post: Vietcetera Open Nhật Bản: Người Việt xây dựng thương hiệu quốc gia bằng chính câu chuyện của mình
24/08/2025 12:50:33 AM --- Done post: Môi trường giáo dục đa văn hóa và nhân văn tại Trường Quốc tế Mỹ TAS
24/08/2025 12:50:33 AM --- Done post: Đầu tư dài hạn của bố mẹ, là để con được lớn lên đúng cách
24/08/2025 12:50:34 AM --- Done post: 1/7/2025 –  Những tên mới, trong một tình yêu chưa bao giờ cũ...
24/08/2025 12:50:34 AM --- Done post: Từ khi nào quyền riêng tư chính trị và đời sống cá nhân đều mong manh như nhau?
24/08/2025 12:50:35 AM --- Done post: 5 Điều thú vị xung quanh ngày "giỗ tổ" nghề báo 21/6
24/08/2025 12:50:35 AM --- Done post: Thế giới cá tính nhiếp ảnh tại i/IDENTITY by Fujifilm - We Are What We Shoot có gì đặc biệt?
24/08/2025 12:50:36 AM --- Done post: Khi nghệ thuật không đứng yên: 50 năm văn học nghệ thuật TP.HCM và câu chuyện mang tên “Tỏa”
24/08/2025 12:50:36 AM --- Done post: Vietcetera Open: Một hành trình mới cho người Việt toàn cầu
24/08/2025 12:50:37 AM --- Done post: Đằng sau những lời than thở về “năm số 9”
24/08/2025 12:50:37 AM --- Done page: 1/10
24/08/2025 12:50:37 AM --- Number of posts for page 1: 10
24/08/2025 12:50:37 AM --- Number of posts added on 2025-08-24: 10
24/08/2025 12:50:37 AM --- Done post: Diệt sâu bọ, ăn cơm rượu và một ngày hè để thương lấy chính mình
24/08/2025 12:50:41 AM --- Done page: 2/10
24/08/2025 12:50:41 AM --- Number of posts for page 2: 10
24/08/2025 12:50:41 AM --- Number of posts added on 2025-08-24: 11
24/08/2025 12:50:46 AM --- Done page: 3/10
24/08/2025 12:50:46 AM --- Number of posts for page 3: 10
24/08/2025 12:50:46 AM --- Number of posts added on 2025-08-24: 11
24/08/2025 12:50:51 AM --- Done page: 4/10
24/08/2025 12:50:51 AM --- Number of posts for page 4: 10
24/08/2025 12:50:51 AM --- Number of posts added on 2025-08-24: 11
24/08/2025 12:50:56 AM --- Done page: 5/10
24/08/2025 12:50:56 AM --- Number of posts for page 5: 10
24/08/2025 12:50:56 AM --- Number of posts added on 2025-08-24: 11
24/08/2025 12:51:00 AM --- Done page: 6/10
24/08/2025 12:51:00 AM --- Number of posts for page 6: 10
24/08/2025 12:51:00 AM --- Number of posts added on 2025-08-24: 11
24/08/2025 12:51:05 AM --- Done page: 7/10
24/08/2025 12:51:05 AM --- Number of posts for page 7: 10
24/08/2025 12:51:05 AM --- Number of posts added on 2025-08-24: 11
24/08/2025 12:51:10 AM --- Done page: 8/10
24/08/2025 12:51:10 AM --- Number of posts for page 8: 10
24/08/2025 12:51:10 AM --- Number of posts added on 2025-08-24: 11
24/08/2025 12:51:14 AM --- Done page: 9/10
24/08/2025 12:51:14 AM --- Number of posts for page 9: 10
24/08/2025 12:51:14 AM --- Number of posts added on 2025-08-24: 11
24/08/2025 12:51:19 AM --- Done page: 10/10
24/08/2025 12:51:19 AM --- Number of posts for page 10: 10
24/08/2025 12:51:19 AM --- Number of posts added on 2025-08-24: 11
24/08/2025 04:47:15 PM --- Done page: 1/57
24/08/2025 04:47:15 PM --- Number of posts for page 1: 10
24/08/2025 04:47:15 PM --- Number of posts added on 2025-08-24: 0
24/08/2025 04:47:33 PM --- Done page: 2/57
24/08/2025 04:47:33 PM --- Number of posts for page 2: 10
24/08/2025 04:47:33 PM --- Number of posts added on 2025-08-24: 0
24/08/2025 04:47:52 PM --- Done page: 3/57
24/08/2025 04:47:52 PM --- Number of posts for page 3: 10
24/08/2025 04:47:52 PM --- Number of posts added on 2025-08-24: 0
24/08/2025 04:48:10 PM --- Done page: 4/57
24/08/2025 04:48:10 PM --- Number of posts for page 4: 10
24/08/2025 04:48:10 PM --- Number of posts added on 2025-08-24: 0
24/08/2025 04:48:29 PM --- Done page: 5/57
24/08/2025 04:48:29 PM --- Number of posts for page 5: 10
24/08/2025 04:48:29 PM --- Number of posts added on 2025-08-24: 0
24/08/2025 04:48:47 PM --- Done page: 6/57
24/08/2025 04:48:47 PM --- Number of posts for page 6: 10
24/08/2025 04:48:47 PM --- Number of posts added on 2025-08-24: 0
24/08/2025 04:49:10 PM --- Done page: 7/57
24/08/2025 04:49:10 PM --- Number of posts for page 7: 10
24/08/2025 04:49:10 PM --- Number of posts added on 2025-08-24: 0
24/08/2025 04:49:29 PM --- Done page: 8/57
24/08/2025 04:49:29 PM --- Number of posts for page 8: 10
24/08/2025 04:49:29 PM --- Number of posts added on 2025-08-24: 0
24/08/2025 04:49:47 PM --- Done page: 9/57
24/08/2025 04:49:47 PM --- Number of posts for page 9: 10
24/08/2025 04:49:47 PM --- Number of posts added on 2025-08-24: 0
24/08/2025 04:50:05 PM --- Done page: 10/57
24/08/2025 04:50:05 PM --- Number of posts for page 10: 10
24/08/2025 04:50:05 PM --- Number of posts added on 2025-08-24: 0
24/08/2025 04:50:24 PM --- Done page: 11/57
24/08/2025 04:50:24 PM --- Number of posts for page 11: 10
24/08/2025 04:50:24 PM --- Number of posts added on 2025-08-24: 0
24/08/2025 04:50:42 PM --- Done page: 12/57
24/08/2025 04:50:42 PM --- Number of posts for page 12: 10
24/08/2025 04:50:42 PM --- Number of posts added on 2025-08-24: 0
24/08/2025 04:50:50 PM --- Done page: 13/57
24/08/2025 04:50:50 PM --- Number of posts for page 13: 4
24/08/2025 04:50:50 PM --- Number of posts added on 2025-08-24: 0
25/08/2025 04:50:38 PM --- Done post: Tài sản quốc gia, Việt Nam có gì?
25/08/2025 04:50:59 PM --- Done page: 1/57
25/08/2025 04:50:59 PM --- Number of posts for page 1: 10
25/08/2025 04:50:59 PM --- Number of posts added on 2025-08-25: 1
25/08/2025 04:51:23 PM --- Done page: 2/57
25/08/2025 04:51:23 PM --- Number of posts for page 2: 10
25/08/2025 04:51:23 PM --- Number of posts added on 2025-08-25: 1
25/08/2025 04:51:46 PM --- Done page: 3/57
25/08/2025 04:51:46 PM --- Number of posts for page 3: 10
25/08/2025 04:51:46 PM --- Number of posts added on 2025-08-25: 1
25/08/2025 04:52:09 PM --- Done page: 4/57
25/08/2025 04:52:09 PM --- Number of posts for page 4: 10
25/08/2025 04:52:09 PM --- Number of posts added on 2025-08-25: 1
25/08/2025 04:52:32 PM --- Done page: 5/57
25/08/2025 04:52:32 PM --- Number of posts for page 5: 10
25/08/2025 04:52:32 PM --- Number of posts added on 2025-08-25: 1
25/08/2025 04:52:55 PM --- Done page: 6/57
25/08/2025 04:52:55 PM --- Number of posts for page 6: 10
25/08/2025 04:52:55 PM --- Number of posts added on 2025-08-25: 1
25/08/2025 04:53:18 PM --- Done page: 7/57
25/08/2025 04:53:18 PM --- Number of posts for page 7: 10
25/08/2025 04:53:18 PM --- Number of posts added on 2025-08-25: 1
25/08/2025 04:53:41 PM --- Done page: 8/57
25/08/2025 04:53:41 PM --- Number of posts for page 8: 10
25/08/2025 04:53:41 PM --- Number of posts added on 2025-08-25: 1
25/08/2025 04:54:04 PM --- Done page: 9/57
25/08/2025 04:54:04 PM --- Number of posts for page 9: 10
25/08/2025 04:54:04 PM --- Number of posts added on 2025-08-25: 1
25/08/2025 04:54:26 PM --- Done page: 10/57
25/08/2025 04:54:26 PM --- Number of posts for page 10: 10
25/08/2025 04:54:26 PM --- Number of posts added on 2025-08-25: 1
25/08/2025 04:54:49 PM --- Done page: 11/57
25/08/2025 04:54:49 PM --- Number of posts for page 11: 10
25/08/2025 04:54:49 PM --- Number of posts added on 2025-08-25: 1
25/08/2025 04:55:12 PM --- Done page: 12/57
25/08/2025 04:55:12 PM --- Number of posts for page 12: 10
25/08/2025 04:55:12 PM --- Number of posts added on 2025-08-25: 1
25/08/2025 04:55:24 PM --- Done page: 13/57
25/08/2025 04:55:24 PM --- Number of posts for page 13: 5
25/08/2025 04:55:24 PM --- Number of posts added on 2025-08-25: 1
26/08/2025 04:48:35 PM --- Done post: Tùng Vũ (Bobby): Ống kính là “hộ chiếu” cho hành trình nâng tầm “thanh âm thị giác” tại Nhật
26/08/2025 04:48:51 PM --- Done page: 1/57
26/08/2025 04:48:51 PM --- Number of posts for page 1: 10
26/08/2025 04:48:51 PM --- Number of posts added on 2025-08-26: 1
26/08/2025 04:49:10 PM --- Done page: 2/57
26/08/2025 04:49:10 PM --- Number of posts for page 2: 10
26/08/2025 04:49:10 PM --- Number of posts added on 2025-08-26: 1
26/08/2025 04:49:29 PM --- Done page: 3/57
26/08/2025 04:49:29 PM --- Number of posts for page 3: 10
26/08/2025 04:49:29 PM --- Number of posts added on 2025-08-26: 1
26/08/2025 04:49:48 PM --- Done page: 4/57
26/08/2025 04:49:48 PM --- Number of posts for page 4: 10
26/08/2025 04:49:48 PM --- Number of posts added on 2025-08-26: 1
26/08/2025 04:50:06 PM --- Done page: 5/57
26/08/2025 04:50:06 PM --- Number of posts for page 5: 10
26/08/2025 04:50:06 PM --- Number of posts added on 2025-08-26: 1
26/08/2025 04:50:25 PM --- Done page: 6/57
26/08/2025 04:50:25 PM --- Number of posts for page 6: 10
26/08/2025 04:50:25 PM --- Number of posts added on 2025-08-26: 1
26/08/2025 04:50:43 PM --- Done page: 7/57
26/08/2025 04:50:43 PM --- Number of posts for page 7: 10
26/08/2025 04:50:43 PM --- Number of posts added on 2025-08-26: 1
26/08/2025 04:51:02 PM --- Done page: 8/57
26/08/2025 04:51:02 PM --- Number of posts for page 8: 10
26/08/2025 04:51:02 PM --- Number of posts added on 2025-08-26: 1
26/08/2025 04:51:21 PM --- Done page: 9/57
26/08/2025 04:51:21 PM --- Number of posts for page 9: 10
26/08/2025 04:51:21 PM --- Number of posts added on 2025-08-26: 1
26/08/2025 04:51:39 PM --- Done page: 10/57
26/08/2025 04:51:39 PM --- Number of posts for page 10: 10
26/08/2025 04:51:39 PM --- Number of posts added on 2025-08-26: 1
26/08/2025 04:51:58 PM --- Done page: 11/57
26/08/2025 04:51:58 PM --- Number of posts for page 11: 10
26/08/2025 04:51:58 PM --- Number of posts added on 2025-08-26: 1
26/08/2025 04:52:16 PM --- Done page: 12/57
26/08/2025 04:52:16 PM --- Number of posts for page 12: 10
26/08/2025 04:52:16 PM --- Number of posts added on 2025-08-26: 1
26/08/2025 04:52:27 PM --- Done page: 13/57
26/08/2025 04:52:27 PM --- Number of posts for page 13: 6
26/08/2025 04:52:27 PM --- Number of posts added on 2025-08-26: 1
27/08/2025 04:48:46 PM --- Done post: AI “trầm cảm” và “nổi loạn” nói gì về chúng ta?
27/08/2025 04:48:48 PM --- Done post: Huân chương Sao Vàng, Huân chương Hồ Chí Minh và những vinh danh trong đời sống hôm nay
27/08/2025 04:49:02 PM --- Done page: 1/57
27/08/2025 04:49:02 PM --- Number of posts for page 1: 10
27/08/2025 04:49:02 PM --- Number of posts added on 2025-08-27: 2
27/08/2025 04:49:21 PM --- Done page: 2/57
27/08/2025 04:49:21 PM --- Number of posts for page 2: 10
27/08/2025 04:49:21 PM --- Number of posts added on 2025-08-27: 2
27/08/2025 04:49:39 PM --- Done page: 3/57
27/08/2025 04:49:39 PM --- Number of posts for page 3: 10
27/08/2025 04:49:39 PM --- Number of posts added on 2025-08-27: 2
27/08/2025 04:49:57 PM --- Done page: 4/57
27/08/2025 04:49:57 PM --- Number of posts for page 4: 10
27/08/2025 04:49:57 PM --- Number of posts added on 2025-08-27: 2
27/08/2025 04:50:15 PM --- Done page: 5/57
27/08/2025 04:50:15 PM --- Number of posts for page 5: 10
27/08/2025 04:50:15 PM --- Number of posts added on 2025-08-27: 2
27/08/2025 04:50:33 PM --- Done page: 6/57
27/08/2025 04:50:33 PM --- Number of posts for page 6: 10
27/08/2025 04:50:33 PM --- Number of posts added on 2025-08-27: 2
27/08/2025 04:50:51 PM --- Done page: 7/57
27/08/2025 04:50:51 PM --- Number of posts for page 7: 10
27/08/2025 04:50:51 PM --- Number of posts added on 2025-08-27: 2
27/08/2025 04:51:09 PM --- Done page: 8/57
27/08/2025 04:51:09 PM --- Number of posts for page 8: 10
27/08/2025 04:51:09 PM --- Number of posts added on 2025-08-27: 2
27/08/2025 04:51:27 PM --- Done page: 9/57
27/08/2025 04:51:27 PM --- Number of posts for page 9: 10
27/08/2025 04:51:27 PM --- Number of posts added on 2025-08-27: 2
27/08/2025 04:51:45 PM --- Done page: 10/57
27/08/2025 04:51:45 PM --- Number of posts for page 10: 10
27/08/2025 04:51:45 PM --- Number of posts added on 2025-08-27: 2
27/08/2025 04:52:03 PM --- Done page: 11/57
27/08/2025 04:52:03 PM --- Number of posts for page 11: 10
27/08/2025 04:52:03 PM --- Number of posts added on 2025-08-27: 2
27/08/2025 04:52:21 PM --- Done page: 12/57
27/08/2025 04:52:21 PM --- Number of posts for page 12: 10
27/08/2025 04:52:21 PM --- Number of posts added on 2025-08-27: 2
27/08/2025 04:52:36 PM --- Done page: 13/57
27/08/2025 04:52:36 PM --- Number of posts for page 13: 8
27/08/2025 04:52:36 PM --- Number of posts added on 2025-08-27: 2
28/08/2025 04:49:00 PM --- Done page: 1/57
28/08/2025 04:49:00 PM --- Number of posts for page 1: 10
28/08/2025 04:49:00 PM --- Number of posts added on 2025-08-28: 0
28/08/2025 04:49:21 PM --- Done page: 2/57
28/08/2025 04:49:21 PM --- Number of posts for page 2: 10
28/08/2025 04:49:21 PM --- Number of posts added on 2025-08-28: 0
28/08/2025 04:49:42 PM --- Done page: 3/57
28/08/2025 04:49:42 PM --- Number of posts for page 3: 10
28/08/2025 04:49:42 PM --- Number of posts added on 2025-08-28: 0
28/08/2025 04:50:03 PM --- Done page: 4/57
28/08/2025 04:50:03 PM --- Number of posts for page 4: 10
28/08/2025 04:50:03 PM --- Number of posts added on 2025-08-28: 0
28/08/2025 04:50:23 PM --- Done page: 5/57
28/08/2025 04:50:23 PM --- Number of posts for page 5: 10
28/08/2025 04:50:23 PM --- Number of posts added on 2025-08-28: 0
28/08/2025 04:50:44 PM --- Done page: 6/57
28/08/2025 04:50:44 PM --- Number of posts for page 6: 10
28/08/2025 04:50:44 PM --- Number of posts added on 2025-08-28: 0
28/08/2025 04:51:04 PM --- Done page: 7/57
28/08/2025 04:51:04 PM --- Number of posts for page 7: 10
28/08/2025 04:51:04 PM --- Number of posts added on 2025-08-28: 0
28/08/2025 04:51:24 PM --- Done page: 8/57
28/08/2025 04:51:24 PM --- Number of posts for page 8: 10
28/08/2025 04:51:24 PM --- Number of posts added on 2025-08-28: 0
28/08/2025 04:51:44 PM --- Done page: 9/57
28/08/2025 04:51:44 PM --- Number of posts for page 9: 10
28/08/2025 04:51:44 PM --- Number of posts added on 2025-08-28: 0
28/08/2025 04:52:04 PM --- Done page: 10/57
28/08/2025 04:52:04 PM --- Number of posts for page 10: 10
28/08/2025 04:52:04 PM --- Number of posts added on 2025-08-28: 0
28/08/2025 04:52:24 PM --- Done page: 11/57
28/08/2025 04:52:24 PM --- Number of posts for page 11: 10
28/08/2025 04:52:24 PM --- Number of posts added on 2025-08-28: 0
28/08/2025 04:52:44 PM --- Done page: 12/57
28/08/2025 04:52:44 PM --- Number of posts for page 12: 10
28/08/2025 04:52:44 PM --- Number of posts added on 2025-08-28: 0
28/08/2025 04:53:00 PM --- Done page: 13/57
28/08/2025 04:53:00 PM --- Number of posts for page 13: 8
28/08/2025 04:53:00 PM --- Number of posts added on 2025-08-28: 0
29/08/2025 04:48:20 PM --- Done page: 1/57
29/08/2025 04:48:20 PM --- Number of posts for page 1: 10
29/08/2025 04:48:20 PM --- Number of posts added on 2025-08-29: 0
29/08/2025 04:48:44 PM --- Done page: 2/57
29/08/2025 04:48:44 PM --- Number of posts for page 2: 10
29/08/2025 04:48:44 PM --- Number of posts added on 2025-08-29: 0
29/08/2025 04:49:08 PM --- Done page: 3/57
29/08/2025 04:49:08 PM --- Number of posts for page 3: 10
29/08/2025 04:49:08 PM --- Number of posts added on 2025-08-29: 0
29/08/2025 04:49:32 PM --- Done page: 4/57
29/08/2025 04:49:32 PM --- Number of posts for page 4: 10
29/08/2025 04:49:32 PM --- Number of posts added on 2025-08-29: 0
29/08/2025 04:49:55 PM --- Done page: 5/57
29/08/2025 04:49:55 PM --- Number of posts for page 5: 10
29/08/2025 04:49:55 PM --- Number of posts added on 2025-08-29: 0
29/08/2025 04:50:18 PM --- Done page: 6/57
29/08/2025 04:50:18 PM --- Number of posts for page 6: 10
29/08/2025 04:50:18 PM --- Number of posts added on 2025-08-29: 0
29/08/2025 04:50:42 PM --- Done page: 7/57
29/08/2025 04:50:42 PM --- Number of posts for page 7: 10
29/08/2025 04:50:42 PM --- Number of posts added on 2025-08-29: 0
29/08/2025 04:51:06 PM --- Done page: 8/57
29/08/2025 04:51:06 PM --- Number of posts for page 8: 10
29/08/2025 04:51:06 PM --- Number of posts added on 2025-08-29: 0
29/08/2025 04:51:29 PM --- Done page: 9/57
29/08/2025 04:51:29 PM --- Number of posts for page 9: 10
29/08/2025 04:51:29 PM --- Number of posts added on 2025-08-29: 0
29/08/2025 04:51:51 PM --- Done page: 10/57
29/08/2025 04:51:51 PM --- Number of posts for page 10: 10
29/08/2025 04:51:51 PM --- Number of posts added on 2025-08-29: 0
29/08/2025 04:52:14 PM --- Done page: 11/57
29/08/2025 04:52:14 PM --- Number of posts for page 11: 10
29/08/2025 04:52:14 PM --- Number of posts added on 2025-08-29: 0
29/08/2025 04:52:37 PM --- Done page: 12/57
29/08/2025 04:52:37 PM --- Number of posts for page 12: 10
29/08/2025 04:52:37 PM --- Number of posts added on 2025-08-29: 0
29/08/2025 04:52:56 PM --- Done page: 13/57
29/08/2025 04:52:56 PM --- Number of posts for page 13: 8
29/08/2025 04:52:56 PM --- Number of posts added on 2025-08-29: 0
30/08/2025 04:44:55 PM --- Done post: Hạt gạo Việt: Từ cánh đồng làng đến thương hiệu đại diện đất nước
30/08/2025 04:45:16 PM --- Done page: 1/57
30/08/2025 04:45:16 PM --- Number of posts for page 1: 10
30/08/2025 04:45:16 PM --- Number of posts added on 2025-08-30: 1
30/08/2025 04:45:39 PM --- Done page: 2/57
30/08/2025 04:45:39 PM --- Number of posts for page 2: 10
30/08/2025 04:45:39 PM --- Number of posts added on 2025-08-30: 1
30/08/2025 04:46:02 PM --- Done page: 3/57
30/08/2025 04:46:02 PM --- Number of posts for page 3: 10
30/08/2025 04:46:02 PM --- Number of posts added on 2025-08-30: 1
30/08/2025 04:46:26 PM --- Done page: 4/57
30/08/2025 04:46:26 PM --- Number of posts for page 4: 10
30/08/2025 04:46:26 PM --- Number of posts added on 2025-08-30: 1
30/08/2025 04:46:49 PM --- Done page: 5/57
30/08/2025 04:46:49 PM --- Number of posts for page 5: 10
30/08/2025 04:46:49 PM --- Number of posts added on 2025-08-30: 1
30/08/2025 04:47:11 PM --- Done page: 6/57
30/08/2025 04:47:11 PM --- Number of posts for page 6: 10
30/08/2025 04:47:11 PM --- Number of posts added on 2025-08-30: 1
30/08/2025 04:47:34 PM --- Done page: 7/57
30/08/2025 04:47:34 PM --- Number of posts for page 7: 10
30/08/2025 04:47:34 PM --- Number of posts added on 2025-08-30: 1
30/08/2025 04:47:58 PM --- Done page: 8/57
30/08/2025 04:47:58 PM --- Number of posts for page 8: 10
30/08/2025 04:47:58 PM --- Number of posts added on 2025-08-30: 1
30/08/2025 04:48:21 PM --- Done page: 9/57
30/08/2025 04:48:21 PM --- Number of posts for page 9: 10
30/08/2025 04:48:21 PM --- Number of posts added on 2025-08-30: 1
30/08/2025 04:48:43 PM --- Done page: 10/57
30/08/2025 04:48:43 PM --- Number of posts for page 10: 10
30/08/2025 04:48:43 PM --- Number of posts added on 2025-08-30: 1
30/08/2025 04:49:06 PM --- Done page: 11/57
30/08/2025 04:49:06 PM --- Number of posts for page 11: 10
30/08/2025 04:49:06 PM --- Number of posts added on 2025-08-30: 1
30/08/2025 04:49:29 PM --- Done page: 12/57
30/08/2025 04:49:29 PM --- Number of posts for page 12: 10
30/08/2025 04:49:29 PM --- Number of posts added on 2025-08-30: 1
30/08/2025 04:49:49 PM --- Done page: 13/57
30/08/2025 04:49:49 PM --- Number of posts for page 13: 9
30/08/2025 04:49:49 PM --- Number of posts added on 2025-08-30: 1
31/08/2025 04:46:03 PM --- Done page: 1/57
31/08/2025 04:46:03 PM --- Number of posts for page 1: 10
31/08/2025 04:46:03 PM --- Number of posts added on 2025-08-31: 0
31/08/2025 04:46:27 PM --- Done page: 2/57
31/08/2025 04:46:27 PM --- Number of posts for page 2: 10
31/08/2025 04:46:27 PM --- Number of posts added on 2025-08-31: 0
31/08/2025 04:46:50 PM --- Done page: 3/57
31/08/2025 04:46:50 PM --- Number of posts for page 3: 10
31/08/2025 04:46:50 PM --- Number of posts added on 2025-08-31: 0
31/08/2025 04:47:15 PM --- Done page: 4/57
31/08/2025 04:47:15 PM --- Number of posts for page 4: 10
31/08/2025 04:47:15 PM --- Number of posts added on 2025-08-31: 0
31/08/2025 04:47:37 PM --- Done page: 5/57
31/08/2025 04:47:37 PM --- Number of posts for page 5: 10
31/08/2025 04:47:37 PM --- Number of posts added on 2025-08-31: 0
31/08/2025 04:48:00 PM --- Done page: 6/57
31/08/2025 04:48:00 PM --- Number of posts for page 6: 10
31/08/2025 04:48:00 PM --- Number of posts added on 2025-08-31: 0
31/08/2025 04:48:23 PM --- Done page: 7/57
31/08/2025 04:48:23 PM --- Number of posts for page 7: 10
31/08/2025 04:48:23 PM --- Number of posts added on 2025-08-31: 0
31/08/2025 04:48:46 PM --- Done page: 8/57
31/08/2025 04:48:46 PM --- Number of posts for page 8: 10
31/08/2025 04:48:46 PM --- Number of posts added on 2025-08-31: 0
31/08/2025 04:49:09 PM --- Done page: 9/57
31/08/2025 04:49:09 PM --- Number of posts for page 9: 10
31/08/2025 04:49:09 PM --- Number of posts added on 2025-08-31: 0
31/08/2025 04:49:32 PM --- Done page: 10/57
31/08/2025 04:49:32 PM --- Number of posts for page 10: 10
31/08/2025 04:49:32 PM --- Number of posts added on 2025-08-31: 0
31/08/2025 04:49:54 PM --- Done page: 11/57
31/08/2025 04:49:54 PM --- Number of posts for page 11: 10
31/08/2025 04:49:54 PM --- Number of posts added on 2025-08-31: 0
31/08/2025 04:50:17 PM --- Done page: 12/57
31/08/2025 04:50:17 PM --- Number of posts for page 12: 10
31/08/2025 04:50:17 PM --- Number of posts added on 2025-08-31: 0
31/08/2025 04:50:37 PM --- Done page: 13/57
31/08/2025 04:50:37 PM --- Number of posts for page 13: 9
31/08/2025 04:50:37 PM --- Number of posts added on 2025-08-31: 0
01/09/2025 04:46:58 PM --- Done post: Vì sao quốc kỳ Việt Nam là cờ đỏ sao vàng?
01/09/2025 04:47:16 PM --- Done page: 1/57
01/09/2025 04:47:16 PM --- Number of posts for page 1: 10
01/09/2025 04:47:16 PM --- Number of posts added on 2025-09-01: 1
01/09/2025 04:47:37 PM --- Done page: 2/57
01/09/2025 04:47:37 PM --- Number of posts for page 2: 10
01/09/2025 04:47:37 PM --- Number of posts added on 2025-09-01: 1
01/09/2025 04:47:57 PM --- Done page: 3/57
01/09/2025 04:47:57 PM --- Number of posts for page 3: 10
01/09/2025 04:47:57 PM --- Number of posts added on 2025-09-01: 1
01/09/2025 04:48:18 PM --- Done page: 4/57
01/09/2025 04:48:18 PM --- Number of posts for page 4: 10
01/09/2025 04:48:18 PM --- Number of posts added on 2025-09-01: 1
01/09/2025 04:48:38 PM --- Done page: 5/57
01/09/2025 04:48:38 PM --- Number of posts for page 5: 10
01/09/2025 04:48:38 PM --- Number of posts added on 2025-09-01: 1
01/09/2025 04:48:58 PM --- Done page: 6/57
01/09/2025 04:48:58 PM --- Number of posts for page 6: 10
01/09/2025 04:48:58 PM --- Number of posts added on 2025-09-01: 1
01/09/2025 04:49:18 PM --- Done page: 7/57
01/09/2025 04:49:18 PM --- Number of posts for page 7: 10
01/09/2025 04:49:18 PM --- Number of posts added on 2025-09-01: 1
01/09/2025 04:49:39 PM --- Done page: 8/57
01/09/2025 04:49:39 PM --- Number of posts for page 8: 10
01/09/2025 04:49:39 PM --- Number of posts added on 2025-09-01: 1
01/09/2025 04:49:59 PM --- Done page: 9/57
01/09/2025 04:49:59 PM --- Number of posts for page 9: 10
01/09/2025 04:49:59 PM --- Number of posts added on 2025-09-01: 1
01/09/2025 04:50:19 PM --- Done page: 10/57
01/09/2025 04:50:19 PM --- Number of posts for page 10: 10
01/09/2025 04:50:19 PM --- Number of posts added on 2025-09-01: 1
01/09/2025 04:50:39 PM --- Done page: 11/57
01/09/2025 04:50:39 PM --- Number of posts for page 11: 10
01/09/2025 04:50:39 PM --- Number of posts added on 2025-09-01: 1
01/09/2025 04:50:59 PM --- Done page: 12/57
01/09/2025 04:50:59 PM --- Number of posts for page 12: 10
01/09/2025 04:50:59 PM --- Number of posts added on 2025-09-01: 1
01/09/2025 04:51:19 PM --- Done page: 13/57
01/09/2025 04:51:19 PM --- Number of posts for page 13: 10
01/09/2025 04:51:19 PM --- Number of posts added on 2025-09-01: 1
02/09/2025 04:49:14 PM --- Done page: 1/57
02/09/2025 04:49:14 PM --- Number of posts for page 1: 10
02/09/2025 04:49:14 PM --- Number of posts added on 2025-09-02: 0
02/09/2025 04:49:32 PM --- Done page: 2/57
02/09/2025 04:49:32 PM --- Number of posts for page 2: 10
02/09/2025 04:49:32 PM --- Number of posts added on 2025-09-02: 0
02/09/2025 04:49:50 PM --- Done page: 3/57
02/09/2025 04:49:50 PM --- Number of posts for page 3: 10
02/09/2025 04:49:50 PM --- Number of posts added on 2025-09-02: 0
02/09/2025 04:50:08 PM --- Done page: 4/57
02/09/2025 04:50:08 PM --- Number of posts for page 4: 10
02/09/2025 04:50:08 PM --- Number of posts added on 2025-09-02: 0
02/09/2025 04:50:26 PM --- Done page: 5/57
02/09/2025 04:50:26 PM --- Number of posts for page 5: 10
02/09/2025 04:50:26 PM --- Number of posts added on 2025-09-02: 0
02/09/2025 04:50:44 PM --- Done page: 6/57
02/09/2025 04:50:44 PM --- Number of posts for page 6: 10
02/09/2025 04:50:44 PM --- Number of posts added on 2025-09-02: 0
02/09/2025 04:51:02 PM --- Done page: 7/57
02/09/2025 04:51:02 PM --- Number of posts for page 7: 10
02/09/2025 04:51:02 PM --- Number of posts added on 2025-09-02: 0
02/09/2025 04:51:20 PM --- Done page: 8/57
02/09/2025 04:51:20 PM --- Number of posts for page 8: 10
02/09/2025 04:51:20 PM --- Number of posts added on 2025-09-02: 0
02/09/2025 04:51:38 PM --- Done page: 9/57
02/09/2025 04:51:38 PM --- Number of posts for page 9: 10
02/09/2025 04:51:38 PM --- Number of posts added on 2025-09-02: 0
02/09/2025 04:51:56 PM --- Done page: 10/57
02/09/2025 04:51:56 PM --- Number of posts for page 10: 10
02/09/2025 04:51:56 PM --- Number of posts added on 2025-09-02: 0
02/09/2025 04:52:14 PM --- Done page: 11/57
02/09/2025 04:52:14 PM --- Number of posts for page 11: 10
02/09/2025 04:52:14 PM --- Number of posts added on 2025-09-02: 0
02/09/2025 04:52:31 PM --- Done page: 12/57
02/09/2025 04:52:31 PM --- Number of posts for page 12: 10
02/09/2025 04:52:31 PM --- Number of posts added on 2025-09-02: 0
02/09/2025 04:52:49 PM --- Done page: 13/57
02/09/2025 04:52:49 PM --- Number of posts for page 13: 10
02/09/2025 04:52:49 PM --- Number of posts added on 2025-09-02: 0
03/09/2025 04:47:51 PM --- Done page: 1/57
03/09/2025 04:47:51 PM --- Number of posts for page 1: 10
03/09/2025 04:47:51 PM --- Number of posts added on 2025-09-03: 0
03/09/2025 04:48:09 PM --- Done page: 2/57
03/09/2025 04:48:09 PM --- Number of posts for page 2: 10
03/09/2025 04:48:09 PM --- Number of posts added on 2025-09-03: 0
03/09/2025 04:48:27 PM --- Done page: 3/57
03/09/2025 04:48:27 PM --- Number of posts for page 3: 10
03/09/2025 04:48:27 PM --- Number of posts added on 2025-09-03: 0
03/09/2025 04:48:45 PM --- Done page: 4/57
03/09/2025 04:48:45 PM --- Number of posts for page 4: 10
03/09/2025 04:48:45 PM --- Number of posts added on 2025-09-03: 0
03/09/2025 04:49:03 PM --- Done page: 5/57
03/09/2025 04:49:03 PM --- Number of posts for page 5: 10
03/09/2025 04:49:03 PM --- Number of posts added on 2025-09-03: 0
03/09/2025 04:49:21 PM --- Done page: 6/57
03/09/2025 04:49:21 PM --- Number of posts for page 6: 10
03/09/2025 04:49:21 PM --- Number of posts added on 2025-09-03: 0
03/09/2025 04:49:38 PM --- Done page: 7/57
03/09/2025 04:49:38 PM --- Number of posts for page 7: 10
03/09/2025 04:49:38 PM --- Number of posts added on 2025-09-03: 0
03/09/2025 04:49:56 PM --- Done page: 8/57
03/09/2025 04:49:56 PM --- Number of posts for page 8: 10
03/09/2025 04:49:56 PM --- Number of posts added on 2025-09-03: 0
03/09/2025 04:50:14 PM --- Done page: 9/57
03/09/2025 04:50:14 PM --- Number of posts for page 9: 10
03/09/2025 04:50:14 PM --- Number of posts added on 2025-09-03: 0
03/09/2025 04:50:32 PM --- Done page: 10/57
03/09/2025 04:50:32 PM --- Number of posts for page 10: 10
03/09/2025 04:50:32 PM --- Number of posts added on 2025-09-03: 0
03/09/2025 04:50:49 PM --- Done page: 11/57
03/09/2025 04:50:49 PM --- Number of posts for page 11: 10
03/09/2025 04:50:49 PM --- Number of posts added on 2025-09-03: 0
03/09/2025 04:51:07 PM --- Done page: 12/57
03/09/2025 04:51:07 PM --- Number of posts for page 12: 10
03/09/2025 04:51:07 PM --- Number of posts added on 2025-09-03: 0
03/09/2025 04:51:25 PM --- Done page: 13/57
03/09/2025 04:51:25 PM --- Number of posts for page 13: 10
03/09/2025 04:51:25 PM --- Number of posts added on 2025-09-03: 0
04/09/2025 04:48:02 PM --- Done page: 1/57
04/09/2025 04:48:02 PM --- Number of posts for page 1: 10
04/09/2025 04:48:02 PM --- Number of posts added on 2025-09-04: 0
04/09/2025 04:48:20 PM --- Done page: 2/57
04/09/2025 04:48:20 PM --- Number of posts for page 2: 10
04/09/2025 04:48:20 PM --- Number of posts added on 2025-09-04: 0
04/09/2025 04:48:39 PM --- Done page: 3/57
04/09/2025 04:48:39 PM --- Number of posts for page 3: 10
04/09/2025 04:48:39 PM --- Number of posts added on 2025-09-04: 0
04/09/2025 04:48:57 PM --- Done page: 4/57
04/09/2025 04:48:57 PM --- Number of posts for page 4: 10
04/09/2025 04:48:57 PM --- Number of posts added on 2025-09-04: 0
04/09/2025 04:49:15 PM --- Done page: 5/57
04/09/2025 04:49:15 PM --- Number of posts for page 5: 10
04/09/2025 04:49:15 PM --- Number of posts added on 2025-09-04: 0
04/09/2025 04:49:33 PM --- Done page: 6/57
04/09/2025 04:49:33 PM --- Number of posts for page 6: 10
04/09/2025 04:49:33 PM --- Number of posts added on 2025-09-04: 0
04/09/2025 04:49:51 PM --- Done page: 7/57
04/09/2025 04:49:51 PM --- Number of posts for page 7: 10
04/09/2025 04:49:51 PM --- Number of posts added on 2025-09-04: 0
04/09/2025 04:50:10 PM --- Done page: 8/57
04/09/2025 04:50:10 PM --- Number of posts for page 8: 10
04/09/2025 04:50:10 PM --- Number of posts added on 2025-09-04: 0
04/09/2025 04:50:28 PM --- Done page: 9/57
04/09/2025 04:50:28 PM --- Number of posts for page 9: 10
04/09/2025 04:50:28 PM --- Number of posts added on 2025-09-04: 0
04/09/2025 04:50:46 PM --- Done page: 10/57
04/09/2025 04:50:46 PM --- Number of posts for page 10: 10
04/09/2025 04:50:46 PM --- Number of posts added on 2025-09-04: 0
04/09/2025 04:51:04 PM --- Done page: 11/57
04/09/2025 04:51:04 PM --- Number of posts for page 11: 10
04/09/2025 04:51:04 PM --- Number of posts added on 2025-09-04: 0
04/09/2025 04:51:22 PM --- Done page: 12/57
04/09/2025 04:51:22 PM --- Number of posts for page 12: 10
04/09/2025 04:51:22 PM --- Number of posts added on 2025-09-04: 0
04/09/2025 04:51:41 PM --- Done page: 13/57
04/09/2025 04:51:41 PM --- Number of posts for page 13: 10
04/09/2025 04:51:41 PM --- Number of posts added on 2025-09-04: 0
05/09/2025 04:46:01 PM --- Done post: “Vietnam is calling”: Khi Việt Nam đang “trending” khắp mạng xã hội
05/09/2025 04:46:22 PM --- Done page: 1/57
05/09/2025 04:46:22 PM --- Number of posts for page 1: 10
05/09/2025 04:46:22 PM --- Number of posts added on 2025-09-05: 1
05/09/2025 04:46:46 PM --- Done page: 2/57
05/09/2025 04:46:46 PM --- Number of posts for page 2: 10
05/09/2025 04:46:46 PM --- Number of posts added on 2025-09-05: 1
05/09/2025 04:47:09 PM --- Done page: 3/57
05/09/2025 04:47:09 PM --- Number of posts for page 3: 10
05/09/2025 04:47:09 PM --- Number of posts added on 2025-09-05: 1
05/09/2025 04:47:32 PM --- Done page: 4/57
05/09/2025 04:47:32 PM --- Number of posts for page 4: 10
05/09/2025 04:47:32 PM --- Number of posts added on 2025-09-05: 1
05/09/2025 04:47:55 PM --- Done page: 5/57
05/09/2025 04:47:55 PM --- Number of posts for page 5: 10
05/09/2025 04:47:55 PM --- Number of posts added on 2025-09-05: 1
05/09/2025 04:48:19 PM --- Done page: 6/57
05/09/2025 04:48:19 PM --- Number of posts for page 6: 10
05/09/2025 04:48:19 PM --- Number of posts added on 2025-09-05: 1
05/09/2025 04:48:42 PM --- Done page: 7/57
05/09/2025 04:48:42 PM --- Number of posts for page 7: 10
05/09/2025 04:48:42 PM --- Number of posts added on 2025-09-05: 1
05/09/2025 04:49:08 PM --- Done page: 8/57
05/09/2025 04:49:08 PM --- Number of posts for page 8: 10
05/09/2025 04:49:08 PM --- Number of posts added on 2025-09-05: 1
05/09/2025 04:49:32 PM --- Done page: 9/57
05/09/2025 04:49:32 PM --- Number of posts for page 9: 10
05/09/2025 04:49:32 PM --- Number of posts added on 2025-09-05: 1
05/09/2025 04:49:56 PM --- Done page: 10/57
05/09/2025 04:49:56 PM --- Number of posts for page 10: 10
05/09/2025 04:49:56 PM --- Number of posts added on 2025-09-05: 1
05/09/2025 04:50:20 PM --- Done page: 11/57
05/09/2025 04:50:20 PM --- Number of posts for page 11: 10
05/09/2025 04:50:20 PM --- Number of posts added on 2025-09-05: 1
05/09/2025 04:50:43 PM --- Done page: 12/57
05/09/2025 04:50:43 PM --- Number of posts for page 12: 10
05/09/2025 04:50:43 PM --- Number of posts added on 2025-09-05: 1
05/09/2025 04:51:06 PM --- Done page: 13/57
05/09/2025 04:51:06 PM --- Number of posts for page 13: 10
05/09/2025 04:51:06 PM --- Number of posts added on 2025-09-05: 1
05/09/2025 04:51:09 PM --- Done page: 14/57
05/09/2025 04:51:09 PM --- Number of posts for page 14: 1
05/09/2025 04:51:09 PM --- Number of posts added on 2025-09-05: 1
06/09/2025 04:43:32 PM --- Done page: 1/57
06/09/2025 04:43:32 PM --- Number of posts for page 1: 10
06/09/2025 04:43:32 PM --- Number of posts added on 2025-09-06: 0
06/09/2025 04:43:50 PM --- Done page: 2/57
06/09/2025 04:43:50 PM --- Number of posts for page 2: 10
06/09/2025 04:43:50 PM --- Number of posts added on 2025-09-06: 0
06/09/2025 04:44:09 PM --- Done page: 3/57
06/09/2025 04:44:09 PM --- Number of posts for page 3: 10
06/09/2025 04:44:09 PM --- Number of posts added on 2025-09-06: 0
06/09/2025 04:44:28 PM --- Done page: 4/57
06/09/2025 04:44:28 PM --- Number of posts for page 4: 10
06/09/2025 04:44:28 PM --- Number of posts added on 2025-09-06: 0
06/09/2025 04:44:47 PM --- Done page: 5/57
06/09/2025 04:44:47 PM --- Number of posts for page 5: 10
06/09/2025 04:44:47 PM --- Number of posts added on 2025-09-06: 0
06/09/2025 04:45:07 PM --- Done page: 6/57
06/09/2025 04:45:07 PM --- Number of posts for page 6: 10
06/09/2025 04:45:07 PM --- Number of posts added on 2025-09-06: 0
06/09/2025 04:45:26 PM --- Done page: 7/57
06/09/2025 04:45:26 PM --- Number of posts for page 7: 10
06/09/2025 04:45:26 PM --- Number of posts added on 2025-09-06: 0
06/09/2025 04:45:45 PM --- Done page: 8/57
06/09/2025 04:45:45 PM --- Number of posts for page 8: 10
06/09/2025 04:45:45 PM --- Number of posts added on 2025-09-06: 0
06/09/2025 04:46:04 PM --- Done page: 9/57
06/09/2025 04:46:04 PM --- Number of posts for page 9: 10
06/09/2025 04:46:04 PM --- Number of posts added on 2025-09-06: 0
06/09/2025 04:46:22 PM --- Done page: 10/57
06/09/2025 04:46:22 PM --- Number of posts for page 10: 10
06/09/2025 04:46:22 PM --- Number of posts added on 2025-09-06: 0
06/09/2025 04:46:40 PM --- Done page: 11/57
06/09/2025 04:46:40 PM --- Number of posts for page 11: 10
06/09/2025 04:46:40 PM --- Number of posts added on 2025-09-06: 0
06/09/2025 04:47:00 PM --- Done page: 12/57
06/09/2025 04:47:00 PM --- Number of posts for page 12: 10
06/09/2025 04:47:00 PM --- Number of posts added on 2025-09-06: 0
06/09/2025 04:47:20 PM --- Done page: 13/57
06/09/2025 04:47:20 PM --- Number of posts for page 13: 10
06/09/2025 04:47:20 PM --- Number of posts added on 2025-09-06: 0
06/09/2025 04:47:22 PM --- Done page: 14/57
06/09/2025 04:47:22 PM --- Number of posts for page 14: 1
06/09/2025 04:47:22 PM --- Number of posts added on 2025-09-06: 0
07/09/2025 04:44:05 PM --- Done post: “...Muôn thu sau lưu tiếng anh hào...”
07/09/2025 04:44:26 PM --- Done page: 1/57
07/09/2025 04:44:26 PM --- Number of posts for page 1: 10
07/09/2025 04:44:26 PM --- Number of posts added on 2025-09-07: 1
07/09/2025 04:44:51 PM --- Done page: 2/57
07/09/2025 04:44:51 PM --- Number of posts for page 2: 10
07/09/2025 04:44:51 PM --- Number of posts added on 2025-09-07: 1
07/09/2025 04:45:16 PM --- Done page: 3/57
07/09/2025 04:45:16 PM --- Number of posts for page 3: 10
07/09/2025 04:45:16 PM --- Number of posts added on 2025-09-07: 1
07/09/2025 04:45:39 PM --- Done page: 4/57
07/09/2025 04:45:39 PM --- Number of posts for page 4: 10
07/09/2025 04:45:39 PM --- Number of posts added on 2025-09-07: 1
07/09/2025 04:46:04 PM --- Done page: 5/57
07/09/2025 04:46:04 PM --- Number of posts for page 5: 10
07/09/2025 04:46:04 PM --- Number of posts added on 2025-09-07: 1
07/09/2025 04:46:28 PM --- Done page: 6/57
07/09/2025 04:46:28 PM --- Number of posts for page 6: 10
07/09/2025 04:46:28 PM --- Number of posts added on 2025-09-07: 1
07/09/2025 04:46:51 PM --- Done page: 7/57
07/09/2025 04:46:51 PM --- Number of posts for page 7: 10
07/09/2025 04:46:51 PM --- Number of posts added on 2025-09-07: 1
07/09/2025 04:47:15 PM --- Done page: 8/57
07/09/2025 04:47:15 PM --- Number of posts for page 8: 10
07/09/2025 04:47:15 PM --- Number of posts added on 2025-09-07: 1
07/09/2025 04:47:38 PM --- Done page: 9/57
07/09/2025 04:47:38 PM --- Number of posts for page 9: 10
07/09/2025 04:47:38 PM --- Number of posts added on 2025-09-07: 1
07/09/2025 04:48:01 PM --- Done page: 10/57
07/09/2025 04:48:01 PM --- Number of posts for page 10: 10
07/09/2025 04:48:01 PM --- Number of posts added on 2025-09-07: 1
07/09/2025 04:48:26 PM --- Done page: 11/57
07/09/2025 04:48:26 PM --- Number of posts for page 11: 10
07/09/2025 04:48:26 PM --- Number of posts added on 2025-09-07: 1
07/09/2025 04:48:50 PM --- Done page: 12/57
07/09/2025 04:48:50 PM --- Number of posts for page 12: 10
07/09/2025 04:48:50 PM --- Number of posts added on 2025-09-07: 1
07/09/2025 04:49:14 PM --- Done page: 13/57
07/09/2025 04:49:14 PM --- Number of posts for page 13: 10
07/09/2025 04:49:14 PM --- Number of posts added on 2025-09-07: 1
07/09/2025 04:49:20 PM --- Done page: 14/57
07/09/2025 04:49:20 PM --- Number of posts for page 14: 2
